"Joke";"Joke topic"
What did one ghost say to the other? Do you believe in people?;Ghost
What did one testicle say to the other testicle? Don't talk to the guy in the middle. He is a dick!;Testicle
Why does Santa come down the chimney? Because Mrs. Claus told him he'd never get in the back door.;Santa
What do you call a cold and angry cow? Brrrgrrr... What do you call an angry and cold baby? GrrrBrrr...;Cow
WHEN CATS ARE SAD Bartender: What'll ya have? Cat: Shot of rum. [Bartender pours it] [Cat slowly pushes it off the bar] Cat: Another.;Cat
Can a ninja throw a star? Shuriken;Ninja
You heard about the guy who stole that calendar right? he got 12 months ...I'll see myself out;Calendar
I was going to make a chemistry joke But I know I won't get a reaction;Chemistry
Why do Cows have Hooves instead of Feet? Because they Lac-Tose.;Cows
I hate when I decide to sleep and my brain goes like "Come back here! Remember that thing you did, why?" & we stay up talking about it.;Sleep
One. How many psychics does it take to change a lightbulb?;Psychic
I play the keyboard in a band called The Internet!;Keyboard
Whats the difference between Harambe and a African child? People give a shit about Harambe;Harambe
You know how you have that ONE hoodie that no matter when or what you're eating -- you ALWAYS spill something on it? It's cuz you're a pig.;Hoodie
I don't like holocaust jokes ...because my grandpa died in the holocaust. He fell off a guard tower.;Holocaust
What happened when a ghost asked for a brandy at his local pub? The landlord said "Sorry we don't serve spirits.";Ghost
Knock Knock Who's there ! Bart ! Bart who ? Bart-enders serve drinks !;Bartender
One. How many psychics does it take to change a lightbulb.;Psychic
Autocorrect just changed "what are your plans" to "plants". Yes autocorrect, I'm curious if they're growing roses or sunflowers?;Autocorrect
Why did the lone dolphin stop swimming? He didn't see a porpoise...;dolphin
I just got a new job working for R.E.M. . . . I'm expecting a generous Michael Stipend.;music
... and on the eighth day, Satan created teenagers.;religion
My walk of shame is putting back the 9 boxes of assorted cereals that my wife found in the grocery cart.;marriage
What's musical and useful at the grocery store? A Chopin Liszt Note: taken from one of those horrible "Joke of the Day" desk calendars. It took almost 12 months to get something clever.;music
I just put BOTH my legs into one pajama pant leg...making me a MERMAID!;sleep
Your liver is the only organ that can regenerate itself. I believe that calls for a drink... Cheers!;health
My father told me that I should condition more and shampoo less I told him to stop getting in the shower with me;family
I really wish I knew who kicked the jack under the car which I was working on.. .. the suspension is killing me.;car
I read that having sex every day for a year could transform your marriage. It worked so well I'm thinking of suggesting it to my wife.;marriage
The NFL's Refs;sports
What vehicle does Hitler use to fly ? Heil-acopter;history
I had to ground my son for cursing. He turned the girl next door into a frog.;family
What did the Mexican put under his carpet? Underlay! Underlay!;home
Breaking Ne ws;news
Latino soap operas where no one seems to have locks on their doors and people burst in at odd hours demanding the truth;Latino
Unappreciated diet tip: If you want to lose a significant amount of weight, it's important to start out really fat.;Weight
How do you starve a neurosurgeon? Hide his paycheck with his kids.;Neurosurgeon
A video montage of all the times my foot, still wet from the shower, has clung to my underwear as I pull them on, and I've lost my balance.;Foot
I make out with guys that wear Abercrombie & Fitch cologne because it rubs off on me & I love how it smells, but shopping there is SOOO gay.;Cologne
Yo mama so fat, the sorting hat put her in all four houses.;Fat
Some people are very down to earth... You know, midgets.;Height
Paddy and Murphy walk into a bar... Hand in hand;Gay
I broke my finger today but on the other hand I am completely fine;Finger
What do you get when you cross an elephant with a rhino? *shrug* elephino.;Elephant
*someone hands me a baby* Oh... no thank you *places baby on the ground*;Baby
What do you get when you travel a long way with a kung fun hero, and breathe heavily next to a guy named Russ? Miley Cyrus.;Travel
Watching a documentary is the leading cause of being unbearable in conversations for a week.;Documentary
I'd love to get myself a job inspecting mirrors! I could really see myself doing that.;Job
How to begin a TIFU post This wasn't today...;TIFU
"Thank you for coming." "It was mandatory." #corporateshows;Corporate
What happened to the engineer who miss labeled all the floor numbers He was wrong on so many levels.;Engineer
I kept trying to think of puns about the eye during my biology lesson, when we dissected one. To be honest, they kept getting cornea and cornea....;Eye
I moved to Australia, I've never been so appreciated! I've had so many offers to "Get F**ked!"... I have the pick of the litter!!;Australia
I see, it's all coming back to me now... Said the blind man as he pissed into the wind.;Blindness
"My husband is such a pig. All I asked for was $100 for the beauty salon..." "He took a long look at me and gave me $300";Marriage
"I make everything sad, but I'll class your shit up." - Violins;Violins
Dear Mom and Dad, if you can read this tweet, Congratulations!!! it's time for lesson number 10.;Parenting
A photon walked into a hotel. The clerk asked it it would like a hand with it's luggage... "No thank-you", said the photon, "I'm travelling light".;Photon
Charm me with your intelligence or just wait till I'm really drunk.;Intelligence
Hey gurl, are you an inaccurate answer? Because that is one-significant-figure;Science
Why was the OCD race car driver so fast? Because he had anal prolapse.;OCD
What did the Nazi say... What did the Nazi say when he got lost on the way to the gas chamber? AUU-SCHWIT;Nazi
Read in a Forrest Gump voice. My mother always told me life is like a jar of jelly beans.Everbody hates the black ones. (I know this is a terrible joke, my friend told it to me.;jelly beans
Next time someone asks you how you slept, close your eyes & say "like this" & just stay that way for like 8 hours!!!;sleep
How does a viola greet a relative? Cello!;viola
(from my 9 year old) What time is the best time to go to the dentist? Tooth hurty (2:30);dentist
What's black and white and turns cartwheels? A piebald horse pulling a cart!;horse
A woman is accused of attacking her husband with several of his guitars The Judge asked "First time offender?" She replied, "No, first time a Gibson, then a Fender.";guitars
What do you get when you cross a rhetorical question and a joke?;rhetorical question
Once again the award for the most stupid act ever was given to a man who glued his hands to the bars on a treadmill. That's two years running now.;treadmill
Did you hear about the unnecessarily large string orchestra? It was shut down due to mass violins;orchestra
What career choice to hippies usually pick? Chemistry, because there is lots of acid involved.;hippies
Why was Thor so worried about his hair looking good? because he is a Norsissist.;Thor
What's the cheapest type of meat? Deer balls, They're under a buck!;meat
For the record, riding my unicycle to the bank robbery was a terrible idea.;bank robbery
What is the best way to send a letter to the  Easter Bunny? By hare (air) mail.;Easter Bunny
There was a mass shooting at the Gap store this afternoon. They're still counting the casual Tees.;shooting
After spending over 3 decades in the hard candy business, I've had enough... I've finally realized it's for suckers.;hard candy
What do you get if you cross a snake and a  hotdog ? A fangfurter !sna;snake
Who decides which weeds to kill in the garden? Weedicide.;garden
My birthday is the 26th, the day of the first Presidential Debate. I do love comedy on my birthday!;birthday
Giving birth? Passing a gallstone? Monica Seles tennis match? Possible scenarios from sounds emitted from chic on elliptical next to me;gym
Why did the student act crazy each time he worked on math homework? He was on crystal math.;math
Peter Pan and the Lost Boys are actually the souls of aborted kids That explains Captain Hook;Peter Pan
Where does spaghetti go to dance? The meatball.;spaghetti
A poet once gave a pigeon helium, and invented high coo.;poet
What do you get if you cross Islam and Capitalism? No more jokes about the profit.;Islam
How does Jack Frost get to work? By icicles;Jack Frost
Someone asked me if I wanted to watch Richard the third. I Said 'I haven't the seen the first 2';Richard the third
Q: What do you get when you cross a ghost and a the letter K? A: A book.;ghost
It must suck when a billionaire... Wakes up feeling like a million bucks.;billionaire
My all time favorite lawyer joke. Q: What's the difference between a porcupine and a BMW full of lawyers? A: The porcupine has the pricks on the outside.;lawyer
Doctor doctor I keep thinking I'm a  spoon. Sit there and don't stir.;doctor
The heart is a barefoot child that keeps running in and out of traffic.;heart
When it comes to getting things done, my work ethic is like lightning. I take the path of least resistance.;work ethic
If Satan ever loses his hair, there will be Hell toupee.;Satan
Why is it called finding nemo? been wondering for years;Nemo
Where does Kylie Minogue get her kebabs? Jason's Doner-Van;Kylie Minogue
I beat a black belt at karate. My next challenger is a green sock.;karate
Why did my friend throw my computer out the window? So A Dell could message me and say Hello from the other side.;computer
Why did the french guy not help his friend fix a pipe? He said he would assister.;french
90% of parenting is giving up the last fried cheese stick to your kid and pretending you're OK with it.;parenting
"I've never flown before said the  nervous old lady to the pilot. "You will bring me down safely won't  you? "All I can say ma'am" said the pilot "is that I've never left  anyone up there yet!";flying
I'll admit, ever since I saw Psycho as a kid I've felt a tiny bit nervous each time I kill someone in the shower.;shower
Why does Pakistan never get a corner during a football match? Every corner they get, they open a shop on it;pakistan
My family is German. I've learned the hard way not to get drunk. The hangovers aren't the problem, but for some reason I keep waking up in Poland, and all my Jewish neighbors keep vanishing...;german
When Chuck Norris is in a crowded area, he doesn't walk around people. He walks through them.;chuck norris
What do you call a banana you have a crush on A baenana;banana
What did the pirate say when his kids were about to watch their favorite cartoon? ARE YE READY KIDS?!;pirate
My grandad was killed by a zulu He was having a shit in London zoo and the roof fell in.;zulu
Virgin will hate it when someone said... You don't worth a pound.;virgin
DOCTOR: I have some bad news. You have HIV ROMAN: What?! DOCTOR: Do you have any questions at this time? ROMAN: Yes, wtf is H4?;doctor
I'm not afraid to admit that I'm not the sharpest elevator in the sea.;intelligence
What is the difference between Michael Phelps and Hitler? Michael Phelps could finish a race.;Michael Phelps
What do you call a fish with no eyes? A fsh! ... I'll show my way out;fish
How about a ceiling fan with brakes so I don't have to stand there for 10 seconds wondering if I actually turned it off.;household
Generally, the phrases "I'm sorry" and "I apologise" are used synonymously... But not at a funeral.;apologies
"What kind of house does cheese like to live in?" "A cottage";cheese
Q: What is rhubarb? A: Celery with high blood pressure.;rhubarb
How do you know Kurt Cobain didn't have dandruff? A bit of his head and shoulders were found behind the couch.;Kurt Cobain
4-year-old from next door got a whistle for his birthday and I got 1 phone call.;neighbors
Given how many times they've been screwed by hurricanes, it's time to change the name of the Virgin Islands.;Virgin Islands
Hoarding's great. Collectively speaking.;hoarding
Every fight is a food fight when you're a cannibal.;cannibalism
Give a man a fish and you feed him for a day Teach him to fish and you get rid of him during weekends.;Fishing
Why don't they call the Batman film "The White Knight" instead of "The Dark Knight"? Because no one would care that he died.;Batman
Is William Shatner the past version of William Shitner?;William Shatner
Why did the condom hit the wall? Because it was pissed off;Condom
Last night I was laying in bed, looking at the stars... And then I wondered, Where the fuck did my roof go?;Roof
What do you tell a conductor when they lose control of their orchestra? Go Bach and get a Handel on it!;Conductor
Did you hear about the discounts at Darth Maul? I heard they're going to cut the sales by half;Darth Maul
why is a divorce so expensive? Because it's worth it.;Divorce
Why can't you fool an abortion? It wasn't born yesterday.;Abortion
Why do midgets laugh when they play soccer? 'Cause the grass tickles their balls when they run;Midgets
Condom Why did the condom fly across the room? Because he was pissed off;Condom
What did constipated Yoda say to his fecal impaction? "I shit you not.";constipation
Which is the only day you are safe in a cannibal  village? Sitterdays (when they eat the baby-sitter instead).;cannibalism
Did you hear about the gay turtle? Finally came out of it's shell.;homosexuality
I used to hate my job moving air around... But now I'm a big fan.;job
I just threw a rock at a guy who was getting Subway breakfast. He understood why.;Subway
Hope you guys like this, it's been a tough day. I bought a pair of sneakers from a drug dealer. I don't know what he laced them with, but I've been tripping all day. :(;drugs
I'm starting a new Egyptian fraternity, would you like to join? It's called Delta Delta Delta.;fraternity
Whats the difference between a duck? One of its legs are both the same.;duck
Describe yourself in three words. Lazy.;personality
What do a plum and an elephant have in common? They're both purple except the elephant.;plum
Did you hear about the new low fat religion? "I Can't Believe Its Not Buddha";religion
How does a WWE wrestler like his eggs? Raw;eggs
How did "Hans Solo" not catch on as an euphemism for masturbation?;masturbation
"I'm not drunk, I'm a zombie..." ~Me passing out candy on Halloween;Zombie
What did the racist ghost say? Wight Power!;Racism
How did the blind man know Santa was in his house? He felt his presents.;Blindness
Oh, you have dignity? Well I have nachos. I win.;Dignity
A tachyon leaves a bar... The bartender says, "We don't serve your kind here." A tachyon walks into a bar.;Physics
What do you call it when frankenstein's monster's wife gets her period? Her monstrual cycle;Frankenstein
First Spaceman: I'm hungry. Second Spaceman: So am I it must be launch time !;Space
What state makes exclusively swiss cheese? Swisconsin.;Geography
You're never too old to learn something stupid.;Learning
A man was killed by ducks last week I guess you can say that's a pretty *fowl way to die*;Death
Sorry Siri, talking to machines is not for me. I still get tongue-tied at the drive-through.;Technology
Who cares if you pee in the shower? The bride and all her guests, apparently.;marriage
"These orthodontic shoes are really great!" - don't you mean *orthopedic*? "I stand corrected.";shoes
Waking up alone with morning wood is one of the hardest things in life. [NSFW];sex
I like my tumors like I like my bingo numbers... B9;tumors
Nicknames How do you get bob from "robert" ? -no answer How do you get billy from "william"? -no answer how do you get dick from "richard"? -ask nicely;nicknames
When I was growing up my parents used to tell me that I can be anyone I wanted. Now the police call that Identity theft.;identity
I'm beginning to think rappers exaggerate a Lil.;rap
What's the difference between a snow-man and a snow-woman? Snowballs.;gender
Knock, knock Who's there? Cecile. Cecile who? Cecile the d-door! There's a m-monster outs-s-side!;monster
Mom: So, do you have someone special in your life? Me: Define "someone" Mom: You know, a boyfriend. Me: Define "boyfriend";relationships
What goes clop, clop, bang bang bangbangbang!clop,clop,clop? An amish driveby;crime
That's a nice ham you got there... It'd be a shame if you put an 's' in front and an 'e' at the end of it.;ham
What's the difference between a hippie chick and a hockey player? A hockey player showers after three periods.;hygiene
Sex jokes Are Not Funny Come on guys.;sex
I keep waiting for my Cadbury Creme Eggs to hatch into Cadbury Creme Chickens, but no luck so far. And sitting on them certainly didn't help;Cadbury Creme Eggs
There's this guy at work who loves shoving baguettes up his butt. What a pain in the ass.;Work
I often find myself singing in the shower, which can be extremely frightening. Is he a clone!? What is this place! SOMEBODY HELP ME.;Singing
[me giving tour of city landmarks] and on your left you'll see a corgi in a bandanahe's not part of the tour but let's go get a closer look;City landmarks
There are 2 types of people in the world Those who can extrapolate from incomplete data.;People
I bet when Johnny Depp dies his only regret will be he didn't do enough Tim Burton films.;Johnny Depp
Why is six such a nervous number? **sinko says** it's because of some cannibalism story going around.;Numbers
How many stoners does it take to, ah... unhhhh..........;Stoners
Where does light go when it is convicted of a crime? Prism;Light
What do you call it when someone makes a slam-dunk wearing shiny handcuffs? Boom-shackle-lacquer!;Basketball
Alzheimer's cop: do you know why I pulled you over?;Police
Why was the Scandinavian atheist warm? He had Thor doubt.;Atheism
How did the elephant get into the room? We don't talk about it...;Elephant
What's the most privileged fish? A Great White shark.;fish
What do you call the Japanese police force? Kawaii Five-0;police
Guy tells a psychiatrist he has a fear of commitment. Psychiatrist says, "There's no need to worry. I only do that in extreme cases.";commitment
When life hands you melons, make sure you squeeze them fast before you get slapped.;life
"Hippos are actually more dangerous than crocodiles and sharks combined." - Moron who clearly hasn't pictured a Crocoshark.;animals
What do you call it when a DJ doesn't wear a period appropriate costume? Era Error;DJ
Two muffins are baking one says to the other "Hey man you got a light?";muffins
What do you say to a two headed monster? Hello hello.;monster
My dad was a good man, he raised five boys.... Without the rest of us knowing;family
I'm a kleptomaniac It's ok though, I'm taking something for it;kleptomania
My grandfather came back from the war... ...with a single arm. To this day, we still have no idea whose it is;war
When is a door NOT a door? When it's ajar.;door
[Jaws 5] Shia LaBeouf: Wait, is that a real shark? Spielberg: ACTION!!;movie
Whats the hardest part about slaughtering a pig? He keeps saying "I have a wife and kids, please don't kill me, I'm just doing my job";Pig
New Show Magic Show Idea I'm going to start a magic show at a funeral home and call it Abra Cadavera Hour;Magic
yo mamma so fat she sat on her ipod and made it an ipad;Fat
There have been many time in 2010, when I have annoyed you, disturbed you, irritated you, bugged you... today I just wanna tell you... I plan to continue in 2011!;Relationship
A man walks into a bar... Then he said ouch.;Bar
My biologist girlfriend was making competent cells at the lab today... I asked if they were very sure of them cells.;Biology
If a server comes to my table and asks 'hows everythin tasting?' mid chew I like to grab their wrist and keep them there until I can answer;Server
Q: Why was Jon walking backwards on the first day of school? A: Everyone kept saying it was back to school time.;School
Two dogs are standing beside a road... The first one goes, "woof", the second says, "knock it off! That's all you said yesterday.";Dogs
(really fucked up joke) How do you say happiness in German? Auschwitz;Holocaust
John regrets getting a brain transplant. I guess he changed his mind.;Brain
My life is an open book. But it's very poorly written and I die in the end.;Life
Staring deeply into the abyss. Paralyzed by fear. Unable to move, let alone function. In short, yes, Pandora. I'm still listening.;Music
I've never been booed off stage. I've never been booed off stage! Sure, I've been booed on stage plenty of times... but never off stage. In honor of Mitch Hedberg. RIP.;Stage
Do you know what the difference is between toilet paper and a shower curtain? Oh. So it's you then.;toilet paper
We were watching The Discovery Channel on the couch. I was naked. She was afraid. I guess I should have probably introduced myself first.;introduction
The internet does not make people ignorant, it just makes their ignorance visible to everyone else.;internet
Breakfast Bacon, Eggs, and Toast walk into a bar. The bartender says, "Sorry, we don't serve breakfast here.";bar
What do you call a traitor with a lisp? Judith;traitor
Similes are like as holes.;similes
Why did the vulture have to check some luggage at the gate? It was only allowed one piece of carrion.;vulture
What kind of hair do oceans have?  ...Wavy hair.;ocean
What is the Puerto Rican national anthem? Row row row your boat;anthem
Tom has no legs Who's that running? Not Tom;running
Drunk dude told me this at a party "Hey Katy, do you know what your Canadian name is?" "Katy A." (Katy, eh) Maybe you would've had to have been there...;Canada
"I can try" is a great response to invitations because you're not even committing to trying.;invitation
A butcher married a baker and had a kid who grew up to be what? Fat.;butcher
Anal intercourse is for assholes.;intercourse
Art is when u fart without F.;Fart
We should re-fi, so we can get some hi-fi and watch sci-fi on the wi-fi.;Finance
It's called karma, and it's pronounced "haha! Screw you!";Karma
slight variation on an arguable classic: How do mermaids reproduce? Binary fish-ion.;Mermaids
My X-ray technician told me she usually doesn't go on dates with her patients... ...but she saw something in me.;Dating
Sorry I reported your newborn's pic on FB but nudity is nudity;Nudity
Where does a snowman keep his money? In the snowbank. I'll see myself out..;Snowman
My computer's RAM isn't that great... ...but it still has faster processing than the DMV.;Computers
A dog walks into a bar.. "I'm looking for the man that shot my paw";Dogs
Another blonde joke A blonde tells her husband 'I've been thinking' He replies 'Take two aspirin, the pain will clear right up'.;Blondes
What did the recent Sunni convert says about ISIS? They really scared the Shiite outa me!;ISIS
What do call a horse that lives near you? A neighbor (naybor for pessimist horses);Horses
How do priests make holy water? They bless the hell out of it.;Priests
Dora, with all the questions she poses to her audience, is breeding a generation that will scream loudly at the characters in scary movies.;Dora
Want to hear a joke? Just talk out loud.;Talking
Why did the thoughtful father buy his six children a dachshund? He wanted a dog they could all pet at once.;Fatherhood
What did Dr Frankenstein get when he put his  goldfish's brain in the body of his dog? I don't know but it is great at chasing submarines.;Dr Frankenstein
Why did the airplane fall out of the sky? Because the pilot was a loaf of bread;Airplane
Nothing enrages me more than a pop-up ad that MOVES SO YOU CAN'T CLICK THE X.;Pop-up Ads
Why won't the witch let the traveling pig actors into her gingerbread cottage? She's afraid they'll bring down the house.;Witch
How many dicks do you have to suck before you know you're gay? Three, two for fun and one just to make sure.;Homosexuality
Mechanic : your motor is losing power and it won't last long. Me : you been talking to my wife bro?;Marriage
"Whose funeral was this photo taken at?" John, serious tone: "I dunno. Let's see who's missing" possible funniest thing john has said;Funerals
How many accountants does it take to change a light bulb? "What kind of answer did you have in mind?" Two one to change the light bulb and one to check that it was done  within the given budget.;Accountants
ME: [in front of mirror] Bloody Mary Bloody Mary Bloody Mary *Bloody Mary appears* ME: I'm moving today and need your help BLOODY MARY: Shit;Bloody Mary
Why are there so many body shops in heaven? Abortion.;abortion
Please do not wear flip flops if your feet look like you could sweep down & snatch your dinner while it's still running through the forrest;feet
What do you call a Chinese man with one foot? Taiwon Shou.;Chinese
Politicians only kiss babies because it might be theirs.;politicians
I don't really know how to tell jokes;jokes
Therapist: What's the problem? Wife: He makes friends with the strangest things Me [petting a bee]: You're not strange are you Alan;marriage
Why would you be scared to get Ebola? You haven't left your couch since 2011.;Ebola
Why can't I trust my Walmart calculator? It's always 7% off.;calculator
How do lesbians keep things interesting in the bedroom? They think outside the box.;lesbians
What do you call a flying turtle? A shellicopter.;turtle
What do Buddhist monks have for breakfast? 'Ommm' lettes!;Buddhist
Ever have one of those days where you just don't feel like being at work? I've been having one of those days for two fucking years now.;work
Why don't lobsters like to share? Because they're "shellfish";lobsters
I wish the mailman would come to my house at the same time as the garbage man so he could give my mail directly to him.;Mail
Why do people at Disneyland hate coke heads? They're always cutting lines;Coke
I've had about 13 beers so I guess I'll give myself a haircut;Drinking
