"Joke";"Joke topic"
Sometimes it seems like Anthony Weiner doesn't even have a sense of Huma.;politics
When his I.Q. reaches 50, he should sell.;intelligence
The downside of studying law: you think a lawsuit is the solution to all problems. *resists from threatening Dominos for not giving oregano*;law
What does a bro say when asked if he needs help doing a magic trick? Nah brah, tadah brah!;magic
Not everyone that comes into your life needs to stay there.;relationships
Multitasking: screwing up several things at once.;productivity
I refused to buy my 5yo a tablet, and now she's resorted to hand-drawing angry emojis on pieces of paper to express her frustration.;parenting
Why do credit cards not work in France? They don't understand the concept of charging.;credit_cards
[Corporate Olive Garden meeting, 1985] Jesus: Let's do unlimited breadsticks. CEO: How can we supply that many? Jesus: *winks at camera*;business
I feel there's still hope for this world every time my computer's spellcheck doesn't recognize Kardashian.;technology
Buy Domino's Fire everyone Hire dragons Fire roasted pizzas Delivery in six minutes or less IMAGINE DRAGONS;business
Where does geography and geography meet? The Bermuda Triangle.;geography
WALKING DEAD JOKE (Harsh) I was going to say a compliment about beth but i'm afraid it would go strait to her head.;television
For all you Engineers out there A statically indeterminate beam walks into a bar, the bartender asks: "What do you want?" The beam replies: "Oh, just give me a moment.";engineering
How do you call fish with no eyes fsh;fish
I got sacked from the dodgems. I'm going to take them to court and win the case based on funfair dismissal.;job
Did you hear what ubisoft rated assassins creed black flag? They rated it ARrrrrrrr 16.;video games
Why can't people in wheelchairs be looked at for too long? The can't handle stares.;people in wheelchairs
You know, sometimes bad things happen to exactly the right people.;general
Knock Knock Who's there ! Coda ! Coda who ? Coda paint !;paint
An illegal immigrant and a pedophile got into a fight... It was the real life version of Alien vs Predator;immigration and crime
An invisible man and an invisible woman got married. Their kids were nothing to look at either.;marriage
Go into a bathroom stall and write: "For A Good Time Call Your Mother. She Misses You & Enjoys Hearing Your Voice.";general
My wife told me she used to be a lesbian once "You mean I turned you?" I asked with a grin. "No...." she replied wistfully. "I just ran out of money.";marriage and relationships
Girl, are you pre-Renaissance art? Because you need to get some perspective.;art
"Toilet joke * Dirty "Toilet joke" [Dirty] if it's yellow let it mellow if it's brown let it drown if it's red.... you could of spread?;toilet
What would you call a terrible piece of gold? Absolutely Auful!;chemistry
What is the most violent element of the periodic table? Ni, because Ni for an eye;job
Nothing embarrasses a psychic more than a surprise party.;surprise
I'm going to be late I'm at the hospital getting my hymen restored, so I'm a bit de-laid.;hymen
Even after all the crap that's gone between them. They're still together. My butt cheeks :);relationship
Allstate just sent me a safe driver bonus check for 73 cents so I guess good things do happen to good people.;driving
Sometimes I just get the urge to belt out The Lion Sleeps Tonight. After all, it's only a whim away.;music
Jared was a good eater But he always left a little behind;eating
Looking for a joke: irish dinner potatoe Pretty close, but need to know the exact joke about irish dinner consisting of potatos and beer;irish dinner
If your phone fell in a toilet, you would... 1995: ...leave it, toilets are gross Today: [wrist-deep in urine] BRING ME A BOWL OF RICE NOW;phone
What's the difference between a lawyer and a bucket full of shit? The bucket.;lawyer
Where does the General keep his armies? In his sleevies;army
Go ahead and cremate your grandma, you've urned it.;cremation
Hell hath no fury like a woman slightly inconvenienced.;woman
*PLOT TWIST* Breaking Bad last ep. Walt takes off the mask to reveal he was Dwayne Johnson The world finally knows what the Rock was cookin;Breaking Bad
Constantly saying "I don't care about sports" is a form of caring about sports;Sports
Q: Why are elephants gray? A: So you don't get them confused with blueberries.;Elephants
Next time you're having a bad day just remember that alligators spend their whole lives looking like they're trying to do a push-up.;Alligators
What's the most dangerous place in an Excel file? C4;Excel
What do you call a Mexican Jedi? A Padajuan;Star Wars
Charlie Brown decided to wear transparent pants one day... ...and when Lucy saw him she said "I always thought you were a blockhead, Charlie Brown, but now I can plainly see your nuts.";Peanuts
What is a Nuclear Physicist's favorite Genesis song? "Land of Cold-Fusion".;Genesis
30 wolves 28 sheep how many did not 10;Math
what idiot called it a best man instead of a lord of the rings;Lord of the Rings
I need to get baked ...goods for the staff party this afternoon.;Baking
Did you hear about the man who went into the doctor for anal glaucoma? He couldn't see his ass going into work.;Health
People used to laugh at me when I said I wanted to become a comedian... well nobody's laughing now!;Comedy
I don't understand... ...how God can have Ten Commandments for the whole world, and yet my wife can have 152 just for our house.;Marriage
A wireless bra? They weren't tricky enough, now I need a password?;Technology
We should legalize heroin just for the commercials alone;Drugs
Slept like a log last night Woke up in the fireplace.;sleep
What's so good about living in Switzerland? Not sure but the flag's a big plus.;Switzerland
*Relationship status* Me: I'm heading off now. Wife: Yayyy.;marriage
Superman wears Chuck Norris underpants.;superhero
Who does a dead pharaoh talk to? His mummy.;pharaoh
It's not really 'fast food' if fat people can catch it.;food
What's the opposite of running away and getting married? Anteloping.;marriage
What do you call a pall-bearer in Oklahoma? a Karaoke;Oklahoma
Bud light is alot like sex in a canoe... It's fucking close to water;beer
A joke told by the mods of this sub. "Long";length
I'm badman! bad to whom? whoman!;identity
Spent all last night mouthing words to my dog to try and convince him that he'd gone deaf.;dog
What do you call a wooden spoon in the bedroom A weapon of ass destruction;spoon
What do you call a deaf person who can't lip read? Anything you want!;lip reading
What's red and green and wears boxing gloves? A fruit punch.;fruit
If you received a blow job from a toothless Japanese woman, Would you call that oralgumi?;blowjob
Two and a half men would be way funnier with an all black cast But then it would have to be called one and 3/5ths men;cast
So I was petting a duckling the other day... you could say I was feeling a little down.;duckling
Sun Devil Fans What is the difference between a Sun Devil fan and a pet rock? About 3 IQ points;fans
What is McDonald's demolition service called? Quarter pounder.;demolition
After a tornado tore through town, thankfully no one was hurt. The trees were stripped bare, though. God breathed a sigh of releaf.;tornado
Green smoothies because who has the time or energy to chew 17 cups of spinach/lettuce/kale;smoothies
A student brought me 20 huge homemade chocolate chip cookies today. Good thing I have self-control--I saved one for my kids. To split.;cookies
A girl quit her job at the doughnut factory... She was fed up with the hole business.;factory
Did a somersault for the first time in years. I know that's not a good tweet but I'm getting bored lying here waiting for the paramedics.;somersault
So weird that before we invented cars, if you hated someone you keyed their horse.;cars
[Sky-diving] INSTRUCTOR: pull your shute! ME: my shoe? INSTRUCTOR: your parachute! ME: my pair of shoes? [later] CORONER: where's his shoes?;sky-diving
40 days after Christmas Yo momma is so fat, I took a picture of her for Christmas and it's still printing.;Christmas
Did you hear about that new supervillain, The Weather Man? I hear he's taking the world by storm;supervillain
Most irons aren't made from iron, which ironically is both ironic and unironic.;irony
It's Saturday night and I just saw a guy with a ponytail and tinted lenses. Somewhere, a tarantula is home alone;appearance
[dinner party] *removing myself from table* Excuse me, I have to take this. *picks up host's dog* *leaves*;manners
Poker never works well in Africa Ethiopians always eat the chips;Africa
Did you hear about the agnostic insomniac dyslexic? He lay awake at night wondering if there's a Dog.;religion
Maybe 6% of pens work. Terrible job, pen manufacturers.;quality
It's hard for me to believe that the new Star Wars trailer has already been seen millions of times. How do they even know where it's parked?;technology
What do you call it when an inmate takes a picture of their-self? A Cellfie;photography
Knock, knock. "Who's there?" "Annie." "Annie who?" "Annie body home?";knock-knock
A crossfitter, a Texan, and a vegan walk into a bar. How do you know? They all tell you within 3 seconds.;stereotypes
A fool guy A man ask another what's you name and from where are u? He replied why would i tell u that my name is jhon and i am from usa.;identity
You're invited to my Oscar party! The theme is movie star cuisine which means there won't be any food.;parties
No one sleeps with Gandalf because it takes him until first light on the fifth day to come.;sex
What is more dangerous than a polar bear? A bi-polar bear.;bear
I thought I was wrong once But I was mistaken;self-doubt
There's only two things I hate in this world: intolerance... and the Portuguese.;nationality
Say what you want about deaf people;deafness
What do you call a parrot when it has dried itself after a bath? Polly unsaturated!;parrot
The Anesthesiologist has become Comfortably numb.;anesthesiologist
Did you hear about the the horse that got shot? He's in stable condition.;horse
I forgot my U-bend was blocked when I went to the toilet... I soon remembered, when it all came flooding back.;toilet
What do you call Batman who skips church? Christian Bail;Batman
I've got hoes in different area codes. (I'm very careless with my gardening tools.);gardening
Cop: Know why I stopped u? Scientist: No Cop: How much science u do tonite? Scientist: Just one-[test tube falls from coat] Cop: Get out;scientist
People at my work name their food.. .. today I ate a lasagna named Peter;food
God: You finish all 11 commandments? Moses: About the 11th one... God: What? Moses: Check yourself before you wreck yourself? God: Fine, 10.;commandments
Some lady at Olive Garden died, so we're rummaging through her stuff. Just like a real family.;family
What's Whitney Houston's favourite type of co-ordination? HAND-EYEEEEEEEEEEEEEE!!!!!!!!!;music
I consider each one of my friends a gift. Now if only I could remember where I put some of those receipts...;friendship
If the headline just read "Kanye West Acts Like a Shithead," news sites could reuse it over and over again.;celebrity
God grant me the serenity to accept the things I cannot kill, the courage to blow up the things I can, and the wisdom to not get caught.;violence
The guy blaring the self help CD at the red light in the rusted car with no bumpers wasn't amused when I said, "I don't think it's working";self-help
I hate three things in this world: math;math
What did the guy in China say to the Chinese couple who finally got approved to adopt? Con-grab-ur-asians!!;adoption
Which film star is always jumping around the forest? John Treevaulter.;film
The most diverse software company in the world consists of 100% black lesbian single mothers missing a body part, with arts degrees;diversity
My stats teacher told me I was average. I thought that was mean.;statistics
Think of how old we're gonna feel when Honey Boo Boo dies from an overdose.;celebrity
I like my men like I like my coffee... Nowhere near my vagina. A little lesbian humor....I'm not gay I just couldn't resist....too good :);coffee
What do you use to check your cell from across the room? A telephono lens.;cell phone
Animal testing is pointless. We already know they're animals.;animal testing
What song do pigs sing on New Year's Eve?  Auld Lang Swine.;New Year's Eve
SCIENTISTS: We've discovered a massive black hole with no obvious qualities ME: Ok wow I'm right here;black hole
I hate when you forget to wear a belt and have to shoot heroin using the blood pressure machine at walgreens.;heroin
Cop: [knocks] Dinosaur: can I help you? Cop: we've had reports of small arms fire [Flaming T-Rex runs past screaming];dinosaur
If a blind girl says you have a big dick.. She probably is just pulling your leg.;blindness
Do you ever get the feeling that you're being watched? Because if it's bothering you I'll stop.;paranoia
Had to stop watching Game of Thrones with my parents tonight, because of all the sex. So I've recorded it to watch after they've finished.;Game of Thrones
What do you do when you are riding a horse, and a cheetah and ostrich are chasing you? You get your drunk ass off the carousel!;carousel
Modern Haircuts by Sean Head;haircuts
8yo: Do we have a fire extinguisher? Me: Yes. 8yo: Where? Me:... 8yo: WHERE! 6yo: (from outside) It's spreading. Me: I'm up.;fire extinguisher
Nice selfie, I love the way the light brings out the bat sh*t crazy psycho in your eyes.;selfie
me: wow the stars are beautiful gf: omg babe they really are me: u know who else is beautiful? gf: *blushes* who? :3 me: Harambe;stars
Why is the Canadian Mint so confusing? Because they don't make any cents.;money
I give this cheese an "A" I grated it myself;cheese
If you don't boo at people after bad sex how do you expect them to ever get better?;sex
I have a nice body. It's out in the trunk.;body
Why does the police officer get up early in the morning? To beat the crowds.;police
Babe Ruth Walks Into a Bar Bartender says "Why the Long Balls?;baseball
If your kid complains about how bored they are during winter break put a cape on them and say, "Now you're super bored!" and then fly away.;kids
How did the astronaut break up with his girlfriend? "I just need some space.";space
How does the Ultimate Warrior repair his car? With parts unknown.;car
How many hours A guys asked he's wife "how many hours will it take me to get to 80 miles going 80mph" the wife looks at him confused and answers "80 hours";driving
Why did the chicken kill himself? To get to the other side.;chicken
What is Minion's favourite brand? Banana Republic~BA~NA~~NA~~~;brand
Don't go to a fight with a gun or a knife, Bubblewrap yourself, People won't fight when there's bubblewrap;fight
A food truck rodeo is a lot like the game The Oregon Trail You circle your wagons. You trade money for food. And it usually ends with dysentery.;food truck
The pleasure is all mine... The greeting of a greedy hedonist.;greeting
I'm such a daredevil. I put ALL my eggs in one basket at the grocery store.;grocery shopping
Batman: "I am...**BATMAN!**" "Hi, Batman, I'm not Dad because yours already died when you were a kid.";Batman
UPS, FedEx, and DHL trucks should play a jingle like ice cream trucks so we know when our packages are coming.;package delivery
a C, Eb, and a G walk into a bar... The bartender says "sorry we don't serve minors here," so the Eb walks out and the C and the G have a fifth between them.;music
I'm going to open a restaraunt called pantera bread It will be similar to panera bread, but the food we serve will be much heavier;restaurant
Why are the British known for keeping a stiff upper lip? Because it hides their teeth.;British
Pete and Repeat were on a boat. Pete fell off, so who was left?;wordplay
What happens when you drop a piano in a mine? A Flat Minor;music
Eating a banana. Thought I should tell you. Twitter seems concerned about women getting enough potassium. But... why can't I use my teeth?;eating
To say Nirvana wasn't the most influential early 90s band would be... A denial, a denial, a denial, a denial...;music
Start here. Now go to that side. Back to this side. that side again. now this side ok that side this side 1 more time now front (bed making);bed making
The concepts of "History", "Discovery", and "Learning" should be embarrassed by each of their respective Channels.;TV channels
Why do Chicken Coops have two doors? Because if they had four doors, they would be a chicken sedan. *slaps knee*;chicken coops
Does anybody know the name of that Godzilla Movie? It's the one where another monster actually breaks one of Godzilla's legs. I can't remember the name of the movie, but it has a huge cast.;movies
I realized today why some people spend their lives looking for bigfoot. He doesn't exist.;bigfoot
What would happen if Leafy went to The Filthy Frank show? Chin-chin would leave.;TV shows
If you replace the "W" in "where" "what" and "when" with "T" you get answers to the questions.;language
Why are rivers lazy? Because they never get off their beds.;rivers
My 20y/o brother went to Elementary school.. To learn firebending;Avatar
What's a control freaks favorite macro? Control+U;computing
What do you call an anorexic with a yeast infection? A Quarter-Pounder with Cheese.;anorexia
What's the difference between a Russian ambassador and a chicken? The Russian ambassador is Turkey;nationalities
Sex is like listening to the Beatles Your parents do it and it somehow doesn't make it less cool. Shout out to CH, because I heard it here.;sex
[After date, walking her to her door] Her: Thanks. I would invite you in, but I don't want to.;dating
Have you seen Stevie wonders new house? He hasn't either;Stevie Wonder
My priest was pretty upset today. Nobody at mass bought him a Father's Day card.;Father's Day
I used to own a racing snail... It never won though. To improve its performance I removed its shell but, if anything, it made it more sluggish;snail racing
What I hate most. I hate people who never finish their sent;unfinished sentences
Whats blue and doesn't fit anymore A dead epileptic;epilepsy
My girlfriend and I decided we aren't ready for a baby yet, so I double-bagged it. It worked babies cannot breath through two layers of plastic shopping bag.;birth control
Why was 6 afraid of 7? Bcuz 7 8 9!;math
Every time I have sex with a woman I always assume she has herpes... ...that way I don't have to tell her about mine.;sex and herpes
What do you call an 83 year old black man? Dick Gregory;Dick Gregory
How do you piss off Winnie the Pooh? Put two fingers in his honey.;Winnie the Pooh
We had a pop quiz in culinary school today. It was a piece of cake.;culinary school
SON: I'm moving out as soon as I turn 18 and you can't stop me. ME: [pumping fist] If you insist.;parenting
Why did the detective wear a patch on his left eye? It's his private eye.;detective
What do you call a political conservative woman who is required to always be there? Amanda Tory;woman
THEM: You can't go wrong with this recipe. ME: Watch me.;recipe
Someone please recommend a self-help book that can teach me how to sleep through an alarm.;sleep
So I asked my dad... So I asked my dad during Christmas dinner if anything were home made? He replied "definitely not you.";family
What do you do when a cannibal eats a vegetable? Throw away the wheelchair;cannibal
So I was at Legoland the other day and I saw a couple making out I thought it was inappropiate so walked up to them and said "Come on guys, this is Legoland. Build a room.";Legoland
High joke A cop stops a man and asks "how high are you?" The man replies." That is wrong english. You should say 'Hi how are you?'";police
Why did the snail cross the road ? It is not clear yet , let it cross the road first. Update : It has been confirmed that it was to meet the Chicken who crossed the road earlier.;snail
I'm starting to think people are having babies solely for the Facebook likes.;Facebook
How many psychologists does it take to change a light bulb? One. But only if the light bulb wants to change.;psychologist
A "clear memory" button, but for my brain. And while we're at it, a "delete cookies" button, but for my thighs.;brain
Q: Why did the haunted house not like rain? A: Because it dampened his spirits.;house
Moves shopping cart to allow car to park Lady doesn't even say thanks Puts cart back behind her car Leaves.;parking
What's sexist and not a concern for feminist? Misandry;misandry
Rap videos are completely unrealistic. Nobody has that many friends.;Rap videos
"tell... my wife... i loved her..." carl dies. NOO! U LOVED HER WHAT?! *shakes body* U LOVED HER... TITYS? HER CAT? *slaps face* PLS WAKE UP;Death
Some days I ask, "What would Chewbacca do?" And the answer is always, "Make that gargly roaring sound." So that's what I do.;Chewbacca
I refuse to text and drive... I always end up spilling my beer.;Driving
Knock knock... Who's there? Go fuck yourself.;Knock knock jokes
*sees a guy snap fingers at a server. I reach for my bag* Wife: No. We only have one left. We have a baby. Me: (to genie) take his fingers;Genie
My inappropriate uncle told me this one when I was 11: Where do cousins come from? ant holes;Cousins
If diet and exercise are not working for you, try actually dieting and actually exercising.;Dieting
I wish I had emo hair So it would cut itself.;Emo hair
In future period films set in the late 2000s/early 2010s, I hope they accurately portray all 16:9 televisions showing stretched 4:3 content.;Period films
My wife drove us into town today, she parked up in a sidestreet. I said, "I'll get a taxi from here." "Where to?" She replied. "To the f*cking kerb.";Parking
When people shorten words for no reason it makes me want to commit murds.;Language
Why did the cowboy get a daschund Because he wanted to "get a long little doggie";Cowboys
What goes "Clippity Clop Bang Bang, Clippity Clop Bang Bang"? An Amish drive by shooting;Amish
How many mexicans do you need to screw a lightbulb? Juan;Mexicans
INTERVIEWER: What do you see as your biggest weakness? ME: INTERVIEWER: ME: MY MOTHER: He's not good at speaking up for himself;Interviews
*stands over dads casket* "Mom isn't doing well, dad." *puts hand on dad's shoulder* "You need to stop building caskets. It's creepy.";Family
My girlfriend said she wanted to experiment a bit in the bedroom we synthesised a new protein chain;Science
What do you call it when you kill an important donkey? An Assassassination. I made it up when I was seven and to this day its the only thing I've ever made up that resembles a joke.;Donkeys
I need a thingy to fix the thingy because the thingy came loose and the thingy is wiggly now. Do you sell those? -Me, at Home Depot;DIY
Why did the monkey fall out of the tree? ..because it was dead;Monkeys
ShittyJokeExplainBot walked into a bar. He didn't order anything. Wait for it...;Bars
Why did the hipster fail making ice cubes for his bourbon? Because he pulled out the tray before it was cool;Hipsters
"Lie flat on your backs class and circle  your feet in the air as if you were riding your bikes" said the gym  teacher. "Fred! What are you doing? Move your feet boy."  "I'm freewheeling sir.";School
Our Unabashed Dictionary defines wet dream... As the winner of a damp-t-shirt contest.;Sex
Dear funny, I picked up the wrong sandwich at Subway Oops, wrong sub!;Subway
I've had a really bad day. First, my wife got ran over by a bus. Then, I lost my job as a bus driver.;Marriage
Why did the mushroom get invited to the party? Because he was a fungi;Parties
I'm worried that I'm gonna get a super judgey coroner.;Death
Federal Express is to merge with United Parcel Services The resulting company will be called Federal United Parcels Or FedUp for short;Companies
Safety Tip: lock your doors and windows before bed. Btw, I love what you've done with the place.;Home Security
What do you get if you cross a giraffe with a dog ? An animal that barks at low flying aircraft !;Animals
You may think it's a good idea to go to weight watchers to meet women... but actually the ones there are quite hard to pick up.;Dating
That sunken Nazi submarine they just found is a lot like my girlfriend Dead and full of seamen;Relationships
My favorite episode of Friends is the one where blacks mysteriously vanish and unemployed white people find affordable housing in Manhattan.;TV Shows
What do you call a Mexican that's lost his car? Carlos;Nationality
I hate these supposedly "funny t-shirts". Just the other day I saw one which on the front said "I'm not gay..." and on the back said "but my boyfriend is". So I asked my girlfriend to take it off.;Fashion
"No points, illegal kick to the face." "But I'm the hero of this movie." "Fair enough, here's your trophy." -The Karate Kid;Movies
What's the best joke you ever heard? For me, it's gotta be Emo Phillips' Baptist joke. Although to tell it you've gotta get his execution down.;Jokes
Usually, the one you want, is the one you can't have.;Relationships
What is the National bird of Pakistan? Drone;Countries
What did the doctor say to the angry midget? "I'm going to ask you to be a little patient.";Medicine
What did the Eskimo lady ask her husband when they were having sex? Are you even Inuit?;Cultures
Matchbooks exist just to be clues in detective movies.;movies
My dad told me "Son if you don't stop masturbating you'll go blind" I told him "Dad I'm over here";sex
So my friend gave me half a pie... So i said, "No that's one pi";math
What do you call four bees?? ....Be-fore;bees
All of the construction that was slowing down traffic during the summer is over now. I don't know why they can't repair those cones indoors.;construction
Thought I saw a brownie walk by but it was just my dog. Other than that, diet is going well.;diet
Why is the all-lisp percussion section so quiet? Because thimbles aren't very loud.;music
