"Joke";"Joke topic"
Me: I heard Oxygen and Magnesium are going out. Friend: OMg!;Elevator
Is it a good idea to have multiple PhDs? To a certain degree.;Chemistry
What's the difference between a vegan, a crossfit instructor, and a psychological test subject? The test subject is the only one you'd willingly ask to "tell us about yourself.";Education
My girlfriend just said she's leaving me because of my obsession with goats. Meh.;Vegan
Officer: "Do you know why I'm standing here?" Me: "You got all C's in High School?";Goat
A Roman walks into a bar. He holds up two fingers and says, "five beers, please.";Police
Never ask me "Who hurt you?" unless you want to sit through a 13 hour PowerPoint presentation.;Roman
Black jokes and Mexican jokes are all the same If you know a Juan, you know Jemalle;Emotional Baggage
You want to hear the best joke ever? Repost;Chinese Khan
How many Amish people does it take to change a lightbulb? A what?;Joke
My Doctor says I need to start exercising religiously. So now I hit the gym on Christmas and Easter.;exercising
Did you hear that Jim Carrey lost his left arm in a horrific accident? I guess that makes him all-righty then.;Jim Carrey
Shout out to girls that have a relationship with prisoners. At least they always know where their man is at.;prison relationships
My Local Pizza Place Just Folded Now they serve Calzones.;pizza
Somebody gets stabbed in London every 57 seconds. Poor bastard.;London crime
What's Paul Walker's favorite energy drink??? N.O.S. too bad he can't handle the crash...;Paul Walker
Why don't cows smoke weed? The steaks would just be too high.;cows and weed
What is the difference between a used tire and a year supply of used condoms? The first one is a Goodyear and the other is a great year.;used tire and condoms
Why isn't Sean Connery an unmarried roofer? He's not a fan of the shingle life.;Sean Connery
What idiot called it kitchen worktop manufacture and not counter productive.;kitchen worktop
Two guys are fighting, who should get the last painkiller? If it is a regular fight, give the painkiller to the loser. If it is a fight to the death, the winner gets the painkiller.;fighting
People always call me unattractive until they see my wallet... then they call me poor too.;attractiveness
The sign said 'Free Range Chickens'. So, I took some.;free range chickens
Why did the boy drop his icecream? He was hit by a truck.;boy
What is the highest form of flattery? A plateau;flattery
A man gets his drill and drills a hole in a wall... ..its a bit boring.;drill
What do you call a deer without an eye? No idear.;deer
It's rude to upstage the bride on her wedding day but that's exactly what's going to happen when I burst into flames as I enter the church.;wedding
I watched a documentary about the victims of anorexia. Maybe I would have taken them more seriously if the camera didn't add 10 pounds.;anorexia
Alcoholics don't run in my family They stumble around and break things;alcoholics
How much cash could the cash cab cache if the cash cab could cache cab?;cash
Am I the only one who wants to write "Over" at the end of my tweets? Over.;tweet
When i fart I always tell my gf that it were butterfly's that did'nt know the way to my heart.;fart
An excaped convict fell out of a polishing machine and landed on a worker. He was struck by a smooth criminal.;convict
Back in my day, we didn't have computers or the internet. Guys would have to walk uphill for days to tell me I'm gay.;computer
My ex-wife was deaf. She left me for a deaf friend of hers. To be honest, I should have seen the signs.;ex-wife
My pizza is burnt, my beer is frozen and my girlfriend is pregnant. I can't take anything out in time.;pizza
How many bones are there in a graveyard? A skeleTON.;cat
What happens when you have sex with a cow and no one catches you? So far, nothing.;graveyard
why netflix and chill? Because amazon and chill has 1 day delivery.;sex
[At job interview] Interviewer: Do you have a police record? Me: No. But I do have a few of their albums on cassette *hires me instantly;netflix
Classic joke at my Catholic High School I went up to a man and said "Jesus is the messiah" He said "No way" I said "Yah-weh";police
Saw a guy in the gym, ahead of me on the Lat pulldown machine, wearing a David Luiz T-Shirt Needless to say, I got past him.;Jesus
What do you call an Asian driveby? Cap-a-chino;gym
TRAINER: you know what they say ME: no pain! lo mein! TRAINER: it's "no gain" ME: (eating Chinese food) i like this better;witch
It's all shits n' giggles... Until someone giggles and shits.;workout
Did you hear about the guy who had sex with his car? Apparently he was pretty Exhausted.... &lt.&lt .&gt.&gt I'll show myself out -.-;giggles
[wearing a 'World's Greatest Dad' t-shirt while talking to the bartender] "The younger one is about 8 and the older one is older than 8.";sex
Why did the Jews hate the holocaust? Because it "caust" them 6 million.;guns
Did you know that Hitler made a rap album? Straight out of Mein Kampf-ton.;Jews
What if Superman landed in Mexico instead of Kansas? He'd be an illegal alien.;Hitler
If you move to a different country at least TRY to fit in with the culture. Like when I lived in Italy & changed my name to Mario Spaghetti;Superman
I've only ever met white people with gluten allergies;culture
What STD did Forrest Gump catch? NSFW Jennytal Warts;gluten
2000s kids wont get this. Y2K;STD
I bet the guy who invented the percent symbol, %, got his inspiration from watching his wife put on a seatbelt;Y2K
All who believe in Telekinesis.... All who believe in Telekinesis raise my hand.;percent symbol
What do you call a friendship between punctuation? Commaraderie;Telekinesis
My hamster died as he lived... in the microwave.;punctuation
I've spent the past four years looking for my ex-girlfriend's killer, but no one will do it.;hamster
I'm thinking about going to the male pornstar tryouts... ... but I heard there's some stiff competition.;ex-girlfriend
Q: Why do ducks have big flat feet? A: To stamp out forest fires.;Legume
Do You Like Hardee's? Then you're gonna love how Hardee's nuts hit your face.;Duck
What Is A Mexican's Favorite Bookstore? Borders.;Fast Food
Him: Sometimes you can be a little... loud. Me: WHAT ARE YOU TALKING ABOUT I AM A DELICATE FLOWER;Bookstore
Girl, are you an umbrella? Because you're never with me when I need you & I've forgotten you at a restaurant 4 or 5 times.;Self-Description
Consider one of the most perplexing questions of our time: Where do' solutions go when a candidate gets elected?;Relationship
Deodorant? I've never needed to buy any. People just give it me. Complete strangers sometimes;Politics
Jeff is here! "Jeff from work or Jeff the guy who announces his arrival anytime he enters a room" Jeff is here!;Personal Hygiene
Now that cell phones are becoming more and more waterproof, pretty soon it will be okay to push people into pools again...;Social Interaction
Relationships are a lot like algebra.  Have you ever looked at your X and wondered Y?;Technology
What did Snow White say to Pinocchio after she sat on his face? "Lie to me, bitch!";Relationship
What did the Amish IT guy say about the computer? It was a bit buggy.;Medical
Did you hear Lance Armstrong lied The ball of some people;Technology
My girlfriend called me a pedophile. I said that's a big word for a nine year old.;Blackmail
Facebook: A place for liars and braggers to unite.;Dynamite
It's good to keep healthy. My gran started walking 10 miles a day when she was 50... ...she's 80 now, and we don't know where the hell she is.;Facebook
What do you get when you cross 2 ducks and a match? Fire Quackers;Health
In Soviet Russia... ...bar raise you!;Ducks
I've never once been able to explain my car trouble to a mechanic without resorting to sound effects.;Russia
I like my beer like I like my violence... Domestic;Car trouble
They say I can take the catheter out next week. And no, I'll never piss on an electric fence again;Sex
Another off color limerick A sperm, alack and forsooth Was at it's moment of sexual truth It had hoped to fall On the womb's spongy wall But was dashed to it's death on a tooth!;Medical
My Uncle has a coal fetish. Its why he likes to bang miners.;Sex
If you don't have anything nice to say I would probably enjoy spending time with you;Coal
When I was young I wanted to join the basketball team... but the coach said they didn't need more basket balls;Cleaning
What's the point of having nice tits if you're going to cover them up? Stop being so fucking greedy and unbutton your shirt like I do.;Basketball
Why don't Australians have sex? Because they mate. ...I'll let myself out.;Amplifiers
A shepherd was looking for a sheep that ran away Forget it, you've already herd this one.;Australians
Why isn't there a Superpig? It's too hard for a pig to change clothes in a telephone booth.;Sheep
I asked Siri to tell me a joke She turned the front-facing camera on;Superheroes
Sorry to text you so late but can your dog come over?;Technology
It's quite appropriate that fast food cashiers... often open with "sorry for the weight".;Dogs
It's ridiculous that the pope has to go around surrounded by armed guards these days I know he's a priest but he's not going to do anything out in public;Fast Food
the best insult ever is "who is this clown" because 1. you're calling them a clown 2. you're saying they're not even a well known clown;Pope
What does a former terrorist playboy say to the officer interrogating him? "Look, officer, I may be wearing a turban, and I may have a gun on me, but I ain't Bin Laiden years!";Insults
What do you call a bug that vanishes? A non antity.;Terrorism
What's it called when you fry up an egg with a bunch of different ingredients? Omelette you figure it out;Bugs
What is the extreme of oral sex? Licking an ostomy bag.;Pets
A friend asked me to do their hair for a rastafarian party... I'm dreading it;Olympics
This is your pilot speaking. We'll be taking off shortly once our flight crew confirms that this is, in fact, an airplane;Hair
today I went for a run & a homeless guy was like WHAT ARE YOU RUNNING FROM & I was like EVERYTHING;Flight
Why was the cell phone wearing glasses? He had lost his contacts!;Running
So in between the 4 seconds that I missed your call and managed to call ya back, you've fallen off the face of the earth??;Phone
Whats the difference between three cocks and a joke..... your mom can't take a joke;Phone
Guys, I figured out a better way to pretend you died mid-type! All you need to do is hold dooooooooooooooooooooooo;Tree
Dates are cool when I tell them I worked in a prison for twenty five years. But man, if I forget that a'...;Typing
Yo mama so old her social security number is 1!;Dating
Why do sanitary towel adverts always feature a liquid which is blue? Are aliens their primary customers?;Age
I got dumped by the personal trainer I was dating. When I asked why, she said we just weren't working out.;Advertising
Even if you don't pay, they'll usually let you go through a car wash at least once a day without a car.;Optical Illusion
Why don t women have men s brains? Because they don't have penises to put them in;Car Wash
*Hears a joke about a chocolate bar* *Snickers*;Pressure
I went to an anti-religion camp once It was a blasphemy;Chocolate
So you know how you don't dream when you smoke weed? What if MLK smoked?;Religion
New rule: You're not allowed to be condescending unless you can spell it.;Dreams
Divorce is tough on some kids. Others are just happy to be single again.;Condescension
What does Hilter get when he's scared? The hebrewgeebies;Divorce
One of the most effective forms of birth control is assembling furniture together as a couple.;Hitler
I love breakdancing. I don't do it... Or watch it, even. I just like it because it allows be to sell cardboard to rich white kids.;Birth Control
Dear Grocery Bagger, Please don't put dryer sheets and bread in the same bag. My kids don't like peanut butter & Spring Meadow sandwiches.;Breakdancing
you know what never gets old? Children who died at a young age.;Grocery Shopping
Reasons I Don't Smoke Pot;Death
WIFE: He's just so distant lately ME [skywriting]: U N T R U E;Marriage
My friend did some graffiti with me He just tagged along.;Friendship
What would Hitler say to his son? Look, I am your Fuhrer;Hitler
I have PTSD from catching a glimpse of a co-worker's pale belly roll during a meeting.;Work
New York, "Darling, can I go out in this dress?" "Yes dear, it's already dark out.";Fashion
What's the difference between an Anorexic girl and an escalator? The anorexic would not eat Chinese.;Anorexia
If you take something for granted you risk losing it. When I finally find my car keys, I'm telling them how much I love them.;Relationships
I love when girls say they need a man that can keep up with them... but immediately go into hysterics when I catch them.;Game of Thrones
Why do the Lannisters have such big beds? Because they pushed two twins together to make a king.;Food
I've been eating a lot of eggs lately.. I must be on an egg roll.;Drinks
Last night I asked my Asian girlfriend for 69... She made me sweet and sour pork with fried rice.;Incest
Incest results in some very strange humans. That's why my sister and I ALWAYS use a condom.;Work
How much does a pirate earing cost? A buccaneer;weather
My daughter asked me if I know how to do the Running Man, like my generation didn't invent it. Anyway, that's what brings me to the ER.;pirate
I love dead baby jokes ..they never grow old.;dance
Me: I don't scare easily. Pregnant wife: All four of our daughters will be teenagers at the same time. Me: *never stops screaming*;death
Me: "Dad, I wanna to go to a 50 cent concert!" Dad: "Well here's a dollar, take your sister too.";family
I get wetter as you get dryer. What am I? A necrophiliac.;music
You should never lie through your teeth. Open your mouth and speak properly.;party
So I've been clearing out my attic... ... and I've decided to get rid of my hoover- it was just gathering dust.;lying
Watched a sad porno the other day... [NSFW] It was a real tear jerker.;household
Why did Muhammad cross the road? You should not question the prophet's motives infidel!;movie
Any skirt looks good on the back of the chair.;religion
Yo mama's so fat she has titties in the front AND in the back;art
"What goes down must come up." -Sir Anorexic Newton;Music
My phone just sent me an unsolicited hockey score. Aren't there Japanese horror films that start this way?;Physics
they say a friend will come over and help you move and a good friend will help you move a body I have two good friends;Technology
What do you call it when a helicopter pilot reflects on his life? HINDsight;Friendship
When I'm bored late at night, I text random numbers saying: "You should really clean under your bed, it's filthy down here. PS: I love you.";Aviation
Just heard this on a PBS kids show... What did one wolf say to the other wolf? Howls it going?;Psychology
How come no one in a zombie movie has ever seen a zombie movie;Horror Movies
If his selfie doesn't make you kegal, you're just not that into him.;Zombies
phd thesis: the amoumt of property damage depicted in a action movie is directley proportional to its budget;Religion
When A Man Becomes Rich He Becomes Naughty  When A Woman Becomes Naughty. She Becomes Rich;Movies
What do you call a plant that doesn't move? A tree.;Beekeeping
My wife's an experienced navigator, she gives great headings.;Botany
I wish my penis was smaller. Then I could finally disprove the Planck length.;Physics
I don't know why everyone is hating on this mayweather it's beautiful out.;Weather
Why did Jon Snow stand in line for 6 hours at the Apple Store? For the watch;Technology
How come girls always brag about being "reunited" with their friends? Quit that shit. You aren't Outkast. You're just two chicks.;Sports
"It just feels so good to have a clean apartment!" - someone who's never killed a bear with a sword;Friendship
Do you know why the bike couldnt stand by itself? It was TWO TIRED!!!;Household
"If you have any questions, just ask. My door is always open." said the boss at my new job. "Why do you need a door then?" I asked him.;Physics
Where is the biggest jews concentration? In the air.;Management
Tigers blood gave Charlie Sheen HIV;Ethnicity
Why did the bible cross the street? To get to the other genocide.;Celebrity
Me: GUESS WHO BOUGHT A MEGAPHONE? Neighbour: Get out of my house! Me: You're not even guessing.;Religion
What did hitler say when he smashed his thumb with a hammer? "Au, schwitz!";Neighborhood
What can both Christians and Atheists agree on about Jesus? Kanye's not him.;History
What do you call it when a group of ghosts rob a bank? A polterheist.;Religion
Everything is made in China. Except babies. Babies are made in vaChina.;Crime
GF asked me last night "Do you even know why I like cherry coke??" "...because it's so delicious.";food coloring
The red man lives in the red house, the blue man lives in the blue house, then who lives in the white house? The black man;cherry coke
What's so unfunny that it's funny? An anti-joke.;houses
The most effective way to torture young people is to make them watch old people use a computer;anti-jokes
I almost got busted for shoplifting candy today... But I got out of it. I've got a couple of twix up my sleeve.;computers
A report indicates Viagra can cause temporary hearing loss in men.  So guys, you can have sex, but you can't hear the woman talk afterwards. In a related story, Viagra sales have skyrocketed.;shoplifting
My neighbor still has his christmas lights up. Not to be out done, I won't remove my politcal yard signs until November 2012.;morning-after pill
Kids are worthless because they're short and poor.;Christmas lights
What's white, located in washington and has a president within it? Monica Lewinsky's teeth.;kids
I had my stag do in Amsterdam. To remember the occasion my mates got me a sweater. I'd have preferred a moaner or a screamer, however.;groceries
Why isn't there a roomba that cuts grass? Probably some stupid law about sending a blade wielding robot out into the neighborhood.;Amsterdam
if you think about all the people you didn't marry, you've had a positive impact on virtually every life in the world;Amy Winehouse
Patience is what parents have when there are witnesses.;Marriage
A man walks into a bar with a piece of asphalt. He says to the bartender "one for me and one for the road".;Parenting
Why were the new mittens so flirty? Young gloves.;Asphalt
I find it really annoying that eating food doesn't heal wounds like I was led to believe as a kid. Damn Nintendo.;Gloves
What do comedians put outside their house on Halloween? 'Pun-kins';Video Games
My first workout back at the gym was great. I did 15 mins of cardio, 10 mins on the defibrillator, and then 3 days in the hospital.;Halloween
What do you call someone who photographs fish? A school shooter;Workout
Log Joke A mathematician is asked what type of log do you find in the forest? He says ln(x).;Alcohol
My friend from Hollywood always told me, "Shoot for the stars." He was an assassin.;Mathematics
What looks just like half a loaf of bread?  Its other half.;Hollywood
I can tell by the way you keep snapping your gum in my ear that you really don't value your life at all.;Bread
An atheist, a vegan, and an anti-vaxxer walk into a bar... I only know because they told everyone within two minutes.;Gum
How do you make Ben Carson yell? Watch a movie with him.;Ben Carson
Can a match box? No, but a tin can!;container
This is a robbery In some firm, two masked thieves enter: -This is a robbery The accountant, relieved: -Thank GOD, I thought it was the IRS.;robbery
Why Does Paris Hilton Have a Chihuahua? Cause she doesn't want a Dog thats more intelligent than her!;Paris Hilton
I once knew a man with two monocles. He made made a right spectacle of himself.;monocles
My pet butterfly got a tattoo of my lower back;butterfly
Damn girl, are you weed? Because you smell dank.;weed
Dyslexic zombies crave Brians.;zombies
I love my 6-pack so much I protect it with a layer of fat.;beer
Last night I had a nightmare that Ann Coulter died and came back to haunt me... ...she was a coultergeist;Ann Coulter
There's a movie coming out about a big rig truck. Have you seen the trailer?;truck
You hear some creature making noises in the distance. "Quick! Quick! Quick, quick, quick!" you hear it exclaim. What kind of beast is it you hear? A duck. ... with hiccups.;duck
What's Superman's greatest weakness? Horses;Superman
My cell phone fell in the pool...now I know what it feels like to have someone you love drown.;Soccer
My ex told me that Gaga's "Bad Romance" song reminds him of me. Now I'm glad I dumped him. What sort of idiot admits to listening to Gaga.;Cell phone
My girlfriend said I have crusty feet. I blame my socks.;Music
Stationary Thief Hits Police Headquarters: Police say they can't rule anything out.;Relationship
I like my women like I like my coffee... ...with extra large cups.;Police
What were the last words of the Mayor of Hiroshima? "What the fuck was tha . . .";Eggs
What do you call a abortion in Czechoslovakia? A cancelled check.;Hiroshima
What's more fun than swinging an infant over your head with a rope as fast as you can? Stopping it with a shovel;Abortion
What do you get if you cut an avocado into 6.02 * 10^23 pieces? Guacamole.;Infant
My relationship therapist got a divorce;Avocado
My ex and I didn't work out, you could say our stars didn't align I'm a Cancer she was a cunt. She was anything but a Virgo, and her Pisces smelt like a Taurus.;Relationship
Went to the doctors and told him l was suffering from premature ejaculation. He asked how does your wife feel about it? I said she took it on the chin the first time but now its getting on her tits...;Productivity
What do you have when you just used the toilet and realized there's no toilet paper? A real mess on your hands.;toilet
Oh. Awesome. A gift card. It's like money, but I can only spend it where you thought I'd like to.;gift
Don't tell me you're fat because obesity runs in your family... Not a damn thing has ever run in your family.;obesity
I told everyone at the party how much I love MC Escher and I got some weird stairs;MC Escher
My music teacher told me to stay on key I said "pitch please";music
Why does Peter Pan always fly? Because he Neverlands. That joke never grows old!;Peter Pan
Suicide is only illegal because dead people can't pay taxes.;taxes
Why do doctors spank babies when they are first born? The penises fall off the dumb ones.;doctors
Travelers to India joke that the country name is an acronym for, I'll Never Do It Again!;India
What did the bartender day to the man who was drinking his vodka to fast? Stop "Russian";vodka
I've been trying to find my girlfriend's killer for the last month. Nobody's agreeing to do it.;girlfriend
I accidentally have two dates tomorrow night should I handle this like a sitcom or an adult;dates
A long time ago, I learned the importance of just being myself. I think the world would be a better place if everyone would just be myself.;self-improvement
What do you call it when one bull spies on another bull? A steak-out!;bulls
By the power vested in me by this case of beer, I now pronounce these three loads of laundry as one.;laundry
What did God say after she made Eve? "Practice makes perfect.";God
The first time I've had sex was like the first time I rode my bike My dad was holding me from behind;Sex
I escaped the terrorists of Iraq, wanna know how I did it? I ran.;Terrorism
*emergency room* NURSE: "we're losing him!" DOCTOR [pouring like a lot of buckets of ice water on his head]: "IM WORKING AS FAST AS I CAN";Emergency
What is Hitler's favorite letter in the alphabet? I don't know, but it's definitely not z's!!!;Hitler
I ordered a coffee and the barista asked what size. I told her size didn't matter. We laughed. Then she gave me an extra large coffee.;Coffee
Why did the late man stand on the clock? He wanted to be on time.;Time
How long does it take a necrophiliac to screw in a light bulb? Not long... they like to do it while it's still warm.;Necrophilia
I got a Ouija board tattooed on my back to trick ghosts into giving me massages.;Ghost
The reward for a job well done is more work.;Work
"I've been a very bad girl. I need to be punished." She said... "Very well.." I replied.. installing windows 8 on her laptop.;Punishment
18: You & I are getting fat bec. u cook so damn good! IT'S.ALL.YOUR.FAULT! I was insulted, complimented, then scolded in under 2.5 seconds.;Weight
My grandpa is a total pervert My mom told me he had a stroke at my sister's piano recital;Pervert
Why was jesus great at rock climbing? He could find foot and hand holes;Jesus
Anyone can recommend a good Hobbit movie?;Hobbit
Jesus drove a Honda but didn't talk about it... "For I did not speak of my own Accord ..." John 12:49;religion
What does a crappy Carpenter make? Loose stools;craft
Is there something about me that suggests I want to hear about your smoothie cleanse, because I can change.;health
What was the Mathematician's Favorite Johnny Depp Movie? 's of the Carribean.;movies
What do you call a New Zealander with a sheep under each arm? A pimp.;nationality
Hear about Harrison Fords plane crash? I guess he shouldn't have been..... (_) ( _)&gt- (_) Flying solo.;celebrity
So I told a deaf guy... "Stop me if you've heard this one...";communication
Rabbits who hang out in indie pet stores are hopsters.;music
What are hurricanes with a central dense overcast over the eye called?  -Hurricanes with cataracts;weather
I submitted several play on words to a competition, hoping one will bring me victory.... Unfortunately, no pun in ten did;writing
Searched my teens room for drugs, was told "you don't give me enough money for drugs." I don't know whether to be proud or up his allowance.;parenting
Last CsGo update;gaming
I am as a wake as a funeral.;death
