"Joke";"Joke topic"
In wartime, it's so often the most vulnerable who get forgotten. Someone needs to kill them too.;war
What do you call a sleepy relative of a paper towel? A napkin.;napkin
What's Bruce Lee's favourite drink? WAAAAAATEEEEERRRR;Bruce Lee
Which came first, the chicken or the egg? Eggs can't cum.;chicken
I never wash my fruit, in case anybody's wondering how badass I am.;fruit
Me: Wanna hear a joke? Dog: sure Me: Knock knock *dog goes crazy barking at the door*;dog
There something bugging me. I've encountered this object many times over in the streets lately. Every way I turn I see Weed.... les;weed
What's a hipster's biggest problem? You probably haven't heard it.;hipster
Yelling at a dog... Yelling at a dog to stop barking doesn't work. The dog just probably thinks, 'Awesome, now we are both barking!';dog
What do you call someone who's representing a bike shop? A spokesperson.;bike
What do you call a Russian road with a KFC and lots of prostitutes? The Road of Bones;Russia
Have you heard the one about the bed? No? Then it probably hasn't been made yet.;bed
Dad's last words "Why hello, Serious, my name's...";dad
I bet unscary monsters like to hang out at the back of marathons and imagine all the athletes are running from them.;monster
What has 2 legs and bleeds profusely? Half a cat;animal
Why are so many Italians named Tony? Because when they immigrated from Italy, customs stuck a label on their lapel reading ToN.Y.;nationality
TIFU by having the bomb squad called to my party. They said it was the bomb.;party
A son asks his mom... -Mom, why is my cousin named Diamond? -Because Aunt Carol Loves Diamonds -What about me? -Enough questions Harambe;family
I don't think I could ever fall in love with a midget... I don't think I could ever fall in love with a midget. But I guess it's better to fall in love with a small person, than not a tall.;personality
Hey man, settle an argument for me? "Sure" [handing him a sword] Great, he's just in there;argument
What's the difference between a Porsche and a Porcupine? A Porcupine has the pricks on the outside;vehicle
I bought my son a refrigerator for his birthday I can't wait to see his face light up when he opens it.;gift
What do you call Stephen Hawking before he got motor neuron disease? Stephen Walkin;person
I thought it was odd that there is a Bass Pro Shop and a Dicks in the same shopping center.... But then I realized Bass Pro does attract dicks!;store
"Oh, not much, just grooming my magnificent, powerful wings, you?" -Pegasus every time a normal horse calls him;horse
it's 2013 and food can still make you fat get it together science.;science
Have you guys seen that great television show, "Candy Crush Saga With The Sound From Another Television Show Playing In The Background?";tv
Great things come in small packages Is what i say everytime before i whip it out.;Packages
Every generation just wants their kids to have a better "Spiderman" reboot than they did.;Reboot
What do you call a gust of wind full of sand? A rough draft;Wind
Yo mamma so fat... That when she fell, no one was laughing but the ground was cracking up;Fat
The term "Every 60 seconds in Africa , a minute passes" is stupid Because the majority of Africans don't get seconds , they'll be very lucky if they even get their first servings .;Africa
Roses Are Red, Violets Are Blue, I'm a schizophrenic and so am I. -Oscar Levant.;Love
She: 5 mins babe He: Ok *discovers a new planet* *travels to it* *discovers life* *returns back* He: Ready? She: 5 mins babe;Relationship
My favorite pokemon joke What did pikachu say when ash fell off a cliff? Pikachu, that's all he can say.;Pokemon
I got sick from the Mexican ice cream shop... I got helladiarrhia.;Mexico
i love nature :) sittin in grass, soakin up sun, listenin to all those weird ringtones that come from those animals in the trees or whatever;Nature
If I was on death row I'd request my own heart as my last meal. But they wouldn't be able to extract it til they killed me: Catch 22. I walk;Death
Why Did The Alcoholic Comedian Quit Performing? He couldn't handle the boos.;Comedian
My sausage-addicted friend died in a car crash. Apparently, he took a turn for the wurst.;sausage
My girlfriend told me to go out and get something that makes her look sexy. So, I got drunk.;girlfriend
A cattle rancher thought he had 196 cows... ...but when he rounded them up, he had 200.;cattle
Best pickup line that should not fail. Guy: Wanna have great sex. Girl: No. Guy: Great, let's go then.;pickup
I wonder if clothes in China say "made around the corner";clothes
An Irish man walks out of a bar....;Irish
Doesn't expecting the unexpected make the unexpected become the expected?;expectation
A paraplegic high school senior can graduate... ...but can't walk with their class.;paraplegic
What's grey and comes in pints? An Elephant.;Elephant
I kicked my rear-view mirror addiction... I'm never looking back.;addiction
Did you hear about the plane full of anorexics that crashed? There were no FAT-alities, but everyone felt really, really dead.;anorexics
I remember last year... It's like it was yesterday.;memory
I prefer my babies *shaken, not heard*;babies
I was talking to a record producer at the urinals and now I've got a number 1 on my hands;Music
Why don't Rooster's wear underwear? Because their pecker's on their face;Animals
Why was the scalar depressed? Because he had no direction.;Mathematics
My friends call me The Archeologist Because I date old, dusty pieces of junk;Dating
I woke up to the crack of Dawn the other day... I said "Dawn! Get off my face!";People
Italian WWII Tank for Sale It has 5 speeds 4 are reverse.;War
You have to wait 30 days to buy a gun but Amazon Prime only takes 2 days to ship live bees, no questions asked.;Shopping
how do you make pickle bread? with dill dough;Food
Relationship status: fell out of bed while reaching for a donut;Relationships
The best &amp funniest part of The Big Bang Theory.., is when I get the remote to change the channel.;TV
Planters will be distributing exclusively to airlines. That's just plane nuts.;Food
My jokes are still in alpha. Hopefully soon they'll get beta.;Jokes
Sea cucumbers are actually animals, so regular cucumbers are either lying or they need to step their game up.;Food
I unplugged my carbon monoxide detector from the wall today All that beeping was giving me headaches and making me feel nauseous;Health
Why don't Mexican's sweat as much as other races? They don't want to fill up the river as they cross it.;Mexican
Did you hear about the circus fire? It was in tents.;circus
Maggie Thatcher is due to be buried in a man made lake. Well, it will be once everyone finishes pissing on her grave.;Thatcher
Why was the vampire's girlfriend mad at him? Because she couldn't finish her sentences. Why couldn't she finish her sentences? He kept eating her periods.;vampire
Dreading the day that all my present and past roommates figure out that I haven't bought my own body wash in 10 years.;roommates
I was in the supermarket today and the cashier asked the foreign couple in front of me if they needed help packing their bags Fuck me, we only voted out yesterday give them a chance;immigration
What's worse than waking up with a boner? Realizing it's not yours.;boner
Two drums and cymbal fall off a cliff... buh dum, tish...;drums
I hate when I am about to hug someone really sexy and my face hits the mirror.;mirror
I can't believe how racist star wars is. Of course the only black guy never knew his father.;Star Wars
Wife left a note on the fridge it says "It's not working, gone to my mom's" I opened it and opened a beer, it's cold, the fridge works fine?;marriage
Well if you didn't want me to fall in love with you, why did you tell me you had nachos?;nachos
My wife's a terrible cook, she can never get her sauces right! But I've stuck with her, through thick and thin.;cooking
Thank you Halloween, all of a sudden, cobwebs in my house are decorations!!!;Halloween
God has cursed me with thoughts that come in 147 characters.;Twitter
I do really well on Jeopardy. I get all the answers, every one of them, almost instantly. I do, however, have a lot of trouble coming up with the questions.;Jeopardy
[in a meeting] ok a Dracula movie except he's new in town and biting is illegal but he befriends the pastors daught- "that's just Footloose";Dracula
This one trick will make you feel young again. Made you look.;Age
What's a neckbeard's favorite pie? Lemon m'ringue pie;Neckbeard
Why can't you give Elsa a balloon? Because she'll just let it go.;Elsa
[Penn and Teller getting a loan for their comedy act] "Ok all you guys need is a name" *they look around bank for ideas*;Comedy
I just found out they have Canadian Jeopardy It's almost the same, only your answers must be in the form of an apology.;Canada
I could see how 2 deaf guys arguing would appear to be gang related.;Deaf
Next time you get in a fight with your girl.. Go tighten all the lids on the jars.;Relationship
Islamophobia is a lot like acrophobia ... understandable to an extent.;Islamophobia
If the actor who plays Wolverine were to reveal that he's been a con-artist his entire life.... Would that mean this has all been a huge act, man?;Wolverine
What's long and hard and screws people? An exam.;exam
Why is it really hard to convince Egyptians? Because they all live in de-nile...;Egyptians
H: So what's the worst thing you've ever seen someone do? Me: I watched a mother buy her son a harmonica.;mother
What's the difference between a black man and batman? Batman can go into a store without Robin!;black man
What is the Dothraki horde's favourite cheese? Khaloumi.;Dothraki
Arnold Schwarzenegger goes to a Halloween party. The theme is "Dead Classical Composers"... When asked who he'll dress up as, Arnold says, "I'll be Bach.";classical composers
What came first: the chicken or the egg? The egg because I ate egg for breakfast and chicken for dinner.;chicken
I want to believe Pistorius...... ... But it's pretty clear his argument doesn't have a leg to stand on;Pistorius
What do you say to give an electrician encouragement? "You conduit!";electrician
If you pooped everything out and then only ate corn after that, would your next poop just be a pile of corn? Oh sorry welcome to PF Chang's;poop
After Monday and Tuesday even the calendar says W T F.;calendar
A guy calls his local butchery... - Do you have chicken paws? - Yes - Do you have chicken wings? - Yes, I do - Do you have pig's head? - Sure - You must look really funny then;butchery
What's the difference between a lentil and a chick pea? I've never paid money to have a lentil on my face!;Legume
Why was the blond excited when she finished her puzzle after 6 months? Because the box said 2-4 years!;Blondes
North Korea says it's gonna terror attack South Korea. I don't have a punchline, that's just really funny.;North Korea
This gym has a very strict rule no denim jeans or jorts. But if you're 300 lbs of muscle & attitude, apparently it's merely a suggestion.;Gym
What did one hat say to another? You stay here, I'll go on a head!;Hats
Girlfriend: Are you ready to be a dad? "I don't know, how would I know?" GF: I'm pregnant! "Hi Pregnant, I'm... OH MY GOD I'M READY";Parenthood
I bought my friend an elephant for his living room. Friend: thank you. Me: Don't mention it. *Edit: formatting.*;Elephant
You know you just can't tell Penguin jokes. They just don't fly;Penguins
Afraid your kid might be a commie? Well if he paints one of his bedroom walls red with some yellow stars or a hammer and sickle, that's a huge red flag.;Communism
I love "Choose your own adventures" because my two favorite things are reading and blaming myself.;Books
What's invisible and smells like carrots? Rabbit farts.;Rabbits
I went to school with a girl who said her last name was Faux. I thought to myself, "Man, that's got to be fake.";Names
If you get butterflies in your stomach You should probably stop eating insects;Insects
I used to live on the 13th floor but have just moved up to the 14th floor But that's another storey.;floor
Why is it hard to explain puns to kleptomaniacs? They always take things literally.;kleptomaniacs
What the mothers against drunk driving aren't counting on is my innate ability to run people over while sober.;drunk driving
A survey was held on what citizens of the United Kingdom thought of the new DOOM game... The overwhelming response was "bloody hell";DOOM game
What was Justin Timberlake called when he was a kid? Justin Timberpuddle!;Justin Timberlake
There was a prison break and I saw a midget climb up the fence. As he jumped down he sneered at me, and I thought "Well that was a little condescending.";prison break
Raccoons wearing tiny little glasses, digging through trash and carefully reading nutritional information of any food items they find.;raccoons
Doing word problems as a kid as helped me in adulthood. "Dan doesn't have enough money for his bills, how long before he is homeless?";word problems
What did the 3D Vector say after making a bad joke? i j k;3D Vector
Blind Man I just passed a blind man in home depot. He was dressed head to toe in camouflage. I assume he was trying to even the playing field. Well done sir. (True Story);blind man
What does a buisness man wear to the beach A wet suit What am i doing with my life...;business man
How many bees does it take to screw in a light bulb? Two, but how do they get in there?;bees
I was arrested for having sex with a 15 year old girl... ...i thought she was a couple of years older than that, I suppose that makes two reasons why I'm a bad father.;sex
What's the definition of a cannibal? Some who goes into a restaurant and orders a waiter!;Cannibal
If you use the iPhone 6 upside down, boom, iPhone 9.;iPhone
Feline-loving fashionista's favorite music? Techno. *boots-n-cats-n-boots-n-cats-n-boots-n-cats*;Fashion
Why did Microsoft jump from Windows 8 to Windows 10? Because Windows 7, 8 9.....;Windows
I'm running a 3K to raise awareness for the Klan!;Klan
Why did the baker have brown hands? Because he kneaded a poo.;Baker
What do you call a guy in a suit sitting in a tree? Branch Manager;Business
What is Romeo and Juliet's favorite fruit? Cantaloupe.;Fruit
A rainbow is doing a drug deal... The cops pull up and the rainbow yells "I don't want to go back to prism!";Rainbow
Why did Hitler have a vitamin C deficiency? He hated juice.;Hitler
okay, so you're definitely the best at keeping your body completely still, what do you want, atrophy?;Body
Where did the hamburger meet the cheeseburger? At the meat ball.;Food
How do skeletons make a baby? They bone;skeletons
Hung like Einstein smart as a horse... Thanks dad.;intelligence
To all you letters that want to be before P in the alphabet, join the Q.;alphabet
What else did Lochte say after the truth came out? This did not go swimmingly at all;Lochte
Is one of the steps in the P90X workout to tell everyone on Facebook that you're doing it?;P90X
I have never met a farmer that isn't pro tractor;farmers
Why can't you fool an aborted fetus? Because it wasn't born yesterday.;abortion
Some morbid baby jokes What's scarier then ten babies in one jar? A: One baby in ten jars How do you got a baby in a container? A: blend it.;babies
[at sheep farm] Me: So how do you get steel wool? Farmer: well, that we get from our metal sheep Me: huh? *sheep walks by with Slayer shirt;sheep
My problem is that all food is comfort food;food
A man walks into the zoo. The only animal there is a dog. It's a shitzu.;zoos
Why is Jar Jar Binks so lonely? He's been Wookie for love in Alderaan places.;Star Wars
What's another name for a ghost writer? A prose-titute.;writing
Venison... is dear.;venison
Hey everyone, my mom's following me on Twitter now, so ixnay on all the eetstway about the ugsdray and exsay and acismray. Thanks;Twitter
Pony: "I love hay so much I-" Dad: "Why don't you marry it, ya big nerd?" *pony grows up* *becomes Horse Emperor* *legalizes hay marriage*;Marriage
What do you call pasta with ketchup? Spaghetto Ba-dum tss.;Pasta
A blind woman told me she thought I had some good girth on my cock I think she was just pulling my leg.;Blindness
"Hello Kitty" should have been a brand of condoms...;Condoms
Butts Do not like lies.;Butts
It's ironic that so many NASCAR fans are afraid of other races.;NASCAR
Save money this Halloween by utilizing last years' hobo costume to dress up as this year's federal employee.;Halloween
What does blue paint taste like? Exactly like red paint!;Paint
Before you decide to spend less time on social media, make sure you go to every social media website and tell everyone.;Social Media
Bad news about shortbread! They're not making it any longer.;Shortbread
Did you know that 1 in every doll, in every doll, in every doll, in every doll are Russian?;Dolls
SEA LION 1: "More like shark *weak* amirite?" SEA LION 2: "Hahaha" SHARK: "Hey guys, what ya watching?" [Sea lions jump onto ceiling fan];Sharks
After starting on August 15th, 2004, Julia Roberts just finished brushing her teeth a few hours ago.;Brushing Teeth
I want to die in my sleep like my grandfather. Not screaming like the passengers in his car.;death
I'm pretty Gouda cheesy jokes And I bet you Swiss I had another.;cheese
I hope the members of Chumbawmba have those Life Alert bracelets, you know, in case they finally can't get up again.;music
Why did Michael Jackson have such a private life? He wasn't nosey.;celebrity
So are we all just going to pretend that we didn't spend 2001 yelling, "Whassup?" at each other?;pop culture
Where am I? I don't know where I am, but there's a huge nuke in front of me, obviously supposed to be secret. I'm terrified. I ran.;war
I went to the shop and bought a Christmas Tree. The assistant asked me, "Will you be putting that up yourself?" I replied, "No, you sick fuck. I'll be putting it up in my living room.";Christmas
How many bassists does it take to screw in a lightbulb? None the keyboardist can do it with his left hand.;music
What did the bird say when it flew into the window? Owl;bird
Never look back. If Cinderella went back to pick up her shoe, she wouldn't have become a princess.;fairy tale
I'm coming out of the closet. Not that! I mean her husband finally left for work.;marriage
So my friend tells me that he's thinking about creating a new strain of Marijuana called "Comcast". It'll sound really good but it won't get you very high.;technology
I have a confession about my time at the movies recently... Okay, fine. I'll admit it: I'm bad. I take women to The Hobbit: The Desolation of Smaug and I never Gollum back.;movie
Ukraine asks Russia to leave... Russia replies, "Crimea river.";politics
You know what's odd? Every other number.;math
I think the doctors told me my blood type was A... but I'm not positive.;blood
I saved a ton of money by eating all my groceries before getting to the register.;groceries
I love how science fiction movies skip right to the fiction part.;science fiction
I feel like before a bee stings a human, all his dumb bee friends are like "you can totally take him.";bees
Me: I HAD A VISION! I was a GARDEN GNOME & I was ridding a FLAMINGO & the FAIRIES sprinkled cocaine on me & I FLIED!! My Therapist: .....;visions
The titanic is all like... "I nominate all my passengers for the ice bucket challenge";Titanic
WIFE: You forgot my birthday again didn't you? ME: [putting wrapping paper round the cat] Goddammit, I told you not to turn round yet Janet;birthday
So I was buying a ticket for a train from London to Paris... And the man behind the desk said, "Eurostar?" So I replied, "Well I've been on TV, but I'm no Johnny Depp!";trains
In honor of the Vikings/Packers game on Saturday... How can you tell if a Packers fan is mad at you? They grit their tooth at you.;football
Now I'm trying to see if I can hear the ocean - me, as a gynecologist;gynecology
What do you call a pink slip served in a coffee bag? Grounds for termination!;employment
Cemetery I was walking in a cemetery this morning and saw a guy behind a gravestone. I said "Morning." He replied, "No, just taking a shit.";cemetery
Doc, I can't stop singing the 'Green Green Grass of Home'. He said: 'That sounds like Tom Jones syndrome'. 'Is it common?'I asked. 'It's not unusual' he replied.;music
To me, God will always be that guy that could've made Pokemon or Star Wars real but instead was all like, "Nah bruh, malaria and AIDS.";God
*ex-Olive Garden server shoveling dirt into a fresh grave* Tell me when.;Death
I was in the attic the other day... ...and I found a Christmas present that I meant to give to my daughter a year ago. It's a shame I forgot about it, she always wanted a puppy.;Gift
My newly married friend begins most sentences with, "My husband said." My go to response is, "My dogs haven't said much today.";Marriage
My ex's ex and my left hand are dating.;Relationship
Today's a beautiful day... After all, nothing beats Mayweather.;Boxing
Why did The Walrus go to a Tupperware party? He wanted to find a tight seal.;Party
Thinking about implanting a magnet in my chin so I can make a badass beard of iron filings and paper clips. More attractive, yes?;Fashion
What did the judge say when the skunk walked in the court room? Odor in the court!!!;Court
Religion is like AIDS. Keep it to yourself.;Religion
Joe was chopping wood with his Dad Joe: Dad, I think I want to be a pilot! Dad: That's great, start over there. You can grab that wood and pile it.;Career
Neighbor: Help I have a plumbing emergency! Me: *grabs tools* Neighbor is naked and wet Me: um what kind of plumbing are we talking about?;Plumbing
A mexican magician told the audience he'll disappear on the count of three. He said "Uno, dos" *POOF* He disappeared without a tres.;magic
I was going to sue U2 for stealing one of my songs But I found out my lawyer was pro-bono.;lawyer
Ooh. Remove card RAPIDLY, not RABIDLY. I think I owe the lady at pump 2 an apology.;language
I just bought a Christmas tree and my buddy asked, "Are you going to put that up yourself?" I replied, "No, I was thinking the living room.";Christmas
Why are there no awards for excellence in betas? Because no one wants to be the master beta tester.;awards
Why did the fly fly? Because the spider spied 'er!;fly
[Opens hand sanitiser] SUbmiT YoUr SOuL tO EternAL HeLL fiRe [closes lid] wtf? [looks at label] LINDA YOU BOUGHT HAND SATANISER AGAIN;hand sanitizer
[turns to guy at next urinal] "When the Little Mermaid became human how did she know how to use a toilet? BIG-TIME plot hole in my opinion";movie
[to snake at news station] you can't do weather anymore "ssswhy not?" are we getting rain tomorrow? "sssno" do you see how that's confusing?;snake
Sorry I conned your kid out of their Chuck E Cheese tickets. Maybe try not raising a sucker. Now excuse me, I have a sweet toy to play with.;parenting
What does Santa say to the elves after they make the toys? Leave my presents;Santa
Do you need an Ark? I Noah guy.;Bible
I get carried away sometimes... Usually because I refuse to leave.;personality
they say each cigarette you smoke takes 7-11 minutes off your life, last year i smoked 11,000 i dont look a day younger;cigarettes
My Mum laughed at me when I said I was building a car out of spaghetti... You should have seen her face as I drove pasta;Spaghetti
My wife asked me to stop singing Wonderwall... I said maybe;Singing
Live Shark "Can I buy a live shark here?" "Lady, what do you want with a live shark?" "A neighbor's cat has been eating my goldfish, and I want to teach him a lesson.";Shark
How long does it take for a GNOME developer to take a shit? I don't know, how long until the next version of GNOME?;GNOME
What is a Mathematician specializing in absolute numbers called? A Sith.;Mathematician
Wife: Our daughter lied to me. Me: What did I tell you about telling the truth? 5-year-old: It's only for people who don't have lawyers.;Lying
Sarah Jessica Parker walks into a bar. The bartender asks "Why the long face?";Sarah Jessica Parker
What do you call an overweight ET ? An extra cholesterol !;ET
A cop just knocked on my door and said that my dogs were chasing people on bikes. My dogs don't even own bikes...;Dogs
What's the difference between a Catholic and a Baptist? A Catholic will say hello when he sees you in the liquor store.;Religion
Today I learned that pouring water on someone who is sleeping under an electric blanket won't electrocute them. It will only make them angry;Electric blanket
As soon as I plugged in my laptop, all my files became unreadable. I guess power corrupts.;Laptop
What did they call Jesus Christ when he was crucified? Holy;Jesus Christ
What did the business man say to the gangster? Pull up your fucking pants.;Business
What do gay people call each other on? Homophones!;homophones
What do gay people call each other on? Homophones.;homophones
some people want to be buried when they die. others want to be cremated. personally, I think I would like to be brought back to life;death
Money doesn't grow on trees unless you are a pot dealer;money
Why was the surfer such a bad cook? All he could handle was the microwave;cooking
What's the most famous line at a gay bar? "Can I push in your stool?";gay bar
My friend got a nice new ride, but no one wants to drive him around in it Now he's got all that car and nothing to chauffeur it.;car
I asked my mate what he wanted for dinner He said he fancies a Chinese. I said I didn't ask you about your love life I asked what you wanted to eat.;Chinese food
[hits you in the face with newspaper] "Sorry, I thought your eyebrows were caterpillars.";none
[Army Shooting Range] Officer: Are you locked & loaded? Soldiers: YES SIR! Officer: You may fire at will! Soldier Named Will: WTF?;army
Me: SORRY I HAVE TO HANG UP I'M HEADING INTO A TUNNEL * hangs up land-line *;phone
How would you tell if the Queen was stoned? Her Highness will tell you;Queen
