"Joke";"Joke topic"
A guy goes to the doctor... The doctor says "You have to stop masturbating." The guy says "Why?" The doctor says "...because I'm trying to take your blood pressure.";doctor
NEVER FORGET WHERE YOU CAME FROM. I just came from wolfing down a Kit-Kat in the utility closet.;roots
Cancer research scientists have grown human vocal cords in a Petri dish. The results speak for themselves..;research
How many times do you have to tickle a squid to make it laugh? ten tickles;laugh
*stands on scanner at self checkout, weighing self after keying in mango code, just to see what net worth is in mangoes;self-worth
Boss Like Diaper A Boss is like a diaper, always on your ass and usually full of shit;boss
How many Germans does it take to change a light bulb? Nein.;Germans
I'm NOT flirting!! its called BEING NICE!;flirting
What do you call an angry pirate? P-irate;pirate
To me, drink responsibly means don't f?cking spill it;drinking
A democrat, a libertarian and an idiot walk into a bar.. "I'll have a beer please", says the republican.;politics
What do you call a sassy criminal walking down the stairs? A condescending con descending.;crime
One day, a man ran through Red Square in Moscow, shouting at the top of his lungs, "Khrushchev is a fool!" He was subsequently arrested for revealing state secrets.;politics
Blind man walks past a fishmongers "hello ladies!";women
Dear XBOX Kinect If I wanted to use my whole body to play sports, I'd play sports.;gaming
What did the Mexican say when his homework flew out the window? Where you going essay!?;homework
Duck in my soup. Me: Waiter, there's a duck in my soup... Waiter: That's a pond, you're at a park, I'm just here with my family, will you put some pants on?;food
What's warm, white, and I drink almost every night? Warm milk before bed... Get your mind out of the gutter!;sex
My 13 year old told me this joke.... Him: I want to start a dating website for Indians.... Me: a dating website for indians? [scratching my head wtf] Him: yeah I am going to call it connect the dots.;dating
BOSS: I've called you here because I suspect one of you... IS AN OWL ME: Who? *everyone stares at me, even Gary whose head is turned 180*;work
What is bordering stupidity? Canada and Mexico both are.;geography
Well it's now clear to me that this crime scene would be considered, what? Pants required? Pants preferred? Hey, is that guy dead?;crime
What's the most positive thing about Harlem? HIV;location
To all the girls who take pictures in the bathroom in public places, I'm taking a dump in the stall behind you....Don't forget to tag me;public places
"Oh NOW Burger King delivers!" -Paula Deen;Burger King
[Dad jokes anonymous] "...and I'm clean 30 days" Guy from back: HI CLEAN 3O DAYS I'M DAD "DAMN IT, JERRY!";Dad jokes
Him: What's your cup size? Me: Venti;cup size
What is Hitler's favorite chocolate? Fuhrerro Rocher;chocolate
Sitting on my hand until it gets numb so it feels like someone else is folding my laundry.;laundry
I've been lying on the floor of this Cheesecake Factory for half an hour. Everyone keeps stepping over me;Cheesecake Factory
Day 19, I have successfully conditioned my master to smile and write in his book every time I drool.- Pavlov's Dog;Pavlov's Dog
I know what I'm getting for Christmas. Fat. I'm getting fat.;Christmas
I'm surprised Bob the Builder ever gets anything done He's surrounded by tools;Bob the Builder
Dad joke Do any of you, when going poop, say "Get out of me you piece of shit!" And then chuckle cuz it's a literal piece of shit?;poop
I lost two things today: My virginity and my job as a morgue assistant.;virginity
Why should you never mention the number 288? Because it's two gross. source: someone told me this joke, it's not my joke.;numbers
Does anyone know how the lady reacted when Van Gogh gave her his ear? Was it positive? Cause I'm running out of ideas for gifts.;Van Gogh
What's it called when you're killing time at work hiding in the bathroom? Stalling.;Work
Politics isn't confusing. You have a choice of being screwed by one of two gorillas and one is considerate enough to use lube. Now choose.;Politics
Fitness tip: It's absolutely crucial to take "rest days" when working out so you don't get hurt. I've recently taken over 300 of them.;Fitness
Cheesy joke What did the big cheese round say to the baby cheese round? Getting older isn't going to make you the big cheese.;Cheese
Why can't you starve in the desert? Because of all the sandwiches there.;Desert
You must be a magnetic monopole because all I get from you is attraction.;Attraction
The police came to my house looking for a child molester... I guess I wasn't supposed to volunteer.;Child Molester
Why do dogs run in circles ? Because its hard to run in squares !;Dogs
I used to be addicted to the "Hokey Pokey" song, I couldn't stop listening to it again and again and again... But I turned myself around.;Hokey Pokey
How does a gay forester calls his diary where he keeps account of all his affairs? A heath ledger;Gay Forester
There are eleven types of people in the world... those who understand binary, and ten other types of people.;Binary
What goes stomp, stomp, stomp, squish? An elephant with a wet boot;Elephant
Why does Edward never leave Russia? He's always Snowden.;Edward Snowden
I never feel more hypocritical than when I tell my kid she's been on the computer too much.;Parenting
What the difference between the U.S. Government and a bucket of crap? The bucket;Politics
Math Problem Q: If the the radius of a pizza is *z* and its width is *a*, what is the pizza's volume? A: (pi)(z)(z)(a);Math
Yo momma is so fat that she was sorted into the House of Pancakes;Insult
an irishman walks out of a bar Hey! it could happen;Drinking
Maybe Jehovah's Witnesses keep knock knock knocking because they're looking for Heaven's Door. You don't know.;Religion
I asked a librarian About some books about Pavlov's dogs and Schroedinger's cat. She said it rings a bell, but doesn't know if it's here or not.;Science
Is athlete's foot [gulp] fatal, doc? "Not with the proper treatment." *gives foot $56M 7-year contract*;Sports
A cop stopped me and asked "Do you know why I followed you " so I said "because my tweets are funny" & we laughed &  high-fived & I'm in Jail...;Police
Second date tip: repeat everything you said on the first date, word for word.;Dating
20 years ago we had Johnny Cash, Bob Hope and Steve Jobs. Now we have no Cash, no Hope and no Jobs. Please dont let Kevin Bacon die!;Celebrity
My girlfriend said we should split up because she can't handle me acting like a detective all the time... "GOOD IDEA!" I said... "We can cover more ground that way!";Dating
"RELEASE THE KRAKEN!" "Kraken's not here." "What? Ugh! What can we release?" "Gary's here." "Gary?! Dammit! Fine... RELEASE THE GARY!";Mythology
Where do lightning bolts go on dates?  -To cloud 9;Weather
My doctor told me to stop drinking today...then he told me to stop laughing.;doctor
Hey, parents. Stop raising children and start raising adults.;parents
Just watched a guy in a shirt that read "Jedi I am" trip on a curb and fall. Jedi you are not sir;Jedi
If you see someone doing a crossword puzzle Whisper in their ear, 7 up is lemonade.;crossword
A cabbage, a faucet, and a tomato had a race. The cabbage was ahead, thefaucet was running, and the tomato tried to catch up.;vegetables
What should you do if you find an angry 500-pound dog in your kitchen? Eat out.;dog
Dogs are tough!! Been interrogating this one for hours and he still won't tell me who's a good boy!;dog
I hate when my iPod earbud cord gets hung on an object and it violently rips the earbud out and I get that murder-y feeling.;iPod
Jerusalem by Don McLean I think the song could be greatly improved if at the line: "All roads lead to you," the singer shakes a fist and yells out "Take that, Rome!";Jerusalem
Did you hear about the magician that turned his family into a 3-piece suite but couldn't change them back? They were rushed to hospital where staff described them as "comfortable".;magician
How do mice celebrate when they move home ?  With a mouse warming party !;mouse
If asked at a job interview "what's your biggest weakness", test their tolerance for honesty by replying "mortality";job
Good News: The Giant Panda is no longer considered 'Endangered'. Bad News: It's now considered 'Extinct'.;panda
Why Would Clint Eastwood be Bad at Restructuring a Business? He can't remember if he fired 5 or 6.;Business
Why don't soccer players get hot while running? Because they hve so many fans;Soccer
I am so good at sleeping I can do it with my eyes closed.;Sleeping
Sometimes after a long hard day at work, it takes me 4 bars to get home;Drinking
What do you get when you cross a muppet with the Loch Ness monster? Messie Thank you and goodnight.;Monster
The sum of the cabbage is directly proportional to the square root of the carrot divided by the mayo. That's Cole's Law.;Food
Im trying to get back to my original weight. 7 lbs 9 oz;Weight
Fart when people hug you...it makes them feel strong.;Fart
Knock Knock Who's there ! Crock and Dial ! Crock and Dial who ? Crock and Dial Dundee !;Knock-Knock
*Semi drifts into my driveway, transforms into a robot and hands me my package.* This Amazon Optimus Prime account was so worth it.;Delivery
Where do you take someone who overdoses on homeopathic medicine? A mental hospital;Medicine
So I went to the mattress store and tried laying on one of the Temper-Pedic mattresses. I was impressed.;Mattress
What's the difference between a meeting and a funeral? A funeral is a meeting where you're dead outside as well as in.;Meeting
How does Ebenezer Scrooge make phone calls?  Collect!;Christmas
Sooo much pressure as a woman to not have a mustache.;Women
Damn that lawnmower.... No matter how much I like a film, I can only give it one thumb up.;Film
Why does a German always have the last laugh? He has to wait for the verb.;Language
Why did Paul Walker cross the road? Because he wasn't wearing a seatbelt;Paul Walker
Why did the aliens choose to not invade and enslave the human race? Because they're not garbage collectors.;Aliens
Why Did The Boy Drop His Ice Cream? He Got Hit By A Bus.;Children
Five most popular enhanced interrogation techniques.. .. The fourth one will shock you!;Torture
A joke I made up inspired by Mitch Hedberg. "Last week I had to put down my dog. It was sad." "I said, you are one dumb dog.";Pets
Yesterday evening, I had to change a light bulb. A bit later on, I crossed the road and walked into a bar. My life is one big joke;Life
Leprechauns Why are leprechauns always laughing when they're running? Because the grass is tickling their nuts;Leprechauns
People can't drive. Take this guy behind me for example, doing 110 mph with flashing blue lights. What the hell is a ECILOP anyway??;Driving
Make A Dumb Person Curious Do you know how to make a dumb person curious?" - "No, how?" - "I'll tell you tomorrow.";Curiosity
What's black hairy and writes under water? A ball-point gorilla!;gorilla
Tweeting with an egg avatar is like showing up to a job interview in a sweatsuit.;twitter
Why did the squirrel swim on its back? To keep his nuts dry;squirrel
What's a pirates favorite thing to knit? Scaaaaaarrves;pirate
PLOT TWIST: MARIJUANA is the drug against wars.;war
I have to go to twitter for my news because the news is too busy showing me tweets.;news
This election cycle makes me want to find a bar really badly... Do any 21st amendment people know where I can get a drink around here?;election
JonesTown Massacre Do you know why you never hear any jokes about the JonesTown Massacre? .......The punchline is too long!;massacre
What do you say to an alien with two heads? Hello. Hello.;alien
Teacher asks a question Teacher: "whoever answers my next question can go home" Jimmy throws his bag out the window Teacher: "who just threw that?" Jimmy: "that was me";teacher
Three virgins go into a bar a blonde, a brunette, and a redhead. Hours later out come a blonde, a brunette, and a virgin. ....Ginger Snap!;virgin
What has four legs, is green and fuzzy, and if it falls out of a tree can kill you? A pool table.;pool table
"Oh my gosh, this is the biggest donut I've ever seen." "Mam, that's a tire." "Kids, get me a napkin.";donut
My friends cat just ran across his banjo and was immediately sued by Mumford and Sons.;cat
What do you call a gay Dinosaur? Megasaurass;dinosaur
Timing. Why don't Norwegians tell good jokes?;Timing
Two banana peels What do you call two banana peels? A pair of slippers;Banana
Tampon commercials create an unrealistic expectation of how much fun it is to be around menstruating women.;Tampon
Anyone seen the movie about the female eye doctor who's always naked when she kills her patients? It's called 'Lasik Instinct'.;Movie
Ghost: never eats, never sleeps, moans a lot Vampire: sucks the life out of u Werewolf: human w/ fits of howling Child: all of the above;Child
why are there fences around graveyards? people are just dying to get in there these days.;Graveyard
What does have eyes but can't see, has legs but can't walk, and has wings but can't fly? A dead bird.;Bird
Sometimes I like to freak out the toddler by putting my iPad to my ear and frantically asking her if I've been miniaturized.;iPad
[making out] ME: *grabs a blindfold from the nightstand* GIRLFRIEND: omg really? ME: *blindfolding the dog at the end of the bed* really.;Dog
Capitalization... It's the difference between helping your Uncle Jack off a horse, and helping your uncle jack off a horse.;Capitalization
Me: if u kill a murderer the number of murderers in the world doesn't change Her: yeah... anyway your total will be $8.49 at the 2nd window;Murderer
Helen Keller walks into a bar... Then a table, then a chair.;Helen Keller
"This isn't my first rodeo" -Guy at his second rodeo;Rodeo
What do rednecks do on Halloween? Pump kin;Halloween
Why did the students need a ladder to get into school? It was a high school.;School
Oscar nominations are out. Let's experience actual emotion about multimillionaires giving each other gold;Awards
"My name is Robert and I support apples." -- Bob for apples;Politics
An asshole What do you call someone that puts the punchline in the title?;Jokes
What is Jackie Chan's favorite drink? Wata;Drinks
When my daughter gets older, she will have a camera phone OR a mirror. Not both. Thanks for the advice Twitter.;Parenting
I always cry at weddings (they're wasting so much rice!!);Weddings
Couples who take too many fertility drugs should always put an asterisk next to their child's name to show that the parents used steroids.;Parenting
What does Snoop Dogg say to his baby? Kushie kushie koo;Parenting
I had my first ever threesome last night... There was a couple of no-shows but I still had a great time.;Relationships
Are you hot, dawg? Funniest dog joke I tell my pet beagle every hot afternoon. He laughs everytime.;Dogs
Skinny jeans are like a cheap hotel... There's no ballroom.;Clothing
Why did the chicken cross the ocean? To get out-of-range of North Korea's nukes.;Politics
Japanese boy kills his grandfather... Pfft, youth in Asia.;Youth
As a Fat bottomed girl, I'm not sure how we're expected to make the Rockin' world go round. That sounds *way* too much like exercise to me;women
Why don't off duty police men fire grenades into children's cribs? If you're good at something never do it for free.;police
Am I an Angel A little Black Baby Dies and goes to heaven, he sees and angel flying and says "God am I an angel?" God looks down pats him on the head and says " Nah Nigga you a bat";religion
you can't please everybody. if you could, you'd probably be pansexual.;sexuality
Ever find buried treasure in your grandpas backyard containing passports, Nazi uniforms, and a photo with Papa with the Fuhrer inside? Yeah.;history
[thoughts of person talking to me]: He's furrowing his brow, he must really be listening! [my brain]: How do cows make cheese;communication
If a bundle of sticks with an axe in it is a fasces, does that make an OP with an axe to grind a fascist? Seems that way on 4chan.;politics
Why did Anthony Kiedis cross the road? To get to the Otherside.;music
On a recent flight I was surprised to be served breakfast. Although it was only plane yogurt.;food
What do you get from a Hebrew genie? A coupon for 10% off three Jewishes;religion
What is a ghost's favorite Wild West  town? Tombstone.;geography
Who led the Jews across a semi-permeable membrane? Osmoses.;religion
I went to the zoo... I went to the zoo yesterday and I was disappointed to see the only animal they had was a single dog. It's a shih tzu.;animals
Did you hear about the steak that was knighted by the queen? Sir Loin.;food
What would you name a star wars movie featuring Pluto? This is really just a bad pun, but to me those are the best kind of jokes Pluto strikes from the back and destroys Uranus.;movies
I knew my girlfriend was cheating on me. She told me she was at the mall with her friend Carrie. Thing is, Carrie was sleeping right next to me!;Girlfriend
5 years from now it'll be 2020... I can see it now... That's a perfect vision joke.;Vision
Baby needs a costume? Wrap it in tin foil. Baked potato. Next question.;Baby
Why couldn't the butter quit his gambling addiction? HE WAS ON A ROLL!;Butter
So Oxygen, Hydrogen, Sulfur, Sodium, and phosphorus walk into a bar. The bartender says "OH SNAP";Elements
I'm selling my talking parrot..... Why? Because yesterday, the bastard tried to sell me.;Parrot
I miss the days if you were angry while on the phone, you could slam it down without costing $400!;Phone
Alcohol is an excellent solvent. It dissolves marriages, friendships and organs.;Alcohol
My "Savings Account" is just several pairs of unwashed jeans on the floor that may or may not still have change in the pockets.;Savings
There are three types of people in the world... Those that can count and those that can't.;People
Manatees come in all sorts of shades and hues Oh the hue manatee;Manatees
What do you call someone who hangs around with musicians? A drummer.;Musicians
What's pink and hard? A pig with a knife.;Pig
Diet tip: If you think you're hungry, you might just be thirsty. Have a bottle of wine first and then see how you feel.;Diet
90% of my opinions are a shrug.;Opinions
What stresses fish out the most? Current events.;Fish
What did both the bomb expert and the digital clock maker say to their mother? Look, Ma! No hands!;Professions
If you show up to a job interview high and tired... You're hired!;Job interviews
A 15 year old took gold in the Olympics and then there is me whose greatest accomplishment is getting up to 10 on flappy bird.;Gaming
Satan: you can spend eternity in hell OR you can go to work for the first time in 5 days. Me: hmmm Satan: well? Me: IM THINKING, DAMN IT;Work
I have CDO. It's like OCD, except the letters are all arranged in flawless, perfect alphabetical order... AS THEY SHOULD BE.;CDO
Why can't you fart in an apple car? It doesn't have windows.;Apple car
*steals machine parts all year* *gets coal for xmas* "Santa you idiot, the parts were for a pressure chamber" *turns coal into diamond*;Christmas
What do all Pedophiles have in common They're all Fucking Immature Ass-holes;Pedophiles
What is the most noble office supply? The ruler!;Office supplies
In an interview: "How good are you with Microsoft PowerPoint?" "I Excel at it." "Did you just make a Microsoft Office pun, sir?" "Word." Edit: thanks u/Steve_Jobs_iGhost;Microsoft Office
Where do you see yourself in 10 years? In a mirror! Reply from my 9 year old brother, after my mom asked me this while talking about future career prospects.;Future Career
The real oldest yo mama joke... ...yo mama;Yo Mama
What do you get when you drop a piano on an army base? A flat major.;Piano
I farted in a room of hipsters and watched them fight over who heard it first.;Fart
You can tune a piano.. You can tune a piano, but you can't tunafish;Piano
Did you hear about the guy that spilled curry powder in his bed? Woke up in a Korma;Curry Powder
Doctor: "Why is my waiting room empty?" Judge: "I hauled everyone off to court" Doctor: "You're trying my patients";Doctor's Waiting Room
I'm not fat. I'm just easy to see;Body Image
Whenever someone tells me "make yourself at home" at their house, I always clog their toilet;House Etiquette
I was surprised that Lil Jon endorsed a presidential candidate... BERN DOWN FOR WHAT?!?;Lil Jon
WIFE: can you preheat the oven? ME: you mean heat it WIFE: not this again ME: it can't be heated before it's heated. don't give me that look;Oven
Two cannibals are eating a clown... and one says to the other: "Does this taste funny to you?";clown
The 3 stages of man: He believes in Santa Claus. He doesn't believe in Santa Claus. He is Santa Claus.;man
Husband says to his wife "you're always pushing me around and talking behind my back!" She says "what do you expect? You're in a wheelchair.";marriage
Everyday, millions of plants are killed by vegetarians. Help stop the violence. Eat a steak.;vegetarianism
I just farted in an elevator. Which was wrong on so many levels.;flatulence
Who's the most popular guy in the hospital? The Ultra Sound guy. Who is it when he's not there? The Hip Replacement guy.;hospital
TRUTHFUL TUESDAY: When my son was 7 he pissed me off so badly I pressed all the elevator buttons knowing every new rider would blame him.;parenting
I got excited when I came across this "topless Bar", in kolkata while driving home last night. I walked in and was shocked to find out that it had no roof !;bar
The past, present, and future walked into a bar... It was tense.;time
What do call a poor black man listening to classical music? A Baroque nigga.;music
What's the worst thing you're likely to  find in the school cafeteria? The food!;cafeteria
Why did Arthur have a round table ? So no one could corner him !;king
We've secretly replaced the G with a K on this bottle of Jergens. Let's see if he notices.;prank
Roses are brown, violets are brown Who shit on my yard?!?;yard
Do you know what an Australian kiss is? It's a French kiss, ......down under!;Australia
My cat deleted my final thesis. Don't believe me? Cats can handle mice.;cat
I've waited a year to post this This;
If you've been married less than a year, stop with all the love and marriage quotes. S hit will eventually hit the fan...;marriage
A guy on the street just said "nice feet" to me can someone tell me seriously if that was a cat call?;compliment
How come you never write e-mails? I'd rather send a note!;email
Autocorrect changed Friend to Fiend but sleeping with a Fiend with Benefits is actually a little more exhilarating;autocorrect
Ran into my ex on the street. He's got a hot wife & 2 kids. I have a taco in my hand. And one in my purse. And an emergency taco in my coat.;ex
I'm not exactly sure who Pavlov is... But the name does ring a bell.;Pavlov
What did the proctologist do to those poor people's butts? He rectum.;proctologist
*walks into funeral while playing the mandolin* "I'm sorry. Am I interrupting?" *dead guy sits up in casket* No it sounds lovely. Keep going;funeral
What would bears be without Bees Ears;Bears
Q: Was Jesus delicious?;Jesus
I've been waxing my car for twenty years and I still don't know karate.;Karate
I just ran 3.5 miles in 30 minutes! Ha! Just kidding, I ate some ice cream.;Running
Aaron Hernandez He used to be a tight end, but prison will turn him into a wide receiver. );Aaron Hernandez
Walk like an Egyptian is a song, but also a sure fire way to make it safely through a bad neighborhood.;Egyptians
What font was used on Wyatt Earp's tombstone? Sans Sheriff.;Wyatt Earp
To the person who stole my Microsoft Office. I will take it back. You have my Word.;Microsoft Office
i know a guy who loves saying "best thing since sliced bread" and i imagine hes always at a grocery store lookin at bread and just losing it;Bread
What's the difference between a Catholic Priest and acne? Acne waits until you're thirteen before it comes in your face;Priests
When Chuck Norris was in middle school, his English teacher assigned an essay: "What is courage?" He received an A+ for turning in a blank page with only his name at the top.;Chuck Norris
How do you convert Spanish programming into English? Yes++;Programming
Chuck Norris once visited the Virgin Islands They are now known as the Islands.;Chuck Norris
An all inclusive guide for lurkers: How to reach the front page. Details inside.;Lurkers
Dear Evolution, It's a conference call, not a bear attack. How about making me super eloquent instead of the heart rate and adrenaline?;Evolution
Two wires were screwing around on the network. What did they discover? Twisted pair.;Networking
Dad: Why is your January report card so bad ? Son: Well you know how it is. Things are always marked down after  Christmas !;School
Why did Nixon never drive on the highway? Because he always took the low road.;Nixon
Why did the scarecrow win an award? Because he was outstanding in his field;Farming
DTF (Down time finally) -mom's everywhere;Parenting
Waking up Is the second hardest thing in the morning.;Morning
Princess Peach has been kidnapped so often, I'm beginning to think she might be Liam Neeson's daughter.;Gaming
What goes above the water and below the water but doesn't touch the water? An egg in a duck.;Nature
Boss: Can you send the documents Me: I am sinking in the muck of a swamp of ancient pain Boss: Ok just don't forget to send the documents;Work
Behind every successful status update, there is a Ctrl C & Ctrl V;Social Media
ClickBait, don't click on it are you serious?;Internet
If you can't handle me at my fattest, then you sure as hell don't deserve me if I ever lose weight. Which could happen, you don't know.;Relationships
"Pool" in Spanish is "Piscina". They know.;Language
Today on "Dora the Explorer", Dora and Boots learn there are some places they can't explore when Map leads them to an armed border patrol.;Immigration
