"Joke";"Joke topic"
[me narrating a documentary about narrators] "I can't hear what they're saying cuz I'm talking";documentary
Telling my daughter garlic is good for you. Good immune system and keeps pests away.Ticks, mosquitos, vampires... men.;garlic
If I could have dinner with anyone, dead or alive... ...I would choose alive. -B.J. Novak-;dinner
Two guys walk into a bar. The third guy ducks.;bar
Why can't Barbie get pregnant? Because Ken comes in a different box. Heyooooooo;Barbie
Why was the musician arrested? He got in treble.;musician
Did you hear about the guy who blew his entire lottery winnings on a limousine? He had nothing left to chauffeur it.;lottery
He was a real gentlemen and always opened the fridge door for me;gentlemen
Telling my daugthers date that "she has lice and its very contagious the closer you get to her." *Correct way to parent.;parenting
What should you do before criticizing Pac-Man? WAKA WAKA WAKA mile in his shoes;Pac-Man
What do you call a barbarian you can't see? an Invisigoth.;barbarian
How do you spell Canda? C,eh,N,eh,D,eh;Canada
You ever notice that the most dangerous thing about marijuana is getting caught with it?;marijuana
What did Arnold Schwarzenegger say at the abortion clinic? Hasta last vista, baby.;Arnold Schwarzenegger
My wife is in a bad mood. I think her boyfriend forgot their anniversary. Way to go, dude. Now we all suffer...;Marriage
My speech today will be like a mini-skirt. Long enough to cover the essentials but short enough to hold your attention!;Speech
Why do you never see elephants hiding in trees? 'Cause they are freaking good at it;Elephants
My son just got a tattoo of a heart, a spade, a club, and a diamond, all without my permission. I guess I'll deal with him later.;Tattoo
What do you call a potato in space? Spudnik;Potato
How to get a cop's attention;Cop
What happens to a necrophiliac after death? Reserection;Necrophilia
Why did the chicken hold a seance? To get to the other side.;Chicken
Where do baby cows go to eat lunch? At the calf-eteria.;Cow
What's the difference between a painting and Jesus. You only require one nail to put up the painting.;Jesus
Mom: "Do you want this?" Me: "No." Mom: "Ok I'll give it to your brother." Me: "No I want it.";Brother
Yttrium-barium-copper oxide walks into a bar The bartender tells him, "We don't serve superconductors here." He leaves without resistance.;superconductors
Every night, I take all of the singles out of my wallet, spread them on the bed, and pretend I was pretty that day.;beauty
Which gospel contains Jesus' parable about the shades of numbers? Math hue.;numbers
Ibuprofen is my favorite headache medicine that also sounds like a reggae professor.;ibuprofen
Before I destroy a wasp's nest I like to capture a single wasp and tell it my entire diabolical plan.;wasps
INTERVIEWER: Why do you want to work here? ME: *crumbs tumbling from my mouth* Oh, I don't. I was just walking by and saw you had donuts.;job interviews
Coming on valentines day. Fifty shades of grey. There won't be a dry seat in the cinema.;movies
Did you hear about the midget psychic who escaped from prison? He's a small medium at large.;psychics
What's the difference between a car tyre, and 365 condoms? One's a Goodyear, an the other's a great year.;condoms
Roses are red, Violets are blue. I have a gun. Get in the van.;poetry
I've struggled for years to be above the influence... But I've never been able to get that high;influence
With Facebook, you can stay in touch with people you would otherwise never talk to, but that's only one of the many awful things about it;Facebook
I saw a French rifle on eBay today It's never been fired but I heard it was dropped once.;war
What did the car said to the valet? I've been through a lot.;car
"I can't stand when people say they hate both of the presidential candidates." --Stephen Hawking;politics
A Mexican fireman had twin boys He named them Jose and Hose B;nationality
I was drinking at the bar, so I took a bus home. That may not be a big deal to you, but I've never driven a bus before!;driving
Things have really turned around for me since I re-named my penis and testicles "JD Power and Associates".;body
My sex face is the same as my first pee in three hours face.;body
Sometimes you check the amount of subscribed people. When you do this, there are 4,111,093,0003.666 "humorists". 2/3rds of a person? Really?;humor
I don't believe in Bigfoot because he never believed in me. I'd scan the crowd at my ballet recitals, and always see that one empty seat.;mythical creatures
What did the porn actress say when she opened the door? Make sure to come upstairs.;porn
I don't judge people based on color, race, religion, sexuality, or gender...I base it on whether or not they're an asshole.;people
Why were the baker's hands brown? Because he kneaded a poo.;job
Not to get too technical, but chemistry says alcohol IS a solution. So I win.;chemistry
I often think if I'd taken a different path in life, I could be lying on a slightly more comfortable sofa right now.;life
I'm terrible at telling jokes... I always punch up the fuck lines;jokes
What did the hillbilly say to his sister after she asked him to have sex with her? If you incest.;incest
"You know what, we need a huge spoon to take care of this" -Guy who invented shovels;invention
How to keep the flies off the bride at an Italian wedding Keep a bucket of shit next to her;wedding
What do grandparents smell like? "Depends";grandparents
7% of all hearing loss is a result of sitting in a restaurant next to a table full of women who just received dessert.;hearing loss
I like my slaves like I like my coffee Fair Trade.;slavery
ME: I fell off a 50 ft tall ladder once GIRL: holy cow how did you survive ME: I fell off the bottom rung;fall
What do you call a blind dinosaur? A do-think-he-saurus :) !! Lol What do you call a blind dinosaurs dog? A do-you-think-he-saurus-rex;dinosaur
I just bought a very tiny amphibian for a pet. It's my-newt!;pet
This may be not be a mainstream opinion, but I don't believe you should cut down a Christmas tree unless you intend on eating it.;Christmas tree
Jenna Jameson to Oprah, "There's a little bit of Jenna Jameson in everyone." I'm pretty sure she got that backwards.;Jenna Jameson
Even after 20 years, Jared Fogle is still getting into smaller and smaller jeans.;Jared Fogle
I have a degree in men's studies. It's called "world history". #TRUMP 2016! YOU CAN'T STUMP THE TRUMP!;politics
Why don't most fans like the first 39 episodes of DBZ? Its pretty gay, just Saiyan.;anime
My ex-wife still misses me... But her aim is gettin better.;marriage
This doctor once told me eating a bagel was like eating 5 slices of bread and I was like ok, cool, I like bread;food
What do you call a three-humped camel? Pregnant (Told to me by one of the kids at work);animals
What do you call Jay-Z having a leg transplant? A hip-hop hip op.;music
Wanna hear a pun about long hair? Rapunzel.;hair
"I'm so pissed I could punch a ba-" "A what?" Big Baby from Toy Story 3 hovers over me, sawed-off shotgun in hand. "A bagel. I HATE carbs.";anger
My doctor had to put me on a new medication that's supposed to help lower the amount of karate in my blood;health
[uses the restroom] Wife: make sure to put the toilet seat down Me: okay Me: [to toilet seat] you're worthless and nobody likes you;marriage
You know... When someone says to you "Jesus loves you." It's always comforting. Unless you are in a Mexican jail.;religion
When I hear "This call is being monitored for quality assurance" I think "Cool, let's see how bad this person wants their job.";Quality Assurance
You know what the definition of "competitive" is? Finishing first *and* third in a circlejerk.;Competition
How do you know if your wine was made in the 90's? It smells like teen spirit.;Wine
What was the name of Paul Revere's favorite porno mag? The British are Coming;Paul Revere
[car wreck] [hand reaches out] "Take my hand. I'm Chad Kroeger from the popular band Nickelback." [I let the flames slowly bake me alive];Nickelback
Chicken Why did the chicken cross the road? Why? To go to the gay guys house Knock knock Who's there? The chicken;Chicken
Teacher: Why do we put a hyphen in a bird-cage?  Pupil: For a parrot to perch on miss.;Punctuation
I visited Amsterdam this summer, and decided to have sex with a prostitute. It was an overall positive experience. Sadly, it was an HIV positive experience.;Amsterdam
Yup. If pasta & antipasta ever touch, they annihilate. For your safety, that's why restaurants never serve them together.;Pasta
Alcohol is like Lysol for feelings, it won't kill all of them.;Alcohol
When my wife takes a nap, it's "desperately needed rest." When I do, it's "lazy chauvinist party-time.";Napping
"Update the Force, young Skywalker" Said Adobe Wan Kenobi.;Star Wars
lookin for a quick and easy way to beef up that scrawny bod and really turn some heads at the beach? float dead in a lake;Fitness
TIL A ref can show a player the red card for a loud fart ... even if it isn't Messi.;Soccer
What did the wise man say to the fat guy? You should probably go on a diet.;Diet
Who is better? The 3rd wave feminist or the pencil? The pencil is better. It has a point.;feminism
Guys, I think I found the Cure to Aids! It requires having a Magic Johnson.;Magic Johnson
Why do you call a Mexican midget a paragraph? ...because he's too short to be called an essay.;Mexican
This morning I had a swollen testicle. "I'd have simply preferred toast," I told my wife.;marriage
"What's that?" A divorce jar. Every time we fight you put a dollar in and I'm a little bit closer to freedom. *puts in dollar* "WTH!?!";marriage
If you have a parrot and you don't teach it to say,"Help, they've turned me into a parrot." you are wasting everybody's time.;parrot
My 8 y/o memorized my 12 character password that has upper and lowercase letters, numbers and symbols but can't remember to flush the toilet;password
What do you call a racist dog from Animal Crossing? KKK Slider;racism
Me: waiter, do you have frog legs? Waiter: of course monsieur Me: good, hop over there and get me a beer;frog
What did the man with The World's Largest Penis say when he had to have his legs amputated "Don't worry, I still have my third one.";penis
What's the worse thing to do to a blind person? Leave a plunger in the toilet;blindness
When I was interviewed for a job in the chemistry department, they asked me if I had lab experience. I said I was more of a cat person.;job interview
There are two types of people in this world. And I hate them both.;people
I'd give these pigeons some bread but they'd probably just spend it on drugs.;pigeons
Two skeptics walk into a bar.. I'd tell you what happens next but noone knows;Skeptics
Everytime you pull the trigger a bullet loses its job...HAHAHAHA! Because it gets FIRED. HAHAHA! *I'm in tears*;Jobs
In China the labels read, "Made by someone you know.";Manufacturing
It would be great to be born on Earth and die on Mars. Preferably not on the point of impact.;Space
You could be a "Before" model.;Beauty
Descartes walks into the bar. The bartender asks him, "will you have your usual tonight?" Rene replies "I think not" and he disappears.;Philosophy
Anyone want to hear my Human Centipede joke? Nah, I won't tell you it. It sucks ass.;Horror Movies
My dog can predict when an earthquake is going to happen. But television doorbell versus actual doorbell baffles him every time.;Earthquakes
My favorite knock knock joke. I need someone to start it ... Someone start the knock knock joke ...;Knock Knock Jokes
My Parents asked me what i wanted for christmas... I said i want something to wear and something to play with. So they got me a pair of pants with the pockets cut out.;Christmas
With 10K characters, I can finally get into great detail about how I'm not allowed at the company family picnic any more!;Company Picnics
[at my funeral] So young, how did he die? He ran into oncoming traffic after walking past a group of adults saying the word "bae";Slang
What do you call a frisbee that's more than a friend? Frisbae;Frisbees
What does a sheep say after walking into a disgusting, dirty bar? Ew.;Bars
What's the best part of a pregnancy joke? The delivery.;Pregnancy
What is the biggest compliment you can pay at a gay bar? Pushing in somebody's stool.;gay
What is your best "Yo mama" joke?;mama
What's a pirate's favourite type of weaponry? It's ARRRtillery! bonus: A pirate's favourite melee weapon? A scimitARRR;pirate
Hey, who did you vote for?... I wrote in Michael J. Fox. I think he can really shake things up!;politics
I once had a crippiling masturbation addiction... ...now i have a sex addiction, could you say my addiction has gotten out of hand?;addiction
Do it tomorrow. You have made enough mistakes for today.;productivity
Why did the Mexican take his Xanax? For hispanic attacks.;Mexican
*Guy tries giving me his phone number* Me: Oh no thank you. I already have one;dating
I'm glad it's the thought that counts because I spend all day thinking about the shit I should be doing.;productivity
A man balks in a war He is discharged for dereliction of duty and takes up drinking.;war
Instead of calling them flyover states we should call them comments section.;politics
A triangle exploded and a piece hit me. It was a 60-debris angle.;geometry
Yo mama so lazy she thinks a two-income  family is where yo daddy has two jobs.;mama
Does a cow give milk? No, they have to take it from her;cow
Breaking Bad is my favorite documentary about what it takes to be an entrepreneur while balancing family life.;TV Shows
My black cat just ate my four leaf clover. That can't be good.......;Luck
Why can't a bike stand on it's own? Because it is two tired.;Bikes
What did the gay guy say to his lover when they were going on vacation? "Hey, can you help me pack my shit?";Relationships
Coworker: Stop Me: collaborate and listen Coworker: Don't Me: you forget about me Coworker: Hey! Me: teacher, leave them kids alone;Music
What's an extroverted accountant? One who looks at your shoes while he's talking to you instead of his  own.;Accounting
Why are hillbilly murders hard to solve Because they all share the same DNA;Crime
My house is really small until I can't find my phone.;Homes
Sorry, but breaking up with you on facebook was the best way of letting all your friends know I'm available.;Relationships
I don't understand women. I also don't understand how a car works but I still drive it.;Relationships
How do they calculate global warming? Al-gore-ythms;Science
What happens when Turkeys get the common cold? They quit smoking.;Health
The hands that help others in need are holier than the lips that pray.;Philosophy
What do gays and melons have in common? cantaloupe...;Fruits
My girlfriend is great in bed... But I don't know how my best friend would know that.;Relationship
What do you call a Jedi who worries about not making deadlines? Panickin' Skywalker.;Star Wars
Why did the composer go to the chiropractor? Because he had Bach problems;Music
[Justice League HQ] SUPERMAN: Looks like Batman is hungry tonight MOTHMAN: [visibly sweating] I think I'll just fight daytime crimes;Superhero
If we attacked Turkey from the rear... ...do you think Greece would help?;Geography
A sheep, a drum and a snake fall down a cliff badum tss;Animal
My favourite word is snigger It allows me to be sracist without speople sthinking I'm a sbad sperson;Racism
How do you hide an elephant in a fridge? You remove his slippers and open the door . You put him inside. You close the door and take the slippers away.;Animal
Pete and repeat are in a boat Pete and repeat are brothers. Pete falls overboard, who's left?;Brother
What do you call a green cow in a field? Invisibull.;Animal
What did Arnold Schwarzenegger say to the gym manager when he was joining a new gym? I'll re-rack.;Bodybuilding
You're shoes are untied! April fools! Got ya!!;Prank
What do you call a cheap circumcision? A rip-off.;Circumcision
I went in to hospital for an operation... I asked the anaesthetist if I could administer the needle myself, and he said: "Sure, knock yourself out".;operation
A piece of shit walks into a bar It's my dad... My dad is a piece of shit.;family
What's a snakes favourite dance ? The mamba !;snake
What do you call a cheap circumcision? A rip-off!;circumcision
What is the last thing that tickle-me elmo gets before he leaves the factory? Two test tickles;elmo
What do you get when you cross a sheep stealer with royalty? Mutton Looter King;sheep
I'd kill for a microwave that plays Europe's "The Final Countdown" during the last 30 seconds.;microwave
Did you hear about the skeleton who didn't go to prom? He had no body to go with.;skeleton
What do you call it when a jugaloo sleeps with his girlfriend after a fight? Make up sex.;relationship
How does a baboon make phone calls? He just monkeys around on the line!;baboon
Kids are like farts. You don't mind your own, but others peoples are just unbearable;kids
Over the past year, my sexual fetishes have been slowly getting more perverse. But it wasn't until I spanked a statue that I realised I'd hit rock bottom.;sex
I milked the cow "We don't have a cow" the neighbors' cow then "Their cat?" Pretty sure it was a cow he was saying moo "Meow" Ah shoot;cow
The IRA have been fighting for Irish reunification since the 70s. . . All they needed to do was vote for the Conservatives.;Irish reunification
Why is Chapstick so popular? Cause it's the balm baby!;Chapstick
What is the best advice to give a worm?  Sleep late.;worm
If I was antisocial I wouldn't have just ordered a pizza over the phone.;antisocial
Facebook buys Instagram for one billion?!? Idiots!! They could have downloaded it from the app store for .99 cents..;Facebook
I may not be getting laid tonight, but I'm definitely banging my snooze button in the morning.;sex
I want to make a series about the murder of an airline crew but I still have to shoot the pilot.;airline crew
My friend always wanted to work in animation, but never got past the interview He just couldn't understand the difference between a professional "colorist" and a professional "racist";animation
[sees a zebra for the first time] What's up with that horse? [sees a giraffe for the first time] Okay, what the hell is going on today?;animals
so as I went in to vote this morning, an old lady told me to make sure I voted for the candidate that could make change. Boy, is my bank teller going to be surprised!;voting
You're so fat and unfunny... that the only punchlines you have are stained on your shirt.;fat
Glue is weird it's all like hey I want to stick these pieces of paper together wait I have an idea hand me that dead horse;glue
Waiting for the day when a girl finally says that I'm "the one," but isn't talking to a police officer.;police
Some people say Glenn Frey got pneumonia from the cold... But that can't be true because he said the Heat is On.;Glenn Frey
A duck walks up to a prostitute.... And says, "put it on my bill";prostitute
My love for you is like a fart. Everything about it is powered by my heart.;love
What did the Mexican gang member say when two large houses fell on him during an earthquake? Get off me, homes.;Mexican gang
"You're a unit of power Joe." "I'm a Watt?";power
I once bought an e. e. cummings poem collection.. It was the worst game of Mad Libs ever.;e. e. cummings
Why is it that the more numbers someone has in their e-mail address, the less I respect them?;email
What does the mayonnaise say to the refrigerator? Shut the door im dressing;mayonnaise
My bank account status is more scary than the Conjuring!;bank account
If you ever need help learning C++, I can give you some pointers. And you can keep me as a reference.;C++
What have you done wrong if the wife keep complaining when you try to watch TV in the living room? You made the chain too long in the kitchen.;wife
A good rule of thumb is to never be in Liam Neeson's movie family.;Liam Neeson
If you pour two beers in one glass, it's just one beer.;beer
Why was the baby ant so confused? Because all of his uncles were ants!;family
Simba - "welcome to... The bone zone" Nala - "the what?" Simba - "elephant graveyard. I said elephant graveyard";animals
How are doctors so well tempered even under heavy stress? They have a lot of patients;medicine
I wonder if dog's had facebook, would they put our picture as their profile picture.;social media
ME: Haha you can tell them any name and they have to say it BARISTA: I have a latte for "A Person Who Deserves Love"? ME [crying]: Hahaha;love
Peter Pan escaped the adult world... ...by becoming an alcoholic. He goes by Peter the Panhandler now.;addiction
How do you find a blind man in a nudist colony? It's not hard;disability
My Grandfather had the heart of a lion and a lifetime ban from the zoo.;family
FOR SALE: Faulty Guitar. No strings attached.;music
An atheist, a vegan, and a crossfit fanatic walk into a bar... Who talks more?;religion
How is light beer like having sex in a canoe? They're both fucking close to water.;alcohol
How many tickles does it take to make an octopus laugh? Ten-tickles. I'll see myself out.;octopus
What do you get when you cross an insomniac, agnostic and a dyslexic? Someone who stays up all night wondering if there is a Dog.;religion
What do you call a number that won't sit still? A roamin' numeral. :P;math
Where do drinks go on vacation? Coaster Rica;travel
I farted in the Apple store and everyone got pissed at me. Not my fault they don't have Windows.;technology
I left Stephen Hawking like 8 voice mail messages before I realised he'd picked up every time.;celebrity
What type of school did Sherlock Holmes go to? Elementary :);education
Believe it or not, my wife and I were actually matched on Tinder. We'd been married for 12 years.;marriage
I scream, you scream, we all scream for ice cream. This kid working at Baskin Robbins is pretty scared. Now he's crying in the corner.;work
So a Trabi owner pulls up to a gas station... ...and says to the attendant: "Two windscreen wipers for my Trabi please." The attendant replies: "That sounds like a good deal!";car
How many police officers does it take to change a light bulb? None, because they'll just beat the room for being black!;police
Coffee so good it helps a little old lady cross the street.;coffee
What did nazi pilots eat for breakfast? Luftwaffles;war
So a blind man walks into a bar He hurts himself pretty badly.;bar
If you're not one of the first five boys in the yard, you almost never get a milkshake.;boys
sometimes i visit websites that have videos of people making love;videos
Why aren't Tyler Perry movies for the light-hearted? They're dark comedies.;Tyler Perry movies
How do you tell the circumference of a pecan Pecan pi;pecan
Ethiopian Cuisine... is a bit bland. It tastes like nothing.;Ethiopian Cuisine
I love raccoons. Part cat. Part dog. Part rodent. Part bear. Little people hands. What's not to like?;raccons
[Google search history] Moles How to kill moles How to make homemade bombs Rescue moles from cave-in Dealing with regret Mole stew;moles
A guy walks into a bar... Ouch.;bar
Standing in the park, I was wondering why a Frisbee gets larger the closer it gets. And then it hit me.;Frisbee
When in doubt, just do the opposite of whatever the person wearing pajamas in public is doing.;pajamas
[Ouija board] Spirits are you there? U R C U T E D O Y O U H A V E K I K *flips board*;Ouija board
Not being able to read because your book ran out of batteries is a pretty hilarious first-world problem.;book
My internet connection on my farm was be terrible until I moved the router in the horse barn. Now I have stable WiFi.;farm
Putting captions in the wrong place You know what I hate the most...?;captions
What does a sheep call a film it doesn't like? a baaahhhd movie. (   );movies
An irishman walks out of a bar...;bars
Brexit There is a new slimming product in town. It is called Brexit. It'll help you lose a lot of pounds.;politics
Orange Julius is the third best thing to happen to oranges behind mimosas and the "orange you glad I didn't say banana" knock knock joke;oranges
What is a bear's favourite drink ?  Koka-Koala !;bears
Why do golfers wear 2 pairs of pants? Incase he gets a hole in one;golf
How do you stop a baby from crawling in circles? Nail its other hand to the floor.;babies
What is the favorite food joint of dubstep makers? Sub-WUB-WUB-WUB-way;music
Two fish are in a tank... One is driving, and the other is manning the guns.;fish
Steve wrote home. 'I'm glad you named me  Steve' he said in the letter. 'Why?' asked his mother in her reply. 'Because that's what all the kids at camp call me' he wrote  back.;names
Do hamburgers make good vampires? No because they always find themselves in ghoulash situations!;vampires
Whilst at college I did experiment with marijuana. I did it in snow, I did it in sleet, but I did not in hail. ^-- ^Ed ^Byrne;college
I paid 10.50 for a movie ticket to watch Tom Cruise die continuously for 2 hours. I would have paid a hundred dollars to watch that.;movies
A Spanish magician announced that for his final trick, he would vanish into thin air. He counted down: uno, dos, then POOF! He was gone, without a tres.;magic
A Bug's Mind What's the last thing that goes through a bug's mind when he crashes into a windshield? His asshole.;Laptop
My mom recently bought a Jesus shaped flashlight When I asked her why she said: So whenever someone says "I can't see" I can be like "here, let Jesus light the path";Bug
Why is my Chinese girlfriend so bitchy? Well it's true, you are what you eat.;Jesus
Don't you just hate it when people answer their own questions? I do.;Kings of Spain
The hotel we stayed in for our holiday offered bed and board but it was impossible to say which was the bed and which was the board.;Self-answering
