"Joke";"Joke topic"
Fear Factor would have been much scarier if it had just been people in their twenties trying to figure out how to have careers;careers
I just had sex with a pregnant girl and told my buddies I had a threesome;sex
Robin Williams: *Goes for hi-five* C'mon man, don't leave me hanging.;hi-five
What does a German snake sound like? ....;snake
Someone at this party is wearing the same shirt as me. It's very awkward. How did this happen. We barely even fit in this shirt.;shirt
Why are gay guys with big dicks the first ones picked at the bar? Low-hanging fruit;gay guys
An anatomical original Thought you'd like a pun. What sound does a pigeon make when kicked in the nuts? [A high coo](/spoiler);pigeon
Drinking causes memory loss. And then, drinking causes memory loss.;drinking
I'm such a perv that... ... even the crack of dawn isn't safe.;dawn
"wow this rap song is good I wonder who this is" *waits literally 4 seconds* "oh there look at that he said his name how convenient";rap song
Say what you want about pedophiles.. but at least they slow down at children's crossings.;pedophiles
It only takes a second to show someone how you feel about them... The Police call it indecent exposure, but whatever...;feelings
[Classroom in 2064] Student: So how did the war start? Teacher: Well you see, Seth Rogen and James Franco made a movie..;war
I've completed my 1st four year term as husband and have been elected to a 2nd. Let the lame duck husbandry begin.;Marriage
Did you hear about the clumsy thief who stole sculptures of famous people's heads? He eventually got busted.;Thief
I'm not dumb, I just have a lot of blonde moments.;Blonde
What do you call a vehicle with no fuel in Africa? Outtagascar;Africa
The electoral college needs to go away. The tuition rates are out of control.;Education
*Spends 30 min practicing Starbucks order in mirror* *Feels confident* *"Hi I'd like a grander ahoy Ralph Macchioatto lateenbay"* *dammit*;Starbucks
A poem I found I dig... You dig... We dig... He dig... She dig... They dig... It's not a very beautiful poem, but it's quite deep!;Poetry
Macs ranked best to worst - Fleetwood - book pros - n cheese - klemore;Macs
Do you accept Jesus Christ as your lord and saviour? No, sorry we only accept Visa or MasterCard.;Religion
Q: How many Pisceans does it take to change a lightbulb? A: Lightbulb? What lightbulb?;Pisces
Why would Gabe Newell be a good president? Because then World War 3 would never happen;Gabe Newell
Going to Walmart with my mom and kids is a great way to test if the Xanax is working! *eye twitches;Walmart
If the name of your song is not a prominent lyric of the song, I respect you, but I don't have time for you.;Music
Job interview with Al-Qaeda Had a job interview with Al-Qaeda today. "Where do you see yourself exploding in five years? ", they asked.;Job
A lesbian couple asked me if I would like to make them parents. I never thought adoption could be so exciting.;Family
Do ten millipedes equal one centipede?;Animals
[REPOST] How many narcissists does it take to screw in a light-bulb? One. He stands in place while the whole world revolves around him.;Psychology
My granddad has the heart of a lion. And a lifetime ban from Bristol Zoo.;Family
One quality im not looking for in a potential partner is the ability to maintain a virtual farm;Relationship
What has 7 arms and sucks? Def leppard;Music
[On a date at a restaurant] So this is nice huh? "Yea,uh, who's that?" *Dad is breathing on the window and writing 'VIRGIN' in the steam*;Relationship
What's Satan's main social media site? Pentagram;Religion
*Tries to get makeup off* Makeup: I have a boyfriend.;Beauty
It's been a brutal heatwave with no respite, but things will finally cool off tomorrow and rain. I can't wait to complain about that.;Weather
Perms are just rad skateparks for lice.;Beauty
Harry Potter movies should be rated R for the huge amount of cursing. ... i can find the door out.;Harry Potter
Just finished building doors for my fish. I'm highly skilled in the field of carp-entry.;Carpentry
Rhianna is writing the soundtrack for the new Lilo and Stitch movie It's about how Stitch develops a gambling problem &gtSTITCH BETTA HAVE MY MONEY;Lilo and Stitch
How to get a job without experience ? Just run for office!;Politics
Teenage Parties  It's getting harder and harder to tell the zombies from the regular people.;Teenage Parties
"Always leave them wanting more" is my new mantra when paying bills...;Bills
Manslaughter: I always used to read it as 'man's laughter'. Seems oddly appropriate for someone who's got away with murder...;Manslaughter
Knock knock? Who's there? To. To who? to *whom*.;Grammar
Good slumber party questions: - What's the furthest underground you've ever eaten a burger - How many necks have you touched - What's pesto;Slumber Parties
My roommate's diary says I have boundary issues.;Roommates
Barely amusing Japanese joke Why are snakes so difficult to pick up in Japan? Because in Japan, snakes are hebi.;Japan
Keep your friend's toast, but keep your enemy's toaster.;Enemies
Some fairy tales start with "once upon a time". Others start with "If I won the elections".;Politics
Knock knock - Who's there? - Impatient cow. - Impatient co- - He already left.;Impatience
Why did Snoop Dogg buy an umbrella? Fo drizzle;umbrella
I know we're not supposed to say this, but our second black president looks just like our first black president to me.;president
Honey, am I fat? Of course not! You just interact a bit more with the Higgs field.;weight
A farmer's cattle broke out of their pen and got into the marijuana plants he was growing. The steaks were really high.;steak
Breaking news! Cannot unsee! Mathematicians find 2-1=0!;math
I just had 'the talk' with my kid. You know, the one where you break the news that Batman isn't real.;Batman
What happens when you cross and owl with a bungee chord? My ass.;owl
What happened to the horse that swallowed a dollar bill? It bucked!;horse
I think if I was a lifeguard I would just talk shit through my megaphone. "WHAT WERE YOU THINKING... WHO WEARS CARGO SHORTS TO THE POOL.";pool
Get hoarders addicted to crack, they will sell all their s*it..Problem solved.;hoarders
Whats this new apple product I keep hearing about? A: Whats this new apple product I keep hearing about? B: Which one? A: the I-sis;iPhone
I will never forget what my dear old Grandad said to me just before he kicked the bucket. He said, "Grandson... how far do you think I can kick this bucket?";grandad
Sorry for nicking your car w/my door, but you didn't leave much room. It's small, but I circled it with my key so you could find it.;cars
"excuse me, (Chinese couple at the next table,) I seem to have forgotten my calculator, can I borrow your toddler?";math
What I say: No! What my kids hear: There's a really good chance if you keep asking.;kids
What does R. Kelly say to his kids when they do something bad? Urine trouble;kids
When asked about hobbies, don't start lap dancing. #jobinterviewfail;job interview
I was born disabled I couldn't walk, had no hair, couldn't talk, just laid there and shit myself....;birth
Did you hear that France changed their flag? It is now just White;France
Why didn't the gunpowder plot work? Because gunpowder is black.;gunpowder
I hear you take milk baths. That's right.  Why? I can't find a cow tall enough for a shower!;baths
T-Rex probably died from the spread of disease since he couldn't use the soap dispensers without smashing his face into the mirror.;T-Rex
I hate it when people say Amsterdam is only for smoking weed. I mean c'mon, there's prostitutes too!;Amsterdam
yo mommas so poor the roaches pay the light  bill!;yo momma
"How's your love life?" Well, I went on a date. 45 minutes in I realized it was a turtle in a wig. "I'm sorry man" it's ok. still got laid.;dating
Why do lesbians like Sports Authority so much? Because they hate Dick's!;lesbians
The joke about the sun Is too hot to handle;sun
There's a thin line between word and world.;word
At what age do you tell a highway it's adopted???;highway
Q. How many line dance instructors does it take to change a light bulb? A. Five!...Six!...Seven!...Eight!;line dance
The human brain is an amazing organ. It keeps working 24 hours a day, 7 days a week, and 52 weeks a year, from before you leave the womb, right up until you find religion.;brain
Gardens (only clean joke I know) Why don't you tell secrets in a garden? Because the corn have ears, the potatos have eyes and the beanstalk.;garden
What does a pirate drink for breakfast? Arrrrange juice.;pirate
Boss, I can't come in today. Got a bad case of- *puts hand over phone* -what was it again? Daughter: Boogeritis. *to phone* It's Boogeritis.;illness
How many Germans do you need to screw in a lightbulb? One. We're efficient not funny!;Germans
Last night I reached for my liquid Viagra and accidently swigged from a bottle of Liquid Paper... I woke this morning with a huge correction.;Viagra
Just started a new exercise program where I put on a gorilla mask and chase a random toddler through Costco.;exercise
Do you know why astronomers named the planet "Saturn?" It just had a nice ring to it.;Saturn
What did the anus say to the nose? FRAAAAAAPPPBLAPPPPLAAAAAAAPBRENKKKKKKKKKK!!!;Body
Why can't you fool an aborted fetus? Because it wasn't born yesterday;Fetus
I'm sick of following my dreams. I'm just going to ask them where they're going and hook up with them later.;Dreams
There are 2 kinds of programmers Those who understand pointers and Segmentation fault (core dumped);Programming
Why didn't the lifeguard save the hippy? He was too far out man!;Lifeguard
How do you play a big game of Hungry Hippos? Go to a weight watchers meeting and roll Maltesers down the middle of their meeting circle.;Game
Nothing makes me second-guess my language like a little voice chirping, "Mommy, I found your freaking measuring spoons.";Parenting
Why did the libertarian chicken cross the road? That's none of your damn business. Is he being detained?;Politics
Me: Where the hell are you going with those balloons? 4yr: I need to wee! Me: With balloons?! 4yr: Its so much fun to wee with balloons;Childhood
When Snoop Dogg was born, he had 3pounds .. in his possession.;Snoop Dogg
The key to Simon & Garfunkel's success was that one was big and one was small. Before, duos were always the same size. They changed the game;Music
Did you hear about... ...the optometrist who fell in his lens grinder? He made a spectacle of himself.;Optometrist
"I finally caught up with my son." "That's good. Progress. How did it go?" "Badly. I cut off his hand THEN told him." - Vader & therapist;Parenting
"Get over yourself." *Me teaching clones how to play leapfrog;Cloning
So a bear walks into a bear... and says, "Sorry, I didn't see you there." - my daughter, age 5;Animals
In most of the country, if you lose your khakis you have no pants... But in Boston, if you lose your khakis you can't start your car.;Geography
Who the hell buys a cat? There are cats everywhere just let one in your home and it becomes your cat.;Pets
Why doesn't Santa have any children? He only comes once a year and that's down the chimney.;Christmas
I met my ex-wife at the gym. We didn't workout.;Relationships
My Easter wish is for Paul Simon to finally turn cannibal, if only because I'm beyond ready for him to record "Fifty Ways to Eat Your Lover";Music
What do you call an alligator in a vest? An IN-VEST-IGATOR!;Animals
Yo mama so fat when God said "Let there be light" he he to ask her to move out of the way.;Insults
Why shouldn't you ask if someone's a Texan? Because if they are they'll tell you, and if they aren't you don't want to insult them.;Geography
What's the only thing better than a gold medal at the Paralympics? Legs;Sports
Q: What's the definition of perfect pitch? A: When an accordion is thrown down the toilet without it touching the sides.;Music
Me: !!Ugh!! YOUR DAMN DOG IS STARING AT ME AGAIN! Him: Just ignore him. Me: I'm trying! Him: I was talking to the dog...;dog
What kinda truck does Paulie Shore drive? A DiiieEEeESsssleeeeee;truck
I hope you're using all the time you save by saying "totes" instead of a "totally" to learn a trade.;language
Cereal box mascots give kids a dangerously positive view of animals who in the wild would literally kill them before they gave them cereal.;animals
Did you hear what the Pope was giving up for lent? His job.;Pope
Black or white... We all have white in our blood.;race
There once was a guy drawing blood... ...he used a pencillin.;medicine
Ever hear the story of the dyslexic, agnostic, insomniac? He would lay awake at night worried about the existence of dog.;religion
My best friend back home just had his first kid but I also will be giving birth today...to some relatable content;content
If you ever get cold... Just stand in a corner. They're usually around 90 degrees!;temperature
I've just bought a transparent megaphone. Now everyone can hear me loud and clear.;communication
Before you act, listen. Before you react, think. Before you spend, earn, Before you pray, forgive. Before you post, check  for typos.;life
Hey, NSA, if you're going to read them, would it kill you to star them?;NSA
I'm helping the sharks celebrate their big week by throwing cats into the ocean.;sharks
I once dated a girl with two noses. She wasn't much to look at but she smelled great.;women
What kind of overalls does Mario wear? Denim denim denim..;Mario
You know what they say about people with big brains, right? "You have a severe case of meningitis.";intelligence
Why is Stephen Hawking so controversial? He never changes his position.;Stephen Hawking
I take comfort in the fact that my neighbour will probably die before me. I'll be at his funeral, leafblowing through the entire ceremony.;neighbour
Before firemen rescue cats from trees they always take a photo and that's where 'hang in there, baby!' posters come from.;cats
To the rooster goes the spoils.. indeed;rooster
Plastic Surgery I loaned a friend 5000 to get plastic surgery last week... I'll never get the money back, I dunno what he looks like now.;plastic surgery
I like my men like I like my coffee shops. Clean. Smells nice. Free wi-fi.;men
I always keep two kinds of birth control available: condoms (cling wrap), and "fancy" condoms (condoms).;birth control
When does a Cub become a Boy-Scout? When he eats his first Brownie;scouting
Turkeys are crazy. They hunch down and freeze in groups in grocery store coolers to elude hunters. Must be a safety in numbers thing.;turkeys
OK, Gravity wasn't very realistic. First of all, and I checked this, Sandra Bullock -- not an astronaut;Gravity
What do you call a Greek arsonist? A ;arsonist
Why does Puff Daddy have nice hair? Because Sean Combs.;hair
Beer: The WD40 for conversations.;beer
How do you make apple jelly? google maps.;jelly
Why was the airport depressed? It had a terminal illness.;airport
If your clock strikes 13, what time is it? time to fix your clock.;clock
I just managed to determine someones IQ just by hearing her laugh.;intelligence
History Teacher: what ended in 1918 ? Student: 1917;history
I'm the most bashful person in the world, until you get me on the dance floor. Then I become the most bashful newborn giraffe in the world.;personality
If I don't charge my iPad at the beginning of the week I spend the whole time just trying to catch up to 100%.;ipad
I sent in a list of my top ten puns to the newspaper hoping at least one would be selected for the joke of the day. Sadly, no pun in ten did.;puns
What's the crackhead's favorite song? I wanna rock!;song
Do you know why one side is longer than the other when birds fly in a "V" formation? Because there are more birds on that side.;birds
What's a Mexican's favorite candy bar? A payday;Mexican
My greatest fear is sitting in front of thousands of people while my Google search history is being read aloud.;Google
Justin Bieber gets 40,000 retweets just for tweeting 'Hello', so here's my attempt: Hele0iM1. Ah, harder than it looks. Fair play to him.;Justin Bieber
There are 10 kinds of people in the world Those who understand Hexadecimal, and F the rest;Hexadecimal
Rob Zombie is a good musician but also a great way to make money when the undead rise from their graves;Rob Zombie
How do you find Will Smith in a snow storm? Just check for fresh prince;Will Smith
How does a solar system have a party? They planet;solar system
Two whales walk into a bar. The first one says... "Eoooooooohahhhhhmmmmmmmuuuuuuaaauuu..." The second whale turns to the first and says. "Frank what the fuck is wrong with you?";whales
What do singers get during their periods? Minstrel cramps.;singers
In china, tried Donkey meat yesterday.... It tasted like ass.;Donkey meat
The only thing I can fix in this world tonight is another drink.;drink
Son, there's the house where I grew up. And I bought a Playstation at that Best Buy in 1996. Well, that's pretty much the tour;childhood
"Give it to me!" she said, "I'm so fcuking wet, give it to me right now!" And I replied, "Fcuk you, it's my umbrella!;umbrella
Blinding hatred is a perfectly healthy response to everything that other people do.;hatred
I'm think about taking up Jousting so I have something to talk about at awkward dinner parties.;jousting
What happened to the man who turned into an insect ? He just beetled off !;insect
What do you call a ceramicist with a beard? A Harry Potter;ceramicist
If I had a dollar for every time Greece made a bad economical decision Their economy would still be failing.;Greece
What do you call piss from the continent? Ureapean / Urinepean.;piss
Why should you never race with a guy from Finland? Because they're already Finnish before the race even began;Finland
How many legs does an elephant have if you count his trunk as a leg? Four. Because calling the trunk a leg doesn't make it a leg.;elephant
A toothless termite walked into a tavern ... and said: "Is the bar tender here?";termite
A terrorist invites his socially awkward friend to a party "C'mon," he said, "It'll be a blast.";terrorist
I like to think that hobos that talk to themselves are just recording a podcast.;hobos
Pregnancy test that says, "Your cart has 1 item in it";Pregnancy
Batman's Bat Signal was really banking on the fact that crimes only happened at night.;Batman
What does the rapping shepard sing to his flock? Ewe, crank that soldier boy!;Shepard
Bring brownies to work. Spend the rest of the day asking coworkers, "you feelin anything yet?";Brownies
What's the definition of a period? A bloody waste of fucking time.;Period
robber: give me the money! *points gun at cashier* cashier: wait thats just a blow dryer nervous snowman patron: please just do as he says!;Robbery
Knock Knock Who's there ! Cuba ! Cuba who ? Cuba wood !;Cuba
My teacher said I'd end up working in McDonald's. Well, look who's laughing now. The guy's ordering chicken off me in KFC.;McDonald's
Shooting guns is a stupid hobby. Its much easier and more cost efficient to shoot targets!;Guns
Two muffins in an oven... ...One says to the other, "Blimey it's hot in here" The other screams, "AARRRGGGHH, a talking muffin!!!";Muffins
Q: Why did the bird get a ticket? A: It broke the law of gravity!;Bird
My kid started doing this annoying preteen whiny voice and now I can turn my head all the way around like the exorcist.;Preteen
A man comes home... ... To his wife repotting cactuses and succulents "Allo Vera";Cactus
What do you call porn with transgender midgets? Micro trans action.;porn
Jupit. Jupiter. Jupitest.;Jupiter
(For Ents) So the D.E.A filed a report So the D.E.A filed a report about the Old lady who swallowed the Fly. Turns out Flies are a Gateway Bug;Ents
I spent the last two years trying to find my ex girlfriend's killer. No one will do it.;murder
This guy told me that he can see the future but he didn't even try to duck when I punched him in the face.;prediction
Eating Chinese food is like getting an organ transplant There's always a chance your body will reject it.;food
Why was the Xbox 360 named as it was? Cos when I seen one i turnt 360 degrees and walked away Playstation for life xD;Xbox
A monk to another, "O! master, is it proper for a monk to use email?" "Sure, as long as there are no attachments", replied the other.;monk
Painted my computer black hoping it would run faster... Now it just doesn't work.;computer
What did the cannibal do after he dumped his girlfriend? Wiped his butt;cannibalism
I grew up for this?;life
For Sale: Starter motor for Perpetual Motion Machine. Only used once.;perpetual motion
Have you never heard of the boy that cried wolf??? The girl that coughed bees? The boy that sneezed sharks? The girl that shit spiders?;fables
What's black, white, and red all over? Two nuns in a chainsaw fight.;nuns
The real joke isn't always in the comments Sometimes it's in the Whitehouse...;Politics
Yesterday I held a door open for a clown... I thought it was a nice jester.;Clown
How many hipsters does it take to change a lightbulb? It's a pretty obscure number, you've probably never heard of it.;Hipsters
When I say I'm as sober as a judge I mean Paula Abdul.;Judge
People are asking if capes are welcome at #ScienceMarch - yes - but please think of the aerodynamics if it happens to be windy!;Science
My girlfriend is like John Cena I can't see her :(;Relationship
My Version Of Flirting! My version of flirting is looking at someone I find attractive and hoping they're braver than I am.;Flirting
A German boy pushed his brother off a cliff. He then turned to his mother and said "Look Mom! No Hans!";Brothers
What do you call a fuzzy animal that grows on trees? A root bear! (I came up with this joke a few minutes ago. I hope it's funny);Animals
I hope I'm not the only one who hovers over someone when they use my favorite pen just so they know I'm serious about wanting it back.;Possessiveness
Don't care what your religious or political beliefs are, if you're male or female, young or old. I will tackle you hard for that last donut.;Donuts
My wife threw a doughnut at my head. Now I have a glazy eye.;Marriage
Aches and Pains by Arthur Ritis;Aches
Broke a light bulb today. Seven years of bad ideas?;Light Bulb
My friend said I'm racist. But I'm not racist, I have one black friend.;Racism
What do you call a black man on the moon? An astronaut you racist fucks.;Racism
What's the difference between a truckload of sand and a truckload of babies? You can't unload sand with pitchforks.;Babies
What musical instrument do people with STDs play? The herpsichord.;STDs
Show me someone who is "cheery" in the morning and I will show you someone who probably knows how to dispose of a body.;Morning
They fired a Mexican guy at work the other day, he was a really hard worker. We hope the find some Juan to replace him soon we are getting tired of working overtime.;Mexican
Who led the Jewish people through the semi-permeable membrane? Osmoses;Judaism
Bjerg is so fly That he's sren;Person
Heard about the peanut that walked through Central Park It was a salted.;Peanut
What did the hotel manager say to the elephant that couldn't pay his bill ? "Pack your trunk and clear out !";Hotel
What did the doctor say when a Chinese baby with down syndrome was born? Congratulations, you have a healthy new baby!;Chinese
No Girlfriend November was a success, now for Don't Date December, Just Me January, Forever Alone February, No Match March..... I got this.;Dating
Just saw a dude catcall a woman with "Nice heels, girl" and his friend slapped him and said "Those are knock offs, bro";Catcalling
A woman walks in to a bar and asks for a Double Entendre... ...So the bartender gave her one.;Double Entendre
my favourite one-liner a seal walks into a club.;Seal
[walks up to guys playing basketball] "mind if I join?" you any good? Hell yeah I'm good. Toss me the orange sphere;Basketball
A Jewish kid.... asks his dad for ten dollars. His dad replies, "Eight dollars? What do you need five dollars for?";Jewish Kid
University.... Close to being unemployed but with your parents still being proud of you;University
Police: where were you between 5 and 6? Me: Kindergarten;Police
Do Russia and Uganda realize if they put all their gay people in jail then jail will become the nicest part of their country?;LGBTQ Rights
My local supermarket is selling Star Wars-themed cereal... They really are trying to milk the franchise for all its worth.;Star Wars
My friend stabbed me with a pencil, I guess you could say I got the point.;Friendship
Why are Microsoft circuit boards so bad? They use French resistors.;Microsoft
How did the Otaku Redneck guy name his daughter? Annie Mae;Otaku Redneck
Buzzfeed: 9 Ways to Know You're Dating a Real Woman and Not a Burrito;Dating
You think the dozen roses on my toilet tank are there to mask odor? Read the card: "Dear toilet. I'm so sorry for all the shit I've done...";Toilet
New Knock-Knock joke? Child: Knock Knock Grandmother: Who's there? Child: [Insert Name] Grandmother: [Insert Name] who? Child: Oh no! You have Alzheimer's! Yes? No?;Alzheimer's
Taking home work has never been more satisfying I love being a coroner!;Coroner
what is the key to picking up girls who are musicians? get a flat and be sharp;Musicians
Why should you never get into an argument with a dictionary? Because they'll always have the last word.;Dictionary
What did captain Kirk do in the head? He Shatner.;Captain Kirk
What has two thumbs and doesn't understand jokes that require a visual component? This guy!;Jokes
*puts kid in tub* *checks twitter* *forgets about kid* *tweets* *remembers kid* *finds kid-shaped prune floating in tub*;Parenting
You like sleeping? Me too! We should do it together sometime.;Sleeping
What do you call a midget psychiatrist on the run from the law? A small medium at large.;Psychiatrist
Clue in Michigan is cheaper, because it only has three pieces Governor Snyder, Flint, and the Lead Pipe;Clue
