"Joke";"Joke topic"
I can finally scratch "murdering an anonymous vagrant" off my bucket list. I didn't do it, it just doesn't seem all that appealing anymore I guess.;Murder
What type of wood is the most expensive? Hollywood! (Made this up while i was doing a project.);Wood
Fired from my job as an autopsy technician for repeatedly asking "are you gonna eat that?" during the procedures.;Autopsy
I got hit in the head with a can of soda today I'm lucky though it was a soft drink;Soda
My ten year old son just asked me what were the 80's like. So I turned the Wi-Fi off and took away his smart phone.;80's
My friend handed me broken scissors... I told him this isn't going to cut it.;Scissors
Where does the bride of Frankenstein have her hair done? At the ugly parlour.;Frankenstein
Did you hear Italy is joining forces with ISIS? They think the world needs more Italian ISIS;ISIS
How do you make an archaeologist blush? Give them a dirty tampon and ask them what period is this from.;Archaeology
What do you call a man with a seagull on his head? Cliff;Seagull
Told my dealer I wanted a shitload of Coke but autocorrect changed it to shipload now I owe a Columbian cartel 18 million dollars;Coke
It's cute how insurance companies think funny commercials and catchy jingles will make us forget how much we hate them.;Insurance
I went to a psychic today. Ended up accidentally breaking her crystal ball. It cost me a fortune.;Psychic
What do you call a big fish who makes you an  offer you can't refuse ? The Codfather !;Fish
Have you guys had the new Lance Armstrong Trail Mix? There's only one nut in the bag.;Lance Armstrong
What do you call Robin Hood's mother? Mother Hood.;Robin Hood
Last night I played Cards Against Humanity for the first time... You know what gives me uncontrollable gas? Auschwitz;Cards Against Humanity
[ouija board] me: are there any spirits with us? Speak now ouija board: H E L L O F R O M T H E O T H E R S I D E me: ....please stop;Ouija board
Why don't ducks blow glass? To many quacks;Ducks
Kinda messed up that marijuana is just a plant. Like, what other plants are drugs? *tries to smoke a carrot* Yea I guess I'm feelin it;Marijuana
[takes a massive shit on a bird in the park] See? Not nice, is it?;Bird
Owning a sword is like being a horny priest... Owning a sword is like being a horny priest, even though you want to, you can never use it without breaking the law.;Sword
Did you hear about the guy who burnt down the Chinese restaurant? He was charged with won ton destruction ^^*cue* ^^*groan*;Chinese restaurant
In LGBTQ families... We need more transparency.;LGBTQ
What's worse than finding a lobster on your piano? Finding crabs on your organ.;music
I'm more hampster than gangster according to autocorrect;autocorrect
I lost over 100 pounds in the last week. The casinos here in London have terrible odds.;gambling
The second I feel pressured to do something, I'm out of there faster than a dog who hears his name and knows it's bath time.;pressure
Doctor: Nurse, how is that little girl doing who swallowed ten quarters last night? Nurse: No change yet.;medicine
I just want one spam email that's like, "Congratulations! You have a perfect-sized penis.";spam
After years of commercials, I still have no idea what a Go Daddy is;advertising
I told my SO that now Movember is over they should shave their mustache. She didn't take it very well.;Movember
Me: grandma have you ever tried Five Guys? Grandma: at once?! *in case you don't know, Five Guys is a burger joint*;Five Guys
Sorry I'm late. My dog ate my car.;excuses
I came up with a shoe company that specializes in selling oversize shoes Which is no small feat;shoes
DEAR ENTIRE WORLD: LIGHTENING IS WHAT BLEACH DOES TO HAIR. LIGHTNING IS WHAT I'M GOING TO STRIKE YOU WITH FOR YOUR CRIMES AGAINST SPELLING.;spelling
If I had kids I would name them Ctrl, Alt and Delete so when they misbehaved I would just hit them all at once.;parenting
The Phantom Menace is easily the best Star Wars installment Jar Jar Binks is the best character.;Star Wars
Unscramble these words Unscramble these words ! 1) PENSI 2) HITLRE 3) NIGGRE 4) BUTTSXE DO YOU GET SPINE,LITHER,GINGER AND SUBTEXT ?;wordplay
My mum tells me that she turns the internet off when she goes to bed, incase you're wondering why your screen just went blank.;internet
My paranoid boyfriend broke up with me. "It's not you," he said, looking around. "It's them.";relationships
Knock Knock Who's there ! Alan ! Alan who ? Alan a good cause !;knock-knock
Great Insults A letter from teacher to parent:Dear parent,Kamal doesn't smel nice in class.Please try to bathe him.Parent answer:Dear teacher,Kamal is not a rose.Don't smell him.Teach him.;insults
Oh I'm sorry.. I didn't know it was "bring your feelings to work day".;work
Two lorry's crashed into each other, one containing terrapins the other containing tortoises... It was a turtle disaster.;accidents
No internet for 11 hours. I've written two novels, lost 15 pounds, and forgotten how to pronnounce "gif.";internet
"Meetings" What a Jamaican calls everything he owns.;possessions
What is the problem with high frequency? It Hertz;physics
I bought a chilli dog and a thumb drive at a gas station... Ya know, for shits and gigs.;shopping
Before mustaches were invented, people had to just GUESS who owned a water bed;mustaches
What did the surrealist butcher name his shop? Salvador Deli;butcher
You have something big inside you. Share it with the world: MetamucilTM;advertising
Which similarities do Bon Jovi and geologists share? They like rock.;rock
If you think my grey hair tells a story, you should see the unmarked graves in my back yard.;age
Why can't you find an Abbey National at the North Pole? Because Santa dere.;bank
What does a Redhead with a yeast infection like to do in her spare time? Make Gingerbread;hair
Did you ever watch that movie about the killer tire? It was actually a sadtire.;movie
knock knock joke "knock knock" "who's there" "jerry" "jerry who? "jerry seinfeld";celebrity
You may have a heart of gold, but so does a hard-boiled egg.;personality
My father held his temper very well.... Every time we would get mad, he would just count to 100. Then take my head out of the water.;parenting
A student asks another student, "How many zeroes does your salary have?" He responds "One" "In which currency?" "Any :(";money
person texting me: hey I'm outside me: [covered in glue and accidentally tripping onto a pile of several thousand photos of you] uh HANG ON;relationship
[boss starts giggling uncontrollably during his presentation as I tickle a voodoo doll];work
My black friend called me a disgrace in front of his girlfriend. But then I realized he was introducing me to his girlfriend, Grace.;friendship
I tried fixing my vacuum the other day on my own... now it sucks even more!;household
Why do people keep asking me what I'm going to be doing in three years? I don't have 2020 vision.;future
Why black people are so good with basketball? They can shoot and steal without being arrested.;racism
Dear Oral-B You forget the J;toothbrush
Did you see the guy at Walmart hiding from ugly people?;appearance
A red and blue ship collided in the Mediterranean today. The survivors are marooned.;ship
Don't worry, they'll tell you. How do you know OP put the punchline in the title?;humor
What happened to the cannibal lion? He had to swallow his pride!;pride
What is your preferred type of birth control? "Well, its not preferred, but I practice abstinence.";abstinence
I walked into an explosives shop the other day and wanted to buy a grenade with my debit card. It all went horribly wrong when the cashier asked for my pin.;explosives
What happened to the cannibal lion? He had to swallow his pride.;pride
How many Germans does it take to screw in a lightbulb? One.;nationality
What do Canadian girls hate? Aboooooooooty call.;nationality
What does a sailor use to clean his clothes? Tide;laundry
That mini heart attack you have when you're in bed half asleep and you suddenly feel like you're falling.;sleep
Why did the blind woman fall down the well? Because she couldn't see that well.;well
Ladies, if all he does is make you cry then maybe you're dating an onion and not a man.;men
In my opinion it's the aborted fetus' fault for not carrying a gun for protection;abortion
How many livers do people have? I want to make sure I have a backup before I put this thing on Ebay.;organs
Best goldfish joke ever told Two goldfish were in their tank. One turned to the other and said, "You man the guns I'll drive.";goldfish
Knock Knock..... Whos there?? 9x11 9x11 Who?? 9x11 paper fight... I came up with this is a fit of insanity from sleep deprivation, so just laugh at it.;math
This joke made me shit myself Just a bit of self-defecating humor.;humor
Why do they use liquid soap in the Navy? It takes longer to pick up;Navy
Have you guys heard the one about the sidewalk? Its all over town!;sidewalk
What's better than roses on your piano? (PG13) Tulips on your organ.;organs
Where do hippos go to school? The Hippocampus!;hippos
Why can't the bike stand by itself? Because it was two-tired.;bike
Quitting smoking is a lot like getting out of a relationship. It's a sad and slow realization of all of the things that you used to like to do it after.;smoking
What has 10 legs 9 arms and sucks? Def Leppard;Band
What's that Eminem song where he's mad?;Music
Nerdy pickup line. Hey baby, Are you uranium because I'm Iodine and if it was up to me I would rearrange the periodic table around and put U and I together. );Chemistry
What did earth say to the other planets? You guys have no life!;Planets
The sadomasochist was arrested and put in front of a judge he got off with a slap on the wrist;Punishment
I love the smell of my F5 key... It's just so refreshing!;Keyboard
I'm tired of people saying I sit too much and I will not stand for it;Protest
I have to come clean... So I just whack off in the shower.;Masturbation
My walls are closing in. Crawling in my skin my Cell walls are closing in? HELP!;Biology
Last night I dreamt I was a muffler I woke up exhausted;Car parts
My OCD brings all the boys to the yard, where they're sanitized and counted before I wash my hands of them.;OCD
I stepped on the scale today. Not to get my weight. I just couldn't reach the cookies in the cupboard.;Diet
I have seagull managers. They swoop in, screech like hell, shit all over everything, then fly away.;Management
Wait. If Toyotas can't stop accelerating, can't they theoretically be used for space travel?;Cars
if Lindsay Lohan can call herself an artist, I can call myself a german shepherd;celebrity
Welcome to college! Here's a list of our majors. Here's a list of majors that lead to unemployment. As you can see, both lists are the same.;education
How many potatos does it take to kill an Irishman? None.....;Irish
From an Obit: He was always a daredevil His last words were "Watch this.";obituary
There's a one-eyed doctor round my way that gives out free body parts. He gives me the willies.;medicine
Live today like it's your last day. But pay bills and dress appropriately just in case it isn't.;life
My girlfriend just made a peepeeAND a poppy at the same time Should I break up with her?;relationship
How did the blonde burn her nose? Bobbing for french fries.;blonde
Lara Rabbit: Do you think that's Sophie's natural color? Zara Rabbit: Only her hare dresser knows for sure.;hair
Why couldn't the life guard save the drowning hippie? Because he was too far out man.;hippie
Why did Jesus run off the airplane? He didn't like the Pilate;Jesus
COP: You seen an escaped evil octopus? ME: No COP: [looks up] Nice chandelier ME: Thanks COP: Why is it wet? ME: Um COP: And holding 8 guns?;police
I am not an alcoholic. Alcoholics need a drink, I already have one.;alcohol
I believe, if you're in Special Ed, and you're late to class... ...it's politically incorrect to say you're tardy.;education
What do you throw a drowning aboriginal? His wife and kids;aboriginal
Kim Jong Un has upgraded himself from "Leader of North Korea" to "Supreme Leader of North Korea" by adding sour cream and extra cheese.;Kim Jong Un
Yesterday one of my patients told me about the time he sat on his testicles... It was nuts.;medical
Which is better Pirate Bay or Pirate Bae? Pirate Bae, because it never goes down.;Pirate Bay
Your password must be at least 8 characters long & contain a capital letter, a number, and a hideous personal secret.;password
How did Hitler achieve 99 firemaking? He burned yews.;Hitler
Why did princess Diana cross the road? She forgot to wear a seatbelt.;princess Diana
WIFE: Will he ever wake up? DOCTOR: Only a shocking truth will do it W: i sold his pet hamster ME *eyes fly open* WHERE HAS THEODORE GONE;marriage
Why did the ghost get kicked out of the bar? 1. Because he was sheet faced. 1. Because he couldn't hold his boos. EDIT: Formatting.;ghost
Why is a horny walrus the same as a Tupperware enthusiast? They're both looking for a tight seal;walrus
The REAL 5 second rule? If you can get to it before the dog, it's yours.;food
Good night cop: Want the light on or off? Sweet dreams kiddo. Bad night cop: You will go to sleep or I will put you to sleep.;police
What do you get when you mix a Jehovah's Witness with an Atheist? Someone who shows up to your door for no reason.;religion
Batman: Life isn't a video game. Your actions have consequences *Robin writes 'I'm sorry I forgot to buy Charmin' 100 times on Batpaper*;Batman
Why did the butcher die ? Because he chopped off the wrong sausage.;butcher
What did the elephant say to the naked man? You breathe through *that*?;elephant
What do vampires put at the bottom of their  e-mails? Best viscious.;vampires
I woke this morning to find Mr.Mittens on the bed staring at me with a look that said 'You're a mouth breather, and I'll never respect you';cat
My wife was struggling to open the freezer In the end she gave up, and froze to death.;wife
what do you call a homosexual plaything? a gayme;homosexual
People need to learn the difference between heroin and heroine. One is exceedingly more difficult to fit into a syringe.;heroin
How do you know the toothbrush was made in France? Anywhere else it would've been the "teethbrush";France
So I walked by a restaurant in Maine! It had a sign up " Happy hour special: Lobster tail and beer!" I said to myself. Jesus, my three favorite things!;Maine
Spilled yogurt on my shirt and now I can't stop thinking of selling shirts made of yogurt. The Yoshirt. I taste potential. And mixed berry.;yogurt
A TV weatherman who keeps accidentally calling the anchorwoman mom;weatherman
My friend said his dog could retrieve a stick from 5 miles away. That just seems a little far fetched to me.;dog
What did the slug say to the police? "I was as"salt"ed";slug
who's there * Knock knock * *who's there* * Dwayne * *Dwayne who?* * Dwayne the tub, I'm dwowning!;Dwayne
New BMWs don't have a dipstick located in the engine anymore They're now located in the driver seat;BMW
You can always predict what antigay protesters will say. But never how they'll spell it.;protesters
Farmers. If Farmer A sells watermelon, and Farmer B sell apples, what does Farmer C sell? Drugs.;farmers
Bird Strike Pilots in a cockpit of A380: -Damn! Birdstrike!! -NO!! It was a Fokker 50!!;aviation
There's so much sexism in this world. Just once I'd like to see a Maury show titled "You are not the Mother".;sexism
They say you should play dead if a bear attacks you. That shouldn't be that hard once he snaps your torso in half.;bears
A ghost walks into a bar. The bartender asks: what'll you have? Ghost says: I'm here for the boos.;ghosts
Why is everyone in the Soviet Union always in a hurry? Why is everyone in the Soviet Union is always in a hurry? They're all Russian.;Soviet Union
What disease do neckbeard mosquitos give you? M'laria.;mosquitos
Me: you have a good head on your shoulders Neck: ok wow, i'm like right here;anatomy
Take your time, Officer. I have nothing but respect for the law. Your imminent death on this dark side street can wait.;police
"Ugh, you're so obsessed with me." Boss: "I just asked why you're twenty minutes late?";work
I was mugged by an artist last night.... he drew a gun on me;crime
Why didn't the skeleton cross the road? He didn't have the guts to.;skeletons
What did Indira Gandhi hate worse than a bogey on a par four Sikhs;golf
How do you make a kilogram of fat appealing? Put a nipple on it;fat
Me: was I born with a mental disorder? Mom: did you iron a shirt while wearing it again Me: NO Mom: ? Me: I thought pants would be different;mental disorder
Adolf Hitler banned 5k races but sponsored an annual marathon... ...Because Marathons are the master race.;Hitler
The magician got so mad he pulled his hare out.;magician
What do a Catholic Priest and McDonald's have in common? Both like to stick their meat in 10 year old buns.;Priest
Yes it was my birthday. I'm going to start lying about my age, but say I'm older so people say how good I look for 47.;birthday
I got fired from my office job for misunderstanding the meaning of 3 hole punch.;office job
I just saw Toy Story in 3D... The guy in 4D asked me to take off my hat.;Toy Story
What do you call an earl grey that likes role play? Not-tea;tea
billy joel: we didn't start the fire detective: I haven't mentioned a fire billy joel: shit;Billy Joel
YOU ARE GROUNDED!!!! ~ me, yelling hilarious shit at the beef in this grocery store.;beef
What's the difference between a black joke and Mexican joke? Nothing. If you've heard Juan you've heard Jamal.;race
What is the difference between a hockey player and a hippie chick? Hockey players shower after three periods..;shower
What do you call a Chameleon that can't change colors? Reptile dysfunction.;Chameleon
What's a stoners favorite word? Here! (Must be said like you are holding a hit in);Stoner
School is like a boner It's long and hard, unless you're Asian.;School
Why couldn't the bike stand by itself? because it was two tired;Bike
Picture a scavenger hunt where the only items on the list are "your house keys" and "your house." Well, son, that's what drinking is like.;Drinking
How did the Mexicans get across the border? They went through Juan by Juan. ^Forgive ^me.;Immigration
What's white on the top and black on the bottom? Society.;Society
TIFU. She was on top.;Sex
I'm training to be a sniper in the Communist Revolutionary Forces... ... I'll be the designated Marxman!;Communism
Q: What do you call a tree from Tulsa? A: An oakie.;Tree
I never really wear camouflage. It's just something that I can never see myself wearing.;Camouflage
"I'd like to make a large cash deposit" teller: ok, how much do you have? "Wow can't a guy just share his dreams without being pressured?";Bank
How many nuns can a nunchuck chuck if a nunchuck could chuck nuns? Nun.;Nuns
Johnny Depp has announced that he has a mental issue He has Deppression;Johnny Depp
What do you call a blind dinosaur? Doyouthinkhesaurus. I watched Jurassic Park tonight, stole this.;dinosaur
We're learning more about the sale of the L.A. Clippers. Insiders say it came down to a bidding war between Steve Ballmer and Oprah. I'll let you guess who Donald Sterling rooted for.;Clippers
Did you hear the pizza guy's joke? He has excellent delivery.;pizza
What do black men do after sex.... 15 years to life!;black men
Why don't you see elephants hiding in trees? Because they're so damn good at it;elephants
Me: I like how you dyed all the meat green for St. Patrick's Day. Chipotle manager: It's St. Patrick's Day?;St. Patrick's Day
Two people were debating first man : Polish are inherently stupid people on earth second man: that's not true first man : prove it second man : let's ask a Sardar.;Polish
[Jesus on a blind date] Christians: "Hmm, you seemed whiter in your profile picture";Jesus
Why did Star Wars episodes 4, 5, and 6 come out before 1, 2 and 3 Because in charge of scheduling, Yoda was.;Star Wars
"Blackhat" opens to just $4M this weekend with a $70M budget, making it the first bomb of 2015. Biggest hack in the movie? Micheal Mann;Blackhat
Why don't they have Oktoberfest in Africa? Because nobody there is much of a drinker.;Oktoberfest
What has ten legs and nine arms? Def Leppard;Def Leppard
My wife thinks I'm cheating on her with our babysitter... I think she's just bitter because she's never been able to have kids...;wife
The day I can't do my job drunk... Is the day I hang up my school bus keys.;Job
I estimate 70% of my work conversations are just me quoting made up statistics.;Statistics
What is the opposite of a meme? youyou.;Meme
What is the ultimate Jewish conflict? Pork chops at half price;Jewish
I like how commercials for gum seem to be predicting a cold, dystopian future where our survival depends on the freshness of our breath.;Commercials
Did you guys hear about the circus fire? It was in tents.;Circus
My SO always wanted a Disney wedding... But aparently selling our memories of it to a demon was out of the question.;Wedding
What is the Earth's most juvenile lake? Lake Titicaca of course!;Geography
Do you think, when they were looking for that Carmen girl, that they ever checked San Diego? Just a thought.;Carmen
In any kind of relationship...you learn more about someone at the end of that relationship than at the beginning......;Relationship
can't wait to see how dudes figure out how to still get really mad at each other when cars are all self-driving;Technology
Santa is a dependent clause because;Grammar
2% of Japanese have cataracts... The rest drive Toyota and Nissan.;Nationality
When Jesus comes back, how will they discover if he's Jesus or Robot Jesus? by giving him the shroud of turing test.;Religion
"Ha-ha who me? Oh, I put ketchup on everything!" CAR SALESMAN: please stop putting ketchup on these Buicks.;Ketchup
There are 10 types of people in this world... Those who understand ternary, those who don't, and those who think it's binary.;Programming
I found a stray cat today. Sadly, my dad is allergic to them so I had to put him down. At least I still have the cat for comfort.;Pets
Why did Mike Dukakis lose the 1998 Presidential election? He TANKED his campaign!;Politics
What do you call an Irishman who can't hold his liquor? [OC] A quadriplegic.;Alcoholism
Hate it when I can't find my slippers so I have to stand upon the wings of my pet pterodactyl Benedict as he fetches me the morning paper;Pets
Apple is suing Qualcomm for selling them overpriced chips. Punchline ends.;Technology
The Doctor stuck a finger in my bum... For a prostate exam. He said "All's fine." I said "Stick another finger in there, please." He asked "why?" I said "I want a second opinion.";Medical
Why don't pirates ever stop going to brothels? They can't get enough booty.;Pirates
Dear 70 year old man with the ponytail: stop it.;Fashion
What did Stephen Hawking Say when his computer crashed? Nothing;Technology
Did you hear about the cartoonist being investigated? Police on the case say he has a sketchy past.;Art
If you finger a bum... you're a hobosexual;Homelessness
Did you hear about the Buddhist that refused Novocaine during his root canal? He wanted to transcend dental medication...;Buddhism
Why did the semen cross the road? I put the wrong socks on this morning.;semen
Few people knew that Albert Einstein had a brother that was an evil scientist who created a monster from body parts. His name was Frank;Frankenstein
What?s green and fluffy and comes from mars? A martian-mellow;martian
What do you call someone who is afraid of Santa? Claustrophobic;Santa
Before Instagram people had to display their photos in fish tanks full of piss.;Instagram
If had a feminine side I would try and fcuk it.;masculinity
Sometimes I need "Eye of the Tiger" playing to get me to leave my bed.;music
No matter how bad you are playing, it is always possible to play worse.;gaming
Two cannibals were having their dinner. One  said to the other 'I don't like your friend.' The other one replied 'Well put her to one side and just eat the greens.';cannibalism
Batman sure has a weird habit of purposely leaving his soft lips exposed.;Batman
Bernie Sanders The real reason Bernie Sanders went to the hospital because he looked at his poll numbers Berning up. Doctors have said that he must have felt the BERN.;politics
Tomatoes are a rich source of lycopene (werewolf dick).;tomatoes
20 years ago my parents had a traffic accident... and that was the day I was born;birth
Didja hear about the new LGBT hockey team gonna play in Boston? (Wait for it ... wait for it ...) Yeah - the Boston Bruouts ...;LGBT
So these two cannibals are eating a clown... One turns to the other and says, does this taste funny to you?;cannibals
I asked a guy at the gym how to use a piece of equipment. "Just push the button," he replied, "Like you would with any other hand dryer.";gym
There are three kinds of people in the world, Those who are good at math and those who aren't.;math
What is Jesus' favorite gun? ... a nail gun!;Jesus
What do you call a potato Kim jong un dropped in his lap? A dicktator.;Kim Jong Un
What is Robin Williams doing in heaven? Not sure, probably just hanging out.;Robin Williams
I thought about getting two pets and naming them One and Two. So when One dies, I'll still have Two.;pets
This guy said he was going to hit me with the neck of a guitar.... I said, "Is that a fret?";guitar
You never have to worry about Starbucks running short on coffee. I hear they always have a latte;Starbucks
What was Tigger doing in the toilet? Looking for Pooh;Tigger
Til, We are Homo Sapiens at school, And said that my mother. She wished My father was still Homo Erectus.;evolution
If an athlete gets athlete's foot what does an astronaut get? Missile toe.;astronaut
Save the whales Collect the whole set. seen on a bumper sticker in PDX;whales
If you cross your fingers after surgery you'll heal faster Or maybe that's just super stichin';surgery
