"Joke";"Joke topic"
Where did Sally go when the bomb went off? EVERYWHERE;Bomb
I just got a photo from a speeding camera through the mail... I just got a photo from a speeding camera through the mail. I sent it right back  way too expensive and really bad quality.;Speeding
I just saw the movie 50 Shades of gray You could say it had a huge climax.;Movie
My boss has a rather shrill phone voice. I once spent 20m talking to him, before realizing it was actually someone trying to send us a fax.;Workplace
This one is about a horse a horse steps in a puddle of mud;Horse
You stop bad music with a tuning fork. How do you stop bad singing? A pitchfork;Music
Did you know Hitler's father was a cobbler? He made Jews.;Hitler
[March 15] Brutus: Going 2 the senate? Caesar: yeah u? Brutus: yep it'll be killer Caesar: how so? Brutus: like cool u know rad senate stuff;Caesar
So I beat a Russian Grand Master once. With his own cane.;Russian Grand Master
What did the Buddhist monk say when he approached the hotdog stand? Make me one with everything.;Buddhist monk
So my neighbor asked me to fix her sink She's obviously never seen a porno because it's been an hour and I'm still fixing the damn sink;Russian Grand Master
Fact: If you ever blow me a kiss, I'm catching it and sticking it down my pants.;Moses
I feel like my rear end turns into Billy Mayes whenever I get diarrhea... "Butt wait, there's more!";None
Q: Why can't Micheal J Fox draw a perfect circle? A: Because drawing a perfect circle is impossible for any human.;diarrhea
I can't afford Disney World so we go to the biggest hill on my street and my kids wait an hour before I roll them down in my office chair.;Micheal J Fox
A frog can leap higher than a house ..partly because of the strength of its hind legs, but also because houses have difficulty jumping at all.;Disney World
I kept pouring water on my Iphone.. because Siri won't tell me where the terrorists are.;frog
What thinks the unthinkable? An ithe-berg;iPhone
My girlfriend wanted a marriage just like a fairy tale... I gave her some bread crumbs and left her in the forest.;None
Cooking with Hitler Step 1. Turn on the gas;cooking
[wife frustrated] "at least I didn't hook up the toilet wrong and tell everyone it's a bidet";marriage
Just in time for Christmas. Rudolph the Red-Nosed Reindeer: Teaching people that it is okay to make people outcasts for being different until that difference benefits someone since 1939.;Christmas
How to Get There by Ridya Bike;transportation
I was up late last night, trying to figure out why the sun disappeared Then it dawned on me....;science
"We're still looking for a side project" Tornado: *raises hand* we could flip houses "We've been over this, it's not what you think it is";astronomy
It would be funny if we discover there are inhabitants on the comet... they would be comedians.;real estate
A father asked his son how baking school was going "I knead some dough.";comedy
A skinny guy with a 6-pack is like a fat chick with t*ts. It doesn't count;baking
I had a difficult childhood... I was brought up by a couple of alcoholics. I called them my Foster's parents.;terrorism
Why did the "M&M" go to university? He wanted to become a "Smartie";childhood
At what age do kids stop remembering how often their parents are late picking them up from school because of online poker?;education
Whats the worst part about a black out in Detroit? All the pairs of floating eyes;parenting
Why did the robot cross the road? Because it was carbon bonded to the chicken.;city life
A nun goes to the greengrocer, asking for a cucumber. "Get 2" he says. "So you have one to eat"; Nun
Me: [Sits down to eat breakfast] Girlfriend: Babe, you forgot the French Toast Me: Oh sorry [raises glass] VIVE LA FRANCE!; Breakfast
I dumped my boyfriend with a lazy eye. Turns out he was seeing chicks on the side.; Boyfriend
I just gave my cat some 7UP. Now he's got 16 lives.; Cat
What is a teenage girl's best friend? Passive-Aggression; Teenage Girl
Chemist have an unpopular view on alcohol... They say it's a solution.; Alcohol
Why do NBA players like poultry? Because they love to slam duck!; NBA
I paid a fish to come over to re-key my guitar, piano and drums. He was a professional tuna.; Music
Jokes in English Doctor: "I'm sorry but you suffer from a terminal illness and have only 10 to live." Patient: "What do you mean, 10? 10 what? Months? Weeks?!" Doctor: "Nine."; Doctor
What's grey and moves at a hundred miles an hour ? A jet propelled elephant !; Elephant
I just think there are a lot more animals out there we could be eating.; Animals
I would most likely die like 45 minutes into a zombie apocalypse, and even more likely it would not be zombie apocalypse related.; Zombie Apocalypse
What do midgets and dwarfs have in common? Just a little; Midgets
My 1-year-old refused to wear her shoes and carried them around instead. She can barely walk and she's already the drunk girl at the party.; Toddler
Which color confuses an idiot? Blue; Colors
A Guy Walks Into A Bar........ Wait For It........ "Ouch";bar
You can get out of jury duty on the first day by blatantly winking at the defendant as you give them a double thumbs up.;jury duty
I get out of awkward dinner party convos by telling people it's my first outing since the psychiatrist declared me unfit to stand trial;dinner party
If you say "gullible" slowly it sounds like "oranges" Weird huh?;wordplay
Why can't you tell Walter White a knock knock joke? Because HE is the one who knocks.;Breaking Bad
ISIS is taking back territory after a surprise turn of events. Their new partnership with Samsung is quickly paying off;ISIS
A waiter walks up to a table of older Jewish folks... A waiter walks up to a table of older Jewish folks while they are eating and asks: "Is ANYTHING alright?";Jewish people
How do you call a black man flying a plane ? A pilot.;racism
If you know the thread count on your bed sheets we're in different tax brackets.;wealth
How did the shrimp eat all the fish food? shellfishly;shrimp
I've just started a band called 999 Megabytes. We haven't done a gig yet.;band
My best friend won't talk to me. It's because he is a dog.;friendship
My parents are in a fight My dad wanted to go see a lighthearted psychic. My mother wanted to buy some cheerful watercolors. I hope they find a happy medium;parents
Why are Russians such bad pilots? Because they're always Stalin. Thank you, good night.;Russians
What do you get when you cross a crocodile with a cartridge? A snapshot.;crocodile
*Witnesses an awkward moment* starts a slow clap* sees that nobody is joining me* pretends like I'm trying to kill mosquitoes*;awkward-moment
My friend said he was a harp.. But he was obviously a lyre.;instrument
Did you hear the joke about the roof? I would tell you, but it tends to go over people's heads;architecture
What do you call someone who finishes a sentence with you? Partner in crime.;wordplay
I got pulled over for drunk driving last night. In my defense I didn't even know I was driving.;drunk-driving
May you never be as bored as whoever figured out that holding a seashell to your ear sounds like the ocean;sound
A man with pica walks into a bar... ...and orders a drink on rocks. Hahahaha! Smart people jokes are the best!;medical-condition
I play Nickelback real loud all day so crickets can listen to something annoying when they try to sleep;music
Horrifically awaiting the day all the shampoo bottles in my shower decide to squeeze me back.;shampoo
Sweep her off her feet, but not like the bad guy from Karate Kid.;romance
What do you called a piano someone pissed in? A peeano.;instrument
4: Where did I come from? Me: Mommy's belly. 4: How'd I get there? Me: I, uh...put you there? 4: How did you... Me: WHO WANTS ICE CREAM?!;parenting
Life hack : Receive a wide assortment of yellow, orange, pink and red envelopes, free of charge, simply by not paying your bills.;Bills
I had a near miss on my a flight to Thailand. Well a pre-op Transsexual.;Transgender
You get to sleep all day, cat, that's why I get the good food.;Pets
What did one window say to the other window? I'm in pane;Windows
*jumps out of plane* *begins reading parachute instruction manual* STEP 1: PUT ON PARACHUTE *looks up* Well hell;Skydiving
A guy just yelled at me for texting and driving. I told him to get off my hood and mind his own business.;Driving
ok kids, this is a smoke detector, if you hear it beeping change the battery, if it's still beeping, check to see if ur on fire;Safety
Where does sans live? Sans francisco;Location
I found a way to make my dick 9 inches long I fold it in half;Body
Feel like Woods household right now is a bunch of people brainstorming, "what is any other plausible reason for this accident?";Scandal
It's HOMOsapiens, not HETEROsapiens. It's the Bi-ble, not the Straight-ble.;Sexual Orientation
What's the best insult you can tell someone?;Insults
The Bible is a fascinating book It's fascinating how a book with so much sex and violence can be so boring;Bible
if a bee sting u, u get a lil pain but the bee dies so who really wins? "lol im OWNING all these bees" i say as i put my face in the beehive;Bees
What's big and ugly and drinks out of the wrong side of the glass? A monster trying to get rid of hiccups.;Monsters
My wife is kind to strangers, she stopped an old lady from buying evaporated milk... ..., and told her it was just an empty can.;wife
Q. What is good for your soul but not your soles? A. Linedancing!;linedancing
I feel sorry for Eazy-E He went from Straight outta Compton to Straight outta condoms before getting aids. I'm sorry.;Eazy-E
I just raced a Smart car. He barely beat me, but that's only cuz I stopped to tie my shoe.;car
I always wanted to be self-confident. Well, look at me now. Actually, don't.;confidence
How can you tell if you have a high sperm count? If she has to chew before she swallows.;sex
The problem with traveling into the future is that it's hard to determine the date because newspapers no longer exist.;future
I love the smell of a camp fire. It reminds me of the night we kille.... .....I just love smell of campfires.;campfire
a friend took Exlax and viagra at the same time... .. he didnt know if he was coming or going.;medication
So many Jehovah's Witnesses and yet still not a shred of Jehovah's Evidence.;Jehovah's Witnesses
Sex is not the answer... Sex is the question. "Yes" is the answer;sex
did you know you can tell how much a girl likes you by the position of their feet Chances are if her feet are next to her ears she really likes you.;sex
Q. How many black people does it take to screw in a lightbulb? A. Nobody knows, there's no light.;lightbulb
Mrs. Smith: Help me doctor! My  son John swallowed the can opener! Doctor: Don't panic. He'll be alright. Mrs. Smith: But how do I open the can of beans?! The toast is getting cold!;can opener
What do you call it when a person falls ill from watching too many BBC period dramas? Downton Syndrome;BBC dramas
We are all part of the ultimate statistic  ten out of ten die.;statistics
So my neighbor knocks on my door. So my neighbor knocks on my door at 2:30am last night. 2:30AM!!! Can you believe it?!!? Lucky for him, I was up playing my drums.;neighbors
me: hello darkness my old friend darkness: you are going to hate me but I forgot your name;drums
Pretty cool to think every time the Verizon guy said "Can you hear me now?" the NSA was quietly answering "Yes we can.";darkness
First day on the job as a drug dealer... Dealer: I don't have coke... is Pepsi okay? *gets stabbed*;NSA
What will Ryan Lochte say if he looses "Dancing With the Stars"? "I was robbed" Sorry, that just came to me like a stroke of idiotic genius and I couldn't help myself.;coke
I am a hiring manager. Before I take a look at all the resumes, I throw the entire top half away. If you're going to be working for me, you also have to be lucky.;Ryan Lochte
"I guess we should make them sound like a space shuttle is taking off during an a-bomb explosion." -person who invented hand dryers;job interviews
Q: Which of the following doesn't belong: wife  meat eggs blow job? A: The blow job. You can beat your wife your eggs or your meat but you just can't beat a blow job.;hand dryers
How many blind people does it take to change a light bulb? None if nobody's looking.;self-absorption
If you want to say something "rude" for the person you hate the most: 'It wouldn't be worth it to buy your voodoo doll, because i would anyways throw it in a fire right away. it's money wasting!;blind people
The Dalai Lama went into a pizza shop.. And asked them to make him one with everything.;insults
Did you hear about the guy who died after eating chicken? The meat was fowl.;Dalai Lama
What do you call a lost crayon? a Strayola;chicken
I love puppies and kittens and little cute hamsters But not all together. I don't like my food touching.;food
Ed Hardy makes a wine. Just tasted some. With full-bodied undertones of asshat, its repugnant mouthfeel would pair well with a cheeseball.;wine
I'm circumcised but I'm looking to change that. Anyone have any tips?;circumcision
"I'm going to slide in and go back and forth until you're satisfied" -Floss;dental hygiene
Nothing screams "I don't care about being on time for work" like hopping on Twitter first thing in the morning.;work ethic
What do you call a cheap cicumsicion? A rip off;circumcision
What did one snowman say to the other? Smells like carrots;snowman
NSFW Two flies are sitting on a piece of shit... One fly farts. The other fly says, "Do you mind? I'm eating.";flatulence
A miracle birth, then resurrection. Accept Frosty the Snowman as your personal savior.;religion
I asked my dad what the deadliest weapon known to man is. He said 'you came out of it'.;birth
What should have tipped off the airline ticket sellers on 9/11? When the terrorists asked for anything cheaper than one-way.;terrorism
What happens when the Pope dies? ....another one popes up.;religion
Why did the blind woman fall into the well? Because she couldn't see that well.;blindness
My friend firmly believes that he's a solute I think he's diluted;Chemistry
What is the biggest plot twist in spanish soap operas? When Rodrigo finds out he is his own mother;Spanish Soap Operas
How did the townspeople react when the mayor presented them with a cost efficient, vegan protein source? They chia'd.;Veganism
What nationality is Santa Claus? North Polish.;Nationality
So sorry... Sorry seems to be the hardest word to say... Unless you're Chinese, then it's "squirrel".;Language
If you've never heard a 9 minute version of "Girl From Ipanema", then you weren't just inside my head while my co-worker was talking to me.;Music
How did Darth Vader know what Luke was getting for Christmas? He felt his presents.;Star Wars
2 halloweens ago I was brutally owned by a small child when I answered my door in normal clothes and she said "nice lumberjack costume.";Halloween
What's another word for a face tattoo? An everlasting jobstopper.;Tattoos
I've heard rumors that desperate prostitutes use Crest Toothpaste to reduce cavities.;Prostitution
That new vet really screwed up my pig's colonoscopy He's pretty ham-fisted;Veterinary
Half-Life 3's release date.;Video Games
An interracial couple eating Cheerios and non-English speakers drinking Coke. We're a Benghazi pizza commercial away from a Texas secession.;Advertising
Iron Man is a super hero. Iron Woman is a command.;superhero
Why did the moron give the sleepy cow a hammer? He wanted her to hit the hay!;cow
What does a college kid do when confronted by an evil spirit? He drinks it just like he drinks every other kind of spirit.;spirit
I'm glad my parents told me I'm adopted But I don't know why they tell me everday.;parents
What does a blonde have if her brain is the size of a pea. Encephalitis, and possibly a medical miracle.;blonde
Hello this is ur pilot speaking We almost began our descent but my copilot said "turn down for what" so looks like we r rerouting to Cancun;pilot
Detective: Why did you dump those vegetables on my desk? Criminal: You said it was time to spill the beans.;vegetables
What's better than a Kike on a Pike? Two Kikes on a Pike!;Kike
I kissed a girl in the club and she said, "Oh my God, you've been smoking. It's just like licking an ashtray." "You non-smokers have some funny habits," I replied.;smoking
Sometimes you have to stop tweeting to have an alibi for ignoring texts.;tweeting
*Brings pen to sword fight* Guy with sword : What's that? Me : Tis mightier! *Gets beheaded*;pen
I watched craps at the casino for over an hour tonight until security finally dragged me out of the bathroom.;casino
I don't mind getting the stink-eye when I say, "Happy Whatever Holiday You're Weirdly Touchy About," because THAT is the spirit of Whatever.;holiday
A bloke in a wheelchair stole my camouflage stuff I told him 'you can hide but you can't run'.;camouflage
A recently fired stock trader said: "This is worse than a divorce, I have lost everything and I still have my wife!" ;stock trader
What kind of bees make milk? Boobies;bees
How do you get to Matthew McConaughey's house? A right a right a right;Matthew McConaughey
The number of things that are *not* rocket science is staggering.;rocket science
How many hipsters does it take to screw in a light bulb? It's a really obscure number. You've probably never heard of it.;hipsters
United Airlines just tried to charge me $25 for the bags under my eyes.;United Airlines
Darn it A man was walking around his backyard in his stocking feet and stubbed his toe on a rock. His sock exclaimed "I'll be darned!";backyard
I don't need a football game to get drunk and scream at my television.;football
I feel really sad for children with cancer and people who still use BlackBerrys.;cancer
"I'll have to report you sir" said the traffic cop to the speeding driver. "You were doing 85 miles an hour." "Nonsense officer" declared the driver. "I've only been in the car for ten minutes.";traffic cop
There are three people in this world... Those who can count, and those you can not.;math
Cookies Two cookies are in an oven. The first cookie says "is it hot in here or is it just me?" The second cookie says "holy shit! A talking cookie";cookies
Strange new trend at the office People are putting names on food in the company fridge. Today I had a tuna sandwich named Kevin.;office
Some kid just threw a bottle of milk at me HOW DAIRY! His behaviour was udderly disgusting. It just skimmed my head.;Milk
it's a status....not your diary...;Social Media
Caitlin Jenner isn't transgender. She's trans-Jenner.;Caitlin Jenner
They say: "keep your friends close and your enemies closer". The problem is, nowadays you can't tell them apart.;Friendship
A vegan, cross fitters, and yoga person sit down for dinner And nobody says a word.;Veganism
My ex posted a pic captioned, "Just me" and I commented, "Yes just you and your 7 personalities";Relationships
How do heavy metal bands surf the web? On the Din-ternet.;Heavy Metal
What does the ninja call his penis? meningococcal;Ninja
Which knight of the round table had Diabetes? Sir Lance-a-lot;King Arthur
What did Martin Luther King Jr., Rosa Parks, and Nelson Mandela all have in common? They're all criminals.;Historical Figures
Non-native English speakers, try to literally translate jokes from your own language We might get some weird/funny stuff;Language
To moma Yo moma so stupid she climbed over a glass wall to see what was on the other side;Insults
I'd make a political joke... But it's too soon, the DNC tried to force one on all of us and we saw how that went.;Politics
How Much Did the Pirate Charge For Corn? A buck an ear;Pirates
Get in on Syrian real estate now! The markets are exploding!;Syria
Michael J. Fox was in a car crash... ...a bystander ran up to check if he was ok. "Yeah..." Michael said "I'm just a little shaken up";car-crash
Why can't two Asians have a white baby? Because two wongs don't make a white;race
Why is Islam called the religion of peace? After you leave the religion, you rest in peace.;religion
I once dated a dyslexic woman. I took her home and she cooked my sock.;dyslexia
As my wife gave birth all the doctors yelled, "Push!" I was convinced it was a Pull door.;childbirth
What times does the chinaman go to the dentist? Tooth-hurty;racism
Crocodiles these prehistoric beasts can grow up to 20 feet! Although most just grow 4.;animals
Did you take a shower today? Why, is one missing?;hygiene
End a boring conversation by opening an umbrella in their face;conversation
At my last physical, my doctor told me I had to stop masturbating, and I asked why. He said, "Because I'm trying to give you a physical.";doctor
No one spoil the ending, I haven't finished the iTunes user agreement yet!!;agreement
In 2011 it is more normal to have 0 or 2 dads than 1 dad;family
Butt sex is a lot like spinach If you're forced to have it as a child, you probably won't like it as an adult.;sex
Did you hear about the stationary store? It moved.;store
My friends think I have a black sense of humour I don't know what they're talking about... In my view it's golden.;humour
Curiosity killed the cat... NASA sincerely apologizes...;curiosity
Why did Hitler kill himself? He finally got the gas bill.;Hitler
3 blondes walk in to a bar you'd think one of them would have seen it;blondes
I got a job as a bounty hunter in China. Couldn't believe my luck, every time they put a new wanted poster up, the guy they were after was standing right next to me!;bounty hunter
Guy in the club: *lifts up his shirt* I do 400 crunches a day. Me: How many more until you get a personality?;personality
I get so fustrated when people say "supposably" or "irregardless" I feel like I'm literally drownding;language
Why do people say tunafish, rather than just tuna? Is that to differentiate from the tunacow and tunagiraffe?;tuna
you're lucky I can teach you how to shave my dad wasnt around to teach me. now watch *presses razor against face and moves head up and down*;shaving
If 7 out of 10 sports fans have below average intelligence, what percentage of sports fans is that? 110%. [Aaaaaand we prove once again that morons are humorless. Really should know that by now.];intelligence
Knock Knock Who's there ! Adelia ! Adelia who ? Adelia the cards after you cut the pack !;cards
I just finished reading the fifth book in this great series. It's called the "Learning to Count" trilogy.;reading
What made Tesla successful ? Its musk;Tesla
Girl: What colour are my eyes? Guy: 34C.;eyes
If you don't like oral sex You should keep your mouth shut;oral sex
Congratulations Amy Winehouse On three years of sobriety!;Amy Winehouse
What shakes and sits at the bottom of the ocean? A nervous wreck.;ocean
What do you call twin kittens? Dupli-cats;kittens
I don't think I'm a father but I better celebrate just incase I am...;father
Why did the student take Viagra while preparing for his exam? His professor said he should study hard.;exam
Where can you find a dog with no legs? Right where you left him.;dog
My diet always starts on a Monday morning and ends at the donuts somebody brings into the office later that morning.;diet
Have you heard the one about the butter? Nah, you'll just spread it around.;butter
How does the moon get a haircut? Eclipse it;moon
What's a thesaurus's favorite cereal? Synonym Toast Crunch;thesaurus
Do you know the one step to avoiding clickbait? Obviously not. gg y'all, inbox = rekt;Clickbait
There is too much freedom in this country, we need more expensive smart.;Freedom
I would totally surf a tsunami. If I didn't get nauseous on water. And if tsunamis weren't dangerous. And I knew how to surf.;Surfing
Mum: How can you practice your trumpet and listen to the radio at the same time ? Son: Easy. I have two ears!;Music
* Dalai Lama goes on killing spree after listening to my coworker eat soup *;Dalai Lama
Feed me once shame on you, Feed me twice i'm moving in.;Relationships
Me: Can I order the conch fritters please? Waitress: The "ch" is pronounced like a "k" Me: Okay Bick.;Food
This isn't a competition! -People who are losing;Competition
I'll be honest, the only time I'd ever want to be 'Keeping Up With The Kardashians' would be if I was chasing them With an axe.;Kardashians
What do you call an old person from Portugal? A portugeeser;Portugal
My brother and I ran out of protein powder. I turned to him and said, "no whey....." (true story);Protein Powder
If mankind has learned one thing from human history, I'd be stunned.;History
I am a very kind and honest person. if I see an old lady trying to cross a street... ...I will tell her she is old.;Kindness
I was going to buy tickets to see Michael McDonald in concert... ...but I keep forgetting;memory
50 Cent Or as he's known in Zimbabwe, 400,000,000 dollars.;money
What do you call a team of Christian mutant superheroes? The A-Men;superheroes
There is no "I" in "team." But there's an "I" in "Tim," and my friend Carlos pronounces it "team" so....there;teamwork
The two hardest things in programming? Naming things, caching things and off-by-one errors!;programming
What is a Polish person's favorite weapon? A Warsaw...;war
How do I tell a man he loves me?;love
Once you've seen one shopping centre... ...you've seen a mall;shopping
I've just wrecked myself. I wish I'd checked myself beforehand.;self-care
Why did the number 6 cry? Because 7 8 9. (7 ate 9);numbers
Do you know how to cook toilet paper? Me either, but I know how to brown it on one side.;cooking
Algorithm A former vice president playing the drums;politics
GF: What's my biggest flaw? ME: You haven't got any, you're perfect, I love you GF: No come on, I mean pacifically ME: We should split up;relationships
What does Batman use to wash his hair? Conditioner Gordon.;haircare
I have a joke about Ebola You probably won't get it;disease
Did you hear about the Asian guy who was so terrible that nobody mourned his death? He was unbereaveable.;Asian
