"Joke";"Joke topic"
Has anyone heard of the movie 'Constipation'? No because it hasn't come out yet. Huehuehuehuehue;Constipation
"Hey I like you" "I like you too" "Let's lick the inside of each other's mouths to express our love" "Yeah that's not weird. Let's do that";Love
Wow you changed your makeup in 16 different hot ways. And where did you learn those 8 moves that drove me wild *sees Cosmo on the table* ah;Makeup
Husband to daughter's boyfriend... ..."Glad to finally meet you. I've noticed you in our food budget for some time now.";Boyfriend
Why is cocaine the alt-right's favorite drug? White powder!;Cocaine
Charlie couldn't believe he was being allowed into the Chocolate Factory His girlfriend had been so against it for years;Chocolate
Diarrhoea runs in my jeans;Diarrhoea
What happens when you give an Italian a coupon? It makes the Dego buy faster.;Italian
When is a door not a door? When it's a jar;door
Why did Mary Magdalene have an affair with Jesus? She heard about his second coming;Jesus
They should bring lacrosse to the X Games... It would be a great opportunity to advertise ex-lax;Lacrosse
Why are gardeners good at spreading religion. Because they can plant churches.;gardener
What's brown and runny? Usain Bolt.;Usain Bolt
There should be a trap door at the front of the line for coffee that opens into a pit of fire if you take too long to order.;coffee
"If you're flying with 3 kids, pick the 1 with the highest earning potential & then work your way down with oxygen masks." -Flight attendant;flying
A friend lectured me about going to see Star Wars alone, because "that's weird." As if chastising a grown man in a cloak is some normal shit;Star Wars
What is the most positive thing in Africa? HIV;Africa
Keep an identical glass of vodka next to the glass of water on your bedside table for a refreshing morning game of Russian Roulette;vodka
When you are trying to get out of the aisle at the movies, and you have to pass by people, do you give them the nut or the butt?;movies
What keyboard shortcut do the elderly have the most trouble with? Ctrl+P;keyboard
When meeting someone, I walk calmly and slowly toward them while something explodes behind me, because first impressions are important.;Impressions
What's the difference between being hard at work and being hard at work. ...you can't be the latter if you're a teacher;Work
The guy who developed Fractals.. The guy who developed fractals was Benoit B Mandelbrot, I heard the 'B' stood for 'Benoit B Mandelbrot';Fractals
According to a new report from BP, the earth will run out of oil in 53 years. Luckily, thanks to BP, the ocean will still have plenty...;Oil
Mime Ninja Silent, But Deadly.;Ninja
I saw two blokes having a fight... I shouted, "My money's on the one with the knife!" You should have seen how fucking fast they both ran off.;Fighting
"Give me the best quality TV commercial I can get for $57!" -Every attorney apparently;Advertising
Guy across the road can't get his truck started. Now he's rolled up his sleeves. That's how you start trucks. By rolling up your sleeves.;Trucks
Wanna hear a joke about cats? Haha, just kitten.;Cats
The last time I had sex, there was a dinosaur in the cave with us.;Sex
A procrastinator walks into a bar I'll post the rest later..;Procrastination
What Does a Gynecologist and a Pizza worker have in common? They both get to smell it, but neither gets to eat it.;Professions
Why do crows do vocal exercises every morning? For the Good of the Caws.;Birds
If you google "MySpace" your computer will ask "Are you fucking serious right now?";MySpace
Why do vegans don't like to kiss?? It gives them butterflies in their stomach;Vegans
I wonder if anyone being chased by a bear has ever tried just turning around and saying in a really stern voice "NO...Bad Bear"?;Bear
What happens on Santa's lap......stays on Santa's lap.;Santa
Kitty Pryde walks into a bar Something is disrupting her mutant power.;Kitty Pryde
Roses are... Roses are grey, Violets are grey, i'm colourblind, and Canadian, eh?;Roses
Statistically, 6 out of 7 dwarves are not happy.;Dwarves
Civil War reenactments are a lot like meetings. You do the same thing over and over again while waiting for your turn to die.;Meetings
What's the difference between a mexican and a perubian? The passport;Mexican
Why did the fox cross the road? It was chassing after the chicken!;Fox
If laziness was an Olympic sport... I would be fourth so I wouldn't have to step up on the podium. Edit: too lazy for dictionaries, thanks /u/ReddSpy;Laziness
Food trucks were invented by a guy who really loved fast food but hated how cheap it was & how he didn't have to stand in line forever.;Food trucks
*Feels the chill* Chill: I have a boyfriend;Relationship
Did you hear about the cannibal who cloned himself to see what he would taste like? It made him shit himself.;cloning
How to fall down stairs: Step 1: Step 2: Step 3: Step 4: Step 5: Step 6: Step 7: Step 8: Step 9: Step 10: Step 11: Step 12: Step 13: Step 14: Step 15: Step 16: Step 17: Step 18: Step 19: Step 20:;stairs
How did the aliens hurt the farmer? They trod on his corn.;aliens
Little known fact: a penguin's head can rotate 390 degrees. Once.;penguins
What do you call the survivors of the holocaust? Residue.;holocaust
I used to think I was homophobic. It turns out that I was just afraid of monsters in the closet.;homophobia
Why did Bilbo Baggins live for so long? Because old Hobbits die hard...;Bilbo Baggins
A rich kid sees a poor kid kicking a can down the road The rich kid says "Hey, you, what're you doing?" The poor kid says "Moving.";poverty
Atoms make up everything... so naturally you shouldn't trust them.;atoms
What kind of water do you drink when the snow melts? Spring water.;water
I gave my son some masturbation advice. "Slow the fuck down, you're going to rip my cock off." I told him.;masturbation
I am not pro gay. I am not even amateur gay. But, I support their rights.;gay rights
I broke up with my gym We just weren't working out.;gym
I'd name my daughter Roxanne. I'd play the song for her all the time so she knows she doesn't HAVE to be a prostitute.;daughter
What do the World Trade Center and genders have in common? There used to be two of them, but now it's too offensive to talk about.;genders
Excuse me, miss. I'm sure you hear this everyday but... ... do you know where the nearest McDonald's is?;McDonald's
I hired a pizza chef as my new golf coach. One way or another the dude is gonna fix my slice.;golf
I opened a company selling landmines that look like prayer mats Prophets are going through the roof;landmines
I think ugly people have children just to prove to everyone they had sex.;ugly people
Why don't the citizens of Boston build igloos? Meh. They just aren't in' uit.;Boston
I find it inconsiderate that policemen always ask if I had been drinking but they never bother to ask if I had anything to eat at all;policemen
Did you hear Mike Tyson was just arrested for nearly beating a Pizza Hut waitress to death? As he was finishing eating, she asked "Hey, mister, you wanna box for the rest of your pizza?;Mike Tyson
How do you tell the difference in an oral thermometer and a rectal thermometer? Taste;thermometer
When I killed a... When I killed a honeybee dad told me no honey for a week. When I killed a butterfly he said no butter for a week. Well mom just killed a cockroach, should I tell her for you?;honeybee
Knock Knock Who's there ! Blue ! Blue who ? Blue away with the wind !;knock knock
A neutron walks into a bar... ...and asks "how much for a drink?" The bartender replies "For you, no charge.";neutron
The Chipotle I went to apologized for not having any lettuce today. I said "It's cute that you think I'm here for that.";Chipotle
A man goes to a doctor. The doctor examines him and finds out he has five penises. The doctor says, "That's amazing! How do your pants fit?" The man says, "Like a glove.";genitalia
LPT How to beat morning wood I find my right hand does the job quite nicely.;sex
Yea, let's do that Old bull and young bull are enjoying a snack atop of hill one morning, and the young bull shouts 'let's run down there and fuck all these heifers!' Old bull replies ' let's walk';sex
I wasn't snoring.. I was dreaming I'm a dirt bike.;snoring
What's the difference between a jew and a dollar? It's illegal to burn a dollar.;money
Did you hear about the sewer line breaking during a funeral earlier? It was a shitty mourning.;death
What is the stupidest animal in the jungle? The polar bear.;animals
Justin Bieber? Why would someone call their daughter Justin?;names
Today may be the hottest day of the year but all the other days have nicer personalities.;weather
How do you hire an elephant ? Stand it on four bricks !;job
Can someone give me a pun about death of a salesman. preferably about willy, but anything will do;death
[first day as a celebrity chef] *Just a heartrending 40 minute montage of me struggling to get the potato masher out of the cutlery drawer*;cooking
What's the difference between an alligator and a crocodile? One you see later, and the other after a while.;animals
Drinking Remember, it isn't drinking alone when you're pregnant.;Pregnancy
Marriage equality AND marijuana laws passed? Now we know what Leviticus really meant by "A man who layeth with another man must be stoned.";Marriage
Let's get this out of the way now. Next Wednesday, the date will be 12-12-12. Happy?;Date
You guys have been the worst hostages I've ever used, hands down. *everyone lowers their hands* GODDAMN IT!!;Hostage
I pick and choose the traffic laws I'll follow.;Traffic
Solid Snake is hiding in the shadows what time is it? Time for you to get a watch.;Solid Snake
Just what is it that makes Italian desserts so appealing? One cannoli guess.;Italian desserts
When stoves die... they go to hoven. I'm^so^sorry;Stove
5 and I are playing "guess the number I'm thinking of" with no limits and no clues. He's guessing sequentially from 1. Talk next week, guys!;Guessing game
So I read this book about a camping trip, It was really intents... I'll see myself out.;Camping
I bet it's crazy hard to do the YMCA dance in Chinese...;YMCA dance
I had a job circumcising elephants. The pay wasn't much, but the tips were huge!;Circumcision
Over the Internet, you can pretend to be anyone or anything. I'm amazed that so many people choose to be complete idiots.;Internet
Had sex for an hour and 30 seconds today Thankyou daylight savings;Daylight savings
What does DJ Khaled call his mexican friends? Another Juan;DJ Khaled
Based on the rate of sagging pants, it is predicted that by 2017, people will just pull their pants behind them with a rope.;Fashion
Before Twitter, I used to be stupid in the privacy of my own mind.;Twitter
My daughter has an ice skating date with her boyfriend tonight. So I'll be the guy skating behind two 12 year olds carrying a shotgun.;Parenting
*Girl opens Xmas present* "Why'd you get me carrots and lettuce?" "Wait but that means-" *Hamster at home wearing glorious diamond earrings*;Gift
If you ever Google "Gary Oldman" For fuck sakes don't forget the "r" in Gary!!!;Google
What is a childs's favourite type of Halloween candy? Lots a candy.;Halloween
How embarrassing! I tripped and fell out of my clothes.;Embarrassment
I went to a vegan restaurant once. Wait, no, that was just a florist.;Veganism
what is the hardest part to eat on a vegetable? the wheelchair.;Vegetable
As a kid, I had a real obsession with Posh Spice It cost my parents a fortune in saffron...;Spice Girls
Imagine a place where you can buy everything related to the Sith and the Dark Side It would be called the Darth Mall... ...and everything would be half off;Star Wars
If your joints pop, snap, and crack when you move your not old... Your just crispy. ;Aging
Difference between an android and an iphone. *iphone falls to the floor* Breaks screen. *android falls to the floor* Breaks floor.;Smartphones
An old man was asking God: "God, how much time do I have until I'll die?" And God answered: "Nine." "God, is that you? What do you mean? Nine months? Nine years?" "Eight, seven, six...";Mortality
God's last name isn't damn. Well technically it's "Jean God Van Damn";God
What's the difference between a chickpea and a lentil? No one's ever paid to have a lentil on their face.;legumes
Little does this young woman in the house behind mine who just closed the curtains know that it was the curtains I was looking at.;neighbors
Those Valentine's Day displays at the entrance of every store are like surprise parties for your loneliness.;Valentine's Day
I'm really bad at making at fences Oops, wrong place for this post;fences
I wonder if both Wright Brothers were behind their inventions, or it was just one & their mother yelling "Wilbur, you include your brother!";Wright Brothers
What doesn't kill you makes you stronger, except for bears, bears will kill you.;proverbs
My dog used to chase people on a bike a lot It got so bad, eventually we had to take his bike away;dogs
Whoever coined the phrase coined the phrase is a fucking asshole.;phrases
What do you call a soldier that got attacked by mustard gas and pepper spray?? A seasoned veteran;war
What was the border patrol agent's greatest regret? The Juan that got away.;immigration
Arguing with someone spoils your day and mood, increases your blood pressure and is bad for your health. Instead of arguing, Just punch them in the fucking face and be done with it.;arguments
Today at the church, the lady next to me lit a cigarette and started smoking it... I almost dropped my beer in shock.;church
Q: What is the pink stuff between  elephant's toes? A: Slow clowns.;elephants
Two unconnected vertices? That's where I draw the line.;math
One time I had a boss who called me while he was in the bathroom, and then he accidentally peed on himself, so sometimes good things happen.;work
I don't like going to the beach. I'm a playa hater.;beach
[Sick Humour] What sits in the corner of the room, crying and getting smaller and smaller? A baby combing it's hair with a vegetable peeler.;child
I'll never forgive the Nazis for how they treated my Granddad in that concentration camp during the war... Five years he was there on that machine gun tower, and never got a single promotion...;war
I've been reading an interesting book about rainbows and colors. It taught me different ways to view color. It's not all black and white;books
Today is the day I release the coyote I trained on Windows 95 back into the wild.;technology
What did one lesbian vampire say to another? See you next month.;vampire
Attack today with a positive attitude. Absolutely destroy it with good vibes. Murder its family with hope.;motivation
Have you ever had sex while camping? It's fucking in tents!;camping
6 was jealous about other kids getting notes in their lunches, so I put one in his: "Sorry, I ate your pudding. Love, Dad.";parenting
Have you ever had sex while camping? It's fucking in tents.;camping
Do flashers have dreams where they leave the house and suddenly realize they've got their pants on?;flashers
I'm not saying you're an idiot, I'm typing it.;insults
There are 10 types of people: Those who understand binary code and those who don`t.;binary code
My wife caught me cheating last night and i feel so ashamed and full of regret. She's never going to play monopoly with me again!;monopoly
I can't handle the pressure of competitions. Even in eating races I choke!;competitions
A Storm Trooper and a Red Shirt get into a fight. Storm Trooper misses every shot. Red Shirt dies anyways.;Star Wars vs Star Trek
Facebook: where English goes to die.;Facebook
Next time someone knocks on your bathroom stall say "Sorry, I'm with a client.";bathroom
I hate when I put food in the microwave and it starts making explosive noises so I check and it's still cold. Why you gotta be so childish?;microwave
Sorry I romantically ran a seagull feather across your lips.;romance
How many questions did the politician answer? 9/11;politician
What do chickens serve at birthday parties ? Coop-cakes !;birthday parties
There should be a prenatal test to find out if you're gonna have one of those kids with tiny teeth and giant gums.;pregnancy
It Looks Like a Booger But it's SNOT!;booger
What do you call a metalhead with a cold? Flemmy;Metalhead
got my blood test results back today, and it's just as i feared. my body is filled with a ton of blood.;Blood Test
Therapist: So what's the problem? Wife: He thinks he's a flamingo. Me: That's it! I'm putting my foot down. *lowers foot that was raised*;Therapy
I told my wife she should call me a champion bullrider... Because I consistently last 8 seconds riding a horned animal.;Bullriding
I may not look good naked, but I'm a beautiful person on the insi.... Hahahaha just kidding I look great naked;Self-Confidence
Turkey shot down Syrian helicopter at the border. How did they train it to do that?;War
How do you find a blind man on a nude beach? It ain't hard....;Blind Man
Remember how terrified Sarah Connor was when the Terminator came around the corner @ the hospital in T2? IMAGINE IF IT HAD BEEN STEVE HARVEY;Terminator
The Final Jeopardy category is: Movies. The answer is: 300. The correct question is: on a scale of 1 to 10, how gay was that movie?;Movie
What do you get when you cross Ebola and Tourette Syndrome?;Diseases
My favorite workout is a mix between a lunge and a crunch, I call it lunch.;Workout
A shitty geometry joke What do you call a fancy bisexual scottish cane? An anglo biscepter;Geometry
My dog has figured out I'm Chinese. He totally tried to make a run for it. Silly dog, I'm not going to eat you until I train a replacement.;Cane
I heard the comedians at Jamestown were pretty bad... The punchlines were so shitty everyone died.;Dog
If someone ever challenges you to a fight, pull your pants off and chase them crotch first. I'm currently undefeated with this method.;Comedy
My girlfriend tried to tell me an abuse joke But I beat her to the punch;abuse
Yesterday, I subscribed to Bigflix ...And now my new favorite word starts with a P and ends with O R N... That's "Popcorn"!! What were you thinking you pervert!!!;movies
.. How are you on your grind, if you're on twitter all the time?;productivity
women's rights;women's rights
- If any person believes that these 2 shouldn't be joined in holy matrimony, speak now or... - THE PRIEST ALREADY SAID THAT! - Ugh, I do.;marriage
What does a dog like to wear when it's exercising? Pants.;dogs
What goes "quick, quick"? Duck in a hurry. (c) beatattitude 2014;animals
Its cool to pee into blue toilet water and watch it turn a different color... just not when it turns purple;toilets
what do you call a guy who cries when he masturbates? a tear-jerker;men
Mexican Carpet layer. What does a Mexican put under his carpet? Underlay! Underlay!;Mexican culture
The frog was double parked... And that's why she got Toad.;parking
I can't believe after all that shit they're back together again... &gtwho? &gtmy ass cheeks.;ass cheeks
I asked my daughter's dentist for her favorite joke. Was not disappointed. What is the latest fad among teenage mermaids in the city of Atlantis? Taking shellfies with their shellphones.;Mermaids
What do you get hanging from orange trees? Sore arms.;Orange Trees
Roadside motels are a good place to stay if you haven't decided yet whether you want to kill someone or be killed.;Motels
Q: How do cats buy things? - A: From a  cat-alogue!;Cats
Why can't Helen Keller drive a car? Because she's dead.;Helen Keller
I can't stand the kids of this generation. It's always meme, meme, meme.;Kids
Before emjois i had to end texts to my girlfriends with "two girls holding hands* heart* kissy face* glass of wine* nail polish* red lips.";Emojis
What is the thing called that irrigates your lawn? A garden Jose.;Lawn Irrigation
Free Willy.....Again?!?!?! Why da phuq! Did they have to "free Willy" so many f***ing times?!?!;Free Willy
Sometimes I masturbate while driving The passengers on my bus don't like it, but the high school hasn't fired me yet...;Masturbation
What i if told you You that read wrong And that probably too;Reading
The first time I spent the night at my girlfriend's house, her father would not let us sleep together... ...which is a shame because he was very attractive.;Girlfriend's Father
Dark jokes Saturday: What is the most offensive brand name you can come up with? Winners get gold! My contribution: "Auschwitz" air freshener.;Brand Names
Pardon me while I slip into something a little more... unconscious.;Clothing
I was talking to some insects about my feet. I think they're pretty big, but mosquitos think they're bite-sized.;Insects
So the past, present, and future walk into a bar. It gets really tense.;time
Hey, Dad, did you get a haircut? No, I got them all cut. #DadJokes;haircut
[DEATH ROW] WARDEN: Last meal? CON: Just a glass of lemonade please *Drinks lemonade/Burps* WARDEN: Pardon [CON WALKS FREE];death
*smoke detector chirps* me*takes battery out* *chirp* me*cuts wires* *chirp* me*smashes it with a hammer* *chirp* wife:We have more than one;smoke detector
Raspberry buy guitar Raspberry take lessons Raspberry answer ad Raspberry show up at drummer's house Raspberry plug in Raspberry Jam;music
How does an abstract artist paint? They wipe their ass with canvas.;art
What did the fuse say when it blew out? Sorry, I couldn't resist.;electricity
What do you call a reptile that loves putting things in groups? a segreGATOR;reptile
Do you guys know the story about the broken pencil? Nevermind, it has no point.;pencil
What's the one thing Spider-man can't eat? Uncle bens rice;food
Why did the flume ride need repairs? Because it got waterlogged.;amusement park
A question related to math so Bob has 20 dollar and Tyrone takes 15 dollars away from Bob. What color is Tyrone ?;math
If I were Luke Skywalker it would have taken me about six minutes to turn R2-D2 into a bong.;Star Wars
Questionably funny "Knock Knock" "Who's there?" "Police" "Police who?" "Police open the door" Posted this in anti-jokes since it is not really funny, and was told to put it here.;police
What did the Japanese General say to his kamikaze trainee? Despite what everyone tells you, you'll never learn from your mistakes.;war
What does a plumber call screwing his wife [NSFW] Servicing the dishwasher;sex
Each time a person sneezes on an airplane, that sneeze circulates the entire airplane cabin before being filtered out by vents.;airplanes
Why do owls not mate when it's raining? Toowet Towoo;animals
I drink black coffee Because I'm not racist.;race
I work in a library and a black guy asked me if there are any coloured printers... I said, "Dude, it's 2016 you can use any printer you want.";race
A Nurse talks to her young Patient Kid: Thanks for helping me get through these tough times, will you come and see me when I get out? Nurse: I'd love to, but I am scared of visiting graveyards;death
Why do chicken coops have 2 doors? Because if they had 4 doors they would be called chicken sedans!;animals
A dyslexic agnostic stays awake at night wondering if there really is a dog.;religion
I accidently opened the fitness app and my phone immediately called to report itself stolen.;technology
People Say It's Annoying When I Talk To Myself... Stop being so hard on yourself.;psychology
*With only office supplies, she diffuses the bomb with 1 second to spare* Boss: What are you doing? Me: *shoves action figures in desk.*;office
What kind of horses only come out after dark? Nightmares!;animals
What brings the monster's babies? The  Frankenstork.;monsters
March Into Battle by Sally Forth;war
"You are what you eat." I'm about 90% burrito.;food
What is your favourite shaggy dog tale?;story
Somewhere, some Nigerian lawyer is wondering why you're not sending him the personal information that he needs to give you your inheritance;scam
I fell on my arm and had to have an operation on my funny bone. I was in stitches for two weeks.;injury
What would you rather have Parkinson's or Alzheimer's? At least with Parkinson's you have half a pint.;disease
What do you call a paedophile crustacean? A Diddler Crab;paedophile
Toddler: I don't like you. *hits* Adult: I don't like you. *tracks your movements for the rest of your life*;tracking
Why did the AC wave try to hang himself? He was sinusoidal.;math
WIFE: Please stop. ME: Stop what? WIFE: Singing in the shower. ME: What's the big deal? WIFE: You're scaring everyone at Home Depot.;music
If a movie is ever titled Reception, we know it won't be starring AT&T. Am I right? Up top!;phone
I wish there was some way to tell if someone was an idiot or not. But we can't have everything we wish for. -Send from my iphone;idiocy
If it's true that spiders are more scared of me than I am of them, why have I never seen a spider crawl away screaming like a little girl?;spider
"OK...that Trust Exercise didn't go exactly according to plan. Once we dispose of the bodies let's keep quiet about this...AS A TEAM!";trust
Things that have occurred in history since the Chicago Cubs last won a World Series... I had an ice cream cone. That I dripped all over myself.;Chicago Cubs
[in Paris] Will you have sex with me? "No monsieur." Okay, like, I don't speak French. BLINK ONCE FOR NO AND TWICE FOR YES.;Sex
How do you turn a duck into a soul singer? Put it in the microwave until it's Bill Withers.;Duck
Me: Are you still wearing pajamas? Go change. 4yo: *Goes upstairs *Comes down wearing different pair of pajamas;Pajamas
Although many forms of punctuation are thought to be antiquated, I still believe we live in a hyphen-nation. I still believe we live in a hyphen-nation.;Punctuation
What does a neckbeard call a disease or ailment? ma'lady;Neckbeard
An Apple store near where I live got robbed $25k worth of merchandise was stolen. The police said that they will get both computers back.;Apple store
What does the 'H' in Jesus 'H' Christ stand for? Haploid;Jesus
