"Joke";"Joke topic"
The hardest part of being Darth Vader is never being able to sneak up on anyone because your theme music started playing.;Parenting
I'm just a girl Hiding under a bed Hoping his wife leaves soon Again;Darth Vader
What started with a J, and ends with whore?;Infidelity
What do you get when you cross a joke with a rhetorical question?;Parenting
What can you tell a black kid to do? Go visit his family tree.;Jokes
Semi-good news for agoraphobics... A treatment is right around the corner!;Christmas
Good effort but we all know you're the ugly one in your two person profile picture.;Agoraphobia
A low pressure faucet and a penis with erectile dysfunction have a lot in common.... Both can still drain their liquids but neithers getting anything off;Frugality
My wife's leaving me for refusing to stop referring to our children as my Capri Son and Capri Daughter.;family
How do you wake up Lady Gaga? poke her face;celebrity
What do you get if you cross a skunk  and a dinosaur? A stinkasaurus!;animals
Pokemon GO servers Yeah, that's it.;gaming
today I matched speeds with a car on the highway so I could make eye contact with a dog in the backseat;driving
A roman centurion walks into a bar... He holds up two fingers and says: "Five beers, please.";history
My Grandad is always complaining about how much things cost. "Two quid for a cup of tea?!"... I said, "Well you just popped round, I didn't invite you!";family
Q: What came first the chicken or the egg? A: The rooster.;science
Q: What did the can say to the can opener? A: You make me flip my lid.;food
DATE: *sighs* You said you were a professional body builder. ME: I am! I make prosthetics. Ha ha! And funny jokes! Wait where are you going?;dating
What is ISIL's favourite dessert? Terrormisu;terrorism
Lumberjacks are good at maths because of their log rhythms Thanks, HL Math.;math
A watch dog is like a regular dog,only it can show you the time.;animals
That awkward moment when no one else is laughing, except for you and you can't stop.;awkwardness
What do you call a urinary tract infection caused in a virgin? Immaculate Infection;infection
and so, the squirrel who forgot where he buried his acorn became the squirel who planted this tall beautibful oak tree;squirrel
[end of a job interview] Interviewer: Any questions? Me: If you could become half robot, would you do it? Him: Me: Him: Which half?;job interview
Always a bridesmaid, never a new world-order leader in a post-apocalyptic all-powerful matriarchy. Sigh.;marriage
i have a heavy flow maxi pad in my wallet so it looks like i have lots of money;money
Honesty is the best policy but insanity is the best defense.;honesty
If I had a dollar for every girl that found me unattracitve... ...eventually they would find me attractive.;attraction
Joss Whedon should open his own version of a Tractor Supply store, with gardening and animal supplies ... ... he could call it Whedon Feed 'n Weed-n-feed;store
Old Twitter is what you'd get if an engineer brought New Twitter to Steve Jobs, and Steve beat on him relentlessly to simplify it.;Twitter
Why do the Scottish wear kilts? Because a sheep can hear a zipper from like a mile away.;kilt
I drink a glass of red wine a day for health benefits. The other 7 glasses are just for me.;drinking
What's the difference between a pick pocket and a peeping tom? [NSFW] A pick pocket snatches watches.;crime
A haunted house, but instead of masked creatures it's filled with everyone's mother-in-laws.;mother-in-law
Where do muslims go when they die? To the ethereal startrek convention.;muslims
The Guy who traded a hat for things of equal or greater worth... No, seriously let me know if you want to trade me something for my hat.;trade
When a cop pulls you over, pull out a map and ask them for directions until they forget that they pulled you over. -me, right now;police
Why do breasts have nipples? Because without them they would be pointless.;breasts
I read murder mystery books starting from the middle. I like the double sided suspense that builds up.;mystery books
Why don't people tell Chemistry jokes? Because they never get a reaction.;chemistry
Instead of politely knocking on the bathroom door, my kid attacks the door like a rookie DEA agent on his first raid;bathroom
[Enter your password] Secret [Password must be 6 characters] Secrete [Password disgusting but accepted];password
Scientists say that girls can get cancer just for being virgins. Luckily theres a vaccine for that.;virginity
[gets down on 1 knee] Babe will you-- "Yeah... Here it is" [she lends me her phone charger] Thanks;Love
How do they fit so many islands into such a small bottle of dressing??!!;Relationship
Sure, Aphrodite poses naked in a giant clam shell, she's a goddess. But when I do it, I'm ''drunk' and 'no longer welcome at the aquarium'.;Dressing
Irritating An irritating friend took a drink from my wife's beer and said, "Ha,Ha, this is one step from kissing your wife!" "Yes it is," I replied, "and two steps from sucking my dick.";Nudity
My family said if I don't get a Facebook, they'd all get a Twitter I sacrificed myself for all of twitter kind I'm the Jesus of social media;Beer
Finally cleaned out the fridge to make meal planning easier. Tonight, we're having buttered olives with mustard and baking soda.;Social Media
I went to a massage parlor today... When it was time for the happy ending, I finished in 20 seconds. The massause said I need to come more often.;Food
My friend asked me if I had any black in me I told him not since I got out of prison.;Massage
911, what's your emergency? What do you mean you've been stabbed? People can't do that, that's illegal.;Prison
Bee population worldwide is exploding. What a time to be a hive.;Emergency
I don't like telling fat jokes They weigh too much on my conscience;Bee
Losing my virginity was a lot like my first football game Hurt, bloody, but at least my dad came.;Fat
If at first you don't succeed, fuck it. What's on TV?;Virginity
Sorry people with seeing eye dogs that say 'No petting'. What you can't see won't hurt you.;Success
What is Will Smith's favorite type of forensic evidence? Fresh prints.;forensic evidence
"I find it funny when my husband brags about how big his penis is.... .....Mine was way bigger";penis size
Why would Target be the worst store to run the Enterprise? Because they all wear red shirts;Star Trek
My favorite mythical creature? The honest politician.;politics
Why doesn't china have casinos? Because they hate Tibet.;China
INSTAGRAM IS DOWN. I REPEAT. INSTAGRAM IS DOWN. HOLD THE DUCKFACES. HOLD THE MEALS. HOLD EVERYTHING.;Instagram
My gay friend told me this joke... But he couldn't keep a straight face;gay people
Let's try something different: How about anonymous white people arguing with one another viciously on the internet? Has that been tried yet?;internet arguments
What did the black boy say when he had diarrhea? I'm melting!;racism
Door says push.. I pull.. If it says pull I push.. I'm ether a hardcore Rebel or I need glasses...;rebellion
i have to wake up at 3 am tomorrow to go to the airport i've honestly never felt more attacked and victimized than i do now;sleep
I've never approached even 10% of Aerosmith's level of excitement that a dude looks like a lady.;Aerosmith
Man next to to me just said into his phone "You caught me in the middle of a sandwich." He's lying. He is not in a sandwich.;lying
How many rats does it take to screw in a lightbulb? Two, but you have to get them in the lightbulb first.;rats
Two Tomatos A father tomato and son tomato were walking down the street. The son was falling behind so the father turned around and **STOMPED** on his son. "**KETCHUP!**";Tomato
GOD: welcome to Heaven I will answer any question you want now. ME: why does Target have 25 checkout lanes with only 2 always open? GOD: ...;Heaven
What did Joey Ramone say to the prostitute? Hi ho, lets go.;Prostitute
In 2009, it cost approximately 53,000 dollars to fly a troop to Iraq, and nearly double that to fly them back. Probably because of all the extra baggage.;Iraq
Why do witches go commando when riding around on their brooms? Better grip. Happy Halloween :);Witches
I made my money the old-fashioned way... I used a printing press;Money
I recently bought a copy of Monty Python's Big Red Book, but was later dismayed to find that I'd purchased the Spanish language version... Nobody expects the Spanish text edition.;Book
The only thing that would prevent my wife from going to Pilates class would be if they invented a more expensive form of exercise.;Pilates
Why should you never rendezvous with a pack of wolves? Because they are *meet eaters!*;Wolves
The perfect Irish bean stew (In an Irish accent) Why does d' perfect Irish stew require exactly two hundred n' terty nine beans? Because if you added one more it'd be two farty.;Irish Stew
Why did the marijuana addict always turn his supply packet around when buying it? He heard the grass is greener on the other side;Marijuana
What do scientists say when they meet each other? Hydrogen Iodide;Scientists
What do farmers say when something is important to them? It plays a big tractor.;Farmers
Saw an ad for a used battery in the paper today: "Slightly rusty, in need of repair but has potential";Battery
My name is jafar, I came from afar, I got a bomb in my car, Allah Uakbar;terrorism
Unemployed teachers ..... Have no class;employment
Every atom in your body is born in a star, traveled millions of light years, & through an amazing process became you. & you watch Teen Mom.;existence
Why do they call them "S'mores"? Because you always want another one!;food
How do these people survive;survival
[traffic jam] MAN: [rolls down window] Dude, why? ME: [in the next car holding a rabbit as it repeatedly kicks the horn] It's his birthday;traffic
A man is applying for the LAPD and the inspector says: "Got you! You thought this was going to be a repost!";job application
My Friendster account was hacked. Now I'm being extorted for all those testimonials I wrote. Said no one ever.;social media
If you think you're having a bad day, the lady who took my order in the drive-thru asked me if my order was to go.;daily struggles
What's even more impressive than a talking dog ? A spelling bee!;intelligence
My friend was bleeding, and the first aid book told me to apply pressure. So I told him if he didn't stop bleeding right away, he'd die.;biology
Motion to rename biological clock "restless egg syndrome.";prostitution
What's the difference between a Chickpea and a Lentil? I wouldn't pay 200 to have a lentil on my face;Education
It's not really fair that little kids can talk and dogs can't. I bet dogs have way cooler stories and they don't ask as many dumb questions.;Food
Have you heard about the new car from Israel? Not only does it stop on the dime, but it picks it up too!;Pets
im a normal guy.. i put on my pants on the exact same normal amount of leg way you do. i kno that number. im a nomal guy;Cars
Why is everyone bragging about how great it is to have kids? I slept till noon today, and the only person who threw up last night was me.;Clothing
I would tell a joke about fat people, But they have enough on their plate as it is.;Parenting
Have you heard about the goodweather witch?  She's forecasting sunny spells.;Body Image
What's the difference between 9/11 and a hand job? 9/11 was an inside job;Weather
Did you hear the one about the German sausage? It was the wurst!;Terrorism
What does the nationalist sing at Christmas? Jingo Bells.;Food
If I promise to miss you, will you go away?;Nationalism
'Your place or mine?' Is the sexiest response to the question: 'Where shall we bury the body?';Relationships
"I heard low winter sun is pretty good." - low winter sun from behind a bush trying to throw it's voice;Crime
Whats the fastest way into a woman's heart? A pick-axe;Deception
What happens if you cross a parrot with a Gorilla? Nobody is sure but if it opened its mouth to speak you'd  listen!;werewolf
Terrorist Jokes. They'll make you explode with laughter.;parrot
Sometimes, to impress girls, I use big words that I don't fully understand... ...in an effort to sound more photosynthesis.;terrorism
Fire engines are painted red for camouflage, so they can sneak up on fires without being noticed;impressing women
Why can't a bicycle stand on its own? It's two tired.;fire engines
"Hey baby ditch the zero *stares silently until lenses transition into sunglasses* and get with the hero.";bicycle
What happened to the Greek dairy farmer who got robbed on his way to market? He was un-feta-ed of his cheese.;train
What borders stupidity? Canada and Mexico.;Greek dairy
Divorce lawyers all over the world are rubbing their hands together in glee now that Twitter DM has a picture function.;geography
Marilyn Monroe died & was reincarnated into thousands of white girls who can't be handled at their worst, and aren't deserved at their best.;divorce
If I said I was the king of the jungle, I'd be lion to you.;temperature
If they make a new Contra game with the original one as a minigame inside it... Will it be a contraception?;jungle
I hate it when guys use pickup lines like, 'Hey, what's your friend's name?' on me. Worst pickup line ever.;abs
Did you hear about the dyslexic pimp? He opened a warehouse.;pickup lines
Some grade school humor What's brown and sticky? * ** *** **** *** ** * A Stick!!;dyslexic pimp
Why do most men like women with big boobs and tight pussies? Because most men have big mouths and small cocks.;stick
I lost 130 pounds of useless fat! Divorce is great!;sex
I'm calling it now: I'm going to discover the cure for blindness and make billions of dollars someday. You'll all see.;divorce
Whats the Diffrence Between Hitler and Usain Bolt? One can acctualy finish a race;blindness
The human soul weighs 1.2lbs. I know because I've weighed myself before and after I walk into my job.;Hitler and Usain Bolt
Excuse me sir, where do you keep the "Whoomp"? Oh, there it is.;job
what do you call a bookstore that's also a bar? tequila mockingbird;music
Did you know: if you put your ear upon a stranger's leg... ...you can hear them saying "WHAT THE FUCK ARE YOU DOING?";bookstore
My girlfriend. ..probably tells me a lot that I don't listen to her.;stranger
I used to work as a waiter at an insane asylum... Serving soup to nuts.;girlfriend
You can lead a horse to water and if he walks on it congratulations you found horse jesus.;horse
Today my dad died in a scuba accident It was a very depressing situation;death
What did Dj Khaled say to the barn owl? You talonted;music
"Darling, your teeth are like stars." "So yellow and so far apart...";teeth
Who cares if toilet paper is soft or not? Only an asshole can tell the difference anyway.;toilet paper
The difference between snowmen and snowwomen. Snowballs.;snow
What do you call it when you get an erection at a funeral? Mourning wood;funeral
What do you call a small bull? A MINI-TAUR!;bull
How do you know when an accountant's on holidays? He doesn't wear a tie to work and comes in after 8.30.;accountant
There is a mathematical theory for good sex The heat of the meat is directly proportional to angle of the dangle given that the mass of the ass is constant.;sex
When is the best time to go to the dentist? Tooth-hurty;dentist
In my spare time I help blind children. I mean the verb, not the adjective.;charity
You breed dogs? Don't they do that on their own?;dogs
My New Yahoo Password NoSecur!Ty;autopsy
No thanks, Trix cereal. I have enough drama in my life without a rabbit trying to steal my breakfast.;password
Why is buying a macbook like using a high end prostitute? Because you spend more but, at least you don't get a virus;cereal
What does a monk say when you evict him? Namaste;musician
BREAKING NEWS: Scientists have discovered what may be the worlds largest bed sheet. More on that as it unfolds.;monk
I'm so sick of seeing so many lazy abortion jokes on here Like can we just cut it out already?;bed sheet
I often wish that gravity was a more selective force regarding who it kept on this planet.;abortion
If Santa knows who's being bad, maybe he could have given us a heads-up during the early planning stages of the Holocaust.;gravity
We built this community from the ground up as opposed to choosing a point in the air and building downwards from there.;Santa
How many husbands have I had? You mean apart from my own?;community
If anyone finds 786 barely used tubes of Chapstick around my city, they're mine. I need them all back.;TV
What goes "ha ha, thump thump?" A guy laughing his balls off.;balls
How many SCPs does it take to screw in a lightbulb? [DATA EXPUNGED];lightbulb
Did you hear about that boxer who adopted a child from Asia? It's Mike's Thai Son.;adoption
Why do people ask "what the hell were you thinking"? Obviously, I was thinking I was gonna get away with it and not have to explain it;thinking
Fish must be excellent drivers. Very rarely do you hear about fish getting into car accidents.;driving
A man walks into a fancy dress party in calvin klein briefs... The host asks him 'what are you dressed as?' Premature ejaculation. I just came in my pants.;party
What happens in a chinese restaurant when the power goes out? It'll dim sum;restaurant
How do deer get revenge? By giving each other a taste of their own venison;revenge
Selling Darwinian birds: 5 for $5 Buck finches get money.;birds
"I don't have to outrun the bear! Just you!" Wrong. Bears are so sick of that joke, they skip the slow guy and eat the fast guy now.;bear
Two programmers walk into a bar: a blond, a brunette and a red head.;programmers
What Daft Punk song is a hit amongst the hispanic community? Juan more time!;song
Why hasn't the Rastafarian gone to see the barber? He's dreading it.;barber
If you guys need me I'll be strutting confidently through a parking lot toward a car that turns out not to be mine.;parking
What is the name of one of the Chinese gymnasts competing at the Rio Olympics? Wai Tu Yung;disabled
My friend always wants to talk about the scientific principle of buoyancy. It's not interesting to me, but hey, whatever floats your boat.;Chinese gymnast
What has four wheels and flys? A garbage truck.;buoyancy
What car does a Mexican drive? A Quebrolet.;garbage truck
I didn't do it, nobody saw me do it, you can't prove anything.;Mexican car
My local post office uses four checkouts unless it's really busy then they use one.;crime
What is a Canadian vampire's favourite drink? Type Eh.;post office
Please don't feed the Kardashians.;Canadian vampire
Me: "OMG, my abs are so sore!" 12: (sarcastically) "What abs?" Me: "The abs hiding under this protective layer of you're grounded.";Kardashians
Apparently, "No kidding!" isn't a good response when your boss says he's confused.;abs
What did the guy with leprosy say to the prostitute? Keep the tip;work
Why didn't Sally become a prostitute to pay her bills? Because it was Plan B.;leprosy
Why do teenage girls travel in odd numbered groups? Because they can't even.;prostitution
Why should you always knock on your fridge door before opening it? Because there could be an Italian dressing inside.;teenage girls
I got into a fight with a baseball player. It wasn't too bad. All I did was strike him three times and he was knocked out.;marriage
I'm going to read braille to the deaf... For the ASL competition.;fight
[NSFW] what did the leper say to the hooker? Keep the tip;reading
What is simultaneously the best and sh*ttiest way to start your day? Pooping;prostitution
Today, I saw that my ironing board cover was wrinkled.I laughed at the irony.Then I laughed again because irony has the word iron in it.;pooping
No wonder ghosts can be disruptive. Some are hundreds of years old and they have to hear us say shit like "My mouse is out of batteries.";ironing
In my experience, less than 40% of people wearing "Duke" sweatshirts are actual dukes.;ghosts
What did the leper say to the prostitute? (NSFW) You can keep the tip...;education
My friend got a tattoo of his wife's name so I guess he loves her as much as he loves barbed wire.;prostitution
Roses are red, Violets are blue I have Alzheimer's To get to the other side;love
5 minutes into watching willy wonka and the chocolate factory and I'm craving chocolate This is why I can't watch breaking bad;memory
if the sun is such a cool and great star then why do all the other stars leave when it shows up;movies
us teens are tired of being murdered all the time in movies. why not make the next murder victim a chimp in a suit or a plant;stars
I was at my friend's house the other day and saw his dog licking its balls. "Oh, I wish I could do that" I said, my friend then replied back "Give him a biscuit and he might let you";movies
Whenever my neighbor looks like they want to speak to me. I collapse to the ground motionless as if I were one of Andy's toys.;romantic comedies
Why did? Why did the house cross the road, One of the most difficult to solve cross the road jokes, I'll give the answer when you all give.;neighbors
What do pedophiles and rappers have incommon They both like da booty;cross the road jokes
Thanks for wishing me a Happy Monday, you've changed my entire outlook. I don't hate Monday anymore. I hate you. Happy New Sworn Enemy.;Lord of the Rings
I was thinking about donating some money to my local hospital... But then I realized they'd probably just spend it on drugs.;Mondays
How do you get 300 babies in a bowl? Blender. How do you get them out? Tortilla chips;donating to hospitals
Just dropped my iPhone in the bath tub. I think it's syncing.;babies
If my grandmother was on Twitter, I bet most of her tweets would be about raisins.;iPhones
Who does Batman call when he needs to cool down his expensive drinks? The Just-Ice League.;grandmothers
Scary Story Told In Only Five Words Your browser history is public!;Batman
Not a mean plane joke. Wouldnt want to make a joke about the air asia flight as it would be plane wrong and offensive.;browser history
What do you call Dora the Explorer in an Iron Man suit? FeDora I'll see myself out.;plane jokes
How do you embarrass an archaeologist? Give him a used tampon and ask which period it came from.;Dora the Explorer
Why does Manny Pacquiao hate Spring so much? Because of May weather.;Spring
What's better than two roses on your paino? Tulips on your organ.;Music
Teacher: Does anyone have questions? Me: If Wile E. Coyote had enough money to buy ACME stuff, why didn't he just buy dinner? T: Holy Shit;Education
20 years ago we had Johnny Cash, Bob Hope and Steve Jobs. Now we have no Cash, no Hope and no Jobs. Please don't let Kevin Bacon die.;Celebrity
Why doesn't Ganondorf like going on the internet? There are too many Links.;Gaming
the sign at this subway bathroom says employees must wash hands. ive been waiting for them to come wash my hands for an hour. nothing.;Hygiene
I always feel better when my doctor says something is normal for my age but then think dying will also be normal for my age at some point.;Aging
Q: What's the best sport to learn when you are moving? A: Boxing;Sports
What did the cannibal do After he dumped his girlfriend Wipe his arse;Relationship
What did the moderate muslim say to the radical muslim? Hello friend!;Religion
"on your left u see fred in camo, on your right is bertha, she has ridden many miles on that electric cart." If walmart had tour guides.;Shopping
Did you get a haircut? No. I got all of them cut.;Appearance
Having a dirty mind makes ordinary conversations much more interesting.;Conversation
Why bachelors are skinner than married men A bachelor goes into the kitchen, opens the fridge, sighs, goes to bed. A married man goes into the bedroom, lifts the blanket, sighs, goes to the fridge.;animals
What do the bathroom doors at the funeral home say? His and Hearse.;marriage
Dear naps, I'm sorry I was a jerk to you in kindergarten;death
I can never decide whether to slam on my breaks or go through a yellow light, so I do an annoying combination.;childhood
What does a mother use to keep her childrens' toenails soft and smooth? A pedi-file;driving
Did you hear the joke about the sewing machine? It'll leave you in stitches!;parenting
How do you unload a truck load of puppies? With a pitchfork;sewing
Did you hear about the magic tractor? Turned into a field.;animals
Me: No, you hang up first Pizza Hut: *click*;magic
Is "humpty dumpty" another way of saying "fuck and forget"?;customer service
Why do scuba divers falls backwards off of the boat? Because if they fell forward, they'd still be in the boat.;literature
I haven't slept for 10 days.... ...because that would be too long. - Mitch Hedberg;diving
What's the hardest part to eat on a vegetable? The wheelchair;sleep
Two hefty guys are drinking in the pub, one says "Your round.";vegetables
What kind of animal lives in a triangle Hippotenuse;Argument
What do outlaws eat with their milk? Crookies.;Animal
If people on Twitter found a horses' head in their bed at least 3/4 of them would get a selfie with it before calling the cops.....;Food
Why do southern girls get pregnant so much more than northern girls? Because it takes them so much longer to say "Kaaa-WIT!";Twitter
There would be no evil in the word..... if Satan had life alert.;Golf
Sometimes I answer your rhetorical questions because I think you are that stupid.;Satan
I work in the meat department and a customer asks me what is the difference between the Halal chicken and the regular chicken. I said "Regular chicken lays eggs. Halal chicken lays hand grenades.";Rhetorical questions
What kind of music does a factory worker listen to? Industrial Metal;Meat department
How do you pick up a fat chick? Piece of cake.;Music
look to the left... look to the right... that's how every black joke starts...;Roadkill
Did you hear about the new anti-depressant for lesbians? It's called tricoxagain.;Black joke
A guy comes into a bar. No wait.. it was a horse. So, a guy comes into a horse...;bar
