"Joke";"Joke topic"
I beat my chess opponent in less than five moves with a baseball bat.;Chess
Live each day like it's my last? Terrible advice. Do you really want to encourage me to eat my weight in cereal?;Life
A Jewish boy asks his father if he can borrow $50 The father replies, "$40 dollars?! What do you need $30 dollars for??";Money
What do you call a cow who is also a knight? Sir Loin.;Knights
If you're heartbroken, remember: There are plenty of fish in the sea. But I'd advise giving mankind another chance first.;Heartbreak
I wish I was Jesus so instead of listening to the same Christmas songs every day if the office, I could be dead.;Jesus
What do you call a policewoman who hasn't shaved for a week? Constable;Police
Why was the bicycle laying on the ground? Because it was two-tired;bicycle
What's brown and rhymes with 'snoop?' Dr. Dre;music
Friends are like snow when you pee on them, they disappear.;friendship
Knights and dragons must have been the first rappers. After all, dragons spit fire, and knights slay.;rap
I always find New Year's Eve stressful. I've been diagnosed with old langxiety.;New Year's Eve
Facebookers reacting to it snowing is very similar to a caveman reacting to seeing fire for the first time.;Facebook
Caught my son running a Google search for "adult entertainment". I was mortified. We are strictly a Bing family.;Google
What's the hardest thing about Rollerblading? Telling your dad you're gay.;Rollerblading
How do you ruin a date with Princess Leia? By saying Alderaan things.;Princess Leia
You know why those automatic sensor sinks save water? Because none of them fucking work;sensor sinks
250 dogs escaped from the SPCA Police are following a number of leads.;dogs
The worst time to have a heart attack is during a game of charades.;charades
My wife's sister My sister-in-law sat on my glasses and broke them. It was my own fault. I should have taken them off.;family
I have a horse named mayo... Mayo neighs.;horse
What was the first thing Hitler bought from the beauty shop? Polish remover;Hitler
Did you hear about the guy who had writers block? He stopped writing and it was;Writer
Why do hockey players wear so many pads? Because they have 3 periods every game!;Hockey
What's the word that starts with an "N" that no one wants to call a black person? Neighbor.;Racism
Italian Spies Why do Italians make good spies? Because they're masters of "DEESE GUYS!";Italian
Does shaking the vending machine count as working out?;Exercise
What's the difference between a Jew and a boy scout? Boy scout comes back from camp!;Jew
So I was in a race against a Prius the other day. I kept up for the first 100ft but I can only walk so fast...;Prius
Hate when you wake up & think it's the weekend but then realise death is inevitable eternal emptiness;Weekend
Hitler couldn't have been that bad of a guy.. After all, he did kill Hitler;Hitler
Q: What does pizza delivery man and a gynecologist have in common? A: Both can smell it but can't eat it.;Gynecologist
What does the herpetologist do when the sexual reproduction experiment is over? Turns off his monitor.;Herpetologist
Why did the python return his pants? They were too constricting.;Python
A clearly exhausted Pao walks into a pub and orders a drink.... The bartender asks "long day?" "No, all days are 24 hours long" Pao replies, amazed at how uneducated the bartender is.;Time
Did you hear about the fire at the bakery? No one was hurt but business is toast.;bakery
If you say "guess who died?" with a big smile on your face some people get kinda angry.;death
Heard of a joke that made people hate me. It's called the game.;game
Stephen Hawking says artificial intelligence could destroy the human race. Sorry Stephen, but my money's on LACK of intelligence.;intelligence
What fruit had to have an announced wedding at home? Cantaloupe;fruit
Hendrik Lorentz walks into a bar... He sits down at the counter. The bartender asks "Why the long face?" Lorentz replies "What do you expect? I'm barely moving";physics
Bloody Mary used to be Virgin Mary.;religion
Why did they have to cancel the volleyball games in the special olympics? It wasn't going over too well.;olympics
Days after a massive F5 tornado hits Mississippi.. ...financial experts estimate it did over 50 million dollars worth of good.;economy
Did you know... ...95% of Chinese have Cataracts and the other 5% drive Rincolns.;China
What do you call a potato from Colorado? A baked potato;potato
"It's not the size of the boat, it's the motion of the ocean." But it takes much longer to get to England on a rowboat.;sex
Hey, the 1700's called, they said please invent telephones.;technology
I had loads of bird seed as well as loads of parrots with headaches. Trying to hold onto all the bird seed but the parrots ate 'em all;parrots
What do you call a man chasing a car? -Exhausted What do you call a man being chased by a car? -Tired;cars
What do you call people who don't repost jokes? liars;reposting
If I could have any superpower, I would pick China.;superpower
I once threw a boomerang, not knowing what it was for... Then it hit me.;boomerang
Crayola is now doing its color testing on manatees and peta is pissed. Oh The Hue Manatee!;crayola
How can you identify a French Infantryman? Sunburned armpits.;nationality
I want to be a pilot, but mostly so I'd have an excuse to tell passengers, "Where we're going, we don't need roads.";career
Summer Safety Tip: Before swimming in the ocean, cover yourself in gluten to lower the chances of being eaten by health conscious sharks.;sharks
Have you guys heard of the Ed Zachary disease? if you get the disease you'll look Ed Zachary like him!;celebrity
If your wife wants to learn to drive, don't stand in her way.;marriage
The Boy in the Striped Pajamas is the only movie I've ever cried to... I laughed so hard I cried;movies
Did you hear about the two men who were  cremated at the same time? It was a dead heat.;cremation
How many black people does it take to start a riot? -1;Riot
Monkey Jokes are alway funny Two monkeys in a bath, The first Monkey says O OOH OOK OOH OOK OOH OOK OOH AHHHHH AHH AHH AHH AHHH. The second Monkey says well put some bloody cold water in then...;Monkeys
One burrito looks at another burrito and says, "you wanna fight?" The second burrito says, "nah". The first burrito says, "What are you, chicken?";Burritos
The Theory of Relativity: Time moves more slowly when you are with your relatives.;Relatives
What do you call a man with potatoes in their ears? Anything you want, He can't hear you!;Potatoes
Reward: Lost Dog What kind of a reward is a lost dog?;Dogs
What do a trickster and a multiplicative inverse function have in common? They both want to pull 1 over on you.;Math
Are the Polish for or against abductions? Maybe I should take a poll;Poland
I don't always tell dad jokes But when I do, he laughs.;Dad Jokes
Cop:alright now repeat after me Me:repeat after me C:no not yet M:no not yet C:stop M:stop C:put your hands in the air M:put your h..;Police
The best part about Facebook is never having to wonder what your acquaintance's baby is doing all day everyday day.;Facebook
How come Apple-products have so small transistors? Children have very small hands;Apple
[Picking up girls] Me: you like bad boys, huh? Girls: yea Me to my wing man: tell them Wing man: he's just literally the worst;Pickup Lines
What happened to the muslim who smoked weed? They got stoned;muslim
My talking dog gave me a stick the other day and told me he found it 600 miles away. That's a bit far-fetched.;dog
What do you call someone with no body and no nose? Nobody Nose;person
Around here we commonly refer to our intellectual property as 'our shit'.;property
If your Uncle Jack was stuck on the horse... Would you help your uncle jack off the horse?;horse
Dad, I don't wanna sleep with my little brother anymore! - I know, son, but I already told you that we don't have enough money to bury him.;brother
Q: Why is a room full of married people empty? A: There isn't a single person in it.;marriage
I got a new car for my wife! It was a great trade!;car
why are black people so good at basketball because they can shoot steal and run!;basketball
I just spent fifteen minutes wondering how mermaids poop in case anyone out there is looking for a best friend or arch nemesis or something.;mermaids
I'm so hungry I could eat a hor *horse walks by snorting aggressively* ticulturalist *horticulturalist pops up trimming hedge aggressively*;food
Ha Long is many Dongs;place
Why was the lettuce scared of the salad? Cos.;lettuce
What's the worst thing about 1 ply toilet paper? It's already shitty before you use it.;toilet paper
I smell sex and candy. I hate being Willy Wonka's roomate.;Willy Wonka
Watching commercials about retirement homes makes my boner reach for the stars.;Retirement homes
How do you pick Dolly Parton's Kids out of a crowd? They're the ones with stretch marks around their lips.;Dolly Parton
Sent him a pic and he replied "BOOM!!" Trying to figure out if that means he liked it or he threw himself on a grenade.;Sending pictures
"Dad, lil bro pooped on the floor!"nMe: Ok, just like we practiced. I'll hide in garage, you go tell Mommy. This convo never happened! GO!;Parenting
I was recently asked to be a part of a biological experiment. The researchers said they would mutate me with an extra chromosome and give me $10 000 for it. I'm down.;Biological experiment
Why did Moe finally decide to kill of Homer Simpson's son? he realized he was a Bartender;Homer Simpson
Two strangers are introduced "you have such a lovely name" "thanks, I got it for my birthday";Names
I think my intelligence is beyond of an average human I just finished a jigsaw puzzle in 6 months, and at the back of the box it says 2-4 years;Intelligence
What do you call a man with a colander on his head? COLIN! Duh!!!;Colin
What do you call a one-eyed sailor? Pop-eye the sailor man!;Sailor
who lives in a pineapple in the back of the white van Spongebob, go meet him kids he has free candy, go and look;Spongebob
I ate an optimist once.. but I couldn't keep him down!;Optimist
Q: Why did the Italian boy want to grow a mustache? A: So he could look like his mama.;Italian boy
How to fall down stairs * Step 1 * Step 2 * Step 4 * Step 15;stairs
I am used but in good condition.;condition
your mom is so stupid... She put gum up her ass so she can pop shit. A very old joke that for some reason makes me giggle every time...;mom
What is the average temperature of a Tonton? Lukewarm;Tonton
Pedophile Jokes? I got 3: If they can cross the street they can take the meat. If they can pee they're old enough for me. I'm like a game boy, kids turn me on. You guys got any others?;pedophile
When black guys say "ya feel me?", I literally feel them so they know exactly what level of white I'm operating at.;black guys
I don't know why everyone is mad at Subway jared He's just a fat man in a little girls body;Subway Jared
T H E K I _ _ _ P P E R Taking a DNA sample from the kidnapper.;kidnapper
Back in my day we didn't have leaderboards or RTs. We just tweeted for fun. Uphill both ways. In the snow.;Twitter
Little Girl: mom, I want to be an alligator when I grow up Mom: well, pick one. You can't be...acghhghh! Stop eating me! Aghhghhh...ah..a...bleh.;alligator
I like my tautologies like I like my tautologies.;tautologies
If your drug dealer is on time, it's a cop.;drug dealer
So if something's not "unique" then it's just "ique," right?;unique
Mirror salesman... Now there is a job I could see myself doing.;mirror salesman
Inspirational tweet: There's always a light at the end of the tunnel. I hope yours is a freight train.;Optimism
How do you find a blind man at a nudist beach? It's not hard;Blindness
Did you hear about the midget psychic who escaped prison? He was a small medium at large.;Escape
What is the friendliest kind of aircraft? A Hello-copter.;Aircraft
You could give me 67 years to do something and I wouldn't do it until the night before.;Procrastination
People in cars cause accidents. Accidents in cars cause people.;Accidents
Please make sure my tombstone reads: wish you were here.;Death
How do you make a plumber cry? Kill his whole family;Plumber
Why is Jupiter both the favourite and most hated planet for Jews? Favourite because **Jew**piter is the biggest planet in the solar system Hated because it's a gas planet;Jupiter
If I wrote an autobiography I bet it wouldn't sell Story of my life..;Autobiography
To the middle-aged guy in front of me at the bookstore buying several martial arts books: Is that even legal with your lack of ponytail?;Martial Arts
The guy in front of me in line to get coffee was loudly complaining that he "needed his fix" and then ordered a soy iced mocha latte;Coffee
*passenger next to me starts putting on headphones* Are you mad at me?;headphones
Do people who swirl and sniff their wine in the glass know that it tastes just the same straight from the bottle? Amateurs.;wine
What do you call a depressed dog swimming in a pool? A watermeloncollie.;dog
Why didn't the other viruses hang out with The Common Cold? Because he is a bad influenza;viruses
Have you ever had sex whilst camping? ...It's fuckin' in*tents*!!!;camping
What do you call a blind trig function? Se-cant.;math
My 11 year old made this up. Why did the pirate need a hooker? Because he lost his hand.;pirate
What did one snowman say to the other snowman? 'Do you smell carrots?';snowman
So Einstein finally finished that theory about space he's been working on. It's about time too, right?;Einstein
I just hope this Justin Bieber thing doesn't make all yellow Lamborghini owners look bad.;Lamborghini
Should English be the only official language of the EU? No.;language
Survival of the Fittest Women in the New Zealand wilderness survives by drinking her own breast milk. Your turn Bear Grylls;survival
Poodles are just angry clouds with legs.;poodles
Why did the walrus go to the Tupperware store? He was looking for a tight seal.;walrus
I asked my co-worker if she liked Adele.. Co-worker: No, I haven't listened to any of her music actually. Me: Oh! Then you must be rolling in the deep!;Adele
When I'm at a business dinner I pretend like I'm choking so I can chug my wine.;business dinner
What's Jared Fogle's favorite weather? El nino.;Jared Fogle
Why do people put orange clothes on their kids at pumpkin patches? I almost picked a fat one up until it screamed.;pumpkin patches
What do you call a Mackem thief who travels around on horseback? A Ha'wayman.;thief
An ideal homework excuse Teacher: Where is your homework? Pupil: I didn't do it because I didn't want to add to your already heavy workload.;homework
Some mathematicians are on the negative side, While others are quite positive.;mathematicians
A sloth was robbed by 2 turtles Sloth robbed by 2 turtles. Cop asks if he could describe the assailants. Sloth replies, "It all happened so fast.";sloth
Why can't you run in a camp ground? You can only 'ran' it's past tents.;camp ground
A grasshopper walks into a bar . . . A grasshopper walks into a bar. Bartender: Ya know, we have a drink named after you! Grasshopper: You have a drink named Steve?;grasshopper
Guy goes to the doctor and says, " I cnat siht!" The doctor says, "Clearly, you are having problems with vowel movements.";doctor
I went to see a theatrical piece about puns last night it was a play on words;Puns
People on Facebook "Like" everything but grammar.;Facebook
Pro tip: When quickly pulling into your garage to avoid your neighbor be sure your garage door is all the way up.;Garage
How do you tell if somebody doesn't have a smartphone? Just wait, they'll tell you.;Smartphone
I was writing a paper on my grandfather... But had to stop because he was moving so much.;Grandfather
I used to have a bird called "Stockholm syndrome" who lived on my shoulder. I used to hate the bastard, but in the end, he grew on me.;Bird
What do you call a fight in Mexico? A Juan on Juan.;Mexico
A man on an airplane was having a heart attack The stewardess asked if anyone on board was a doctor. A man replies, "I'm a vegan!";Airplane
Hey, have you heard about the new Micheal Bay film? I've heard the lead role goes to explosions.;Film
I would talk about computer science... But it makes my mother board;Computer Science
Some people have 32 teeth while others have 10... It's simple meth.;Teeth
I fan speak a little French I'd like to bon appetit (bone a petite) Edit: can not fan;French
Why are the people with the most annoying laughs the ones that find everything hysterical?;Laughter
What's long, green and smells like pork? "Kermit the frogs fingers";Pork
She says she only drinks wine to collect corks for her Pinterest project, which is pretty cool cause it looks like she's building a castle.;Wine
Why was the cannibal expelled from school?  Because he kept buttering up the teacher.;Cannibal
So a guy is eating a steak dinner at a restaurant... ...when the waitress comes over and asked the man "How did you find the steak, sir?" The man looks at her and says "I just moved the potatoes.";Steak
How does a butcher introduce his wife? Meat patty!;Butcher
What do you call 500 dead lawyers chained together at the bottom of the ocean? A good start;Lawyers
Q: How many Leos does it take to change a lightbulb? A: None: Leos are so enthusiastic they carry their own light.;Leos
Did you hear that the BBC have sacked Bob the Builder? They feel they can no longer trust a children's TV star who claims to be able to 'fix it';Bob the Builder
Once upon a time there was a man. Today there are many **EDIT** Grandad joke. Rest his soul;Grandad
I sent off half a score of jokes into a competition to increase my chances to win.. Unfortunately no pun in ten did.;Competition
Why did the condom fly across the room? It was pissed off;Condom
I am a dyslexic AMA fighter, MMA;Dyslexia
New dad as of today, so here is my first dad joke. What do you call it when you accidentally butcher your heifer instead of your steer? A Ms. Steak.;Parenting
The bus carrying the Chinese tourists crashed. It hit a language barrier.;Language
Teacher: Can anyone tell me how many seconds there are in a year ? Pupil: 12 - 2nd January 2nd February...!;Education
What kind of stretches does a pencil do? Ticondeyoga;Yoga
Where could you look up Joan of Arc's profile? On Tinder.;Dating
Why did the fish not get accepted into college? His grades were below sea level;Education
Woke up last night and the ghost of Gloria Gaynor was standing over my bed. At first I was afraid, i was petrified.;Music
A fat racist and a skinny racist jump off a cliff. Who wins? Society;Racism
When it gets cold in Ireland, we all sit round a candle. And when it gets REALLY cold, we light it.;Weather
how many tourette sufferers does it twat to caun a light bollocks?;Tourette's
If life hands you lemons, ask it why it has hands.;Philosophy
Two Flies Are Sitting On a Piece of S#!t... ...the first fly farts. The other gives him a disgusted look and says, "Come on man! I'm Eatin' Here!" Boom.;Toilet humor
What did the dyslexic person worship? Santa.;Christmas
Why did the Bear dissolve in water? He was polar;Chemistry
Why did kurt pull the trigger? He couldn't get hole out of his head;Music
I just had my first prostate examination Worst dentist ever.;Medical
Whats brown and comes out of Cowes backwards? The Isle of Wight ferry.;Geography
What do you call the person who revised Hitler's speeches? Grammar Nazi;History
Interviewer: Is it true you are the first duck to be made a duke? Duck: Please address me as 'M'llard';Royalty
Whats The Difference Between a Hobo On a Unicycle And a Man In a Suit On a Bike? Attire.;Social Status
What's worse than finding out that your wife has cancer? Finding out it's curable.;Marriage
Most of the 1990s was spent staring at a cool light display on an Aiwa stereo.;Technology
Is it I 'ran' through the campground? Or...I 'run' through the campground? Oh right, I ran, because its past tents.;Grammar
TIL ninjas only have sex in the dark... That way you can't see them coming.;Ninjas
Do you want to hear a really condescending joke? ... Do you even know what that means?;Language
Q. What is the best way to get to Paradise? A. Turn right and go straight.;Directions
I mean, really though, who hasn't seen a UFO at this point?;UFO
The Three Laws of Secure Computing 1) Don't buy a computer. 2) If you do buy a computer don't plug it in. 3) If you do plug it in sell it and return to step 1.;Computing
I'm gonna be honest with you... Particle accelerators give me a hadron.;Physics
What's the definition of a school report?  A poison pen letter from the principal.;School
I've always wanted to play smooth jazz while making love... ...but apparently the bedroom is an inappropriate place for a drumkit.;Music
Did you hear about the lawyer who ate gold? He passed the bar;Law
Do you know which End she was talking about? My teacher pointed me with her ruler and declared that at the end of her ruler is an idiot. I was suspended for a week for just asking which end!;School
A Polar Bear walks into a cafe He says, "I'll have a burger and.... a coke." The waitress says, "Okay. But, why the long pause?" The bear says, "I don't know. I was born with them.";Bear
What did the crop say to the Farmer? Why are you picking on me?;Farming
What is Viagra for lesbians called? Batteries;Sexuality
[my son brings a meme home] please can we keep him [me loading shot gun] leave the room Gregg;Parenting
"When you're right, no one remembers. When you're wrong, no one forgets.";Memory
What do you call it when a hooker farts? A prosti-toot;Sex
Why are sandwiches better in space? They are always a bit METEOR!;Space
Hermione decided to spice up her life after realizing she was a basic witch. (Sorry, That's it);Witch
Cream? Sugar? Fuck you, I want 2 cubes of chicken bullion in my coffee. I've got man's work to do.;Coffee
Anyone who says their wedding day was the best day of their life, has never had 2 candy bars fall down at once from a vending machine.;Wedding
What was hitler's favorite topic in math? Aljewbra;Hitler
I'm running away to join the internet.;Internet
Normal Person (being inconvenienced): I deserve better than this Me (being stabbed w/swords): I'm so sorry for getting blood on your swords;Swords
FUN FACT: Scientists have proven, there IS in fact life outside the United States.;United States
I saw a VW hybrid today. It runs on gasoline and lies.;VW
How many court cases have been thrown out because the judge needs a unanimous decision & the jury is made up entirely of dentists;Dentists
What's the difference between a Pickpocket and a Peeping Tom? A Pickpocket snatches watches.;Pickpocket
What do you call three rabbits hopping backwards? A receding hare line.;Rabbits
I shake my bottled water so the H's & O's are evenly distributed.;Water
The most unrealistic movies aren't fantasy and sci-fi. They're the movies where people have a conversation in the pouring rain.;movies
I could tell you a joke about a plane... But it'll probably go over your head...;planes
were do animals go when their tails fall off? The retail store. Edit: WHERE NOT WERE I'M RETARDED I KNOW :(((((;animals
I kinda like zombies...but can we go ahead & decide whether they can run fast or just walk?...my apocolypse plans depend on it....thanks!;zombies
I felt like a fool when I bought David Bowie tickets for my son and then remembered that he died last year... Even more so when I remembered that David Bowie died too.;David Bowie
Now that China has blocked Wikipedia, they're considering replacing it with... ... Xikipedia!;China
Some apples don't fall far from the tree, BUT other apples catch a good roll and keep rolling...and rolling...and rolling..;apples
Never trust a psychic wearing a band-aid, they should have seen that shit coming.;psychics
I drank too much water I'm going to pee for it later.;water
What is Bruce Lee's favorite drink? WATAHH!;Bruce Lee
What's the best thing about portugal? You never have to carry your bags because of all the porter-geese. Thankyou, im here till monday!;Portugal
What do lawyers wear to court? Lawsuits.;lawyers
What does FCPA stand for? Finally Caught Pinching the Assets;FCPA
I wanna get on a taxi and after riding around a while without saying anything, tell the driver 'I killed myself on that bridge 2 years ago';taxis
How do you make an archeologist mad? Give them a bloody tampon and ask what period it's from;archeologist
What's brightly coloured and looks good on raver kids? Fire.;raver
Doctor, How was the surgery? surgery? But... was this not an autopsy???!!!;surgery
What do lawyers wear to court? Lawsuits!;lawyer
Seven dwarves... sitting in a bath and they all felt happy. Happy got out and they all felt grumpy.;dwarf
I really suck at school, the only time I got an A+ is at the blood test.;school
What do you call a battle of wordplay? Pun-fu fighting;wordplay
Just accidentally threw an 'xo' in a text to a dude. Guess I have to fuck him now.;sex
Which director is Hollywood's darling? Michael Bae;director
Did you hear about the blonde who got into the  taxi and the driver kept the "Vacant" sign up?;blonde
Measurements in China. How long is a China man?;china
A young musician left his priceless Stradivarius violin on a train in Germany. But it was returned... no strings attached. Wait...what ?;music
What's worse than a cardboard box? Paper titties;boxes
What's the worst part about being a rollerblader? Telling your parents that you're gay.;rollerblading
I'm only listening outside the bathroom door to make sure you're not touching the decorative hand towels.;none
You never realize how boring life is until someone asks you what you like to do for fun.;life
What does Green Day say before bed? Green night;Green Day
[opens treasure chest & it's full of treasure] Me: whoa Friend: what is it? Me [slowly closing chest]: spiders;treasure
