"Joke";"Joke topic"
Worrying works! 90% of the things I worry about never happen.;Anxiety
LIFE HACK: Make your waist feel dramatically smaller by accidentally trying on maternity pants.;Pregnancy
2 snowmen in field, one Turns to the other and says "can you smell carrot?";Snowman
A guy tries to save someone's life... He goes to donate blood, but he decided not to. The doctor told him it would be in vein.;Donation
We got a tornado warning, and I'm too scared to open my windows. Don't want any sharks in my house.;Tornado
Can Feburary March? No. But April May;Months
What does the Pope use to dry his hands? Papal towels.;Pope
Saying 'I'm sorry' and 'I apologise' mean the same thing.. .. except when at a funeral.;Apology
Sometimes I do things to children that they're too young to understand... ...such as teaching them calculus and microbiology.;Education
A builder came up to me. He said, "Do you know how to make a fruit stand?" "Yes," I said. "You just have to balance it on a flat surface.";Fruit
You could make dinner for a toddler, or you could just cut out the middle man & throw away a plate of food and squirt ketchup on the dog.;Parenting
What day do most mothers give birth? Labor day.;Birth
How do rhinos like their eggs? Poached.;Rhino
Amy Winehouse's final album was "recorded before her death." Thanks for the clarification.;Music
I have so much pubic hair I can start a cattle ranch;Body Hair
COP: "Sir, do you know why I pulled you over?" ME: "It was way easier than solving a murder?";Police
I asked a Jewish girl for her number... She rolled up her sleeve;Judaism
Ever heard the one about the dyslexic agnostic insomniac? He lay awake at night wondering if there really was a dog.;Philosophy
Let's talk about Sex Baby. I regret you naming our son that. You're a real piece of shit, Tammy.;Parenting
You look dirty, so does your toaster maybe you should both go for a bath... I'll draw it;Appearance
I went to handshake someone and he basically just gripped my thumb and I'm never going to be popular;Social Skills
How do Filipinos count money?  One-a two-a three-a four-a another-a ...;Ethnicity
[5-year-old and 3-year-old scream at each other] Me: Is that how your mom and I settle arguments? 5: You want me to sleep on the couch?;Parenting
If your mule ate my prize winning bird, what would you have? My 3 foot cock in your ass!;Animals
ME: [in santa costume, covered in chimney soot] that was hard. how does santa do it WIFE: well santas not real, hun ME: [drops cookie] WHAT;Christmas
Do you know what happens when gay marriage is legalized? BREAKING NEWS: California's drought is over. Water supply flourishing from the tears of the racist, homophobic, and conservative southerners;Politics
I farted in church today..... I farted in church today and four people spun around in their seats and looked at me. I felt like I was on the Voice!;Religion
A Buddhist monk walks up to a Hotdog vender and says "Make me one with everything";Buddhism
You want to know what marriage is like? Think of a prison... Now don't change anything.;Marriage
Mute goes to a wedding... After the ceremony he won't let go of his dick and everyone's a little put off by his public display. With his free hand, he signs "Speak now or forever hold your peace".;Wedding
Did you hear about the man trapped in a nun's body? His name is God.;Nun
At first I didn't know how to dig a trench but then I got to the bottom of it.;Trench
Internet went down last night My neighbour added a password;Internet
What does my physics professor have in common with Gandalf? YOU SHALL NOT PASS!!!;Physics
Which mafia boss came with all the dlc? John Goty;Mafia
Yo mama is so Black that she went to the funeral naked!;Yo mama
I wipe my ass like I drive... Only stop on red;Driving
If you made a triangle with sticks... would it be twigonometry?;Geometry
Fruit roll ups I went to the supermarket and asked a clerk if they had fruit roll ups, he then called his gay manager to hug me.;fruit
What do you call an angry paraplegic? A steamed vegetable.;paraplegic
The Blonde Waitress Customer: Can I have some coffee without cream please? Blonde Waitress: We are fresh out of cream, sir. Can I bring you coffee without milk instead?;waitress
Father, pardon, excuse, exonerate, absolve, acquit, forgive me, for I have synonymed.;synonyms
Im making a fortune promoting home security systems.All I do is say "Hello".At 3 in the morning sitting at the end of their bed.;home security
I'm more of an amateur bater. I agree, I need more practice.;batting
Two hillbillies were playing chess..;chess
I saw that show locked up abroad. I expected to see more than just a women getting locked up. But that's all it was, that show is so literal.;TV show
The problem with being gay It's a pain in the ass;gay
Two twins are looking through a family photo album "It's not you, it's me" They both say in unison.;twins
Whenever I see a hot girl on the streets I'm like HOLY CRAP I'M OUTSIDE.;girl
My car starts to hydroplane. I let go & whisper, "Do it. Become the plane you've always dreamed of. I love you." *Soft kiss*;driving
My girlfriend wants me to take her to Paris, and treat her like a princess The only thing is, I don't know which to pick: the guillotine or the Mercedes.;girlfriend
James Bond walks into a bar... James Bond walks into a bar and sits next to a chicken. Chicken: What's your name? Bond: My name's Bond. James Bond. Chicken: Nice to meet you, I'm Ken. Chick Ken.;James Bond
Why do black people only have nightmares? Because we killed the only one with a dream.;black people
How do you troll someone? Make them wipe their screen because they think text is a smudge.;Trolling
Mad Libs inventor died today of POOPING. He is survived by his PIZZA CHEESE and his LAWN DARTS. He will be A DINOSAUR.;Mad Libs
Who is never hungry at Christmas ? The turkey - he's always stuffed !;Christmas
Q: Two musicians are walking down the street and one says to the other "Who was that piccolo I saw you with last night?" A: The other replies "That was no piccolo that was my fife.";Musicians
There is this new awesome technology to do group chats... It's called "put your damn phone away and join the conversation!";Technology
What's the best city to search the World Wide Web in? Rome.;Internet
Why do we drive on parkways when we park  on driveways?;Driving
What's an owl's favourite pin code? 2820!!!!!!!!;Owls
Few things in life are more pleasurable than turning off the lights in a public bathroom while people are still inside;Public Bathrooms
Why is Man Utd's chemistry lacking? Because they are held together by weak van den Gaal's forces.;Football
What kind of soap do Middle Eastern citizens use? Arab spring;Middle East
Duck walks into a pharmacy and asks for some lip balm. "Certainly sir, will that be cash or credit?" "Just put it on my bill.";Ducks
what's green and floats? a leaf;Riddles
Uncle Frank's will stipulates he be cremated & his ashes added to the vegetable water sprayers at the local grocery store. He will be mist.;cremation
I'm a masochist. I downvote myself.;self
I'd also tell you a joke about how my balls hang. . . But that's too low.;testicles
I came up with a movie idea. A man's daughter is abducted. This man has has a unique set of skills and goes on a revenge rampage. But the idea was taken.;abduction
I saw a girl texting while driving the other day.. it really pissed me off, so I rolled down my window and threw my beer at her.;driving
Where is Macau located? In MaFarm;geography
They took my mood ring... ...and I don't know how i feel about it.;accessory
Hands down half 6 is my favourite time of day.;time
Chicks... ...they only get laid once.;chicken
How do you comfort a grammar nazi? Pat him or her on the back and say, "Their, they're...";grammar
What do you call a policeman with blonde hair ? A fair cop !;police
The person who came up with "happily ever after" probably didn't realize humans would live longer than 34 years.;marriage
I'm selling my Theremin.... I haven't touched it in years.;instrument
what type of shoes do artists wear? sketchers;shoes
Just bought some local farm-fresh free-range artisanal organic grass-fed hormone-free something or other that makes me better than you.;food
Happiness is like peeing in your pants ...everyone can see it, but only you can feel its warmth.;Happiness
I love Alfredo sauce. Unless you're a dude named Alfredo.;Alfredo
Some coworkers remind me of my ex, because I would jump in front of a bus to get out of a conversation with them too.;Coworkers
"we can put a man on the moon but ___________" (insert issue that is vastly different);Space Exploration
Did u guys know u can smoke Newports on Delta flights;Smoking
A pirate walks into a bar and the bartender says... "What's with the steering wheel on the front of your pants?" The pirate says, "Argh!! I don't know but it's driving me testicles!!!";Pirate
what's worse than having a cold right before a job interview ? the holocaust;Job Interview
Q: What did the snail say as he rode on the back of a turtle? A: Wheeee!;Snail
What do you get when you cross Holy Water with castor oil? A religious movement!;Holy Water
What's the difference between awkward and awful? Awkward is finding your mom on Tinder, awful is matching with her;Dating
Just went for a piss while still wearing my microphone and the whole conference heard me call the urinal a "thirsty boy";Public Speaking
Why did Newton's wife got pregnant? Because he doesn't believe in using quantum;Physics
A survey found one in five women have ended a relationship because their significant other was too busy playing video games.;Video Games
Why shouldn't you drink at a math party? Because you shouldn't drink and derive.;Math
I was going to say a gay joke but fuck it.;homosexuality
Why are sergeants so successful in physical contests? Three stripes, you rout.;sports
What is CC Sabathia's favorite inning to pitch in baseball? The bottom of the fifth;sports
You know what's worse than your tribal tattoo? The story about why you got it.;tribal tattoos
How do sheep greet each other at Christmas  ? A merry Christmas to ewe;Christmas
What's the difference between a boy scout and a Jew? One gets a badge for lighting stuff on fire, while the other gets a badge for being lit on fire.;religion
Just farted and it sounded like Louis Armstrong saying the word "blueberry" with his mouth full.;flatulence
What do you call a cow stuck in a hurricane? A milkshake.;weather
As my friend confessed, "My teenage daughter never even talks to me," I struggled to conceal my jealousy.;parenting
[texting] WIFE: need to talk when u get home ME: about what WIFE: too much to text just wait till u get home ME: *never goes home*;marriage
Me: *to dog* what should I wear today bud? Dog: *pants*;clothing
Did you hear that they are building massive oscillating blades in New York? I wasn't a big fan of the idea;architecture
What do you call an Irish man who won't leave your porch? Paddy O' furniture;Irish people
Why do people even like anal? It's fucking shit.;sex
Cleaning the Attic Four fonts walk into a bar the barman says ''Hey - get out! We don't want your type in here!'';typography
Pinocchio When did Pinocchio learn he was made of wood? when his hand caught fire!!;Pinocchio
What is the difference between rat poison and diet coke? Diet coke has better advertising.;Advertising
Count Chocula cereal is the perfect combination of breakfast and fear.;Cereal
I'd do well in a zombie apocalypse because I'm near sighted, get cramps if I don't get enough potassium and my only skill is googling things;Zombie Apocalypse
*Snoop walks into a classroom* Snoop: Tell me about the Big Bong Theory Teacher: It's the Big Bang Theory *Snoops walks out disappointed*;Education
Did you hear about the wooden car with the wooden engine, the wooden doors and the wooden chassis? It wooden go.;Cars
I forgot :( Whilst climbing in the roof space to get down the kids Christmas gifts, I found a present I'd forgotten last year. Such a shame - they would have loved that puppy.;Christmas
I've decided my tweets sound better when I say them so instead of tweeting I'm just gonna call all of you when I think of stuff.;Twitter
Viagra Tea Does nothing for your sexual vigour, but stops your biscuit going soft.;Viagra
What's the slipperiest country? Greece!;Countries
Who is the Gorillas' favourite  playwright? Eugene O'Neill - who wrote 'The Hairy Ape!';Theater
You did yoga. You didn't negotiate a peace treaty. Stop walking around like that.;Yoga
What should you do if you find a snake sleeping  in your bed ? Sleep in the wardrobe !;Snakes
My ex-girlfriend once said "It's either me or Twitter." I wonder how she's doing.;Twitter
What did one dairy cow say to another? Got milk?;Cows
My children annoy me so I'm leaving everything in my will to a nap I took in 2007.;Children
Some people say I dream too much, I say it's just because my life is better than their dreams are.;Dreams
When my boss is mad and takes it out on me, I do less work. Can't reward bad behavior with a positive response. Training works both ways;Work
I've just been refused entry to the National Alzheimer's conference. "Do you know who I am?" I shouted.;Alzheimer's
By law, you are required to turn on your headlights if it's raining in Sweden. How the hell am I supposed to know if it's raining in Sweden?;Sweden
why don't melons run away to get married? because they cantaloupe;Melons
"Pardon me miss, but would you mind moving out of the way?" --Polite Ludacris;Ludacris
if you eat your burrito over a tortilla, anything that falls out will simply start building your next burrito;Burritos
What do you call conjoined dolphins Dual porpoise;Dolphins
I was gonna make a gay joke... But Fuck that;Gays
Mt. Everest has lost its record status ... ... now that a British astronaut is Earth's highest Peake.;Mt. Everest
Confucius say... Man who go to bed with sex in mind, wake up with solution in hand.;Sex
Nothing is fool proof to a sufficiently talented fool.;fool
Putting the dog down today. Gonna start by telling him he has a big nose.;dog
The nice thing about being a pessimist is that in the end you are either pleasantly surprised or you have the satisfaction of knowing you were right all along.;pessimist
So if Mary had Jesus, and Jesus was the Lamb of God... ... Does that mean Mary had a little lamb?;Jesus
dumbledore: our enchanted ceiling shows us wat the sky outside looks like mcgonagall: so...a magic glass ceiling dumbledore: [starts sweating];Dumbledore
Sometimes when I'm sad, I'll go to the park and, from a distance, look thru my thumb and index finger and begin squishing people's heads...;people
What's the difference between magic and black magic? Black magic doesn't work.;magic
A man walks into a bar... His friends ducked.;bar
I fucked up making my coffee today \#nofilter;coffee
I just got fired for putting my penis in the pickle slicer at the restaurant where I work She only got docked a week's pay;penis
What do you call a slow hurricane? A slowicane.;hurricane
What Should I Do Today? Eat A Bomb?Nuke A Toaster?Ride Nyan Cat Into Space?Bomb ISIS?Oh Theres Just So Much You Can Do!;Nyan Cat
I heard this amazing joke the other day, made me laugh so hard. Unfortunately I seem to have forgotten it.;joke
Every horse you've ever seen has two people inside them. Horses aren't real. Commitment is.;horses
*looks at crushed dead raccoon on the side of the road* i'm thinking Arby'sTM;Arby's
LPT: Never hold your farts in. They travel up your spine into your brain,and that's where shitty ideas come from.;farts
A grown man smelling like baby powder stood next to me today. My maternal instincts have never been so confused.;baby powder
A double-amputee walks into a bar Then he remembers he's already legless and walks out again.;amputee
How much does it cost for a pirate to get their ears pierced? A Buccaneer.;pirate
What did the elephant say to the man? Cute, but how do you pick up peanuts with it?;elephant
I just took the Bruce Lee of dumps. It fucked my ass all up.;dump
What my girlfriend thought, first 4 dates : 1. Nice shirt 2. Wow, a second nice shirt. 3. Okay, first shirt again. 4. He has two shirts.;girlfriend
[gf comes home after spray tanning] Hey, orange you looking good! "Thanks" Anytime, pumpkin! "You're sweet" You're one in vermillion!;orange
Apparently I pack an apple in my 5 year old's lunch so it can get out of the house for a few hours.;apple
*First Date* Me: *Flirting* You have to promise not to fall in love with me. Him: There's cheese in your hair. And we haven't eaten yet.;cheese
What's the difference between a weasel and a stoat? One's weasily recognised - the other's stoatally different;weasel
Dear guys wearing skinny jeans, I... Can't.... Breathe.... Sincerely, your damn balls.;skinny jeans
What do you call a bearded gardener? Hairy Potter;gardener
I thought I really understood what I was thinking, and then I spoke.;thought
Sorry about your street cred, black guys named Milton.;black guys
What's the hardest thing about being a pedophile? Just trying to fit in, really.;pedophile
Volkswagen How many Jews Can you fit in a Volkswagen? 2 in the front, 3 in the back, and 6 million in the ashtray;Jews
What is the difference between the Christmas  alphabet and the ordinary alphabet? The Christmas alphabet has NO EL.;Christmas alphabet
Where was Timmy when the bomb fell? Everywhere.;Timmy
What does a preverted frog say? Rubbit.;frog
The cops did a high-risk raid on a drug operation located at a barn I guess you could say it was a *high steak operation*;drug operation
The punchline comes first. How can you be sure that a comedian has traveled back in time?;comedian
Choose a major you love and you won't have to work for a day in your life Because that major probably has no jobs (not an original);major
Why do people dislike the new iPhone 7 so much? It can't do jack shit.;iPhone 7
What do you call an aligator in a vest? investigator;aligator
My bathroom smells like somebody just took a shit when I walked out of it.;bathroom
What is the most affectionate type of chicken? The tender ones (Badum Tss);chicken
If you're in college, what do you do when your flatmate has an epileptic seizure in the bathtub? ...throw in your dirty laundry.;flatmate
"Did you hear about the $3,000,000 Maryland State Lottery? The winner gets $3 a year for a million years.";Lottery
"Liquor in the front, poker in the back" is not an acceptable tee shirt slogan for my church's charity poker team... I know that now.;Poker
Did some stand up at a bird sanctuary... They were eating out of the palm of my hands.;Birds
what is the most confusing day in the ghetto? father's day;Father's Day
My friend bought a choir girl zombie costume for Halloween. She put it on and said, "Am I menacing?" I said, "Of course, you're a choir girl.";Halloween
Saudi Arabia... ...is on the United Nations Human Rights Council.;Saudi Arabia
The definition of mixed emotions... My mother-in-law driving of a cliff in my new car;Mother-in-law
What sex position produces the ugliest children? Ask your mother.;Sex
Phone on silent. 10 missed calls. Turns volume to loudest. Nobody calls All damn Day.;Phone
It was recently discovered that Pluto is not actually a dog.;Pluto
Ever hear the one about the deaf guy? Neither did he.;Deafness
I'm getting tired of riding to work from New Jersey to Manhattan with my neighbors I guess I'm getting Carpool Tunnel syndrome;Commuting
Q: What did one candle say to the other candle? A: Are you going out tonight?;Candles
LISA GOPMAN: EATING DISORDER For as long as I can remember, I've had an eating disorder: reverse anorexia. It's when I look in the mirror and think I'm really skinny.;Eating Disorder
What do you call a group of armed nuns enforcing the status quo? a force of habit;Nuns
100% of Nickelback fans drive drunk.;Nickelback
I for one... ... love Roman numerals.;Roman numerals
What's big and grey and protects you from the rain ? An umbrellaphant !;Umbrella
Half of all marriages end in divorce... The other half end in death.;Marriage
Nothing says "We have no faith in our own products" like using a 16 year old girl in your anti-aging cream commercials.;Advertising
I think a duck's opinion of me, is very much influenced by whether or not I have bread!;Duck
What would you call the Fantastic Four if Snoop Dogg joined the team? The High Five;Fantastic Four
Yeah, I guess you could say I "rescued" my dog. I did stop him right before he was gonna start his own podcast;Dog
Your momma so fat... Her aides close lanes on the George Washington Bridge;Mom
"I love my Job!" -Job's wife;Job
TRUMP: Let's get that Muslim Band going "Band? We thought you said ban" TRUMP: No way, that's harsh. Also, how's that Mexican mall coming?;Trump
I wish young people would stop idealising future dystopias and start enjoying the one they're in.;Inferiority
What do you call a man standing up to his knees in water? Wade;Dystopias
I was going to tell a joke about sodium... But then I said "Na, I'll do it later.";Water
If you combined all the movies of Rob Schneider and made them into one single movie, it would be an extremely long movie.;Sodium
I ate way too many freedom fries yesterday. I had to liberate the toilet for hours.;Rob Schneider
I made a website for Kids' jokes. But for some reason people seem hesitant to go to kidslaughter.com;Freedom Fries
Yo mama so fat... ... slapping her belly causes gravitational waves. OR ... every step she takes causes a ripple in special relativity.;Kids Jokes
I was fighting with my wife over the arrangement of the dining-room furniture. I thought I had won but when I got home from work the tables were turned.;Fat People
All the jokes about iPhone 6S are just slightly improved jokes about iPhone 6.;Marriage
Two men broke into a drugstore and stole all the Viagra... The police are on the lookout for two hardened criminals...;iPhone
Where do you find the best tofu in the entire world?;Viagra
yo mama so stupid it took her 2 hours to watch 60 seconds.;Tofu
Why do they build fences around graveyards? Because people are dying to get in;Parenting
Boss: I suspect one of you is dead [Everyone looks at me, except for Paul, who is not moving at all];death
Three stages of a man's life . . . . . Want to stand up Want to stand up Want to stand up;aging
I just bought shoes from a drug dealer I don't know what he laced them with, but I've been tripping all day;drugs
Be alert! The world needs more lerts.;intelligence
- "... He accidentally drank some radioactive milk and became_ - MILKMAN!! - No. He became gravely ill and died. What are you? An idiot?!";superheroes
Visiting grandma (nsfw) Mommy, mommy, I don't want to visit grandma today! "Shut up and keep digging, boy.";grandma
When you go in the other room I ask your dog what you look like naked.;appearance
Two peanuts were walking through Central Park late at night. One was a salted.;peanuts
What's the hardest part about breaking up with a Japanese girl? You have to drop the bomb on her twice before she gets the point.;breakup
Telling someone they can't be sad because others have it worse is like telling someone they can't be happy because others have it better.;emotions
Little girl: "Grandma, make a noise like a frog." Grandma: "Why?" Little girl: "Cause daddy says we'll make a lot of money when you croak.";death
My thanks to Mexican Coke for sponsoring this week's weirdly tight pants. "Mexican Coke: Porque tu pantalones deben ser dolorosos.";clothing
The missus just found out I replaced our bed with a trampoline. She hit the roof.;marriage
did you hear about that kidnapping in Texas? He woke up.;crime
FB lesson number #1. If you don't want people meddling in your business, stop  posting it on your status.;social media
The greatest thing about Christmas is how it teaches kids to be selfish little shits on someone else's birthday.;Christmas
A pig with wings walks into a bar. Stunned, the bartender says "You can't bring food in here from another restaurant! Even if you are a cop!";food
My favorite jokes are the short ones that make me laugh. Here's a short one that I hope makes you laugh. How do you find Will Smith in the snow? - You look for FRESH PRINTS!!;celebrity
I'm scared of the toilet That's where shit goes down;toilet
Do you know the problem with ordering duck? It always comes with the bill.;food
"Raising a family is hard," he said. "Not if they're buried close enough together," replied the Necromancer.;family
I'm not saying let's go kill all the stupid people I'm just saying let's remove all the warning labels and let the problem sort itself out.;intelligence
Just when I think I'm 100% against the death penalty, I see a bright yellow hummer taking up two parking spots.;driving
What do you call a cute homeless girl? Dust Bunny;homelessness
The toilet bowl was stolen from the local police precinct last night. The cops have nothing to go on.;crime
Did you guys see the new line of Tony Romo's cologne? Every time you wear it, you fuck up and the other guy scores.;football
What does Sean Connery wear to avoid the paparazzi? His shunglasshesh;celebrity
I farted on the bus today and four people turned around I felt like I was on The Voice;flatulence
(NSFW) What did the haddock get covered in at the fish orgy? SALMONal fluid;sex
One day I'll cure deafness... You hear me!;medicine
Drunk is when you feel sophisticated but can't pronounce it.;drunkenness
Is this InkJet any good? Sure, we've sold it to royalty Princesses? Mate, it prints ALL the letters!;technology
What do you call someone who sneezes doing cocaine? A snowblower;drugs
Next time you order coffee at Starbucks tell them your name is Bueller and then leave the store.;prank
Remember that AMA guy whose mother slept with him because he had broken his arms? She was adding incest to injury.;incest
Yes, I am aware pigs are more intelligent than dogs. Why would I want to eat an inferior animal and absorb its lesser powers?;food
