"Joke";"Joke topic"
"I never weigh myself" -People who weigh themselves daily;weight
The moral of "The Three Little Pigs" is "make your house with bricks." Why are we giving four year olds architectural advice?;Three Little Pigs
Did you know that if you drop and break a piece of folk art, it just turns into more folk art?;folk art
I love linguistics Its the only class where I can talk about vowel movements.;linguistics
Did you hear about the cyclopic tutor? He had only one eye, but two pupils!;cyclopic tutor
Marriage is like a card game. At first, you have two Hearts and a Diamond, but at the end, you'll want a Club and a Spade.;marriage
Don't ask me where I've been all your life if you're going to look so bored when I open my diary and give you a comprehensive answer.;diary
Why did the aardvark cross the road? To beat up the idiot telling jokes about him. (Not an original joke);aardvark
I eat the free samples at Costco for lunch every day. I'm adding 'enjoys eating out' to my dating profile.;Costco
Two wives talking about sex The first asks 'Do you smoke after sex with your husband?' 'I don't know' replies the second 'I've never looked'.;sex
Roses are red Violets are blue Stop clicking your pen when you talk to me Kevin I swear I will murder your face with my tape dispenser;office
missed connection: you walked by my house and saw me drinking from the hose. please respond with the hose color so I know it's you;encounter
Someone outside the grocery store asked me if I had a few seconds to save the environment. I feel like it would take longer than that...;environment
People always comment about how young I look. I just tell them it's because of all the placenta I've been eating.;aging
My daughter's been seeing someone called Jim. Only for an hour each time, always in sports gear and often sweaty afterwards. I don't approve;dating
What do you call the security guards outside of Samsung? The guardians of the galaxy!;technology
How do you know a Brigham Young student's been mowing the lawn? The welcome mat is destroyed.;university
Swim up bars combine my two favorite things. Drinking and peeing in hotel pools.;vacation
What did the ocean say to the river? "You can run but you can't tide.";ocean
Why should you never fight a dinosaur? You'll get jurasskicked!;dinosaur
What does a German say when you finally explain a funny meme to him? Danke;Germany
After reading that Afghanistan had the highest infant mortality rate, this occurred to me. What do you call Afghan triplets? Twins! I am so sorry....;Afghanistan
Uh uh huh uh uh uh huh uh uh uh huh uh uh uh huh uh uh uh huh uh uh huh uh uh uh uh uh uh uh uh uh uh uh huh Me, Rap battling;rap
My gay friend told me he loves living in Pennsylvania. He's never seen so many assholes in his life.;Pennsylvania
What's a ego maniac's favorite candy? Air heads;Ego
What does it mean when you're on a date and he pushes you in front of a bus?;Dating
Meet my good friend 50 Cent, or as he's known across the pond... 10,000 Pounds;Money
If a red man lives in a red house, a blue man lives in a blue house..... a green man lives in a green house. Then who lives in the white house? A black man;Politics
Why did the grinch cross the road? HE HAS TOO MUCH LONGER LEG !!!!;Unknown
A hippie is walking along A Hippy is walking along wearing one shoe. Another hippy sees him and calls out, 'Hey man, you lose a shoe?' "Nope, found one";Racism
You guys can laugh at my cargo pants all you want, but I just walked out of Taco Bell with 350 sauce packets.;Hippies
I got jury duty next week My duty is to convince the jury that I didn't do it.;Food
Why didn't Rivendell help Gondor? Elfish reasons.;Law
Why is the blood of christ wine? Because he drank religiously;Fantasy
What does Mrs Dracula say to Mr Dracula when  he leaves for work in the evening? Have a nice bite!;Religion
A fireman's pole is a stripper's pole that takes you places.;Vampires
My extra sensitive toothpaste cries when I don't brush my teeth;Professions
What do you get when you cross a slaughterhouse worker and a bad comedian? A bunch of butchered jokes;Toothpaste
Weird Question in Exam Q) What do you find in cells? My Ans) Black People . . . I dont know why do they ask such weird questions in biology.;Professions
How do you kill a vampire dinosaur? You stakeasaurus.;vampire
Cop: You know why I pulled you over sir? Me: Because you suck at finding rapists, murders, molesters, thieves, and arsonists?;police
Why shouldn't you talk to someone with a brain tumor?.... ..because they've got a lot on their mind.;brain tumor
"Yoda, are we supposed to be here?" "Off course we are.";Yoda
You should be able to get out of a speeding ticket if you can prove you were listening to a kick-ass song.;music
Art imitates life. Imitation is the highest form of flattery. Flattery will get you nowhere. So GOOD LUCK WITH THAT ART DEGREE!;art
My masturbation addiction is getting bad I'm right in the grips of it.;sex
"NO HOMO" i scream at my dog Homo as he shits on the carpet;dog
Why was six afraid of seven? It wasn't. Numbers are not sentient and thus incapable of feeling fear.;numbers
I really envy Gay couples At least then both people like anal. I have to keep pulling my girlfriends thumb out of my ass.;gay couples
I saw Death walking out of my house today... I guess Grandma won. Again.;death
What i if told you You the read first line wrong And the second;reading
Trampolines used to be called jumpolines Until your mom jumped on one back in 1972.;trampolines
Do you know how I know that diarrhea is genetic? It runs in your jeans.;diarrhea
Who wins most of the medals for bravery in Burger Land? The meatball heros!;Burger Land
Why don't chickens wear underwear? Because their peckers are on their faces.;Computer
You miss 100 percent of the shots you don't take -Jenny Mccarthy;Chickens
So how long do I have to microwave this spider before I let it bite me?;Hockey
twitter getting rid of the 140-character limit is a bad idea. the ability to say what you need to say in as few words as possible is (1/533);Spider
"The captain of the Titanic just checked into an iceberg on Foursquare with 2,224 other people." - Twitter, 1912;Twitter
That awkward moment when I'm really drunk and you're still ugly.;Titanic
I dropped my bowl of SpaghettiOs and it spelled 'oooooooo' on the floor. Spooky;Drunk
Just learned the Finnish have a word "Kalsarikannit" which means getting drunk alone at home in underwear. Signing immigration forms now.;SpaghettiOs
Luke, I am your uncle. Luke, I am your third cousin. Luke, I am your grandmother. - Skywalker family reunion;Finnish
I wonder how many identical twins are walking around now with the wrong names because their parents got them confused as infants and never figured it out.;Star Wars
What genius named it a "news feed" on Facebook and not "bullshit"?!;Twins
What does a frog do when it barbecues? Rib it...duh!;Facebook
A man walks into a bar sits down and orders a drink. He asks the bartender "are you into incest?" the bartender pours him his drink and says "relatively.";Frog
A combo of two classics. Why did the chicken cross the road? To go to your house. .................. Knock knock. (Who's there?) The chicken!;Incest
People who put a shitload of bumper stickers on the back of their vehicles love to loudly refer to God as a "she" in public places.;bumper stickers
The term "Expecting a baby" implies uncertainty. Like we're almost sure it's a baby, but could also be a bushel of potatoes, who knows;pregnancy
What's the difference between a cow, and 9/11? You can't milk a cow for 14 years.;9/11
Accidentally left creatine out on the counter overnight and there's a bigass 3" tall ant in my kitchen calling me bro now... scared to go in;creatin
What did the lawyer name his daughter? Sue;lawyer
90 people have swine flu and everybody wants to wear a mask. A million people have AIDS and nobody wants to wear a condom.;AIDS
What were the Mexican crisps doing in the locked conference room? It's nacho business!;Mexican crisps
I teased Peyton Manning so he broke my phone. Now it'll never go past one ring....;Peyton Manning
How do you get a dog to stop humping your leg? Pick it up and suck it's dick.;dog
How tall does the grass grow in Germany? Nein feet tall.;Germany
I started to sing the poop song Dad said it was crappy.;poop song
It's illegal to tie your children to things but you can basically do the same by buying them a phone with a short charger and a bad battery.;phone
Nana Nana Nana Nana Nana Nana Nana Nana BATMAN! Nana Nana Nana Nana Nana Nana Nana Nana BATMAN! -Me, sorting through my grandma's mail.;BATMAN
What's Batman's least favourite album? A Night at the Opera.;Batman
I am... A joke !;Tampons
I have a car! I had a car, Untill i woke up;Jokes
Where did the Fonz go for his drinking problem? A-AAAAAAYYYYYYYY;Cars
Philippe Petit walked between the twin towers in 1974, big deal, I can do that today with no training. Just made that up, I hope it's not too soon.;Fonz
Where do pigs park their cars? In porking lots.;Philippe Petit
Fun Super Bowl Game: Every time they show Ray Lewis on the screen, stab someone in your party and then deny it was you.;Pigs
The average person swallows over 4,000 spiders each year. More than that. Tens of thousands. Hundreds of thousands of spiders. It's crazy.;Ray Lewis
I named my dick "The Truth" Because bitches can't handle it.;Spiders
Medical humour Q. What do you call a white blood cell with one leg? A. A limp-phocyte. (You're welcome);Jokes
HOT! dog what did the dog say about sexy dog to is friend wow look at that hot dog;Medical
What's the difference between Mick Jagger and a Scottish Highlander? Mick Jagger sings, "Hey you, get off of my cloud . . ", while the Scottish Highlander yells, "Hey McCloud, get off of my ewe!";Dogs
If your bathroom mirror doesn't look like a Jackson Pollock painting, you're not flossing right.;Mick Jagger
Pacman went to a therapist to help his anger management. She said: "Next time you feel angry just waka-way";Flossing
I went for a run and got back two minutes later because I forgot something, I forgot I'm fat and can't run for more than two minutes.;Coke
Not going to any more weddings or funerals. Please keep that in mind, friends who are considering getting married or dying.;Running
What phrase would a neckbeard who watches South Park use the most? M'Kay;Weddings
Why are fish so gullible? They fall for things hook line and sinker!;South Park
What position does the pig play in football?  Loinback.;Fish
I love 80s Rock It always makes me Bon Jovial;Football
A couple have a lot of sex They challenge each other to see who can have the most sex in a month. The woman wins. Some say she cheated.;80s Rock
There's an omelet in the fridge. I want it. However, I can't have it... It's eggspired.;Birds
What's the difference between men and women when watching video? The phrase "I went through a whole box of tissues watching that film." usually has a completely different meaning.;Omelet
What's the most popular website in Illinois? Cornhub.com;Court
Why is the Mississippi so wide? Because Mr. Sippi is hung like a horse.;Illinois
4: I'M GONNA RIP YOUR EYEBALLS OUT Me: Stop yelling violent things 4: *whispers* I'm gonna rip your eyeballs out;Mississippi
And on the 7th day God rested, but the children did not rest. So on Monday God made school and He sent the kids and all the people rejoiced.;God
No punchline needed. Did you hear Micheal J Fox got a new job working as James Bond bartender.....;Michael J Fox
Why do chicken coops only have two doors? If they had 4 doors they'd be chicken sedans.;chicken
It is a good thing butt cracks are vertical... If they were horizontal, we would hear clapping every time someone used the stairs.;buttocks
When my dad caught me smoking a cigarette he took me out to the shed and forced me to teach him how to be hella cool.;smoking
Why did the communists trip over? Because they were Russian!;communism
What has five arms, three legs and a head? The finish line at the Boston Marathon;marathon
Soup Person1 my alphabet soup is telling me a message. Person 2 what is it saying? Person1: oooooo Person 2 *sigh* Those are cheerios;alphabet soup
What do you call a bird that speaks Spanish? A Si-gull;bird
Did ya hear about the woman with five legs? Her knickers fitted her like a glove.;woman
What's the difference between hard and light? I can go to sleep with a light on.;light
Why did the nurse always insist on  using the rectal thermometer to obtain temperatures? Because nurses are taught in nursing school to always look for her patient's best side.;nurse
Why does the letter "r" make all the difference between Friday and Sunday? payday vs prayday.;letter "r"
My toddler found a bottle of Axe body spray I got as a free sample, and now she's wearing a Tapout T-shirt and calling everyone "bro.";Axe Body Spray
Catch Up or Catch It What do you do meet an old friend? What do you do when someone throws a ball? What do you put on a hamburger? What do you find in a litter box?;Friendship
I set them up, you...;Baseball
The 2016 election What a joke, am I right?;Hamburger
Whores on first, sluts on second, idle hos on third.;Litter Box
What did the guy from Northern Canada have to say about the place? He wanted Nunavut.;Friendship
People keep telling me PHP is a dirty language... Until I shove a string up there asses and turn it into a multidimensional array.;Politics
What do you get when you cross a mosquito with a mountain climber? Nothing. You can't cross a vector and a scalar;Canada
If you had to steal a bike from someone, who would it be? A black guy, because it's probably already stolen.;Programming
What's the difference between a public park and a public toilet? I need to know before my court date on Monday.;Medical
Trying to think of a joke about jerking off... I'm sure it will come.;Math
What do hard-working grocery store clerks get every year? A celery increase.;Public Spaces
Remember the 7-Mile Spanking Machine? Turns out there will also be a punch line.;Masturbation
When I go to Starbucks, I tell them my name is Marco. When my drink is ready and they call my name, I just keep saying Polo.;snake
In 1993, I saw a toddler slip on ice and land on a cat, but I didn't have any social media outlet to tell people about it. So, here it is.;name
Ever had Ethiopian food? Neither have they.;social media
What is worse, ignorance or indifference? I don't know and I don't care;Ethiopian food
Two mosquitoes were buzzing round when they saw a drunken man. One said to the other "You bite him ? I'm driving.";ignorance
..because I always go through the punch-line first I'm usually buzzed by the end of the cake-line..;mosquitoes
What do Pink Floyd and Dale Earnhardt Sr have in common? Each of their last big hits was the wall.;cake
What do you call a Black man that walks by a Cop? A Pencil cause he's full of lead!;Pink Floyd
It's only perverted if she says no..;batteries
wife: Why is 9 crying? me: Because it's raining and he's getting wet wife: But we're at a water park me *takes a drink from my flask* Yep;KKK
hey Colorado, hows your aspen? (ass been);water park
What do you call a masterbating cow? Beef stroganoff;Colorado
The dalai lama walks into a pizza parlor... And he asks the cashier to make him one with everything.;marriage
I held the door open for a clown today... ...it was a nice jester.;pizza
How do you confuse a blonde? You don't. They're born that way! ;clown
Yea, autocorrect, I meant "nymph" instead of "my phone" because I am a 16th Century poet.;hot pocket
Confucious he say... Man who walk before car gets tired, man who walk behind car gets exhausted;autocorrect
Deactivating your Facebook account is the new black friend.;Confucius
I don't understand why women love singing "Let it go"... ...Since most of them keep grudges for life.;Facebook
What steps do you take if you encounter a bear in the wild? Fucking big ones!;lightbulb
Why should the lower 48 states be the lower 46? Because Washington and Colorado aren't low, they're quite high!;bear
My last days. If I ever end up on life support unplug me. Then plug me back in again and see if that works. REBOOT me baby!;states
The Dirty Dancing lift, except I'm throwing her off a cliff.;life support
I really hate it when my gay friends joke about docking... It really gets under my skin.;gay friends
Why do teenage girls not like filing papers? They just don't believe in labels.;teenage girls
What do you call a group of squid? A squad;squid
Q: Why don't Deputy Fire Marshals look out the window in the morning? A: So they have something to do in the afternoon.;Deputy Fire Marshals
How many X does it take to change a light bulb? N! One to change the light bulb, and n-1 to display stereotypical behavioral traits of X!;X
Apparently, 4.665642(1) out of 7.4 people overcomplicate things.;people
What do you say to a black guy after washing his dog? Yo dawg I washed yo dog.;black guy
Now that food has replaced sex in my life, I can't even get into my own pants.;sex
A Jewish kid asks his Jewish Dad for 50$... His dad says "40$? What do you need 20$ for?";Jewish kid
My girlfriend said she's fed up of me pretending im a detective, and we should split up... I told her that's a great idea, we can cover more ground that way.;girlfriend
What do you call a joke that makes fun of a woman, who has not consented to be made fun of? ...misogynistic.;woman
If you Happy and you know it thank your ex!;ex
Why did the Soviets decide to be Russian? Cuz they got tired of Stalin.;Soviets
what do you call a spicy wrap made at an Indian takeaway? currito;Sexual Orientation
Someone at the men's outfitter just called me 'MISS' on the phone... ... ehh at least I don't sound married!;Food
A priest and a rabbi are walking past a play ground. and the priest says, " do you want to go fuck some kids?" and the rabbi replies, "out of what?";Marriage
What's brown and sounds like a bell? DUNG!;Job
What disease do terrible parkers have? parkin'sins;Color
What is the definition of trust? Two cannibals going down on one another;Disease
What was Princess Diana's favorite thing about the Xbox 360? The dashboard.;Relationship
Plastic silverware: because the only thing I hate more than poisoning the environment is washing dishes.;Gaming
What is green and smells like red paint? Green paint. Haha;Environment
I used to go to Weight Watchers to meet women. There were tons of girls there, just not very many.;Color
I wouldn't want to fly Virgin. Who'd want to fly an airline that doesn't go all the way?;Dating
I'm white. But I'm not NASCAR fan white.;Disability
It's so hot I just saw two trees fighting over a dog.;weather
Knock Knock Who's there ! Astor ! Astor who ? Astor the ball is over !;ball
OMG you guys. I just got asked out. By a real live guy. I don't know what to do!? Play dead? Duck and roll? I'm so confused!!;dating
Drugs made me responsible. If it weren't for drugs I might have never started working at 15.;drugs
Why didn't the schizo cross the road He was in two minds about it.;schizophrenia
Every joke posted on this sub is stolen from Sickipedia. If you are going to steal someones joke at least give credit.;jokes
I'm deeply in love with you. But hard deeply, like demented. Kind of sick if you know what I mean. I will most probably end up carving you up. Want a coffee?;love
How to Get a Girlfriend: Out at Sea Me: *rocks boat* Her: Hey! Me: *rocks faster* Her: Can we PLEASE go steady? Me: I do.;dating
I have a friend who's half Indian. Ian;heritage
The basketball shot clock was invented in 1954 after a player hid the ball under his shirt for 48 minutes and told everyone he was pregnant.;basketball
A man walks into a psychiatrist's office... completely naked, but wrapped in plastic wrap. The psychiatrist looks him and down and says...I can clearly see your nuts.;psychiatry
Confusious say "Man who eat many prunes sit on toilet many moons.";proverbs
I'm writing a song about milking a cow. It's all quarter notes.;music
Why don't shrimp give anything to charity? Because they're shellfish.;horses
A Rabbi's money maker. A man asks a Rabbi if he gets paid for the circumcisions. The Rabbi says - No, I can't do that! I just Keep the tips!;charity
A Mexican walked into a Polish store and greeted every one. He was handed a sausage. Edit: Ok I will walk myself out...;circumcision
The man on TV said if you drink alcohol every day, you're probably an alcoholic. Phew! I only drink every night.;nationality
Chuck Norris Children usually write there name in the snow with pee Chuck Norris writes his name in pee on concrete;alcohol
Why could Darren jump higher than Zeus? because he was mortall.;Chuck Norris
My work out class has a cancellation policy of $15 if you cancel too late. Which means I just spent $15 NOT to work out. I am my own hero.;mythology
Why does Paris have tree lined streets? Because the German army likes to march in the shade.;workout
Why couldn't the lumberjack sign into Facebook? Because he was logged out!;history
Her: Dude, back off. You're totally scaring away all the hot guys checking me out at the gym. Me: You do realize I'm your boyfriend right?;Facebook
Her: Welcome to McDonalds sir, may I take your order? Me: *hands her a shovel with mouth agape* ALL. THE. FRIES.;relationship
What does spinach and buttsex have in common ? No matter how it's done, kids don't like it;food
What do you call a girl without boobs? **Justin Bieber**;sex
Crude oil is the worst kind of oil because it says offensive things while it pollutes the water and ruins our planet.;Ice
What's worse than finding a worm in your Apple? Finding half a worm in your Apple.;Oil
I really want a Popsicle but I'm so not in the mood for Freezer Jenga.;Apple
What was the rock band doing at the kitchen sink? Moshing the dishes;Popsicle
If at first you dont succeed, then skydiving probably isn't for you!;Rock
What is the only correct answer to the question 'Are you ticklish?' I have explosive diarrhea.;Skydiving
What do you call an angry psychologist? A thera-pissed.;Ticklishness
"Why?" - Socrates and four year-olds;Psychology
What do you call a torturer who says a lot of puns. A PUNisher;Philosophy
Women might be able to fake orgasms. But men can fake a whole relationship.;Puns
A young woman rolled her eyes towards me, So I picked them up and rolled them back.;Job
I'm really bad at measuring the correct amount of pasta, so if you and 79 of your friends want spaghetti tonight, come on over.;Eye
This one got my coworkers The stewardess on my flight asked me what snack I would like. I told her "The plain chips would be fine. She says "They are all plane chips, sir.";Pasta
What's the difference between a snowman and a snow-woman? Snowballs;engineer
What was the last thing that went through Osama Bin Ladens head before he died? I hope they're all female...;snowman
wife: im pregnant me: what? im not ready to be a mother we still have petty arguments wife: im the mother me: this is what I'm talking about;Twin Towers
What is a Jewish delima? A free ham.;marriage
I need to order faster internet then :D Lag makes you violent, not the games :D;Jewish
If you like a lot of chocolate on your biscuit..... .....join the Euphemism Society.;internet
Q: Why can't you play Uno with a Mexican? A: They steal all the green cards.;chocolate
What do you call it when a Catholic remodels his kitchen? A counter reformation.;octopus
Why did I throw my phone out of my window? Because I turned on airplane mode, and thought it would turn my Iphone into a plane...;Catholic
What's the difference between the Rolling Stones and a Scottish sheep farmer? One says, 'Hey! You! Get off of my cloud!' The other says 'Hey! MacLeod! Get off of my ewe.';phone
If a man says he will fix it, he will. There's no need to remind him every six months;Rolling Stones
DEAD BABY JOKES: So what's the difference between a dead baby and dirt? **I don't eat dirt.**;man
So I tickled my little brothers feet this morning... ... my mom got pissed and told me to wait until he was born.;Mexican
What do you call a dictionary on drugs? Addictionary;Brother
A guy wins a contest s] \ A guy wins a contest at home depot Home depot manager:"Alright sir for your prize would you rather have a ladder or 1 million dollars?" Man:"I'll take the latter.";Dictionary
I'm quitting drinking for good. Now I drink for evil.;Contest
If I got karma for posts... I'd still have no karma;Drinking
Why do support meetings for premature ejaculation always start on time? Because the members come early.;Karma
Why are cops so bad at pool? Because they can't resist hitting the black ball.;Premature Ejaculation
Why was the Energizer Bunny arrested? He was charged with battery. XD;Police
I'm blonde. What's your excuse?;Energizer Bunny
I can't believe that... after all the times my girlfriend called me "daddy", she still didn't get me anything for Father's Day.;Blonde
I own far too many "....For Dummies" books to have healthy self esteem.;Girlfriend
My mum fed me yeast and put me in the oven. Just how I was raised.;Self Esteem
I finally talked to my crush today I told her that she smells different when she's awake;Mother
How many people from Brazil does it take to screw in a lightbulb? A Brazilian!;Crush
You can pick your friends, and you can pick your nose but you might not be able to do either if your hands are severely disfigured.;friends
Why did the.. Why did the chicken cross the road? To get to the other side;chicken
What do you call 88 rednecks in an orgy? A family reunion.;rednecks
My girlfriend is in the hospital after she ate a giant bacon cheese burger. It was mine.;girlfriend
I told the 8 clowns in a tiny cop car to "clown arrest me! Take me to clown jail!" And they did. Bail has been set at 150 banana cream pies.;clowns
Dolls teach girls very unrealistic body standards. A Russian doesn't have to have many tiny Russians inside her to be beautiful.;body standards
