"Joke";"Joke topic"
How do you know when a mongol is level? He's drooling from both corners of his mouth.;Mongol
Nothing is more frightening than accidentally making eye contact with a guy who runs a mall kiosk.;mall kiosk
Wanna heare a joke about potassium? K;potassium
I showed up later to dinner yesterday because I was baking a turkey. I'm the turkey.     Il see myself to the kitchen table.;thanksgiving
What do you get when you combine Avogadro's number of avocados? GuacaMole!;chemistry
What do you call a computer that only plays sad songs? Adele;computer
Why do scuba divers roll backwards out of the boat? Cause if they rolled forwards, they would still be in the boat.;scuba diving
Can I get a pina colada please. 'This is Starbucks' Sorry, can I have venti pina colada.;Starbucks
[Enter restaurant] WIFE: See if you can get us a table ME: Ok [1 minute later] ME: [sprinting towards wife, carrying table] START THE CAR;restaurant
They're remaking Ocean's 11 with an all-female cast and it's gonna be called Ocean's 8 It's that damn wage gap I tell ya!;Ocean's 11
A man caught me applying chap stick, so I just started eating it so it wouldn't be weird.;chap stick
A job interview.  What's your worst quality?  Honesty.  Well, i don't think that honesty is a bad quality..  I don't give a fuck what you think.;job
H: Well, the remote was definitely broken, so I went and bought a new one. Me: H: Oh, and it came with this 75" television.;remote
The economy is so bad I went to buy a toaster and they gave me a bank.;economy
I'll never forget the words of my late Grandfather... "Sorry I'm late.";grandfather
I want to die in my sleep like my grandfather... Not screaming and yelling like the passengers in his car.;grandfather
This morning I went for a run and came back home after 2 mins because I forgot something... I forgot that I was fat and could only run for 2 mins.;running
I made a company that disguises land mines as prayer mats... Prophets are through the roof;landmines
Warning: Dead baby joke What's the difference between a dead baby and a rock. You can't fuck a rock.;dead baby
Tea makes everything great,even meth. Cos without T,meth is just meh.;tea
I can't believe I forgot to bring sunscreen to the beach.... ...boy was my face red.;beach
He who smiles in a crisis has found someone to blame.;crisis
What did the lesbian vampire say to the other lesbian vampire? Same time next month?;lesbian vampire
Dallas Black people: please be Muslim please be Muslim please be Muslim Muslim people: please be black please be black please be black;Dallas
My Wife is refusing to fry any food and is insisting on eating healthier. She is turning into a Kitchen Nazi. She keeps sticking everything in the oven.;Wife
2 words can open up many doors in your life. Push and Pull;Doors
Knock knock..Who's there?..Interrupting coefficient of friction.. The interrupting coeff--- MU!;Coefficient
Q: Why are elephants big, wrinkled, grey, and hairy? A: Because if they were small, smooth, white, and hairless, they'd be aspirin tablets!;Elephants
My ex broke up with me but left a bag of chips in my car. 3 weeks passed and I texted "I still got your chips if you want them.";Ex
When googling Gary Oldman I highly suggest not forgetting the "R";Gary Oldman
What do DNA and Diarrhea have in common? They both run in your jeans (genes);DNA
Well I was going to donate blood today until.... the lady got all personal and started asking, "Who's blood is this?" and "How did you get it?";Blood
Colonel Mustard. In the kitchen. Eating soup. Calm down.;Colonel Mustard
[at funeral] "it was so sudden" really? "yeah right in the middle of rap battle" I thought you said he died of dysentery TERRY: That's right;Funeral
I always eat at McDonald's when they do the Monopoly pieces. 1 in 4 wins obesity.;McDonald's
What did the pirates say who stole Kim Kardashians jewelry? We wanted her booty!;pirates
I bet the guy who invented fake dog shit was upset the name "shampoo" was taken;inventions
I think I'm gonna make a bracelet that supports getting rid of bracelets that support stuff.;bracelets
[around campfire] ME: *grabs guitar* Hey kids how about a song? KIDS: Yeah! ME: ok *clears throat* LET THE BODIES HIT THE FLOOR LET THE BODI;music
Luke, I am your father. Man you should see your face right now. It's all like waaaaaat no way.;movies
Money is the root of all evil, until the collection plate comes around;money
how to get into shape: 1. punch a bear 2. run. this is your life now;fitness
A little boy with diarrhea tells his mom he needs Viagra. The mom asks, "Why on earth do you need that?" The little boy replies, "isn't that what you give dad when HIS shit won't get hard?!";medicine
What do you call someone who discriminates you for your oral hygiene? A dent*ist*.;discrimination
Why do geologists perform so well during intercourse? They really know how to make bedrock.;geology
Harry is a? Fucking WIZARD!;movies
On TV shows, answering machines are actually saying leave a message after the fuck.;TV
What do James Cameron and M. Night Shamylan have in common? Icy dead people.;movies
"So, doctor, do I have cancer or not?" "Oh Jesus Christ, holy shit, tons of it," said the doctor to Martin Shkreli.;medicine
Billy Mays is in heaven now... Billy Mays is up in Heaven partying like it's $19.99.;Heaven
Late to Fight Club Was late to my Fight Club last night so I missed the intro rules. I love Fight Club, I'd highly recommend Fight Club.;Fight Club
It's green but when you press a button it turns red. A frog in a blender.;Technology
Where did Napoleon keep his armies? In his sleevies.;Napoleon
I farted in a room full of hipsters.. then watched them fight over who heard it first.;Hipsters
I guess I prefer Subway because they make me feel like I'm making the healthy decision when I order a loaf of bread with 18 meatballs on it.;Subway
i'm the girl your mom warned you about... long nails, big eyes, purple tongue, green skin. i'm reptar. i'm reptar from rugrats.;Rugrats
Where did Napoleon keep his armies? In his sleevies!;Napoleon
What did the mermaid do last Saturday night? She went out with the tide.;Mermaids
Instead of sending friends Christmas cards, is it ok If I return the ones I got and just add the words "Me too"?;Christmas
The phrase 'lazy asshole' is an oxymoron... Because an asshole gets shit done.;Productivity
What do vegetables watch when they're horny? Corn;Vegetables
One of my favourite things is Pork Souvlaki on a Pita But it's hard to get the animal rights activists to stay still;animal rights
New low: Looking in my purse and seeing my TV remote.;purse
Thought I saw a walking burrito but it was just a pug in a raincoat.;burrito
What do you call a donkey that falls into a pile of sugar? A Sweet Ass (   );donkey
Cops are looking for a man who robbed a store using scissors. They say the guy could be a real danger--unless you have a rock.;crime
Can't believe my neighbors don't have any rum. How am I supposed to enjoy their hot tub while they're on vacation?;neighbors
People who try to beat you when walking into a store. No.;walking
I hate people who think it's cool to take drugs ...like customs officers;customs
Why kind of cigarettes do Hawaiians smoke? Mahalo bro lights.;cigarettes
Stop leaving me messages. If I ever wanted to talk to you again, I wouldn't have borrowed all that money.;messages
Me: *pouts at front facing camera* Front facing camera: I have a girlfriend.;camera
Flavor Flav turns 51 today. He'll spend a quiet day at home, still resting up after a weekend of moving clocks forward.;Flavor Flav
Why does Dr. Pepper come in bottles? Because his wife is dead.;Dr. Pepper
Ate a salad for lunch so basically I didn't eat lunch.;salad
What do you feed a disappearing cat? Evaporated milk;cat
"This birthday cake certainly is crunchy."  "Maybe you should spit out the plate!";birthday cake
Toilet stolen from police station Cops have nothing to go on.;police station
In honour of Back To The Future, I just went back in time one hour. That's the joke.;Back To The Future
How do you spot a blind man at a nudist colony? It's not hard.;blind man
[describing a chair] it's like a swing without all the drama;chair
The band The Doors have decided to change their name after the next member dies It's gonna be Three Doors Down.;The Doors
How much does a corpse weigh? A skele-ton;corpse
I'm pretty sure I have all of those countless hours spent playing Tetris to thank for my mad dishwasher loading skills.;Tetris
If you're behind someone at an ATM late night, let them know you're not a threat by giving them a gentle kiss on their  neck.;ATM
Kill me once, shame on me. Kill me twice, shaman you.;shaman
Chuck Norris never wet his bed as a child. The bed wet itself out of fear.;Chuck Norris
How does the moon cut his hair? 'Eclipse it Thought it was relevant to today's eclipse...;haircut
3 Old Women and a Flasher Three old women are sitting on a park bench when a man comes by and flashes them. Two of them have a stroke, and the third one couldn't reach.;flasher
Why did a man's pet vulture not make a sound for five years? It was stuffed.;vulture
I'm worried about my friend My friend has just be diagnosed as a Polaroid Schizophrenic. It developed quickly.;schizophrenia
Is your refrigerator running? Because if it is, I might vote for it.;politics
What do you call it when a Cat wins a Dogshow? Cat-has-trophy. Such punny. Much Cringe.;dogshow
I dont care or think about the people in my past... there is some reason why they didn't make it to my future!;past relationships
I figure I must be Bi-sexual. I have sex twice a year.;sexuality
What do we want? An end to auto-correct errors! When do we want it? Cow! Sow! Bow! Tow! Duck this!;auto-correct
Whats long, green, and smells like pork? Kermit's finger.;frog
TOP TEN REASONS WHY BEER IS BETTER THAN RELIGION;beer
Every time student loan rates double, the price of solo cups should get cut in half.;student loans
What do you call a herd of masturbating cattle? Beef Strokenoff;cattle
Did you hear about the magic tractor? It went down a hill and turned into a field;tractor
Why do Communists only drink coffee? Because proper tea is theft.;Communism
Man died after crushing against a mirror Witnesses said: "he saw it coming";Death
How do you catch a unique rabbit? Unique up behind it;Rabbits
I am sick and tired of women jokes!! period!;Women
Apologies your honor [slides ventriloquist dummy back under my seat] I was told these proceedings were going to be televised.;Court
People who say "in and of itself" are responsible for most of the trouble in the world.;Language
I didn't know what to wear the the premature ejaculators meeting... So I just came in my pants.;Premature ejaculation
My weather forecast is always "room temperature.";Weather
Another poor soul worked at a company making blankets. He lost his job when the company folded.;Job loss
Of course he's going to get re-elected, because once you go Black...;Politics
Any salad can be a Caesar salad if you stab it enough.;Salad
Made a hiking playlist earlier called trail mix It has a lot of eminem in it;Music
How do you tell who the extroverted engineers are? They're the ones who look at YOUR shoes when they talk to you.;Engineers
What do you call a tight asshole? a noose;asshole
Insomnia causes questionable browser history.;insomnia
Milk toast was probably named by same lazy guy that named the fireplace and waterfall.;food
If you want to set up and run a small company... ...that's your business;business
Everyone needs a three hour nap after their breakfast pizza, right?;food
My boyfriend and I are Cherokee Indians. He stood me up at our favorite restaurant last night... But it's OK. I don't think we could have stayed anyway, we didn't have a reservation.;relationship
How do you make Holy water? Boil the hell out of it.;religion
My wife's credit card got stolen and she doesn't know how... I do, I've been praying for a financial miracle.;marriage
Why did the noodles go to rehab? To get yakisoba.;food
Since I started dating my girlfriend a year ago I became a millionaire! 6 months ago I was a billionaire :(;relationship
What does Lamar Odom have in common with a hooker? Excellent ball control.;celebrity
How do you tell the difference between a meth head and a hillbilly? The meth head still has teeth.;social class
I walked in on my wife singing the other day. Surprised, I said "Oh, I thought you were the radio." Flattered, she asked "Did you come to listen?" "No," I replied, "I came to turn it off.";marriage
How does Darth Vader like his toast? On the dark side.;Star Wars
My girlfriend caught me cross-dressing So I packed up her clothes and left;Relationship
So I'm still newish around here... What are the rules about Canadians? Does everybody get one? Do I get to choose? Where do I sign up?;Nationality
What do you call a bowl full of leaves and epileptics? Seizure Salad.;Health
Instead of God, try worshipping a golf cart for a few years and see if it makes any difference.;Religion
What did Patrick Stewart say when he proposed to his wife? Engage.;Marriage
Animals that lose their tails visit the retail store.;Business
A girl walks into a bar and asks the bartender for a double entendre... so he gives it to her;Sex
A wavy guitarist has a low self esteem He just wanted to B-flat;Music
Tried to cash in on this kid joke thing. My daughter is a disappointment. Why did the skeleton cross the road? He didn't because he doesn't have skin and he just fell apart.;Parenting
No thanks resolutions, if I wanted to be reminded of everything I didn't follow through on at the end of the year, I'd get married again.;Marriage
Why does Germany have so many different kinds of bread? Well, we had to do something with the ovens.;Bread
Just finished painting my bedroom in under ten minutes using vinyl Surely that's some kind of record.;Painting
Q: How do spies send secret messages in a forest? A: By moss code.;Spies
What do you call a ghost with a broken leg? Hoblin Goblin.;Ghost
Why was the detective excited when he found a thimble sized crown? He was looking for Finger Prince. (Say it out loud if you don't get it.);Detective
Happy Greek Easter! Which Greek God loved to collect animals? Zoos;Greek Easter
I blame 2 of my 3 DUIs on Jesus because I specifically told him to take the wheel;Jesus
How did Darth Vader know what Obi-Wan Kenobi was getting for Christmas? He felt his presents.;Darth Vader
I'm pretty sick right now. You could say I'm feeling like Charles Lindbergh... Because I got the flu;Charles Lindbergh
What did one sick casket say to the other sick casket? Is that you, coffin?;Casket
I think it's been enough time to warrant a Star Wars spoiler... Yoda is dead;Star Wars
In hell, the thermostat is guarded by a bunch of dads.;Hell
What's the Difference between like, love and showing off?? Spit, Swallow and Gargle;Love
How many Freuds does it take to screw in a lightbulb? Two. One to change the lightbulb and another to hold the penis. ... ... ... Er... I mean... The ladder.;Freud
have to stop saying "how am i going to kill my way out of this one" everytime there is trouble going on, or at least not out loud;trouble
What did the sign convention management do to the woman who kept pulling down their long signs? Banner.;signs
What did Mr. Freeze do with his wife on their first date? Netflix and chill.;Mr. Freeze
What do you call a black man who flies a plane? [2 part] A pilot, you racist. What do you call a Japanese man who flies a plane? A pirate.;plane
Met a cute guy at the bar, gave him my number and told him to text me when he got home I guess he's homeless.;bar
A spider the size of a golf ball is in my kitchen so I guess this is my last tweet.;spider
someone using bare hands to put salad on a plate is letting you know they're not here for discussions about etiquette or anything really;salad
whats the secret service of Australia called? M8;Australia
I loaned my cell phone to Bill Cosby Now I can't get it to wake up.;Bill Cosby
What does a pirate call his idiot son? A retarrrrrd;pirate
i'm a homewrecker in the sense that i got sick out both ends in the attic and it soaked through the ceiling in 3 different rooms;homewrecker
I just met someone who was a steam-roller operator. He was such a flatterer.;steam-roller
As a kid I was forced to walk the plank... We couldn't afford a dog;childhood
*experiences all five stages of grief while the waiter walks by my table with what I thought was my dinner*;grief
I wonder if Asian people put smileys like this );asian culture
CNN: We're not sure but we'll report it anyway.;news
My laptop is so dumb. Every time it says "Your password is incorrect", I type in: "incorrect" and the silly thing still tells me the same thing.;technology
You smell like trash..... Can I take you out?;dating
Was gonna go to the gym but then I checked Twitter. In 2009;gym
What's the difference between a plumber and a scientist? Pronounce this word: unionized;science
Why couldn't the chameleon change colors? He had a reptile dysfunction.;animals
I saw my first porn yesterday I was so young back then....;childhood
Never buying anything home-made on eBay again... I bought an 'Irony Detector' off of eBay, but it was broken. It detected everything *but* irony...;ebay
Person one: Do you know that joke about the no and the me neither? Person 2: No? Person 1: Me Neither. Person 1: You didnt get it? Person 2: No Person 1: Me neither;ebay
Most people's religion or faith has a switch which they can conveniently switch on and off whenever it suits them.;humor
Leia: This is romantic Han: I know Chewie: Rwwar Leia: Does he have to be here? Han: It's a life debt. You're basically marrying us both;Star Wars
How many Harvard students does it take to change a light bulb? One. He holds it up and the world revolves around him.;Harvard
What do you call a baby seal between two slices of bread? A clubbed sandwich;Seal
I was dating an analog synthesizer But I had to break it off. She was just continuously variable.;Synthesizer
What Cell Phone Company does Usain Bolt use? Sprint;Usain Bolt
In god we trust Everyone else must pay cash;Money
Mick Jagger: Hey Keith, come hold my new baby. Keith holding baby, whispers to it: I'm going to out live you too.;Mick Jagger
My Wife asked me to stop singing Wonderwall... I said maybe..........;Music
A little boy walked into a police station "I lost my daddy" says the boy. "We'll look for him son, don't worry: what's he like?" asked the officer. "Liquor and women.";Father
Find someone who can make you happy, like a doctor or pharmacist....basically anyone who has access to mood-enhancing drugs.;Love
Did you hear about the scarecrow who won a Nobel Prize? He's out standing in his field.;Scarecrow
What kind of computer can sing? A Dell.;Computer
There are two hats on a hanger... The broken one says to the other: "You go on a head...";Hat
What's the key to long lasting Relationships? Not breaking up;Relationship
Why did the vulture get kicked off the flight? He brought the wrong carrion.;vulture
What does a man often wake with, but can never go to sleep with? An alarm, you pervert!;alarm
My clients have a 86% survival rate, which makes me an above-average babysitter.;babysitter
What do you call an alligator detective wearing a waistcoat? An investigator.;alligator
I come from a family of failed magicians I have 2 half sisters;magician
What did the neckbeard say while giving the eulogy for his extremely flatulent friend? Rip in peace;neckbeard
"Here's your cup of Joe" - Joe at the sperm bank;sperm bank
I bet when Hugh Hefner dies no one will say "He's in a better place now.";Hugh Hefner
What do you call a nomadic caveman? A meanderthal.;caveman
"I had the worst Cruise ever." - Katie Holmes;Katie Holmes
Why do I tell jokes in elevators? Because they're funny on many levels.;elevator
I want to study... the area below your curves... It is integral.;math
Two ducks are arguing in a bar about quantum physics... One turns to the other and says, 'Quark Quark' The other says, I'll have a Harvey Schrodinger, thanks'.;ducks
What's the difference between jam and jelly? I can't jelly my dick up your ass.;difference
My main job as a husband is to taste things that my wife thinks taste like they've gone bad and tell her if they taste bad.;husband
Two polar bears were sitting in a bathtub The first one says "Give me the soap". The second one says "no soap. radio".;polar bears
How many Chuck Norris' does it take to screw in a light bulb? None, no light bulb dare go out in the presence of Chuck Norris.;Chuck Norris
My wife caught me masturbating to one of those magic eye pictures. I told her it's not what it looks like;magic eye
Hi, my name's Ray. I'll be drawing your blood today as soon as I finish this Capri Sun. *misses hole 4 times then punches straw through bag*;phlebotomy
A Roman guy walks into a bar... He holds up two fingers and says "Five beers please!";Roman
TIL the musical group Ace of Base was killed in a horrific traffic accident after they missed their exit on the highway and crashed... Police later said, "they didn't see the sign...";Ace of Base
damn girl, you got a butt that WON'T QUIT *butt pulls out a knife* wait, no- *butt stabs me* no, stop- *butt doesn't stop* ...et tu, bootay;butt
The thing about boats... If we don't bow, everyone gets stern.;boats
Urban Outfitters: the most expensive way to look poor.;Urban Outfitters
Bet I could breathe more air than you, bro;breathing
My uncle performed circumcisions... He kept all the foreskin and had a tailor make it into a wallet. Rub it for 5 minutes and you get a briefcase.;circumcision
I do not need to have a threesome... ... if I want to disappoint two people at once, I go to dinner with my parents.;threesome
Now that the Olympics are over, Michael Phelps can finally be released back to his natural habitat the couch with a bong.;Michael Phelps
What did the cold pipe say to the to hot pipe? Nothing,pipes can't talk. Thank you;pipes
New TomTom voice over I got a new TomTom and changed his voice to Chewbacca. Left is BRRRRRRRRRRR and right is BRRRRRRRRRRR And when I'm at my distination : i still dont know;TomTom
Whats the difference between a BMW and a porcupine? On the porcupine, the pricks are on the outside.;BMW
My friend got drunk and thinks he had sex with a prostitute... At first he wasn't sure, but then he was *positive*.;prostitute
What's a pirate's favorite letter? You might think it's R but his first love will always be the C.;pirate
A mother called the police on her 6 month old baby for not taking a nap. He was resisting a rest.;baby
What do you call a group of Japanese people running up a hill? Tsunami Warning;Japanese people
Dodged the bullet A girl asked me today if she is wearing too much make-up. I told her my reply depends on whether or not she intends to kill Batman.;make-up
For a very short period of time, you were the youngest person in the world. #mindblowing;age
What kind of pizzas can tell the future? Medium Pizzas;pizzas
Whenever I put on my Ocean Pacific (op) pants I feel I must say something meaningful.;Ocean Pacific pants
If looks could kill, I'd still use a baseball bat.;looks
If you want to relate to how old people probably feel just imagine that a bowl of soup cost $40 and everybody else acted like that was fine.;age
Two Scotsmen walk past a baker One turns to the other and says 'Is that a cake or a meringue?' The other replies 'no you're right, it's a cake';Scotsmen
What's the difference between a normal pirate and a sexy pirate? The type of booty they plunder.;pirates
Doctor: *taps knee with mallet* feel that? Me: No Doctor: or this? *jabs toe with a pin* Me: Nah Doctor: Just as I suspected. This is my leg;doctor
Why is Forrest Gump as a young boy without his leg braces like a Samurai without a master? Because everywhere he went, he was Ronin! HAHAHAHAHAHAHA! I'll see myself out...;Forrest Gump
what did the kiwi statue said to the other kiwi statue? statue bro?;kiwi
turkey went out of the frying pan and into the fire only for Putin to put them in the oven;turkey
Why did the sperm cross the road? I put on the wrong sock this morning :(;sperm
How many teenagers does it take to screw in a light bulb? Whatever.;teenagers
If I have 5 apples and Jamal take 3, what color is Jamal? Admit it, you're a fucking racist!;apples
Tried to take a photograph of some fog Mist;fog
If you don't pay your exorcist You get repossessed;exorcist
Sex Joke So an egg walked up to a sperm and said, "You cum here often.";sex
How long do you think it will take for gays to find out? That a gay marriage is as much an oxymoron as a gay funeral?;marriage
Patron: How come this fly is swimming in my soup? Waiter: I gave you too much. It should be wading.;food
What do you call a black guy who flies a plane? a PILOT, you fucking racist!;racism
CNN got really excited about the #TransAsia plane until they found out it's not missing so now they don't care.;news
I see dead people. No wait, I take that back. I see people I want dead.;death
One woodworm met another. "How's life?" she  asked. "Oh same as usual" he replied "boring.";life
Some days I want to leave everything and just run away with him. Other days I want to own 3 baby dragons and be fireproof and naked.;fantasy
I saw a chameleon today. I guess it was a pretty crappy chameleon.;animals
What's that thing called when your crush likes you back? Oh yeah. Imagination.;crush
What cars do wolves drive? Auuuuuuuuuuuuudis!;cars
What to toilet paper and the starship enterprise have in common? They both circle Uranus looking for Klingons;space
The soul weighs 21 grams. We know this because the Jurassic World film reels are 21 grams lighter than Jurassic Park;movies
South Africa;location
If the lever on your toaster breaks off and your bread starts burning, can you pry it out with a butter knife? The answer may shock you.;toaster
