"Joke";"Joke topic"
#hashtag From the stoners who brought you "420" and "hella" comes the hot new game Hash Tag!! cause, i mean, come on...regular tag just isn't that fun.;stoners
How did the desk lamp store manager feel when thieves stole all his lightbulbs? He was delighted.;desk lamp
I got arrested for saying "Hi!" to my friend Jack The Air Marshall doesn't screw around;air travel
What do Islamic McDonalds employees wear? A cheeseburka;Islam
I went to Africa and spoke with the people there... It just clicked.;Africa
[Next door dog barking] Me: *inserts earpugs* [Barking intensifies] Me: wtf................haha oh *removes earpugs and inserts earplugs*;Noise
I don't get this joke A guy woke up after being frozen for 1000 years, someone asked how he felt and he said he was okay with an emphasis on the o;Time
Kim Jong died. I guess you could say he was a little il.;Death
what happens when you die? I've seen much scientific and spiritual literature researching and explaining what happens when people die. I've found that generally, they get put in the ground.;Death
Did you hear about the murder mystery porno? In the end, everyone did it.;Porno
Explain joke What is a bee's favorite game? Hive and seek;Bee
My six year old lost a tooth. I left a note instead of money "too dirty." He has been brushing that one tooth all day. Lesson unlearned;Tooth
There isn't such a thing as a communist school is there... They're all in classes?;Communism
My girlfriend and I were making out on the sofa. Her: Ok let's take this upstairs. Me: Alright. You lift one end and I'll get the other;Relationship
What kind of ears do trains have? Engineers (engine ears).;Train
About 90% of people do not know the opposite of these words... Always Coming From Take Me Down;Knowledge
How many politicians does it take to screw in a lightbulb? You hold the lightbulb and every politician screws you!;Politics
WATER POLO INSTRUCTOR: "Are you sure you know what you're doing?" ME: [Adjusting the mask & snorkel on my horse] "Of course I do.";Water Polo
A guy told me he didn't have a penis I doubt he gets cocky often.;penis
What is the only thing more permanent than a Sharpie marker? A STD.;STD
Why did the tomato blush? Because it saw the salad dressing!;tomato
They should hire people to stand in Times Square and yell "WALK FASTER!";Times Square
"Hello 911?" "Someone just stole my status on Facebook... yes, I'll hold.";Facebook
Little boy: "daddy, I want to be a Men's Rights Activist when I grow up" Dad: son, don't grow up to be an irritating wuss;Men's Rights
Where can you always find money? In the dictionary.;money
What does Santa suffer from if he gets stuck in a chimney? Claustrophobia!;Santa
Pirate, land lubber Yarrrr, Why be it that land-lubbers are never confident? For they are always on shore...;pirate
If you believe in God, yet you can't believe it's not butter, then your faith needs to get its damn priorities straight.;faith
*lives in a crumbling democracy on a slow terrible decline* hellll yes who just got two green lights in a row;democracy
Why was 6 afraid of 7? Because 7 shot up a school;school
doctor: "is there anything that runs in the family?" wife: "hm not really" me: "the dog jogs a lot";family
My cat went missing, so I put up posters of myself that says... "If you're reading this, you better get your ass back home right now!";cat
I get a lot of compliments on my stamp collection but philately will get you nowhere.;philately
Sign language is a pretty handy skill;sign language
The other day I found two gold bars. I've always dreamed of an Au pair.;Au pair
Toy inventors make the best writers They have many novel ideas.;writing
Just watched some Midget Wrestling. It was a short fight.;wrestling
Doctor Doctor I feel like biscuits! What you mean those square ones? Yes! The ones you put butter on? Yes! Oh You're Crackers!;biscuits
Have your people call my people but keep in mind that my "people" are just stuffed animals with cordless phones glued to their necks.;communication
Aerosmith guitarist Joe Perry was *rear ended* this morning. Now I understand why he Walks This Way.;Aerosmith
Someone broke into the police station and stole all the toilet seats The cops had nothing to go on;police
I love salad! Just wish it had the taste & texture of pizza.;salad
Why do console gamers use their in game names in real life? They haven't got anti-aliasing.;gaming
So, a squirrel walks into a bar- -k;squirrel
What do we call of spill of the world's most abundant resource? A sunny day.;resource
My wife just bought a $50 bottle of shampoo. So guys, party at my house this weekend because apparently we won the Lottery!!!;shampoo
What do calenders eat? Nothing. Calenders are inanimate objects that are used to keep track of the date and important events.;calendars
Thank you automatic ice dispenser. I was hoping to get either 2 or 675 ice cubes.;automatic ice dispenser
why do indians hate snow? because it is white and on their land;indians
Life is like a bed of roses. You just have to watch out for the pricks.;life
[out to eat with in-laws] Me: Waiter, your cheapest bottle of champagne Wife: Hey these are my parents Me: Waiter, 4 glasses of tap water;in-laws
Just once I'd like to yell, "Don't you know who I am?!" because I'm important, not because I'm drunk and actually forgot.;importance
When someone describes themselves as a "foodie" I automatically assume they shit a lot.;foodie
Mom, can I have another piece of pecan pie? "You mean MAY, not CAN" Ok, mom can I have another piece of pemay pie?;pie
My wife has a book on homeopathy I've only read the blurb on the back, but I think I know everything I need to know about it.;homeopathy
FACT: Uma Thurman is the only person to ever have been named by someone with a mouthful of food.;Uma Thurman
Why was number 6 scared of number 7? Because 7 8 9!;numbers
So, how do you like your job as an elevator repairman? Meh, it has its ups and downs;elevator repairman
My English professor had a colonoscopy... Turns out he had colon cancer so he had to have surgery to remove the tumor. Now he has a semi-colon.;colonoscopy
Did you hear about the stupid  Kamikaze pilot ? He flew 57 missions !;Kamikaze pilot
I just burned 2000 calories. That's the last time I leave brownies in the oven when I take a nap.;Baking
I was feeling a bit down today... So I breathed some helium. It picked me right up!;Helium
Whenever the wind gets bad... I think to myself, "It may be windy but at least its not sandy.";Weather
Good in bed? So I was asked by a girl recently if I was good in bed. My reply: "I know I'm good in bed because I'm always satisfied!";Relationships
Garbage day. When you find out which neighbors are drunks by how many bottles they throw out holy shit this one still has something in it.;Garbage
People thought I was crazy when I said I was going to cure blindness. But they'll see. They'll all see!;Blindness
Did you hear about the salad who went missing? All they found were its chard romaines;Salad
I'm deathly afraid of elevators. I take a lot of steps to avoid them.;Elevators
Guy walks into a bar Metal bar. Ouch;Bars
Are you getting older and wiser? No he's getting older and wider!;Aging
"son, did i ever tell you about how I served in Nom?" "dad, don't you mean Nam?" "sorry son i ate a small cake at the end of that sentence";War
Sorry, I'm using all 43 grocery carts. Use a basket.;Shopping
I'm the Spare Queen All I know is how to make a mess and then make sense of it.;Royalty
Why did the hipster burn his tongue on his coffee? He drank it before it was cool.;Coffee
This year for Lent, I'm giving up;Lent
When someone asks me where I see myself in 5 years... I dunno...I don't have 2020 vision.;Future
People who pronounce didn't as."dih-in't" please doh-on't.;Pronunciation
what did the depressed monkey say when his tail went through the lawnmower? It won't be long now...;Monkey
Where did the terrorist go after the explosion? Everywhere..;Terrorism
Man, speaking (in heavy Scottish accent) to policeman, "But, officer, it said laddies on the door.";Scotland
I'm German and Jewish. I hate myself;Identity
Beefy right wing joke The maniacal right wing, cow-worshipping saffron brigade in India...is it true they never hold a beef against someone?;Politics
what is a ghosts favorite lunch meat? Boo-loney :D;Ghost
To watch a reality show about a restaurant is to realize how much chef's head-sweat you've eaten in your life.;Food
They say sex after marriage is not the same. My sex life is like the Olympics! Happens once every four years, costs me lots of money, &amp there's usually a big fight afterward.;Marriage
What does earth say to the other planets? You have no life;space
Enter new password <glovebox> Must contain number <glovebox1> Must contain PHONE number <no> Please ) <no u creep> Password not recognized;password
So I was at a book store the other day and I saw a Vietnamese cookbook... It was called "How to Wok Your Dog".;cooking
The best writerly advice is to start each paragraph w "Here's somethin for ya!" as the reader is now engaged & will follow you anywhere;writing
Anybody who says they could never conceive of killing another human being just needs to meet more people.;murder
I got a new cat from the inner city shelter. So far he seems fine, except for needing to go outside every hour for a cigarette.;cats
Why is 6 afraid of 7? because 7 is a registered sex offender.;numbers
The older you get the less people you can actually tolerate. I can tolerate about 5 people right now, 3 are my children and even that's iffy;aging
She's like a cat. I don't mean in bed, she just ignores me;relationships
You've failed history again ! Well you always told me to let bygones be bygones !;history
When they announced Ashley Madison was made up of almost all guys... I realized the internet really is a series of tubes.;Ashley Madison
What is orange and sounds like a parrot? A CARROT;carrots
When you're enjoying your Chow mein.. ..but you miss your dog.;dogs
Why does the NSA hate the winter? They got snowed in.;NSA
Where are you only allowed to swim if you have red hair, a lip piercing, three brothers, a missing finger, are slightly overweight and have a birthday in december? The specific ocean.;Redheads
Remember: if you see a tie on my doorknob, it means I'm taking the door to prom;Prom
in 2001 i was in a coma dying from meningitis and someone played "in the end" by linkin park and i woke up to tell them to turn it off;Linkin Park
Sockets What did one socket say to the other? Stay grounded.;Sockets
The Vatican just deleted all the Pope's tweets. Because NO ONE denies reality like the Catholic Church.;Catholic Church
Whats a mans favorite word that starts with 'm' and ends in 'arriage'? A miscarriage! This joke never gets old, just like the baby!;Marriage
A double amputee has escaped from the mental asylum I wouldn't worry too much, he's armless.;Amputee
Christianity One woman's affair which got out of hand.;Christianity
My ceiling fan has three setting: - very slow - slow - I'm about to detach from the ceiling and kill you in a freak ceiling fan accident;Ceiling Fan
Why couldn't Snape be a Herbology teacher? Because he wasn't able to keep the Lilies alive.;Snape
What is the collective noun for a group of depressives? A melancolony;Depressives
I wanted to make a joke about a Russian airplane... ...but it'll probably get shot down;Russian Airplane
How you heard about the new bad breath removal strategy? They call it the tic-tac tactic.;Bad Breath
Why do indegionous people dislike snow? Because it's white and settles on their land.;Indigenous People
Do you hear about the 2 Irish gays? Michael Fitzpatrick and Patrick Fitzmichael.;gay
Shopping with girlfriend, she says, "let's go down this aisle." Me - K. Why? Her - It's a surprise. Me - K. Why? Her - Just grab that. *points* Me - K. Why? Her - KY. Me - K... Her - Y.;shopping
Something you may have in your house right now could be killing your children. We'll tell you about it in 2 days. - Local News;local news
A man shot himself in the head at an NRA sponsored NASCAR event... while the GOP shot themselves in the foot on the NRA sponsored gun bill. (Jokes for the week of 4/13-4/19 @fridayupdate on twitter.);politics
*Runs fingers over Braille calendar* Is this a date? It feels like a date.;dating
Infidel. It's where I want to be, thanks to my fetish for Cuban politicians.;politics
What do they call a meeting among the most  brilliant people in Burger Land? A MEATing of the minds!;burger
Gym Joke A guy who newly joined a gym asked the instructor which was the best machine in the gym which will make him attractive to girls. The instructor replied,"the atm";gym
What's 18 inches, stiff and makes girls cry all night? Cot death;death
Yesterday, a clown held a door open for me... I thought it was a nice jester...;clown
An avocado-wife is giving her husband the silent treatment Husband: "I said you were the good kind of fat!";avocado
Gypsy marathon: runs to a lake, swims, bikes back;gypsy
Ordering a cake over the phone "And what would you like the cake to say?" [covers phone to ask wife] "Honey, do we want a talking cake?";cake
You get an ark! You get an ark! You get an ark! You get an ark! You get an ark! You get an ark! -Noahpra;Religion
What's a feminist's favorite rapper? Feminem;Feminism
My friend told me "the first stage is grief" "Isn't it denial?" I replied. "No, not for me";Grief
Chicago wins World Series for first time since 1908 In other news, Chicago burns to ground for first time since 1871.;Sports
I've just been diagnosed with a chronic fear of giants..... Feefiphobia;Giants
"Tim's coming tonight" "Tim with hooves for feet or Tim that likes to bang coconut halves together?" [in the distance] clip-clop clip-clop;Unknown
What did baby corn say to mumma corn? Where's popcorn?;Puns
The janitor's union called for sweeping reforms.;Puns
What does a Boko Haram terrorist become after getting his throat slit? Boko Halal.;Terrorism
I thought about going to a psychic, but then I started having doubts and changed my mind At that moment I received a text message that said "Well, that's too bad";Psychics
There once was a man from Nantucket... who didn't know what a limerick was.;Puns
I can tell by the way you give me instructions that you've dealt with a lot of dumb people before me.;instructions
shops have changed so much. In my day you could go in with a pound and get a bag of crisp and a magazazine now days they have cameras;shops
"I just can't control myself around you" - Me talking to a homemade batch of cookies;cookies
My black friend was told he couldn't run in the boston marathon Bunch of racists.;marathon
Just remember ...if the world didn't suck, we'd all fall off.;world
How was the red sea made? Over a very long period;sea
The phrase 'balls to the wall' was originally conceived to describe Chuck Norris entering any building smaller than an aircraft hangar.;ChuckNorris
What do you call alcohol in a birdbath? Tequila Mockingbird!;alcohol
In the new version of Star Wars, Harrison Ford slowly flies the Millenium Falcon in the left lane with the turn signal on;StarWars
The Rocky Mountains Ever since Colorado passed amendment 64, legalizing marijuana, there have been talks of renaming the Rocky Mountains to the Stoney Mountains.;mountains
How is it that magic carpets are able to fly? They are powered by turban engines.;magic
I had a piece of Carefree sugarless gum ..and I was still worried! It never kicked in!;gum
Congrats to the person that invented the wobbly restaurant table. It's basically everywhere now.;table
Olive Garden waitress begins to freshly grate cheese onto my salad. I never say when. Room fills with parmesan. No one survives.;Cheese
Where did the drug addict keep his food and dishes? The potry;Kitchen
The worst thing you can be is gullible My friend told me that means you're prone to random attacks by seagulls;Gullibility
2 peanuts were walking down a dark alley one was assaulted;Peanuts
If I had a dollar for every gender I could possibly be... I'd have $2.00.;Gender
[two hours into describing a criminal to a police sketch artist] ...But when he took off the mask, he just looked like a normal guy;Crime
I once put a baby in adult clothing and placed him on my desk with a water bottle labeled "fountain of youth" right next to him.;Parenting
How far do burgers go in school? Through cowlege (then they get their 450 degrees!).;Education
Why can't a T-rex clap? Because there extinct.;Dinosaurs
It's weird that on this date in Back to the Future they didn't show people incessantly posting about Back to the Future.;Social Media
My initial goal is to get really, really fat and be a contestant on The Biggest Loser.;Weight Loss
Have you ever had Ethiopian food? Neither have they;Ethiopia
What's black and hard? Cast iron.;Cast iron
Sleep tight! And if you should die before you wake -- did you clear your browser history?;Browser history
Laughing at your mistakes could lengthen your life. Laughing at your spouse's mistakes WILL shorten it...;Marriage
Why does Santa come only once a year? (Its not the chimney one) Because it's all his sack can handle;Santa
An Italian classics professor... ...goes to a tailor to get his trousers mended. The tailor asks: "Euripides?" The professor replies: "Yes. Eumenides?";Classics
I had a friend who thoroughly hated music... He left no tone unspurned.;Music
What do you get when you cross a Mexican with an octopus? I don't know, but it sure can pick strawberries.;Mexican-octopus
Why'd the seaman cross the road? Because I wore the wrong sock that day.;Seaman
I would like to think money won't change me, but I won $5 on a scratch-off lottery ticket and immediately bought name brand aluminum foil.;Money
Patient: Doctor what should I do if my temperature goes up five more points? Doctor: Sell!;Health
Welcome to the jungle. My name is Axl Rose. I think you'll find we run a pretty good jungle here. There's the toilet *points everywhere*;Jungle
What did the Illuminati say when they tried to read someone's mind, but failed to do so? "Curses, foiled again!";Illuminati
What happened after Hitler dyed his hair blonde? He became a Super Aryian.;Hitler
Apple was going to make a smaller version of the ipod touch for kids, until they realized the name iTouch Kids wasnt an acceptable name.;iPod
Why do men float? 'Cause they're all scum.;men
"This is gonna be so awful, and everyone's least favorite, yet .0001 of the population will keep it in demand." - Inventor of licorice;licorice
What's the difference between George Michael and Carrie Fisher? Two days.;George Michael
Why can't you put two dicks in one condom? Because it's too hard...;condom
How many ears does Daniel Boone have? He's got a right ear, a left ear, and a frontier.;Daniel Boone
My wife asked me "What's on the TV?"  - I said "Dust!";TV
[love making] Her: [leans in] "do that thing you know I like." [i cease to exist] Her: "yeah baby.";love making
I'll pleasure you in ways you never thought possible like vacuuming and doing dishes;household chores
How many cops does it need to change a light bulb? None, they just beat the room for being black.;cops
Just saw a bug change its mind about going into a McDonalds.;bug
What is the opposite of progress? [](/colgatereally)Congress.;Congress
Did you hear about the zombie that went vegan? He called his decision a no-brainer;vegan zombie
A met a girl with 12 nipples Sounds weird. Dozen tit?;Women
I think I have a premature ejaculation problem it seems to come out of nowhere.;Sex
Good jokes What did the doctor say to the airplane that has canser? It's terminal.;Cancer
Marriage is the main reason for divorce.;Marriage
I had a good Jeremy Clarkson joke... But I forgot the punchline... Then it hit me!;Jeremy Clarkson
The problem with money is too much of it belongs to people who aren't me.;Money
Did you know a man gets run over by a car in New York City every five minutes? Whoa, he should really get out of the road!;New York City
I always found the movie "The Exorcist" confusing... It made my head spin.;The Exorcist
Doctor Doctor When I press with my finger here... it hurts and here... it hurts and here... and here... What do you think is wrong with me? You have a broken finger!;Doctor
How do you start a rave in Ethiopia?  You staple food to the ceiling.;Ethiopia
I don't know why everyone is suddenly talking about Twerking... My mate from Yorkshire has been doing it for years. As he says, it's how he gets t'money t'pay t'bills.;Twerking
What's the most awkward U.S state? O....Hi!.....o.....;Racism
Two guys walk in to a Bar First Guy orders an H2O. The Other Guy orders H2O too. The Other Guy dies.;Bar
Today's date: 4/9/16 2 squares/3 squares/4 squares 4/9/16;Math
What do you call a joke about oral sex? Pun-ilingus.;Oral Sex
I retweet to avoid any awkward silences between tweets.;Twitter
Did you hear about the guy who swam the English Channel with no arms or legs? They call him... *'clever dick!'*;English Channel
Why did the man smoke a cigarette in Beijing? To get some fresh air;Beijing
I just saw Avatar and I've got one thing to say: Blue Man Group ROCKED!;Avatar
The best way to get a job is to hold the other person's hand through the interview. If you don't get hired, no worries. You made a friend.;Job Interview
Why did the germ cross the microscope? To get to the other slide!;Microscope
What is Vladimir Putin's favourite drink? White Russian, Straight;Vladimir Putin
I consider myself Christlike in that I refuse to believe my parents ever had sex with each other.;Jesus Christ
[g/friends dad] "who in your opinion is the greatest football player of all time?" Me - [say a real name say a real name] "Football Man";Football
So I bought a fragrant candle the other day, but when I lit it nothing happened... It just didn't make scents.;Candle
Why don't Mexicans cross the border in groups? Because the border says "No TRESpassing";Mexican Border
So a police officer is called out to the scene where a Mercedes is wrapped around a tree, He said "Well, I guess that's the way the Mercedes Benz";police
What kind of grass do cows like most? It's a moot point!;grass
My dentist offered to give me dentures for only a dollar. It sounded like a good deal at the time, but now I have buck teeth.;dentist
I put Red Bull in the hummingbird feeder. I'm pretty sure I just saw one go back in time...;hummingbird
coding humor 1 +1 ___ =10;coding
I went to the doctor's office the other day And he told me, "you've got to stop masturbating so furiously." I responded, "why, doc?" He angrily responded, "because, I'm TRYING to examine you.";doctor
Someone stole a kitchen utensil from my house He said it was a whisk worth taking;kitchen
Just heard on the news about the 1993 luggage murder. Apparently the police are reopening the case;luggage
What do you call a fake noodle? ...*dramatic pause*... An imPASTA!;noodle
In Russia, Vladimir Putin has said that the killers of Nemtsov "will be ruthlessly hunted down." He added, "It's cheaper than paying them";Russia
Imo everyone should consider organ donation Ahhh actually I've had a change of heart;organ
Armageddon... ...tired of all these Rapture jokes.;Armageddon
I'm celebrating 200 years of the buffalo. It's the bison-tennial!;buffalo
Profanity is unnecessary and fucking stupid.;profanity
What is a Minnesotan's favorite state to vacation in? It's Alaska, don'Juneau.;Minnesota
Recent studies have shown that 6 out of 7 dwarves aren't Happy;Dwarves
Someone accused me of spending too much time on the Internet. I don't know what to say. I am so full of emoticons right now.;Internet
What do you call a group of 8 hobbits? a hobbyte Cortana told me that joke;Hobbits
Two blondes are in geography class together... One asks the other "Which is closer, London or the moon" The other replies "The moon, obviously, can you see London?";Blondes
I once dated a girl who got in a car accident and lost her whole left side. Shes all right now.;Women
Have you heard the rumor going around about butter? Never mind. I shouldn't spread it.;Butter
I changed my wifi name to "14.4k dial up connection" so no one would bother stealing my signal.;Wifi
Kadala of Diablo 3;Diablo
When does it Rain Money? When there's a change in the weather.;Money
I would never let my kids watch the orchestra, too much sax and violins.;Orchestra
I got sent out of class today at school. The teacher yelled at me, "What would your parents say if I called them?' I replied, "Hello?";School
Why do I hear noises? (Teacher) "With all this talking I assume you are done with your work" (Student) "And with all this complaining I assume you're single";School
A married couple were fighting... ...when they drove past a farm full of pigs. The husband then asked his wife, "Family of yours?" The wife looked at the pigs, then replied, "Yea, in-laws.";Marriage
Why does a Belgian take a stone and a flashlight to bed? The stone to throw the lights out, the flashlight to check if the lights are really out;Belgian
What did the elephant say to the famous  detective ? It's ele-mentary my dear Sherlock !;Elephant
What happens when Batman sees Catwoman naked? The Dark Knight Rises.;Batman
My dog said "woof" so I said "woof" & now I'm afraid of what I may have agreed to.;Dog
I wonder what will be bigger The video games of the future or the average Tumblr user;Video games
Jared from Subway ended his career the same way he started it. Trying to get into small pants.;Jared
Paula Deen reportably has type 2 diabeties. Any word on she's serving it with butter?;Paula Deen
Got any spare change? No, Im an athiest. Can you give me a hand? No, Im an athiest. Hows the weather? Sorry, Im an athiest. - Athiests;Atheist
If I was an origami penguin, where would I hide?;Origami
How did the aquarium win the battle? Giant Fish Tanks.;Aquarium
Michael Phelps won his 21st olympic gold medal. You could say he's swimming in them!;Michael Phelps
Can a ninja throw a star? Shur-he-can!;Ninja
