"Joke";"Joke topic"
A love letter to my iPhone The apple of my I;technology
Why don't Nazi's like strip clubs? Because, they don't like Poles.;nationality
Doctor doctor I think I've been bitten by a  vampire. Drink this glass of water. Will it make me better? No but I'll be able to see if your neck leaks.;vampires
You get a fish bite! You get a fish bite! You get a fish bite! You're all getting fish bites! - OPiranha;fish
How do I explain to my dog tonight that thunder isn't the all powerful god of canine destruction searching for him with every boom;thunderstorms
Pac Man is my favourite video game about my life. It keeps getting harder and I can't stop eating everything in sight.;video games
My parents won't say which of their six kids they love the best, but they have told me I finished just out of the top five.;family
Driving isn't even in the top 5 things I'm thinking about when I'm driving.;driving
My Girlfriend is writing a book about menstrual cycles. It's a period piece.;menstruation
Waiter your tie is in my soup! That's all right sir it's not shrinkable.;waiter
Why are shoes always tied in the ghetto? Because if not, you always be trippin nigga.;shoes
A lot of people don't realize that Shania Twain's father, Mark, was actually a pretty good writer.;Shania Twain
What's got two wings, a tail and twenty five pricks? England's return flight.;England
I don't like jokes about midgets... ...they're low-hanging fruit.;midgets
What did the house say to the other house when it fell on it. Get off me Homes.;houses
A skeleton walks into a bar... and he says to the bartender... "Give me a beer and give me a mop!";skeleton
What did I do before Twitter? Well, there's my family and......OH MY GOD WHERE'S MY FAMILY?!?!;Twitter
I saw a dramatic comedy about a guy with PbA. The plot was confusing... I didn't know whether to laugh or cry..;PbA
Me? Need a Bag? Nah chill son, Ima juggle this 6 pack of beer and watermelon on my head while riding a scooter.;juggling
I once went 11 years without Masterbating... Then I turned 12;puberty
What's it called when a Roman sees too many flashing colors? A Julius Seizure.;Roman
I joked at school drop off that the white stuff on my kid was powdered sugar, not cocaine, but I took it too far by rubbing some on my gums.;parenting
I'm still waiting for the episode of Extreme Home Make Over where they demolish a hobo's cardboard box and build him a crate...;casting couch
How many Mexicans does it take to change a light bulb? Just Juan.;home
Bernie Sanders Draws 28,000 in Portland Rally I never would have guessed he was such a talented and quick artist.;Mexicans
'Failed to send tweet,' is Twitter's polite way of saying, 'Dude..';Bernie Sanders
Q. How can you tell if someone is half Catholic and half Jewish? A. When he goes to confession he takes a lawyer with him.;Twitter
What's the best part of being a lesbian in 1912? Both got seats on the titanic's lifeboats.;religion
most people don't realize that chickpeas only get $0.79 for every $1 a manpea makes;lesbian
What do parliament and Ukrainian skies have in common? They're both raining bodies;computer
Russian Cosmonauts have been banned from telling jokes on the Interational Space Station... ... because they always involve Mir puns.;politics
Guys I finally came up with a name for our character: Spongebob "Perfect!" Thanks "What's his last name?" Oh, uh- *looks at pic* Squarepants;Russian Cosmonauts
Why do they make condoms with ribs? So you can get traction in the mud.;Spongebob
Kissing is like peeing your pants Everyone can see it but only you can feel the heat;condoms
The sculpture of Amelia Earhart in the Burbank airport doesn't give me that warm fuzzy feeling before flying.;kissing
What's the resemblance between a bungeejump and a african whorehouse? If the rubber blows, you're dead;Bungee jump
1-year-old: *shrieks repeatedly* Me: Why is she so loud? Wife: That's how she talks. Apparently she speaks fluent pterodactyl.;Parenting
Dad, is that dog over there a wiener dog? Son, with enough peanut butter every dog is a wiener dog.;Dogs
Apparently my 6yo old son went to school with a Spiderman costume under his clothes. The students of Edison Elementary are safe today.;Parenting
I suffer bloating for years until I found this one secret supplement! "rotten eggs";Health
A fat guy walks into a bar [deleted];Driving
'Sorry officer but how was I to know that weird noise my car was making was a bicycle stuck in my mudflap?';Redheads
One-Liners The attraction to redheads is a lot like being addicted to drugs.;Technology
I just misspelled a word so bad that auto correct blew milk out its nose.;History
If i could give any advice to hitler... Auschwitz should have been the first thing you made.;Marriage
Hell is having a married couple tell you a story at the same time.;Parenting
Last night my girlfriend fell asleep before me, so I decided to lick her pussy until she woke up. This morning she asked why the cat seemed afraid of me.;Cats
what happens when you pop a cherry? she starts crying;Cherry
How do you top a car? Tep on the brake, tupid!;Car
Knock Knock Who's there ! Arson ! Arson who ! Arson McCullers !;Arson
Where do dads keep their jokes? In their dadabase.;Dad
How many psychologists does it take to change a light bulb? Only one, but the light bulb has got to *want* to change.;Psychology
Based on my search history, Google suggests: A social life;Google
How are rookie marathon runners like people with erectile dysfunction? There both just honestly happy to finish;Marathon
What mental disorder did the serial killer who stabbed his victim 23 times have? OCD.;Serial Killer
My wife has just left me, taking my satellite dish and Bob Marley collection. No woman, no Sky.;Marriage
Don't waste electricity. How would you like it if I turned you on and walked away?;Electricity
*Buys map of world, pins it up on wall* *Throws dart, swears to visit wherever it lands* *Visits the middle of the Atlantic Ocean*;Travel
What's a snakes favourite flower ?  Coily-flowers !;Snake
"WHO WANTS A PIECE OF ME?!?" - Jesus, at the first Communion.;Jesus
Request: Gimme your best white people jokes. Why does everybody else get the brunt of the jokes? Let me hear something different.;Racism
What did the nun say to the priest? Shut up;Nun
I try not to criticize those who practice incest After all, it's all relative.;family
It's a funny old world we live in. Once we had empires run by emperors, then we had kingdoms run by kings. Now we have countries...;government
I dont always roll a joint... But when I do its my ankle.;drugs
People who ignore your texts are probably just busy looking at pictures of you. Keep trying. It's not weird;social media
When will Smith die When Will Smith die we will call him Was Smith?;celebrity
Me in HR: I wasn't trying to be condescending... It's just that the boss didn't understand and I thought the puppets might make it clearer.;workplace
What do you call a sexually-confused Arctic Circle? Bi-polar;geography
What did Hitmonlee say to Hitmonchan when he said he said his jokes sucked? "I'm sorry , I'm not very good at executing punchlines.";video games
Barakaysan la hadal sida Maalinta burcad ah!;language
If Olive oil is made from olives - baby oil made from what? *is;food
Engineers How do you tell if an engineer is an extrovert? They look at *your* shoes while they talk to you.;engineering
Vader: I'll teach you the Death Star's power Leia: By blowing up my planet? Vader: By showing you a PowerPoint presentation Leia: NOOO!!!;movies
Q: What does a proud computer call his  little son? A: A microchip off the old block.;computers
[at the gym] Trainer: "Why don't you tell me what your workout goals are." Me: "Goals? I'm just here so I don't eat for an hour.";fitness
Well well well if it isn't the kangaroo whose pouch I'm in.;Microsoft
A woman calls the nursing home to see how her father is doing... 'He's like a fish out of water.' 'You mean he's having trouble adjusting?' 'No, I mean he's dead.' -Mike Close-;Kangaroo
Why is #Windows10 releasing before nine? because 7 8 9;Nursing Home
12: Dad, if Mary gave birth to Jesus and Jesus is the lamb of god, didn't Mary have a little lamb? Me: And you came with a no return policy;Windows
I got attacked by a yob with bat down the local park yesterday.. I was really impressed with how well he had it trained;Bible
In the beginning ... God created the world, and rested. Then God created man, and rested. Then God created woman. Since then, neither God nor man has rested.;Bat
What room does a ghost not need? A living room;Midgets
One of those people out there with protected tweets is your therapist passing your problems off as jokes.;Ghost
My 13yo just dumped his girlfriend and now he's attempting to get his hoodie back. He's in for one hell of a life lesson.;Therapist
What do you call using Tinder while you are in the bathroom? A swipe and wipe.;Breakup
A photon checks into a hotel and is asked "do you have any luggage, Sir?" The photon replies "no, I'm travelling light";Tinder
Who Shot First? Boba Fett or Jango Fett? Han Solo;Star Wars
What are condoms? Something your worthless fuckup of a father couldn't afford.;Condoms
How many potatoes a day will make you fat? 00000;Potatoes
A ham sandwich walks into a bar. Sits down. The bartender comes over and the ham sandwich says: &gt I'd like a triple of bourbon, neat. Bartender says: &gt I'm sorry, we don't serve food here.;Food
If you heard twenty minutes of moaning from my bedroom that was just me trying to stand up.;Aging
Which Knight invented the Round Table? Sir Cumference;Mathematics
Why spend all that time in school to be a doctor,, when you can save lives by forwarding an email or reposting a status on your Facebook wall?;Medicine
An Elvis impersonator had to cancel a show because he got some terrible family news. He was all shook up;Elvis
Pro Tip: wash your hands after you shake mine;Hygiene
Regular naps prevent old age, especially if you take them while driving.;Aging
Why does everyone mention that in space no-one can hear you scream instead of mentioning something positive like how no-one can hear u yodel;Space
There are two types of guys: those who pee in the shower and those who don't admit it.;Hygiene
Times are tough, jobs are scarce, I know I don't have the greatest body, but for you single ladies, I'll gigolo if the  price is right. . .;Dating
What did the elephant say when he was pulled out of the quicksand by the balls? Thank you, Mr. and Mrs. Ball!;Elephants
What do a WW2 German Soldier and an Animal Doctor have in common? They're both Veteran-Arians (wah wah);Professions
You'll end up real disappointed if you grow up thinking everyone has the same heart as you do.;Disappointment
Confucius say man who at night have scratchy bottom have at morning smelly fingers;Proverbs
What do toilet paper and the Starship Enterprise have in common? They both circle Uranus looking for Klingons.;Space
Dark humor is like food Not everyone gets it.;Humor
"How about we go with a gerund, but, like, maybe just half a gerund." - How ING Bank got its name;Language
What fundamental force compels physicists to go to work on Mondays? The week force.;Physics
What do you call a gay dinosaur? A stego-sore-ass;Dinosaurs
What's red and orange and looks good on hipsters? Fire.;Appearance
Saw my neighbour scrubbing some graffiti saying 'paedo' off his door this morning... I said "What's been going on mate?" He said "Fucking kids!";Graffiti
Why did the Eskimos have to stop partying? because they ran out of Natural Light;Party
"I dunno, maybe you go steal an old lady's purse, you can hold up a liquor store, & you...just sit there looking mean." -Unorganized Crime;Crime
*double-checks the constitution to see if we really have to have a president*;Politics
What's E.T. short for? Cus he's got little legs;Aliens
So a midget's at a casino and he runs into his friend the dealer... The dealer says "Hey how you feelin? I heard you were sick." The midget says "Naah I'm a little better.";Casinos
Police officer: Have you had anything to drink? Me:No PO:Ok, blow into here Me:But there are no candles PO:Ma'am please get out of the car;police
Arrested at the Zoo. I got arrested at the zoo the other day for having sex with a baby gorilla. When I asked the officer what I was being charged with he responded "Statutory Ape".;arrest
What does a mathematician do when he is constipated? He works it out with a pencil.;math
Liquor probably won't fix your problems... but it's worth a shot.;liquor
Me: omg can smoking weed make u hallucinate? Dog making pancakes: lol that wasn't weed dude;weed
My rubberband gun was confiscated in Algebra class It was a weapon of math disruption!;school
I bought a new lock for my bedroom door Wound up getting half off when it didn't work.;lock
Recycling Jesus died for our bins.;religion
What's in an Irish 7 course meal? A 6 pack and a potato.;food
How do they even grow a boneless chicken?;chicken
What did the porn star put at the end of their resume? Sexual references.;job
[Fear Factor] HOST: and the first contestant to touch the puppy in front of them will be sent home *camera pans to me already holding puppy*;tv
Don't be stingy when it comes to getting a circumcision. I got one cheap and it was a total rip-off.;circumcision
I think that some of the people I see in Wal Mart shouldn't be allowed to leave Wal Mart.;Yawning
Before you criticize someone, walk a mile in their shoes. Then when you criticize,you are a mile away from them & have their shoes;Wal Mart
I thought about being a feminist but what could I possibly do for the cause? I'm just a woman.;Criticism
How many cops does it take to change a light bulb? None, they just shoot the room for being dark.;Feminism
Kanye West is now on Twitter. Since he doesn't follow anyone, not only will he not let you finish, he's not gonna let you start, either.;Police
Why did the chicken cross the road? To get away from Gordon ramsey;Kanye West
I am not sure if I need to get beat up, broke as hell and drive a P.O.S car to get a hot girlfriend. Because that's all I  see, ugly is the new hot!;Chicken
Einstein came up with a theory about space... and it was about time too!;Gelatto
I have my entire Valentine's day planned with my toaster! Okay, so first, we're going to take a bath.;Einstein
I Feel Really Safe There are police helicopter circling my house.;Valentine's Day
I used the think that correlation implied causation, but now I know that it doesn't. I took a statistics class last year, and that might have helped, but I'm not so sure.;Police
It's pretty racist that Denzel Washington keeps getting typecasted as black men.;Statistics
What is smarter? What is smarter, longitude or latitude?...Longitude, because it has 360 degrees.;Racism
You may have a drinking problem - when your mother asks you to toast the bread.....and you raise your glass and say "here's to the bread"!;drinking
At first I didn't like my beard.. But now it's starting to grow on me.;beard
Who makes the music for the Marvel movies? The Avengers Ensemble.;music
"I could eat." - How I answer most questions, even if they're not food-related.;food
Once you go black, you can always go back to having coffee with milk, there's really no set in stone rules here.;coffee
My local council just installed a zebra crossing near the primary school What a waste of money, I've never even seen a zebra in this town;zebra
Corduroy Pillow "Did you guys hear about those new corduroy pillows?" [silence] "No? I heard they were making headlines";pillow
LIKE if you don't ring the doorbell... You just text or call to say you're outside.;doorbell
A man is kicked off a plane for playing online games. He was simply trying to have fun above all.;plane
There is a new Barbie doll on the market -  Crash Test Barbie ...comes with car and brick wall;Barbie
What do politicians and diapers have in common? Both should be changed regularly, and both for the same reasons.;politicians
A neutron walks into a bar and orders a drink Bartender says, "No charge";physics
I bet we can get into some serious Treble together.;music
Light a man a fire and he'll be warm for a hour. Light a man on fire and he'll be warm for the rest of his life.;fire
Burlap pants are coming into fashion, People are just itching to show off the new look.;Intimacy
"Are you cold?" No dumbass, I'm on fucking vibrate mode..;Fashion
Kinda thick horizontal curvy line, two thinner curvy vertical lines, squiggly line, different thicker squiggly line -Japanese spelling bee;Vibrate mode
[Security breach at Wayne manor] BRUCE: *brooding darkly* ALFRED: The back door is literally just a waterfall;Japanese language
*friend gets divorced Mon* *friend goes on date Tues* *I break up with boyfriend* *15 years later I casually smile back at a stranger*;Security
2nd Rule of Parent Club: If your kid suddenly says "I think I'd better wash my hands", don't question them. I repeat, DO NOT QUESTION THEM.;Dating
[Walk into a Cat Cafe] Me-I've never eaten cat. What do you recommend? Lady-They're for adopting not eating M-Oh, well can I adopt one? L-No;Parenting
First woman on the Moon: "Houston, we have a problem." What? "Never mind" What's the problem? "Nothing" Please tell us? "You know what the problem is.";Cat adoption
I like my bourbon the way the Chinese like their women... 11 years old and mixed up with coke.;Space exploration
I've never run a marathon, but once I walked real fast across a parking lot because Krispy Kreme was about to close.;Household chores
What do balloons and virgins have in common? One prick and its gone.;Running
An anti-semantic walks into a synagogue. The linguists in the group are offended and leave.;Virginity
Just got kicked out of Chipotle for knowing what I wanted when I got to the front of the line.;Linguistics
Two prostitutes are standing on the corner. One asked the other, "Have you ever been picked up by the fuzz before?" The prostitute replies, "No, but I've been swung by my tits.";Police
A pirate's wife asks him what body part he'd be most okay with losing The pirate thinks and replies, "my spine!" "Why?" says his wife, a little surprised "Because it's holding me back!";School
Washing clothes feels so old fashioned. I mean, who separates whites and colours anymore.;Pirate
People in glass houses Should go to the bathroom in the basement.;Laundry
A teacher asks one of her students what the formula for water was... He said, "H I J K L M N O" Teacher: What? Student: Yesterday, you said the formula for water is H2O;Houses
What do you call a rich frog ? A golf blooded reptile !;Science
With a wheelchair, everyday is Halloween! Children are scared of you, adults try to guess what you are, and the elderly just give you candy! Paraphrased from the wonderful Zach Anner;Frog
How did the pig get to the hospital? in a hambulance.;Disability
What's the difference between Lamar Odom and a hooker? A hooker can wash her crack and reuse it.;Pig
If I did the math right, 8 of you are serial killers and 1,246 of you are eating Nutella.;Galaxy
Why the long face ? A horse walks into a bar. Bartender: why the long face ? Horse: because I'm a raging alcoholic.;Serial killers
I say "do I smell popcorn" right after I fart, so everyone takes in a deep breath.;Horse
What's a pirate's favorite letter? AYEE ya thought it be ARRR but it be the 'C'!;letter
What did the poet with hemorrhoids say? I'm stuffin the puffin back into my muffin.;poet
What do you call it when a lizard cums? Busting a newt;lizard
Why didn't the bear go to college? Because bears don't go to college.;bear
5: "Why is the moon so bright?" Me: "It's not, it's pretty dim actually." Moon: "I heard that.";moon
Steak jokes. They're a rare medium well done.;steak
Why are Saturday and Sunday so strong? Because the rest are weekdays.;days
11: He shoots for her coffee. He SCORES! HE'S... Me: Grounded.;coffee
I swallowed a piece of Lego the other day I was shitting bricks.;Lego
If you want some alone time, tell your husband that you're going to watch the Bachelor. Even if you're not.;husband
If someone stands you up and doesn't call, stay positive. They could be dead.;date
You're like a magnet... Your fatass is always on the fridge.;prison
Josh Dugger The Christians are taking the latest news regarding the Dugger family hard. I just drove by a Chick-fil-A, and the flags were at half-staff.;fat
This morning, I accidentally put redbull instead of water in my coffee After 15 mins of driving I realized I forgot home my car;Christianity
Since I can't afford porn, I just turn on tennis and shut my eyes.;coffee
When they say "all expenses paid" does that include bail?;porn
Roses are red.... Violets are blue-ish, If it weren't for Christmas, we'd all be Jewish!;crime
Hey girl, are you a derivative function? Cuz I wanna be tangent to your curves.;religion
I want to follow you back, really, I do. But the hash tags. My god the hash tags.;math
A person is drowning and yelling "HELP I DON'T KNOW HOW TO SWIM" A bystander tells him to shut up because he doesn't know how to swim either but he's not freaking out about it like the guy drowning.;social media
What do you do if a blonde throws a pin at you?  Run - she is still holding the grenade!;swimming
(My wedding day) Grandma: You remind me so much of your father Me: Wow, thanks that means a lot G: Your father was a disappointment also;blonde
Boy, pet stores don't like it when you ask, "What is the most delicious animal you sell here?";marriage
No matter how white-hot my rage feels, I have been unable to clear the snow off my driveway by giving it the finger.;pet store
3rd eye: youre on drugs 4th eye: youre a nerd 5th-7th eyes: ??? 8th eye: you are now a spider 9th eye: spider on drugs 16th eye: nerd spider;weather
I grew up thinking my dad was a fireman Then I realised he was just an arsonist;Star Trek
I am extremely offended by the song "God is Dead" by Black Sabbath. How can Ozzy Osbourne possibly sing that? ...when Tony Iommi is standing right next to him, alive and well.;Parenting
If CERN's Large Hadron Collider creates a black hole that destroys earth would that make it a weapon of math destruction?;Music
Phone just autocorrected "your" to "yore" in case thou wouldst think I'm smarter than thee.;Science
What they say: "Hey, have you lost weight?" What they mean: "Hey, I remember you being a lot fatter. What gives?";Language
Did you hear about the basketball tournament in Mexico? Its Juan vs. Juan;Social Norms
A Man's Biggest Hope Most men hope they will marry a nymphomaniac. The problem is, that after a few years, the nympho leaves but the maniac is still there.;Basketball
Putting up Christmas decorations was a bad idea. I'm drunk and stuck on top of the house with an inflatable Easter Bunny.;Marriage
Why is six afraid of seven... Because seven is a registered six offender.;Christmas
Why are divorces so expensive? Because they're worth it.;Math
Wish our neighbors would splurge on quieter hookers.;Divorce
I tried to eat soup with a fork. It was a strain.;Parking
Tonight's parenting lesson: If a 2-year-old says, "I'm going to puke," FOR THE LOVE OF GOD DON'T CALL HER BLUFF. I need a shower.;parenting
How do you get your hair into shape? You condition it;hair
What is a composer's favorite vegetable? Bach choy.;vegetable
If the dove is the bird of peace... ...what is the bird of true love? The swallow.;birds
I was recently diagnosed with color-blindness. It came out of the green.;color-blindness
Facebook tells me those vans are dangerous, but Twitter says they have candy. So conflicted.;social media
Yeah, cigarettes make you cool but they also take years off your life. Those are just two benefits.;cigarettes
Water is the most precious drink Because without it we can't make coffee;water
An accountant at a bank was constipated Apparently he couldn't budget, but he worked it out with a pencil and paper and it was all good.;accountant
If the whole world smoked a joint at the same time, There would be world peace for at least two hours.;smoking
When it's cold out I wear my UGG boots. When it's frustrating out I wear my UGH boots.;clothing
What do you call it when Charlie Sheen's brother has sex with him? Emilio Incestevez;Charlie Sheen
Damn girl you must have been out in the sun all day. Because you appealin';Women
my plan for the day is to lay on the floor and not move;None
You can only regret what you remember. -Tequila;Tequila
I planned on watching the super bowl tomorrow, but... My inflatable couch doesn't have enough air in it.;Sports
I wonder who I'll be racist against when I'm elderly. I hope it's robots!!;Robots
My dad never loved me as a child. I can't blame him really. I wasn't born until he was an adult.;Family
What's the difference between a Harley Davidson and a vacuum cleaner? Placement of the dirt bag.;Harley Davidson
I was watching tv with my mom & she was amazed a blind guy didn't care his son was missing & I was like outta sight outta mind am I right;Family
My complete lack of knowledge about Greek mythology has always been my achilles elbow. thanks, Mike!;Greek mythology
Justin Bieber and Ke$ha has sex and gave birth to Rebecca Black.;Celebrities
When you wish upon a star ... you're actually a few million years late, according to astronomy.  The star is dead. Just like your dreams.;Astronomy
"Keep bullying the gay kids!" -Nerds;Bullying
Hey girl, heard you really like pandas *Seductively eats bamboo*;work
I get 9" in bed every night. That's how much mattress is left for me once the dogs get comfortable.;zombies
#rudolph > .nose { background: red border-radius: 50% @include shiny };bed
[drunk w/ 2 kittens at a bar] give me another "haven't u had enough?" i'll tell u when i've had enough! *bartender hands me another kitten*;coding
Kid: Dad, a girl called me ugly, how long does ugly last.. Dad:Hey hun Mom:Yes? Dad: How old are you? Mom: 45 Dad:theres your answer kid;drinking
