"Joke";"Joke topic"
What did the Estonian student say in language class? I'll never Finnish. *dodges tomato*;Language
My wife and I were happy for 25 years Then we met.;Marriage
I was so poor, we couldn't afford a bidet. I had to do hand stands in the shower.;Poverty
What's the difference between acne and a Catholic priest? Acne doesn't come on a boys face till 14;Priest
What was Dodi Fayed's favorite state? In Diana;Dodi Fayed
A fun trick for remembering peoples names is to never interact with anyone.;Social Interactions
If Africa had more mosquito nets... ...we'd save millions of mosquitos from dying of Aids each year;Africa
Jared Fogle just got arrested for Child Pornography Charges. I'm sure he'll be getting plenty of foot longs where he's going...;Jared Fogle
How does a sailor remove a condom? He farts;Sailor
9 out of 10 child psychologists believe TV's shouldn't be babysitters 9 out of 10 child psychologists don't have children;Child Psychologists
You have the face of a saint. Which one? Saint Bernard.;Saint
A pirate with Alzheimer's sold his parrot The next day he woke up and shouted "Where's my ship!?";Pirate
I HATE stereo-types.. Samsung, Sony, Toshiba, doesn't matter. Can't stand 'em.;Stereo-types
Pretty similar... Tea is the only difference between meh and meth.;Tea
The most reliable bridge builders in all of Mexico. Spic and Span;Mexico
It's not sex until you walk away with a nose bleed, and the Eye Of The Tiger song is still playing in your head.;Sex
I used to worry about offending people's moms on facebook but now they all post memes like "I chug vodka to keep from drowning my children";Facebook Moms
The emailer who threatened LA schools claims to be "a Muslim extremist." That's like a student signing his report card "Timmy's Dad.";terrorism
Ace of Base and the Lords of Acid meet in a bar and neutralize each other;music
"Four, five, six, one, two, three, seven, eight, nine, ten! Coming, ready or not!" George Lucas playing hide and seek;movies
I don't gossip because: 1. It's not my business. 2. I'm no better than anyone else. 3. And no one tells me any good juicy stuff :(;gossip
"Nice" - first kangaroo to realise it had a pocket;animals
BUZZ ALDRIN: I spy, with my little eye, something beginning with E. NEIL ARMSTRONG: Earth? BUZZ: Nope *5 minutes silence* BUZZ: OK, yep.;space
What's the best thing from New York City? The train to Boston;cities
What do you call spaghetti that carries a fake ID? an impasta!;food
What is a Mexicans favorite sport? Cross-country;nationality
may your fathers prosper. may your friends be uglier than you. may your exes get food poisoning;life
I don't understand how God can have Ten Commandments for the whole world, and my wife can have 152 just for our house.;marriage
What do you get when you leave a dog inside a car when it's 100 degrees outside? A hot dog.;animals
What starts with p and ends in orn Popcorn;food
[inventing the parrot] HOW ABOUT LIKE A TYE DYE CHICKEN WHO SCREAMS ACTUAL WORDS AT YOU;animals
Bishop gets in trouble for saying fruits should get married in churches "It's only reasonable, they cantaloupe";religion
Like most people my age... I'm 27.;age
Can you write off a divorce as a home improvement expense;marriage
Frankenstein: Master go fishing? Igor: Yes. F: Master take worms? I: Yes. F: Master put on hook? I: Yup. F: Hehe...Master ba- I: Just don't.;monster
What nation is the most unjust? Discrimination;discrimination
If I ever become rich, you know where all my money is going? To the bank;money
How do you make an idiot think he's a duck? Tell him he's a duck.;intelligence
Could you guys not make jokes about the holocaust here? My grandfather died in the holocaust, and it's really offending me. He fell out of one of the guard towers at Auschwitz;holocaust
House is a good doctor. He's also got a good heart. He should let his friends see the real him. But he's scared.;doctor
I can prove global warming is real. The Chicago Cubs are still playing its October already.;global warming
little son knows How to scare parents? Dad: "Can I see your report card, son?" Son: "I don't have it." Dad: "Why?" Son: "I gave it to my friend. He wanted to scare his parents.";school
Wondering when Oceans 14 is coming out? It already did, it's called "The Hobbit".;movie
Charles Dickens walks into a bar... and orders a Martini. The bartender asks,"Olive or twist?";author
I bought a dog the other day... I named him Stay. It's fun to call him... "Come here Stay! Come here Stay!" He went insane. Now he just ignores me and keeps typing. He's an East German Shepherd.;dog
Thank God for butter because without butter all butterflies would be just flies and that sounds terrible.;butter
What was the first thing the stowaway to Mars said after he landed? Just out of Curiosity...;Mars
When is Iran not Iran? When it's a rock.;Iran
Being an adult is mostly just wondering if the stuff in the dishwasher is dirty or clean while eating soup out of a sand castle bucket.;adult life
What's grey and comes in buckets? An elephant!;elephant
What's the difference between a fish and a guitar? You can't tuna fish!!!;fish
What did the elephant say to the naked man? Dude, how the hell do you breathe through that thing?!?;elephant
Why did the duck get kicked out of church? Because he was using fowl language!;duck
A Funeral Director isn't the best position in this economy... It's a dying trade;funeral
What's grey and comes in buckets? An elephant.;elephant
[bankruptcy court] JUDGE: *rubbing bridge of nose* Says here you bought 1000 bouncy castles? ME: *lips on mic* For my kingdom, Your Honor;bankruptcy
The Joys of Horse-riding by Jim Kama;horse riding
Jared from Subway should be happy... ... He will have a life time supply of foot-longs where he's going.;Jared
Started to compliment my neighbors on their new wallpaper but then I realized they can't hear me through binoculars.;neighbors
What do you call a Mexican midget? A paragraph, because he is too short to be an essay!;Mexican
With my luck, I bet if I was homeless, I'd probably end up with the shopping cart with the fucked up wheel.;Luck
Liquids with high viscosity... Why can't liquids with high viscosity get insurance? They resist Flo.;Viscosity
[texting] you mean the wolf to me -wolf? ha! autocorrect fail! -lol what i meant to say was...you're a mean wolf to me;Autocorrect
When Santa arrives at home, he says: Honey, I'm ho-ho-home! ... I'll show myself out.;Santa
Three things in the universe are constant. The speed of light, gravity, and laundry.;Laundry
No matter how old you are, an empty Christmas wrapping paper tube is still a light saber.;Christmas
Did you hear about Mike Tyson's opinion on ears? He had some biting commentary on the matter.;Mike Tyson
How do fish get high? Seaweed;Fish
Rabbits in a row. What do you get when 100 rabbits stand in a row and 99 take a step back? A receding hare line.;Rabbits
Learn from your mistakes. Make better & better mistakes until you're making the best mistakes possible.;Mistakes
If I were a mob boss, I'd ask my henchmen to meet me down by the docks, then surprise them with a day of water skiing;Mob boss
No YOU let your kid think he could turn the traffic lights green with his mind powers until he was 10 yrs old!;Parenting
Do you know why Eskimos always do their laundry  in tide? Because it's too cold out-tide!;Eskimos
A man walks into a restaurant in Mainland China. He calls the waiter over and tells him, 'That steak was rubbery.' 'Thank you for the compriment, sir, and have a rubbery evening!';China
I got invited to my first HS party... ten years too late, fuck you all i'm not going to the reunion, get bent.;Party
Jesus walked into a tavern and saw a man who could not walk. He said, "FRIEND, HAVE YOU BEEN INVOLVED IN AN ACCIDENT AT WORK THAT WASN'T YOUR FAULT?!";Insurance
What is green and glides down a mountain? A skiwi;Fruit
Request: Give me your best wedding joke! (jokes with puns are absolutely acceptable);Wedding
I got kicked out of the cancer ward at my hospital today. Apparently laughter isn't the best medicine.;Hospital
You could make a whole biopic about my life using only the infomercial footage of people unable to perform simple tasks for no reason.;Life
[GRAND CANYON] WIFE: Isn't this incredible? ME: It's ok. WIFE: Were you expecting a thousand canyons? ME: I don't want to talk about it;Travel
What do you call a fat rat? enormouse;Animal
What do a Feminist and a Hockey Player have in common? They both change their pads after three periods.;Sports
It's uncomfortable when the neighbor's kids look like you.;Family
What do you call an amish man with his hand up a horse's ass? A mechanic.;Profession
People who describe things as "better than sex" are having the wrong kind of sex.;Sex
Neutrinos "Sorry we don't serve neutrinos," says the barman. A neutrino walks into a bar.;Physics
Without that little voice in your head, you wouldn't be able to read this.;Reading
Hmmm... Jack Nicholson. He's that guy from the Laker's games right?;Movies
How many ADD kids does it take to screw in a light bulb? WANNA RIDE BIKES??;ADD
A skeleton walks into a bar and says... "Barkeeper, I'll have a beer and a mop";Skeletons
Perks of dating me: You will be the hot one;Dating
Just ran a .3K (Ice cream truck wouldn't stop);Running
The GPA is not my son... But I will raise it.;Education
What happens when you don't pay your exorcist? You get repossessed.;Exorcism
What's green and can eat 50 hot dogs in a minute? Kobayoshi.;Hot Dogs
A lime and banana decided to become a stand-up comedy duo and called themselves ... Key and Peele.;Comedy
Frisbee. I went to the park with my son and he brought his frisbee. We started throwing it around and after a while I started to wonder why frisbees get bigger as they get closer. Then it hit me...;Frisbee
Why do Java programmers wear glasses? Because they can't C#.;Programming
Q: What is a sea monster's favorite dish? A: Fish and ships.;Sea Monsters
1)Buy a plastic phone 2)Walk next to a stranger 3)Whisper into phone "It's done. He's dead." 4)Remove batteries & throw phone in a trash can;Prank
Does Hitler have a favorite number? Hitler: Nine.;Hitler
if your grave doesnt say "rest in peace" on it you are automatically drafted into the skeleton war;Death
I SAW ON THE NEWS THAT SOME GUY IN ANOTHER STATE DIED ARE YOU OKAY - my mom;News
The 1996 film "Crack" was directed by whom? Francis Snort Cokealot;Movies
sometimes i see a bird & i hate it for no reason. i'm not proud of it but its true. they have tiny heads & even smaller hearts. they hate us;Birds
I am your Doctor. Sorry to inform you that you have a brain problem. Your brain is in 2 parts... Left and right. The left part has nothing right in it, and the right has nothing left in it';Doctors
Ever see the same type of towel you own at a friend's house and be like motherfucker stole my towel but really you're just drunk at an Arbys;Towels
Any salad can be a Caesar salad... If you stab it enough times.;Salads
I made a meme;Memes
What becomes packed between periods? School Hallways;School
What kind of file makes a hole bigger?? A Pedophile;file
Hipsters never go white water rafting It's too main stream.;hipsters
What's a ghosts favourite Christmas  entertainment ? A phantomime !;Christmas
Now that there are no phone booths anymore Superman just changes in abandoned Blockbusters.;Superman
In the summer there's only so many clothes you can take off. On that note, please send bail money.;summer
I don't want to know the truth. Lie to me and make it ok.;truth
I like how we say "vegan" now instead of "eating disorder".;vegan
What does a mathematician do when he's constipated? He works it out with a pencil.;mathematician
How to stop, drop and roll if you are drunk. If you're drunk, it's not called the stop, drop and roll. It's called the stop, drop and stop rolling around so your drunk friend can piss on you.;drunkenness
Yo momma's so fat... ...she sat on a quarter and squeezed a booger out of George Washington's nose!;mom
So I was in Jerusalem and a man was trying to sell me a gold watch... I kept telling him I don't want it. It looks too fake, not real gold. He looked at me and says "It's not fake, Israel.";Jerusalem
Why would I buy a pumpkin at the store for $5 when I can drive 30 miles & pay to make my kids walk through a field to pick our own for $27.;pumpkin
I used to like Mitch Hedberg I still do but I used to too. RIP Mitch, we miss you.;Mitch Hedberg
I lost my job today "What? How?" I just wasn't a good housekeeper "BUT YOU'RE A BEEKEEPER" Well that explains all the screaming;job
What's the difference between a oral and rectal thermometer The taste.;thermometer
Eat, Pray, Smoke Weed, Eat, Eat, Eat, Eat, Eat, Eat, Love.;weed
I have no respect for paedophiles... ... they're fucking immature assholes.;paedophiles
A Freddie Mercury Joke If you had sex with Freddie Mercury and got AIDS, would that be considered Mercury poisoning?;Freddie Mercury
I bet cats are pissed they can't sit on televisions anymore.;cats
I'd be great at Wheel of Fortune. I shout random shit all the time. It's called "tourettes". "Pat, I'd like to buy a... FUCK! SHIT! FUCK!";Wheel of Fortune
My friend was really worried when he had to get tested for HIV. I told him just think positive.;HIV
Q: What do prisoners use to call each other? A: Cell phones.;prisoners
Wanna hear a pickup line? ***HONK HONK HOOOOOONK HONK HOOOONNK***;pickup line
What do you call a broken can opener? A can't opener;can opener
Chess makes us to realize our life!!! Chess says everything about husband and wife. The King has to take things one step at a time, while the Queen can do whatever she wants.;chess
What did the wall outlet say to the appliance? "You're grounded.";wall outlet
Dentist: This is gonna hurt a little. Me: Ok. Dentist: I've been sleeping with your mom.;dentist
Hellen Keller walks into a bar Then she walks into a chair Then a table....;bar
The other day I got a fortune cookie with no fortune in it, you know what I call that? I call that unfortunate.;fortune cookie
What do you call a frog that is illegally parked? Toad.;frog
It's hard following a clown act My girlfriend dated a clown before we started going together. I've got some pretty big shoes to fill.;clown
It's hard to explain puns to kleptomaniacs. They always take things literally.;puns
My enemies are gonna be so sorry if I ever get out of this bean bag chair.;enemies
Coolest jobs: 1)Beer maker 2)Secretary of War 3)Ninja 4)Guy who pushes scared skydivers;jobs
My brain keeps singing songs I don't even like.;brain
I dont know why people are disappointed when they find out a celebrity crush is married.As if that was their only obstacle to being together;celebrity
I wish i was Batman Because my parents would be dead.;Batman
My iPhone has 2 million times the storage of the 1969 Apollo 11 spacecraft computer. They went to the moon. I throw birds at pig houses.;iPhone
Anyone want a free car? Angry bee inside but otherwise, perfect.;car
If anyone needs an ark, I Noah guy.;Bible
Cop: A ghost killed your family? Guy: Yes! Cop: Did u forward yesterday's spooky chain email to 5 ppl? Guy: No? Cop: Well there you go.;Ghost
The way I feel when a waiter brings my food is probably similar to the excitement of a dude on Maury who just got told he's not the father.;TV
A man walks into a therapist's with just clingfilm around his waist therapist says, "I can clearly see you're nuts".;Therapist
Just realised why careers advisors are shit they couldn't even pick their own career;Career
What's the worst vegetable to have on a boat? A leek.;Vegetable
How can you tell the difference between a weasel and a stoat? One is weasely identifiable while the other is stoatally different.;Animal
What's the smallest instrument in the world? An e-lectron.;Instrument
A man walks into a psychiatrist's office completely nude, and so the psychiatrist says to the man, "sir I can clearly see your nuts.";Psychiatrist
At school, I saw my principal walking around in a daze. I asked him whathappened, and he just looked at me and said, "I've lost my faculties!";School
How did Henry V reload his rifle? Once more into the breech, dear friends;History
Who is this Rorschach guy.... ... and why does he paint all these pictures of my parents fighting?;Art
Remember... You can pick your nose, you can pick your friends, but you can't pick your friends nose.;Friendship
An Anus gets into a fight with two guys at a bar he rectum;Anatomy
I ended it after I checked his browser history and found hundreds of video game walk-throughs. Once a cheater, always a cheater.;Relationship
Disappointed that there will be no Call of Cthulhu client for Linux I wanted to go insane installing *and* playing the game.;Gaming
I tried to take on ISIS with a shotgun. Iraq'd and then Iran;War
Which country has the most crying people per km? The Soviet Onion;Geography
What did Thor start calling Ironman after he learned the suit was made out of gold titanium alloy? Ironyman ... To be fair Goldtitaniumalloyman just didn't have the same ring.;Superheroes
Me: Someone broke into the business next door last night. Coworker: Wasn't the building alarmed? Me: Buildings don't get scared. CW.....;Crime
who is the most fun on a missing persons case? the search party animal!;Crime
What do you call a black guy that flies a plane? Pilot;Profession
What did the Italian man who was feeling under the weather say when asked if he was attending the office Christmas party? No, I'm a Sikh.;Religion
TIL After years of research, scientists have positively concluded that the most effective way to make your penis bigger is using a magnifying glass;Science
A Lawyer walks into a bar He tries his hardest, and passes the exam.;Law
You know you have a struggle of being a Vietnamese When your first name is Dat, last name is Ho and the teachers call the whole thing out;Ethnicity
What do you call an ugly Spanish chemist? Iron Oxide;Profession
I have done about 300 crunches for my new exercise routine. 299 of them are Nestle.;chocolate
How can you tell a dog from a tomato? The tomato is red.;animals
Erectile dysfunction is a serious condition. It ain't nothing to fuck with.;health
My 6yo is arguing with me over what day of the week it is. Have kids, they said.;family
I was going to tell a Mexican joke... but that's just crossing the border;immigration
Job security: calling my boss and posing as a problematic customer so he'll realize he still needs me while I'm on vacation.;work
What do you call a pig with three eyes? A piiig!;animals
my doctor told me to watch my drinking and so i bought some mirrors;health
The minimum wage in Canada is 9 compliments an hour;work
What do you call an alligator that always starts fights? An instigator!;animals
Hundreds of creepy clowns terrorizing people across multiple states. On the bright side, they can all be picked up in one police car.;crime
Still carry my keys one-poking-out-like-a-weapon-style in case I'm attacked by a not very tough rapist with thin skin.;crime
What do you get when you cross a highway with a lawnmower? Killed.;transportation
If your smartphone is wet.. .. put it into a bottle of rice. The rice will then attract asians who will repair it.;technology
A husband finds his wife in bed with three men. He says, "Well, hello, hello, hello! His wife says, "Aren't you going to say hello to me?";infidelity
So a gay guy just bought a house... He is now a Homowner;homosexuality
First rule of Botox club: Nobody look surprised when someone new joins.;Botox
How many Swedes does it take to clean a men's bathroom? None because they pee sitting down.;nationality
In store checkout behind beautiful woman in sleek black dress. She's buying tequila and a quart of motor oil. Sure like to know that story;women
Holocaust joke best joke A jew is disobeing order in a work camp. SS officer comes to him showing 2 soap bars in the hand: "This is your mother and this your father";Holocaust
I want a kiss cam at my funeral;death
I went to check out a premature ejaculators' support group this morning  But it turns out it's tomorrow.;sex
What are some outstanding hamburger colleges? Brandeis Cowlifornia State Hoofstra Pen State Ranchelaer  Polytechnic Burgereley and Moosouri!;education
What's the difference between a snowwoman and a snowman? Snowballs.;gender
I start a new job in Seoul next week... ...I thought it might be a good Korea move.;career
Did you hear the rumour about butter? Never mind, I better not spread it.;food
What do you call a male seamstress? A homosexual.;seamstress
So the other day I went into a local shop with a sign that read "Therapist" They should really put a larger space between the "e" and the "r";therapist
What do you call a big irish spider ? Paddy long legs !;spider
If you play the "Strawberry Fields Forever" record backwards, you can quietly hear your roommate saying, "Get a job, Megan.";roommate
I Am Not A Lawyer I ANAL.;lawyer
What's the difference between you and a bag of shit? You're not in a bag.;bag
Last year, I got socks for Christmas. The year before, I got a couple of sacks. And before that, a sax. For pity's sake, Santa, you blind old jerk, it's sex. S-E-X.;Christmas
[updating CW's iPhone] M: You need more gigs CW: I don't need no gigs I got a job Having a smart phone doesn't make you smart.;iPhone
I have the best prison name Mitochondria;prison
What is Benedict Cumberbatch going as for Halloween? Benedict Pumpkinpatch;Halloween
Last autumn, a nice flower salesmen sold me some poppies in some cool cylinders. Oh boy! Two more months and here I come, fall opiate tubes!;flower
Why can't Helen Keller drive? because she's dead;Helen Keller
Her: Well, I know I told you that. Me: *closes eyes* Her: What are you doing? Me: Checking for it in my spam folder.;spam
A liberal, a conservative and a moderate walk into a bar. The bartender says "Afternoon, Mitt! What can I get for you?";Politics
What did one muffin say to the other muffin? Nothing, because muffins can't talk..;Muffins
I miss the old days when I could say I wasn't around and you couldn't check Facebook or twitter to see if I was lying;Technology
If your conspiracy theory doesn't involve cats, don't bother me.;Conspiracy
That rose tattoo on your ass was SO hot when you were 19. Now it looks like red cabbage;Tattoos
Why can't T-Rex's high five? Because they're all dead.;Dinosaurs
Want to hear a joke about toilet paper? Nevermind... it's tearable.;Toilet Paper
Going commando is the closest I'll ever get to joining the army.;Military
Yo momma so short and poor... ...that she gotta reach up to touch rock bottom.;Insults
Ladies, if you think being clumsy is cute, I once stabbed my date in the gums with a fork trying to feed her a bite of spaghetti;Dating
How do pirates agree with each other over long distances? With their aye-phones.;Pirates
(NSFW) They've finally published my self-help book about having sex with herbs It's about fucking thyme.;Herbs
From my 3yr old nephew: Why do chickens sit on their eggs? Because they don't have chairs.;Chickens
My son and I don't get along. I call him a son of a bitch. He calls me a motherfucker. Technically we're both right.;Family
Morse code is like taking a shower with black guys and asian Long short long long long short long short short;Morse code
Why'd the man buy a 30 pack of condoms instead of the 10 pack... So he'd get the best bang for his buck.;Condoms
[guy bursts into crowded real estate agents] OK NOBODY MOVE *from back office* Aw c'mon man - really? It's tough enough in this economy.;Real estate
I saw a car with "Wash Me" written on it, so I set it on fire. I'll be damned if I'm going to allow cars to become sentient!;Car
Add an exclamation point to an email BOOM you're a morning person.;Email
Whip cream bikinis are cool but please don't wear chicken gravy again. That's just wrong.;Bikinis
Just saw a bag of McDonalds in the street. Unsure how this will affect brand. Could be good (free advertising) or bad (no one was eating it);McDonalds
Knock knock Who's there? I eat mop. I eat mop who?;Knock knock
What do you get if you take your computer to an ice rink? A slipped disk.;Computer
What did the baseball manager do when he needed another man in the bullpen? He took a can of orange juice from the freezer and made a pitcher.;Baseball
Plan ahead - It wasn't raining when Noah built the ark.;Noah's ark
I just did an alignment on my car... But my car still pulls into crowds :(;Car
Wife: "I look fat. Can you give me........ Wife: "I look fat. Can you give me a compliment?" Husband: "You have perfect eyesight.";Appearance
Can someone please explain this joke to me? How do you get the elephant out of the theatre? You can't. It's in his blood.;Elephant
Before scientists discovered... Before scientists discovered that the "I before E except after C" rule wasn't universal, they were called sceintists.;Spelling
Why did the blind fly starve to death?? Because he couldn't see shit;Blindness
What do pink flamingos have on their front lawns? Plastic Italians.;Flamingos
In my 20s, I was bullied by a crow the size of a chicken for several months.;Bullying
What do you call a fish with no eyes? A fsh! Aaand I'm out;Fish
Welcome to Chili's here's your dirty fork, don't forget to spit on our hostess on the way out.;Restaurant
What did the cheese say to itself in the in the mirror? halloumi;Cheese
Man walks into a bar... ...with a piece of tarmac under his arm, says to the barman 'give us a pint and one for the road...';Road
I was dating a radiologist... but it didn't work out: she could see right though me.;Dating
ANCHOR: Now over to Mike for the weather. ME: IT'S REALLY WEATHERY RIGHT NOW, CARL, WITH MORE WEATHER TO COME! THAT'S IT FOR THE WEATHER!;Weather
I wish I lived in the 1950's, because I have a few songs I want to record about my postman.;Music
