"Joke";"Joke topic"
North Korea's ability to go through with its threats are as poor as the punchline of this joke.;North Korea
"What would be your main strength?" Well, I can communicate with animals... "Wow, impressive. Any weaknesses?" They can't understand me.;animals
Whats the last thing you want to hear before you go to sleep? Zippity Bop, Puddin' pop!;sleep
A ghost walks into a bar... For the boos;ghosts
Why does a 6 oz hamburger have less energy than a 6 oz steak? Because the hamburger is in the ground state.;physics
How do you fix a pumpkin With a pumpkin patch... I'm so sorry.;pumpkins
A guy goes to his doctor. The doctor says to him, "You need to stop masturbating". The patient says "What? Why?". The doctor replies "So I can examine you";medicine
I'm organising an event to help raise awareness of male sexual dysfunction, particularly a failure to climax. If you can't come, let me know.;sex
What's the difference between a cat and a comma? One has its claws at the end of its paws, and one is a pause at the end of a clause.;grammar
A boy talks to his mother about what he hopes to become. The boy said, "Mom? I have something to tell you" "Go ahead", the mother said. "I promise not to laugh." *The boy wanted to be a comedian.*;comedian
Why do scuba divers jump off the boat backwards? Because if they jumped forwards they'd still be in the boat.;scuba diving
I quit cold turkey. I just reheat it now.;quitting
<job interview> It says here on your resume that you are a "self-proclaimed man of few words." Would you like to elaborate on that? Me: no;job interview
When I'm drinking don't worry about taking my car keys. Just hide my phone.;drinking
Nobel Prize Who ever invented Knock, Knock Jokes should win the No-bell Prize.;Nobel Prize
What do composers prepare their ingredients on? A Chopin board;cooking
What did fish say when she hit the wall ? Dam(n) !!!;fish
My doctor accidentally mixed my Viagra with laxitives I didn't know whether I was coming or going!;Viagra
Thanks for explaining the word "many" to me, it means a lot.;word explanation
The only reason I get up in the morning is so I can drink at night.;drinking
Doctor, doctor, what can I do? Everyone thinks I'm a liar... I find that very hard to believe!;lying
What did Jaws call his solo banking firm? Loan shark.;banking
What do you call the study of food prices? EcoNOM-NOM-NOMics.;economics
What do you call the Israeli PM when he switches search engines? Benjamin Netangoogle;search engine
My favorite moment of the day is deciding I'm not going to do anything productive. That moment is now.;productivity
Went to Costco for eggs. Walked out with a toaster oven, an 80 inch 4K TV, minus 1 child and no eggs.;shopping
Said the masochist to the sadist: "Oh hit me, hurt me, oh please just use me" Said the sadist to the masochist: ... no;relationships
What do a guy crossing Niagara falls on a tight rope and a guy getting a blowjob from a 90 year old have in common? Both are thinking don't look down, just don't look down.;dangerous activities
What do you pasta with a witty comeback? Retortellini.;pasta
What's the difference between a pickpocket and a peeping Tom? A pickpocket snatches watches and a peeping Tom watches snatches;crime
I hate when I shoot someone with finger pistols but I forgot to take the safety off so nothing happened and NOW IT'S SO AWKWARD :(;guns
whenever someone says happy birthday.... all I hear is "Happy anniversary of the day your face rubbed your moms vagina";birthdays
Every Political Ad Ever: I'm a rich guy who's not like the other rich guy he's a total douche. *Paid for by my rich guy friends*;politics
A good wife always forgives her husband when she's wrong.;marriage
What do you call a dirty drug addict with a lisp? Methy;addiction
Do you have 11 protons? Because you're sodium fine...;chemistry
Why are feet so funny? Because they're "heel areas" ... I'll show myself out;body parts
*puts stethoscope up to chest* Dr: I dont hear..U don't have a heart Karen "Did my ex Kyle put u up to this?" *Im in the bushes giggling*;relationships
So there I was, balls deep in a jar of mayonnaise. When I said to myself, "Self..." "I shoulda made a sandwich first.";food
What's the difference between Michael Phelps and Hitler? Michael Phelps can actually finish a race;history
When my wife and I have a disagreement, I always have the last word... usually it's, "Yes Dear";marriage
If I was Genghis Khan's personal advisor Every time he had a moment of self doubt, I'd remind him he is Genghis Khan, not Genghis Khan't.;history
I was trying to think of a joke about leprechauns... ...but I lucked out;mythology
What's a sailor's least favorite color? Maroon;colors
[commercial for soup] Have you ever wanted to eat regular food only with water poured all over it? NARRATOR: SOUP;food
How many mottophobics does it take to change a lightbulb? None. Who do you think broke the filament in the first place?;phobias
what do you call a sleep-walking nun? A Roman Catholic;religion
I accidentally gave my wife super glue instead of Chapstick She's still not talking to me.;marriage
::::::::::::::::::::::::::::::::::::::::::::::::::::::::::::::: I'm terribly sorry. I suffer from colon cancer.;apology
What's the difference between a Canadian and an Italian? Where the "eh" is in the sentence. Canadian: "How you doin, eh?" Italian: "Eh! How you doin?";nationality
I was out of tanning oil once, so I used PAM Cooking Spray. The tan didn't stick.;tanning
What has 60 legs and 8 teeth? The front row of a Country concert;country music
How many Public Radio hosts does it take to screw in a lightbulb? We'll be back with that answer right after this pledge break.;public radio
Opposites don't always attract. I've met several sane and normal people and found nothing about them appealing.;personality
Fireman: Is anyone else inside the house? Me: Uh yes..my son is trapped in my room he- [fireman charges into blaze] ..HE LOOKS LIKE AN XBOX;emergency
What happened when Canada got rid of the penny? Canadians became *penniless*;money
A mama's boy is frantically running out of a strip club yelling... MY MOMMA TOLD ME IF I EVER CAME INTO A PLACE LIKE THIS I'D TURN INTO STONE. AND I FEEL IT'S STARTING;strip club
What's the difference between Jesus in real life and Jesus in a picture frame? It only takes one nail to hang up Jesus in a picture frame.;Jesus
St. Peter: "Spock?" Leonard Nimoy: "I'm Leonard. Spock was just a character I played on TV." St. Peter: "HEY EVERYBODY! IT'S SPOCK!";celebrity
I went to Africa recently... ...and I saw that they used Co2 as fuel instead of petrol or diesel. I couldn't believe it and I exclaimed, "Madagascar!";Africa
I met a sick bird yesterday that got deported. The cops kept yelling about him being an "ill-eagle".;Bird
I submitted 10 puns to a local newspaper, hoping one would make it in. Unfortunately, no pun in ten did.;Puns
I hate Mexican jokes... Nunca puedo entenderlos. Edit: The translation of this is "I never understand them".;Mexico
Got so drunk last night that I was able to translate three Pearl Jam albums into English;Pearl Jam
What Not To Upvote Clickbait;Clickbait
If I'm your emergency contact, for your sake, I hope that hospital sends texts too.;Emergency
I told my mom that bukkake is Japanese for bundt cake... I hope I'm there when she orders dessert at the steak house.;Bukkake
The worst time to find out your parents are dead is probably right after you've taken a large hit from helium balloon.;Parents
Why did the bride's best friend become a Samurai... because she was made of honour.;Samurai
What did Putin say to the U.S. and E.U. after invading Ukraine? Crimea river;Ukraine
Tingly feeling You know that nice tingly feeling you get when you're falling for someone? That's common sense leaving your body.;Love
What's the worst thing to give a norteno on their birthday? A SURprise party!!;Norteno
I can tell so much about a person just by guessing.;Personality
If you're a Mayan, I don't even know how you show your fucking face in 2013.;Mayans
Contrary to popular belief, everyone wasn't Kung Fu fighting, I was taking a nap.;Kung Fu
I like to shave my pubes... It helps reduce the wind resistance and makes me able to run faster. You haven't seen me on the news yet because I'm too fast.;Running
What do you call the divorce between Brad Pitt and Angelina Jolie? a Brexit;Divorce
A haunted house would be pretty scary if it was filled with light switches that accidentally turned on the garbage disposal.;Haunted House
Did I tell you that my girlfriend has the flu? Yeah, basically.;Girlfriend
A man using apple maps walks into a bar.. ..or maybe it was a church or a grocery store or something;Apple Maps
I periodically tell chemistry jokes But usually there is no reaction. Probably people are just too noble.;Chemistry
Why did John Snow get an iPhone? For the watch.;iPhone
What's the difference between your mom and your dad? Your dad still sucks dick.;Parents
A baby Seal A baby seal walks into a club.;Seal
Sorry if you don't like my Honesty. But to be fair I don't like your f*cking Lies;Honesty
Whats Black White and Red allover Detroit in winter;Color
How do you win an election? By having people believe that you've won an election.;Election
FYI Don't make snow angels in a dog park.;Snow
A U2 album so shitty, even Android won't give it out for free.;Music
If at first you don't succeed, GREAT. Now you know not to waste your time on that ever again. Fuck that shit. Lesson learned.;Success
Why do Scotsmen wear kilts? Because a sheep can hear a zipper from a mile away.;Scotland
Why are bodybuilders the best the best partners? Because with them it always works out.;Bodybuilding
Give a man a gun and he can rob a bank Give a man a bank and he can rob the world.;Power
Earth got put in Milky Way Special Ed for being bi-polar.;Earth
"Hand me downs" Apparently not the right way to ask the wife to hand me our disabled baby.;Disability
Did you hear that Henry Ford wrote a book? The driving point is that it's auto-biographical.;Book
I wanna give a shoutout to the sidewalks For keeping people off the streets.;Sidewalks
What do you call a weak cup of tea? Subtlety.;Tea
I could host an elegant dinner party, but I don't know enough people with simmering tension over long-held secrets to make it worthwhile.;Dinner
She criticized my apartment... So I knocked her flat;apartment
I've lost all control of my vowels... Now I'm completely in consonant.;vowels
Best gaming joke ever.. ..Riot match making;gaming
Let me put on my thinking cap hmmm... all I'm coming up with is "I'm a sentient garment my very existence is a horror kill me now".;thinking
People who are complaining of shoveling driveways, haven't you heard of moving?;complaining
YouTube is the nicest company ever... They just want to even the playing field so their competitors have a chance to catch up to them.;company
Why are turds tapered? So your asshole doesn't slam shut.;anatomy
When something falls in your mouth by accident and you eat it, it's a snaccident.;eating
A photon checks into a hotel... And the bellhop asks him if he has any luggage. The photon replies, "No, I'm traveling light.";physics
One thing won't change for Jared Fogle while in prison He will still be eating 6" to 12" daily.;prison
Reenacting the Civil War seems like a lot of work. I'd much rather reenact the Cola War from my couch. First is the battle of Whiskey.;war
Furniture salesperson: Do you see anything you like? Waldo: Actually yes this red and white couch is quite nice.;furniture
Cop just pulled me over, said I was going too fast. So I took him to dinner first.;Police
If it's not Valentine's Day and you see a man in flower shop, you can probably start the conversation with "What did you do?".;Relationships
What do you call a singer who sells meat? A Deli.;Music
RED RIDING HOOD: what big pupils you have grandmother WOLF: yeah I found some pills in the bathroom I love you they're unreal you want some?;Fairy Tales
When someone tells you that they cut their own hair, it's polite to act surprised;Social Etiquette
I feel like I'm not giving my followers enough in my tweets. Would you be interested in stock tips or free shampoo samples?;Social Media
Politicians and diapers have one thing in common: they should both be changed regularly... and for the same reason.;Politics
Walking past a new employee's desk & yelling, "Do you think it's a good idea to be surfing porn on your first day?" will never get old.;Workplace
I feel bad for tailgating this minivan so closely but once I started watching Kung Fu Panda on his back seat TV I had to see it through.;Driving
Went out to find a spider in my car this morning. So disappointing. I really liked that car.;Cars
A British engineer just started his own business in Afghanistan He's making land mines that look like prayer mats. It's doing well. He says prophets are going through the roof.;Business
What do you call feeling bad about watching lame reality TV shows? Survivor guilt.;TV Shows
Whats the difference between tuna, a piano and glue? You can tuna piano but you can't piano a tuna.;Wordplay
If jews had a planet I would call it Jewpiter;Religion
What do you call someone who wears a diaper fashioned from a map? Incontinent;Geography
Three blind lesbians walk into a fish market. They get confused;Lesbians
What does a Catholic priest and a silver medalist have in common? They both came in a little behind.;Priests
You're so beautiful Sometimes I have to photoshop you to make you look less attractive! - Zach Anner;Beauty
Can we all agree the biggest balls belong to the first person to set up a tip jar at Starbucks?;Tip jars
Walked up to 2 guys talking business and told them "get a conference room!";Business
My Father always said "You should fight fire with fire" He didn't last long as a fireman.;Firefighting
The heaviest things in the world: 4) iron 3) lead 2) tungsten 1) a toddler who doesn't want to be picked up;Toddlers
Cop: You know your license's expired? Me: Didnt even know it was sick. Cop: Haha! Me: HAHA! Cop: Hehe.. Me: Eheh.. Cop: Step out of the car.;Driving
Diet day 1 I have removed all the bad food from the house. It was delicious.;Dieting
So a blind man walks into a bar And a table. And a chair.;Blindness
Chuck Norris crossed the road. No one has ever dared question his motives.;Chuck Norris
Whoever invented the forklift over estimated the weight of forks;Forklifts
"Let's see what you're made of!" he says on approach, knife in hand. "Good." I mutter. "Another adversary who paid no attention in Biology.";Biology
I'm 6'5" and I can't stop talking down to everyone;Height
What is the best movie like to shout as you orgasm? I am your father.;Movies
a cute girl stopped behind my laptop as I was full screen on a pic of bread and I didn't know what to say so I stammered out "I like bread";Bread
Why will the columbine high basket ball team lose the tournament? Because they lost their 2 best shooters;Columbine
What do you get when you put an egg in the ground? An eggplant.;Egg
How did the Somali terrorist describe his flight? "It was dynamite!";Flight
Chris Brown said he's done making music. That's funny. I didn't even know he started.;Chris Brown
It's been so long since I bought groceries, this morning I saw a c**kroach move out. "Good luck," he sighed, clutching his tiny suitcases.;Groceries
Wanna See a perfect Relationship? You Wanna See A Perfect Relationship? . . . . . . . . . . . . . . Watch A Movie... :P Coz it is possible in movies only.;Relationship
I'll always remember what my dad told me right before he died: "of course you're supposed to use that much lighter fluid idiot.";Dad
Self Detonation is a real blast.. Or so I've heard.. C4 yourself.;Explosion
Sometimes I get mad about having to unload the dishwasher but then I remember a machine just washed my dishes for me.;Dishwasher
"I don't care how goodlooking you are if you don't have any brains." -Zombies;Zombies
Mrs. Claus gave birth on the 24th of December I guess you could say Santa came early this year.;Santa
Do you know what a pirates favorite letter is? ( read before down vote you may be surprised) Well you think it be the rrrrrr's, but it be the cccc's.!;Pirate
My wife is enjoying the attention I've been giving her lately & though painting a phone on her face is inconvenient, it's saved our marriage;marriage
How was the red sea made? Over a very long period.;geography
I should really stop getting stoned before I shower. I think I just washed my hair 16 times.;personal hygiene
Now we're going to say some shit to scare old people. -the local news;news
It is so much easier to turn friendship into love, than love into friendship.;relationships
Knock Knock Who's there ! Chicken ! Chicken who ? Chicken your pockets - I think your keys are there !s;chicken
How do you titillate an ocelot? You oscillate its tits a lot.;ocelot
132 LEGS AND 8 TEETH Q: What has 132 legs and 8 teeth? A: The front row of a Garth Brooks concert!;concert
"Ok, imagine a fleshlight, but full of food." - Hot Pocket sales pitch;food
Why can't you hear pterodactyls go to the bathroom? Because dinosaurs went extinct 65 million years ago.;dinosaurs
Did you hear about the man who was using apples and oranges for flooring? He started to lay them down when he realized it was fruit-tile.;flooring
Have you ever thought about the word racecar and how it's a palindrome? Put it backwards and it spells racecar, put it sideways and it kills Paul Walker.;wordplay
My friend said he knew of a way to always win in Russian roulette I can't tell you what it was, but let's just say... My mind was blown;Russian roulette
Why did the scuba diver drop out of graduate school? Because he was always below a C;Graduate school
What do you call a stoned, dyslexic crow? A hybrid;Dyslexic crow
Do you ever take a bunch of pills, forget that you took a bunch of pills, take a bunch more pills, and then die? I know. Me TOO.;Pills
What do you call the state of having confidence? I'm sorry, it's confidential.;Confidence
Photon A photon goes to a hotel to find a room.. the man at the desk asks if he would like any help with his bags and the photon says "I don't have any.. I'm traveling light.";Photon
You're mom is so poor... that if someone gave her the finger. She'd say thank you.;Poverty
Put that down you fat piece of sh*t'  the title of the dieting book I'm writing.;Dieting
These pants fit like a cheap hotel... No ballroom.;Hotel
I just got a great deal on a Flesh Light... Craigslist is the best!;Flesh Light
What do you call an effeminate Japanese man with radiation sickness, AIDS and hemorrhegic fever? Ebola Gay.;Japanese man
What do you call cheese that's not yours? Colby Jack's.;Cheese
"Don't kid yourself" Would be a great slogan for an abortion clinic.;Abortion clinic
What time does an Asian go to the dentist? Toof Hurty.;Asian dentist
How many ways are there to please a guy? Three way.;men
Chuck Norris once rode a bull, and nine months later it had a calf.;Chuck Norris
What would Kim Jong Un call his children? His young'uns;Kim Jong Un
Did you all hear Jerry Sandusky is getting a custom ipod touch? It will be known as the itouch kids!;Jerry Sandusky
I'm available if anyone needs me to ruin a good thing before it even starts.;relationships
My parents tried to abort me but I was still born.;birth
My answer to most questions is an intelligible grunt, a flustered pointing motion, & a 3 hour nap.;communication
Why didn't the astronauts stay on the moon?  Because it was a full moon and there was no room.;space
Did you hear the one about the pizza? Ugh, nevermind. It's too cheesy.;pizza
What do you call an alligator that wins a race? A chompion. (7-year old me thought he was very clever.);alligator
Two fish are in a tank. One fish turns to the other and says "Do you know how to drive this thing?" The other fish says "Holy shit a talking fish!";childhood
After months of trying to find a job... ...my mate has recently found work in making chess pieces. He starts next week on nights.;fish
FRIEND: hey while I'm on vacation can you come over and feed the cat? ME: FRIEND: ME: to what?;job
Did you see the frog perform in the opera last night? Why yes, she was absolutely ribbeting.;vacation
I bet the terrorists have a guy who does parody songs named Weird Al Qaedavic.;terrorism
What are the four food groups? For bachelors: Fast Frozen Junk and Spoiled. For drinkers: Malt Hops Barley and Yeast. For heavies: Caffeine Fat Sugar Chocolate.;food
I KEPT MY CAPS LOCK ON WHEN I SEARCHED RECIPES FOR DINNER TONIGHT AND NOW GORDON RAMSEY IS IN MY KITCHEN;cooking
I hope the guy who just cut me off in traffic has his fav book made into a movie & the characters are nothing like he imagined them;driving
I have a voluntary version of Tourette's.;health
Someone told me to stop singing Wonderwall I said maybe;music
Most boots are made for walkin'. Chuck Norris' boots ain't that merciful.;fashion
Right now, a future teen mom is applying copious amounts of body glitter to herself.;design
So I used to date this graphic designer... We broke up because I caught her cheating. Writing hundreds of letters to some guy named Lorem Ipsum. What a creep, right?;transportation
GUY 1: a bee flew in my eye GUY 2: I just ate a bird GUY IN BACK: I can't hear u TOGETHER: there must be a better way NARRATOR: windshields;furniture
Before my girlfriend moved in I always had one night stand Now that things are getting serious we have two night stands;household
Does anyone want a vacuum cleaner? Mine's just gathering dust.;farming
Poor helium. I like to imagine there's a shelium out there somewhere, waiting gaseously;helium
I lost my mood ring last night... I'm not sure how I feel about that;mood ring
What do you call frozen hamburger patties? Burrrrrrgers.;hamburger
TIL Harriet Tubman wasn't a real person. It was just what the slaves shouted to each other on the Underground Railroad, "Hurry it up, man!" Credit: my wife;Harriet Tubman
what I love about whole foods is you can fit $50 worth of groceries in a stylish evening clutch;groceries
What do you call a Greek intellectual that only eats kimchee? An Epikorean.;kimchee
Lord of the Rings marathon -Do you know what a Lord of the Rings marathon is? -Yes -But do you know what a Lord of the Rings triathlon is? -No? -That's when you watch all three of them;Lord of the Rings
I'd catch a gently thrown tennis ball for you.;tennis ball
Why is six afraid of seven? Because seven is a well known six offender.;math
Have you heard about the one about suicidal procrastinator He lived a long healthy life.;procrastinator
The best thing about Adrian Peterson's suspension... ...he gets to spend more time with the kids.;Adrian Peterson
Two penguins walk into a bar... Two penguins walk into a bar. They look around for a second and then one turn to the other and says, "God damn it, Frank! We overdressed!";penguins
[sees kid crying at the mall] R u lost? [kid nods, wiping tears] Well [blows cigarette smoke in kids face] looks like u live at the mall now;mall
I'm pretty sure Morgan Freeman was narrating while the universe was being created;Morgan Freeman
Told a girl to text me when she got home. She must be homeless.;Girl
On this day in history, Cocoa Puffs were invented about 3 hours after that rabbit finally got his hands on a bowl of Trix.;Cocoa Puffs
Customer: Why does your sign say "Fine Dining"? Waiter: We can dream can't we?;Restaurant
If two wrongs make a right... Then what do two wrights make? A plane.;Wrights
I have a friend called Rick that was recently turned into cotton... we have to call him Threadrick now. I thought of this joke on the way to buy my lunch today, I hope it's not already been made.;Friend
Difference between outlaws and inlaws? The outlaws are wanted.;Inlaws
Chuck norris doesn't flush the toilet. He scares the shit out of it.;Chuck Norris
Relationship status~ Siri saw my browser history & now she isn't talking to me either;Relationship
What can you sit on, sleep on, and brush your teeth with? A chair, a bed, and a toothbrush.;Objects
I had a harder childhood than most. My parents didn't send me to a therapist, they sent me to a theanalrapist.;Childhood
Why was six afraid of seven? Because seven was a six offender!;Numbers
My estranged father bought me a telescope for Christmas We're a lot closer now.;Father
I just read more people are killed by toasters than sharks. So if you're swimming in the ocean and see a toaster SWIM FOR YOUR LIFE!;Toasters
I've been ignoring these dirty dishes for 47 minutes and they still haven't taken the hint. It's just awkward now...;Dirty Dishes
What was the name of the strip club Hitler worked at? The "Naughtsy";Hitler
Movies you wish Tom Cruise would star in: Remission Impossible;Tom Cruise
the latest news from the boston bombing authorities think it was race related.;Boston Bombing
You miss 100% of the shots you don't take... -Lee Harvey Oswald;Shooting
I used to be into infantalism... I eventually grew out of it.;Infantalism
Have some self confidence Mexican restaurants. Take that hamburger off the menu.;Mexican Restaurants
Why did 7 8 9? ...Fuck;Math
We have rappers who used to be pimps and gangsters telling us not to download music because it's stealing.;Music Piracy
Hey do you know Deanda? Deanda dis dick!!! HA! Got EEEM!;Deanda
Jewish boy&ampfather A jewish boy goes to his father and asks for 50 dollars. His father replies, 40 dollars? What do you need 30 dollars for?;Jewish Stereotype
I was going to smoke a joint with some Mexicans But when I asked if anyone had papers, they all ran off.;Smoking
Was that pun intended? Nope, unintended.;Puns
Teacher: In music if "f" means "forte" what does "ff" mean ? Pupil: Eighty;music
What is the difference between a 2 year old and a bag of cocaine? Eric Clapton would never let a bag of cocaine fall out a window.;children vs. drugs
