"Joke";"Joke topic"
Did you know your kitchen faucet might raid your house? Let that sink in...;kitchen
How did Helen Keller's mother punish her? She left a plunger in the toilet;Helen Keller
I visited my doctor last week, and he told me I had to stop masturbating. I asked him why, surely it's not dangerous. He said it was distracting him.;doctor
Always been a favourite of mine. How many tickles does it take to make an octopus laugh? Ten tickles.;octopus
What do you call a train when it's eating? A Chew-Chew Train! Side note, I have cheesy jokes for days.;train
If schools were really serious about fundraisers, they'd sell drugs and alcohol.;school
Why did I wear no jeans today? my supply was short.;clothing
They say talk is cheap but my last phone call cost me $2.99 per minute, billed directly to my credit card.;phone call
An astronaut squirrel, a snail that meows, crab with a whale as a daughter. Dear creators of spongebob, pass the drugs.;SpongeBob
Why did the girl fall out of the swing? Because she didn't have arms.;girl
If I got a dollar, for every time I think of you. I might start thinking of you.;love
Your mom is like this joke old and overused;mom
I refuse to dance to any song that tells me how to dance in the lyrics;Dancing
College was the most expensive nap I ever took.;College
Why did the sperm cross the road?... Because I put on the wrong pair of socks today.;Sperm
Why did the farmer take a milk bath? Because he's too tall for a milk shower.;Farmer
What do you do with 365 used condoms? Roll them into a tire and call it a goodyear;Condoms
After realising that I had accidentally eaten my clone, I shat myself.;Clone
Why don't Bill Cosby's Lights Work? He required that their circuits have no resistance.;Bill Cosby
What is brown and rhymes with snoop? Poop.;Poop
3 Elephants jump out of a plane, the first two hit land and the last one hits water. What sound did they make? Bum-bum tssh!;Elephants
"I don't understand what this statue of a man talking is supposed to mean" "It's confusing, but I think it's a figure of speech.";Statue
Haven't tweeted lately because I'm really absorbed by this Bounty paper towel.;Twitter
I made up a word today! Plagiarism.;Plagiarism
Why pink camo? Do people hunt barbie jeeps or try to sneak up on pepto bismol?;Camo
I asked this girl in my class for a rubber... forgot that in the U.S. they call it an eraser;Rubber
A woman once said she recognized me from the vegetarian club But I'd never met herbivore.;vegetarian
What's the difference between a VA Nurse and a bullet? A bullet only kills once.;VA Nurse
How is marriage and CPR training the same? You get a certificate for showing you can do it and hope to god you never have to do it again;marriage
I Just got fired from the orange juice factory. They said I could not concentrate;orange juice
you know what people with alopecia say.... you know what people with alopecia say... hair today gone tomorrow;alopecia
What do you call a cow with a twitch? Beef Jerky;cow
My mother and father separated last year and my father recently started seeing someone and it's been very hard for me. There are two major issues I have with his new partner. He's black.;family
Why did the worker at the M&ampM factory get fired? ...he threw out the W's;M&ampM factory
CNN is confirming that the only news in the world today is the blizzard. everything else is under control.;CNN
People use to laugh at me when I said I wanted to be a comedian. No ones laughing now! :(;comedian
Teach a man about politicians Show a man politicians and he becomes interested for a day Teach a man to be a politician and he loses his spine;politicians
What is long and yellow and always points north? A magnetic banana.;banana
What is stronger an elephant or a snail ? A snail because it carries it's house an elephant just carries its  trunk !;animals
How many flies does it take to screw in a light bulb? Two, but I have no clue how they got in there.;flies
What's brown and rhymes with Snoop? Dre;music
Whatever Mom, IF THAT'S EVEN YOUR REAL NAME!!!;family
Some guy ordered a glass of coke. I told him to take a pitcher, it'll last longer.;drinks
Shaving your beard is a great way to remember what you looked like when you were 5.;beard
Want to hear a joke about pizza? Nah, it's too cheesy.;pizza
You know what I hate? People who answer their own questions.;people
When the sun explodes you will have eight minutes before the world ends. In a related story, you might want to order dessert now.;sun
I am not that kind of woman...I"m much worse.;women
What do you call a Jamaican with diahorrea? *Cool Runnings*;Jamaican
Whats the difference between a crab with big boobs and a bus station full of punks? One is a busty crustacean and the other is a crusty bus station;crab
How did hipster kid hurt himself? He touched the stove before it was cool...;hipster
I went to the optometrist the other day and he told me I was colourblind... It came right out of the purple;colourblindness
If you're sad about being alone on Valentine's Day, just remember.. Nobody loves you on the other days of the year either.;Valentine's Day
See these teardrop tattoos? I got one for every time I cried in jail.;jail
Im sat here looking at my glass half empty..... Everyone is telling me that I should look at my glass half full, but i just want to know, WHO THE FUCK DRANK MY DRINK;drinking
What do you say to a redhead who has just been insulted? Aw-burn!;redheads
What's the best thing to put into a pie Your teeth.;pie
When an avocado and a duck mate, what sound does the offspring make? Guac!;avocado
So I asked my North Korean frien how is life was going. He said "can't complain";North Korea
A friend of mine is going to cosmetology school... I told her all the tests will be make-up exams.;cosmetology
Tweets are like your children: you love them all at first, you never know how they'll age, and most of them you regret creating.;Twitter
Where's my cell? "Right there." That's not my phone. "Yes it is. I cleaned it!" My cell's white?;phone
You Suck Originally I had hope and dreams of becoming somebody but thanks to you and the society we live in it's never going to happen;Society
What's a hipsters favorite season? Summer, they like it before it's cool;Seasons
What do you call a terrorist's girlfriend? A Guantanamo Bae Thought of this one earlier and just had to share;Terrorism
I painted my computer black hoping it would run faster, but now it just doesn't work.;Computers
On the way to school... tldr;School
Why did the baker go to work? He kneaded the dough!;Baking
NASA was planning on building a restaurant on the moon They cancelled because they figured it wouldn't have any atmosphere.;Space
If a crackhouse is filled with love, it becomes a crackhome..;Drugs
Is that really your rectal temperature? Nah, I just pulled it out of my ass.;Health
What do you call an incredibly flexible chicken with an alien wristwatch? Bent Hen.;Animals
I wanted to fold the toilet paper and use it again... but felt that it was too tainted;Hygiene
Nigerian people is the best in the world. One of them offered me 1 million dollar via email this morning in just exchange for $100.;Nigerians
The best joke about clickbait ever;Clickbait
What do you call black men working while white men watch? Slav-The NBA;Racism
My E! True Hollywood Story would just be me trying to open a soy sauce packet.;Hollywood
Dang I didn't make it to the gym today! That makes 5 years in a row;Gym
When does a guy turn into a gay? When something's bent on top of U;Homosexuality
[OC] What do you call a Latino on a bike? Juan less car (one less car);Latinos
Joke stealing is not a laughing matter That's why I don't steal unfunny jokes.;Jokes
Nothing kills a good party buzz like the paramedics showing up and acting like drama queens.;Paramedics
God wasn't trying to get Marry pregnant with Jesus. Turns out he was wearing a holey condom.;Religion
Shin: A device for finding furniture in the dark.;Furniture
Strange that the Bible has no bibliography.;Bible
What part of the computer the astronaut likes the most? A space bar.;Computers
I'm not an alcoholic I just have a lot of things to celebrate.;Alcohol
Facebook has pretty much made it impossible to ever again say, "I had no idea it was your birthday!";Birthdays
You know what really gets my goat? The Chupacabra;Chupacabra
My husband is playing Super Mario Bros with our sons and one of them is having a MAJOR tantrum. Sadly, it's my husband.;Parenting
Why was 6 afraid of 7? Because 7 kept blowing up and starting on fire;Numbers
If one quits quitting... Are they still a quitter?;Quitting
When you complain about dropping your phone remember that there are people who are starving who'll totally make you another one.;Poverty
There is never an excuse to use a contract killer Always pay-as-you-go.;Murder
I can tell people are judgmental just by looking at them.;People
Why do psychics ask questions?;Psychics
Having to get just a cucumber at the store can be awkward. Especially if you panic & say, "It's not what you think, it just for a salad.";Cucumbers
Engraved on a hypochondriac's tombstone... See, I told you I was sick.;Hypochondria
[on a date with a caribou as a favor to my sister] me: so...did you like the movie? caribou: *knocks over candy display & tramples 3 kids*;Dating
If I say, "Don't worry, I'm on it," there's a 98% chance I'm referring to my couch.;Procrastination
Did you hear the new broom joke? It's sweeping the nation!;Broom
Gas is so cheap right now, I just buy a new car when I run out.;Gas
Our family's annual tradition, as I put up the tree, everybody gathers around to watch my wife tell me I'm stringing the lights wrong.;Family
Did you guys hear about the joke about the high wall? It's so funny, I'm still trying to get over it.;Wall
Why did the cop climb the tree? He worked for a special branch.;Cop
No, I don't hate you. I promise. Cross my heart and hope you die.;Relationship
What is the one thing you can't say even on the internet? [removed];Internet
I recently saw a documentary on different types of stationery throughout history. It was on paper-view.;Stationery
People with private Twitter accounts should know that withholding their tweets is like not letting us talk to their toddler on the phone.;Twitter
Are we as a society going to reject clickbait journalism? The answer may surprise you!;Journalism
What is the best thing to do with lots of Dutch cheeses? Edam...;Cheese
What was the name of the hog who was knighted by  King Arthur? Sir Lunchalot.;Hog
What dog rides a horse named Macaroni? Yankee poodle!;Dog
I really wanted to remarry the woman I divorced a year ago, but she said I was only after my money.;Marriage
All my friends say that I'm a psychopath. That's not true, I don't have any friends.;psychopath
We have a 9th planet and it's chill Netlixand chill... sorry idk;planet
So, Schrodinger walks into a vet with his cat. The nurse takes the cat, goes into the room, and comes out 10 minutes later. "Sir, we have good news and bad news.";Schrodinger
The word resume has fireworks coming out of it to help with the pronunciation yet we're left to fend for ourselves with colonel?;pronunciation
What did the woman from Finland say after seeing an old man fall in the water, knowing he couldn't swim? "Oh no, Helsinki! He Finnish!";woman
My brother told me I have the body of a god. Buddha!;brother
I love it when waiters tell me to tell them when to stop grating cheese on my meal. It's cheese, dude. We'll be here a while.;waiters
I love telling jokes... But I always punch up the fuck line. Shit!;jokes
I'm creeped out by the Hamburger Helper glove. "Hi, I'm a dismembered hand here to help out with dinner." No thanks.;Hamburger
Teacher to Student: Why are you late? Student: Because of the sign on the road. Teacher: What type of sign? Student: The sign that says, "School Ahead, Go Slow.";Teacher
I've seen Han Solo land the Millennium Falcon on an asteroid, I'm sure he can handle landing a plane on a golf course.;Han Solo
The Da Vinci Code talks a lot about it Jesus had a child... But what about the second cuming?;Jesus
My girlfriend tried to make me have sex on the hood of her Honda Civic... But if I'm gonna have sex, it's going to be on my own Accord.;girlfriend
Doing squats. And by that I mean I'm in the squat position. But really the couch is holding me up. I'm sitting on the couch.;couch
What does an IT guy use for birth control? His personality.;IT
What's the hardest part about eating your vegetables? Digesting the wheelchair.;vegetables
i've got a pilot's licence... and i'm not giving it back to him. luckily he's too drunk to notice.;pilot
A robber walks into a bakery, and pulls out a gun. "Give me the dough!";robbery
I used to be into sadism, necrophilia, and bestiality... ...but then I realized I was just beating a dead horse.;sex
I got free admission for life at SeaWorld For being an Orca Whale.;SeaWorld
Why do female zombies have such a terrible sex life? Because whenever they shout, "I want you inside me." all of the guys run away.;zombies
My gynecologist recognized me at the grocery store, so I guess I need to start wearing longer skirts.;gynecology
Jesus walks into a bar "Just 12 waters please", while winking at his disciples.;Jesus
I was going to buy some Veet wax strips, but then i realized they were a rip-off;hair removal
My Son is a porn star... ...I had to have my wife arrested.;porn
So far, too much day and too little hump.;day
How many Germans does it take to change a lightbulb? Just one. They're an efficient people, but not very funny.;Germans
Pac-Man taught me that you can eat ghosts if you take enough pills.;Pac-Man
If you are charged with possession of marijuana Is it called joint custody?;law
Those glasses really do make you look more dignified. Respectacles;appearance
Which gun does Superman use? SCAR-L;superhero
What's the Vatican City's favorite snack? popecorn;religion
Billion dollar idea: Make a prescription drug that gets rid of the side effects of all of the other prescription drugs.;medicine
What do you call a terrorist in the North Pole? An ISISicle!;terrorism
Why did the boxer date the pretty girl? Because  she was a knockout!;boxing
Q: Why do Greek men wear gold neck chains? A: So they know where to stop shaving.;culture
I read an article about how much college will cost in 20 years so I'm scraping some paint chips off the house for my daughter to snack on.;education
Made a meal out of an old recipe book today. Just tasted like paper really .;cooking
Where do all the funny people hang out at a party? In the punch line;party
*feels the music* Music: "ew. no.";music
I walk around like everything is fine, but deep down, inside my shoe, my sock is sliding off.;shoe
Pancake Day ... Has has really creped up on me this year;Pancake Day
Did you hear about the cannibal spider that ate his uncle's wife? He was an aunteater.;spider
"Not all guys wearing Flannel shirts are Lumberjacks." *hits tree with axe* " Take me for example. I just hate trees.";Lumberjacks
Billion dollar idea. A smoke detector that shuts off when you yell "I'm just cooking!";smoke detector
What do a walrus and Tupperware have in common? Both looking for a tight seal.;walrus
Pee your name in the snow and you'll quickly understand why they teach cursive in our schools.;snow
I was visited by three spirits last night, Vodka, Rum And Gin. . .;spirits
creating an app called Friends With Pools. It's exactly what you think it is.;pools
What do you do with 100 peaches? You eat what you can, and you can, what you can't.;peaches
What's the difference between a baby and a watermelon? One is fun to hit with a sledgehammer, the other is a watermelon.;watermelon
What's the difference between a baby and a bowling ball? You can't unload a truck full of bowling balls with a pitchfork.;bowling ball
There's no easy way to say this..... She sells sea shells on the sea shore, the shells that she sells are sea shells for sure.;sea shells
Did you hear about the Mexican man who went to the old people home to visit his grandpa? See senior.;Mexican
I bought my friend an elephant for his room... He said, "Thanks". I said, "Don't mention it".;Elephant
How many babies can fit in a blender? Depends how powerful the blender is;Babies
Why are artists the only guys who can sleep with comedians? Because drawing is the only way to make a comic strip.;Artists
Clearly Cheating A man cheats on his girlfriend Lorraine with a woman named Clearly. Lorraine dies suddenly. At the funeral, the man stands up and sings, "I can see Clearly now, Lorraine is gone.";Cheating
What do you call a nose without a body? Nobody nose.;Nose
What's the name of the Iraqi basketball team? Alley-oop Akbar;Basketball
Did you hear about the recent kidnapping? It's okay, she woke up.;Kidnapping
On dating sites, some of the options for 'body type' should be, 'Vending machine', 'deformed walrus' and 'pudding in garbage bag'.;Dating
Why does Santa Clause have such a big sack? He only comes once a year.;Santa
What do you call a dog with wings? Linda McCartney Today's TIL reminded me.;Dog
A lawyer walks into a bar... exam. I just thought of this one. Not sure if I'm the first.;Lawyer
I have just seen a load of dyslexic africans. They were laying flowers at nissan maindealers.;Dyslexic
A bear is asking a rabbit a question "Don't you have problems with shit sticking on your smooth fur?" Rabbit goes : Naaah, I don't have a problem with that. So the bear wipes his ass with the rabbit.;Bear
Why did god give women legs? Have you ever seen the trail a snail leaves?;God
TREE: [sees christmas tree thru window] who dose he think he is. all dressed up. too good to be outside ANOTHER TREE: be nice, he is dying;Christmas
How did the homeless handicap child die? Alone;Homeless
I just saw my 25-year-old son run water on a slice of pizza to cool it off. I need to sit down.;Parenting
[Gets Twitter error: "Somehow, somewhere, something went wrong"] I know Twitter, I know. That's why I'm here.;Twitter
What do Muslim children color with? A Quran;Islam
if a picture's worth a thousand words, the people posting photos on twitter are going over by 860 characters;Twitter
Do robots have sisters ? No just transistors !;Robots
In space, no one can hear you scream. Because it's space, and everyone is on the ground. What are you even doing up there?;Space
Took my date to Star Wars and dinner... to make sure BB-8.;Dating
"I don't know, do you guys really think the first rule should be 'Must Wash Hands?'" early brainstorming session on Fight Club script.;Fight Club
[showing people around museum] and if u look to ur left you'll see a bunch of uppity people who get reaaal weird when you lick the paintings;Museum
21 ways to piss off the mods on this sub [removed];Reddit
My wife said: Pls go to shop & buy a carton of Milk & if they have eggs, get six. I came back with Six cartons of Milk & told they had eggs.;Marriage
What did one lesbian vampire say the other? See ya next month );Lesbians
How many policemen does it take to change a light bulb? None. They just beat the room for being black.;Police
Why Did John Lennon Get shot? Yoko Ducked;John Lennon
My girlfriend told me she enjoys sex more while on holiday. I tell you that was an awkward postcard to receive;Sex
What do post-impressionist painters sing when painting a Frozen landscape? Let it Gogh!;Painting
I caught my neighbor putting a layer of topsoil on my allotment The plot thickened;Neighbor
What colour did Matthew McConaughey paint his house? All white, all white, all white...;Matthew McConaughey
19 and 20 got in a fight. 21.;Numbers
I have trouble ending small talk. Some guy I started talking to in 1998 on a bus is still talking to me. His name is Gary. He hates rain.;Small talk
Ladies & gentleman this is ur captain speaking. I havent seen the new Star Wars yet. If I hear u discussing spoilers I will crash this plane;Star Wars
I keep having hallucinations of pickles. My therapist says I'm dillusional.;Pickles
What do you call a Hawaiian homosexual? A tropical fruit.;Homosexuals
"Sure it's a dental PRACTICE, but dont fret, I know what I'm doing. Open wide." *opens wide* "Ok which ones are the teeths? Where are teeth";Dentist
Monster: I've got to walk 25 miles home.' Ghost: Why don't you take a train? Monster: I did once but my mother made me give it back.;Monster
All of my horoscopes lately have started with "Ok, don't freak out but...";Horoscope
Elton John was asked if he'd like an iceberg lettuce in his salad he thought for a moment and replied "no thanks, I'm a rocket man";Elton John
When someone reads your message, then never responds, it's just hurtful. I mean, what else could they possibly have going on at 3 AM?;Messaging
God: You'll be cursed to travel the desert for 35 years Moses: *slipping him $20* How about 30 [Later] Moses: We must wander for 40 years;Moses
Why did the Mexican cross the road? Because there isn't a fucking wall in the way;Immigration
*reads your mind* *decides to wait for the movie*;Mind reading
What do you call a guy who likes telling "dad jokes"? A "groan" man...;Dad jokes
Two young men walk into a bar I dont know what happened then I was outside;Bar
Everyone knows that your eyebrows are drawn on, we just wish you'd make them lightning bolts once in a while.;Eyebrows
Michael Bay looks like if cocaine was a person.;Michael Bay
Hey TV producers! Create a show for white people called "Brunch Wars". You're welcome.;Racism
My internet went out today so I went downstairs and talked to my family They seem like nice people.;Family
How do you spot a joke without a punchline?;Jokes
Hey, Chefs, you're making food. Not curing AIDS, Cancer or defusing a bomb. Settle the fuck down.;Chefs
What's so good about being Swiss? Well, the flag is a big plus.;Switzerland
What does a gay horse eat for dinner? Haaaayyyyyyy;Homosexuality
Mitch Hedberg R.I.P Buddy I was told to move because I was blocking the fire exit ... as if I wouldn't run if there was a fire ... anything flamable and has legs can't ever block a fire exit;Mitch Hedberg
Which country has many spaces to put your car in? Park-istan!;Pakistan
I walked into a bar once... and it fuckin hurt.;Bars
<-----Will never confess the actual number of house cats he's forced outdoors when the owner wasn't looking;Cats
What happened to Frankenstein's stupid son?  He had so much wax in his ears that he became a permanent contributor to Madame Tussaud's.;Frankenstein
[office meeting] BOSS: Printer ink is costing us a ton. Any ideas on how to cut costs? SQUID: *looks up from phone* Why y'all lookin' at me?;office
I remember when [person x] was just *this* big (hold hand at knee level)... Then as I got closer I realized it was a matter of perspective.;growth
Let me clarify that I am not racist. We have a black in my family tree. We just haven't cut him down yet.;racism
As a guy in the porn industry... I work hard.;porn
I found out I was can't wear latex condoms They give me an allergic erection;condoms
If you watch Jeopardy backwards... ... it becomes a show where people pay money to ask questions.;jeopardy
we're going to have a president named jeb. president jeb.;politics
What does an aging Mafia boss do for his birthday? Forget about it.;mafia
I wish No More Tangles shampoo would work on Christmas lights.;christmas
I love to build things... I love hammering, I love sawing, and I love sanding. But drilling is just plain boring.;building
Why can't Asians make white babies? Because two Wongs don't make a white;asians
A high-dea supported by evidence... Is called a High-pot-thesis;thesis
What did the duck say when he bought the chap-stick? Put it on my bill.;duck
Conductor this bus was very slow! Oh I expect we'll pick up speed now you're getting off!;bus
What do you call a fat man in a bath ? Tubby.;man
I have a condition where I spontaneously tell jokes at random times I think it's a gag reflex.;condition
Robber: If you ever want to see your family again do exactly as I say. Now hand me that bag! Me: *sets bag on fire*;robbery
Thank you Facebook for putting everyone's Facebook page link on their Facebook page. I would have never found their page without it.;Facebook
What are Mario and Luigi's overalls made of? Denim, denim, denim.;Mario
My parrot lays square eggs but can only say one word. What's that? Ouch!;parrot
Why did the zombie get a gym membership? Gaaaainsss;zombie
What is the sexiest type of dolphin? A striped tease dolphin.;dolphin
What do you call a superhero-duo run over by a steam roller? Flatman and Ribbon.;superhero
Just killed a cricket at work, and, long story short, I'm now being asked to audition for Riverdance.;cricket
The average person has sex 103 times a year and it's almost March so that means only 103 more to go.;sex
A woman asked a female doctor if she had aids ... "Yes, I do. They're busy now, but they'll be with you shortly.";doctor
concerned about people posting false lunches. lying about the food they ate on here. fraud meals. please start putting the receipts up;posting
I get nervous about DM's asking if it's me in video because: 1. I drink. 2. I sometimes dance when drunk. 3. I'm always white when I dance.;Drinking
Look, I've been following you for the last three doors you've opened. I'm not saying thank you again.;Chivalry
Why did the nickel jump off the building but the dime didn't? The dime had more cents.;Money
Why did peasants hate knights' outfits? Because everyone hates chain mail.;Medieval
Have any of you heard back from D yet? DEEZ NUTZ HAHA GOT EM;Prank
Knock Knock Who's there ! Ahmed ! Ahmed who ? Ahmed a big mistake coming here !;Immigration
Chuck Norris was what Willis was talkin' about.;Chuck Norris
Bush Senior broke his neck He was trying to show Jeb Bush how to dodge wrenches, hey Jeb if George can dog a shoe then I can dog wrench!;Politics
I just got into an argument with Mrs. Fields She was one tough cookie;Baking
