"Joke";"Joke topic"
Teacher : What's your favourite letter ? Student: The letter G. Teacher : Why is that Angus ?;School
The road to Hell is paved with everything that feels like Heaven.;Heaven
Even that crack on the wall becomes more interesting when you're meant to be studying.;Studying
What did the moon say to the window? Fuck off;window
Sometimes I like to sit at the playground & wait for a concerned Mother to ask "Which kid is mine?" I like to reply "I haven't decided yet.";motherhood
What do you call a potato shaped like a penis? A dictator.;potato
i'd be ok with drone strikes if we used them against anyone who thinks mentioning "bacon" is funny;drone strikes
How do you get the political science grad off your lawn? Pay for the pizza;politics
[In a seahorse home] Son: Dad? Dad: Yes? Son: Happy M- Dad: DON'T Son: Moth- Dad: STOP Son: HAPPY MOTHERS DAY *Dad bangs head on desk*;family
What did the quadruple amputee say when he couldn't solve the riddle? I'm stumped.;riddle
love is joke hhhhhhhhhhhhhhh;love
Why is eastern europe filled with strippers? Because they like Poles.;strippers
My dog is a nuisance. He chases everyone on a bicycle. What can I do? Take his bike away.;dog
"Oh holy shit, what the hell is this!" -people who request songs on the radio discovering the internet for the first time;radio
I got banned from my chiropractors office. Apparently its not "appropriate" to ask for a happy ending.;chiropractor
What do you call a bear that can't win? A Chicago Bear;bear
What do you get by cross-breeding a jehovahs witness and an atheist? Someone who pointlessly knocks on the door.;atheism
How do you get heaps of pikachu on to a bus? You pokemon;Pikachu
You can't trust anyone you meet online I went on a date with a guy I met online last week and stole $250 from him;Online dating
My doctor says I'm not eating a balanced diet...that's absurd. I eat as many cookies with my left hand as I do with my right!;Diet
Thinking about free healthcare and how much it's going to cost me?;Healthcare
This month is so 08/15;Month
What do you call a dog wearing a watch? You would call it a dog. A dog wearing a watch is not a watchdog.;Dog
How do you spell moron? M O R M O N;Mormon
I don't have a problem with man buns You used to have to talk to someone for 3 or 4 minutes to figure out if he's a fuckhead;Man buns
What did Stephen Hawking say when his computer crashed? Nothing.;Computer
Q: Can February March? No. But April May!;Months
looks like our killer left his calling card. 5 cents/min to canada, 7c/min to puerto rico. he knows what he's doing.;Murder
Why was hitler bad with directions? Because three reichs don't make a left.;Hitler
The Bat family were playing a game of "old maid" with a poker deck... Needless to say it was a never ending game. Everyone wanted the joker.;Poker
Don't fire till you see the whites of their eyes. OH MY GOD THEY'RE CHINESE!;War
Relax. If you didn't want me knocking it over, why the hell did you write "tip jar" on it? Just for that, I'm taking my 15 cents back.;Tip jar
One big plot hole in X-Men is that Wolverine is over 100 yrs old but there's never been a point in history when that was a hairstyle.;X-Men
5yo and her friend just ended an argument by deciding they would "have a piece of cheese and calm down" So, yeah, she's mine.;Parenting
Where do mathematicians go to gamble? Sine city;Mathematics
Anyone who's ever stood in a busy McDonald's line at 10:29am not knowing what to get has been closer to getting murdered than they realize.;McDonald's
You brought me roses? I can't eat this. Get out.;Gifts
Caitlin Jenner's name should be Trans Trans Jenner;Caitlin Jenner
A man stumbles upon a Genie and is granted 3 wishes. Genie: What is your first wish? Joe: I want to be rich. Genie: Granted. What is your second wish? Rich: I want lots of money.;Genie
What's the difference between an airport shop and a golf course covered in bacon? One's a duty free, the others a Jew free tee.;Airport shop
What do you call a Canadian pimp? Jose (hoes eh?);Pimp
[pharmacy] "I'd like a refill for this bottle of pills" PHARMACIST: Would you like childproof? "No thanks, I already believe in children";Parenting
What do you call a white guy who grew up in the ghetto? Tarzan.;Ghetto
What do you call a frightened nun? A nervous habit;Nun
Mama Bear: Ok but last time Papa Bear: Thanks, babe [she puts on a Goldilocks wig] Mama Bear (falsetto): I can't sleep here! It's toooo hard;Parenting
Did you hear what happened to the dildo farmer? He had a big problem with squatters.;sex
What's white and kills you if it enters your eye? An airplane.;airplane
i wanted som fried chicken but i didnt have any chicken so i fried an egg adn waited a few years;food
Dr. King Schultz wins the Oscar.. The white man profiting yet again at the expense of the black man.;racism
How do Germans tie their shoelaces? In little knotsies....;nationality
Two praying mantis' sitting in a tree. K-I-S-S-I Oh shit, did you see that? Daaaamn. She straight up ate him.;animals
I'm so sick I feel like a white boy at his first Kanye concert (masterpiece);music
Sex in the morning I bet it has been up here before, but I felt that it had to be out here again. Sex is one of THE best things to wake up to.... Unless you are in prison;sex
If it looks like I'm typing for five minutes I'm really just trying to spell diarrhea.;diarrhea
Where do black parents get gifts for their children? At Toys We Is;racism
Mattel has a campaign urging girls to pursue their limitless potential. It's called You Can Be Anything Except A Woman With Barbie's Body.;feminism
BAD MATH JOKE TIME. For pi day, my friend was selling pies as a fundraiser, so because I love pie, I decided to buy two. I went from 0 to 2. I went absolutely nowhere.;math
A doctor goes to his patient and says "I have some bad news, you have cancer and you have alzheimer's" Patient replies "Well, at least I don't have cancer!";health
I think it works! GUYS! I just invented time travel!;time travel
My wife caught me again on the couch with my iPad & a hand towel while I was putting lotion on my feet with my pants off.;marriage
If an apple a day keeps the doctor away how many orchards does it take for a lawyer?;lawyers
The new French tanks have 14 gears 13 go in reverse and 1 goes forward in case the enemy attacks from behind.;war
I want to have 3 kids and name them Ctrl, Alt, and Delete. That way when they fuck up, I can hit them all at once.;parenting
What do you call an orgy with five black people? A threeway;race
"Well, there goes the end of my arm," said Tom offhandedly.;accidents
Two hikers are standing on a bridge over a stream, peeing over the side. First hiker: "Wow, this water's cold." Second hiker: "And deep.";nature
If we're going to do racist jokes How's a Mexican like a cue ball? The harder you hit it the more English it picks up!;race
A man asked me if I could figure out how to operate a camera... I told him I'd look into it and give it my best shot.;photography
If FedEx and Ups merged would they call  it Fed UP?;business
Why did Hitler invade Poland? To get to the other side.;war
In 1969 we put a man on the moon... In 2016 we put a man in the ladies restroom.;transgender
Just made 7 decisions based on my phone's battery life.;technology
why did Microsoft skip 9? because 7 , 8 , 9 !;Microsoft
For Halloween I'm giving out razor blades with candy in them. These kids'll be shaving away and then BAM - nougat everywhere.;Halloween
What is the deal with airplane food? Seriously, I'm trying to feed this thing and I don't know what airplanes eat.;Airplane food
So a black guy walks into a bank... Approaching the nearest available teller, he says, "Hi, I'd like to file for bankruptcy." "Okay", the teller replies, "what's your name?" "Fifty Cent" badum tisss;Bankruptcy
Based on the novel 'Push Notifications' by iSapphire;Novel
Cantaloupe... or Wontaloupe?;Cantaloupe
What's the the key to telling an ISIS joke? The execution.;ISIS
I caught a computer virus once. My thumbnails fell off...;Computer virus
[beside lady with baby] Her: Smells like someone went poop poop! Does the baby need a change? Me: *blushing* Yes ma'am.;Baby
how did one droid flirt with the other droid "hey bb";Droid
A serial killer leaves his mark on his victims by cutting off their left hand and right leg. Authorities say something sinister is afoot.;Serial killer
I made a joke. I had a threesome once... I think I sprained both my wrists;Threesome
2050's kids won't get this... Snow;Nostalgia
Three logicians go to a bar The waiter asks if they would all like a drink The first responds "I don't know" The second responds "I don't know" And the third responds "Yes, why thank you";logic
Finally took that warning on the cigarette pack to heart and stopped littering;smoking
There are 3 kinds of people in this world those who can count, and those who can't.;math
What do you call two Mexican men playing basketball? Juan on Juan.;basketball
Why did the Louvre tour guide work for pennies? Because this docent makes any cents.;job
" How was your blind date ? " " Terrible ! He showed up in a 1935 Rolls Royce. " " What's so terrible about that ? " " He was the original owner ! ";dating
I bought a book about addiction I've read it 50 times and it still hasn't helped.;addiction
Healthy human blood must be a low-carb meal... Because it's the most-keto diet.;blood
Just trimming my nose hair and drinking a soy latte. Damn it feels good to be a gangsta.;gangster
The Easter Bunny, the Tooth Fairy and Manti's girlfriend walk into a bar... Rimshot!;mythical creatures
I threw a boomerang yesterday and it didn't come back. How long do you reckon before it's safe to turn around?;boomerang
Thank you Twitter for introducing me to brilliant people , but your suggestions of who is similar to me is making me reassess my life.;social media
What do you call a Mexican who lost his car ? Carlos.;Mexican
[running from a knife wielding murderer] oh hell yeah, my Fitbit steps are gonna be OFF THE SCALE today;Murder
What's a dog's favorite chip? Ruffles :);Dog
How does a vampire get through life with  only one fang? He has to grin and bare it.;Vampire
I've got money left over for condoms or lottery tickets. I'm trying to calculate the odds.;Condoms
There are three kinds of people in this world.... Ones that can count and ones that can't;People
Why does China care so much about money? They can't resist all of the cha-'ching'.;China
My Grandfather had the heart of a lion and... A lifetime ban from the New York City zoo.;Grandfather
What car does Boba Fett drive? A ManDeLorean.;Boba Fett
I told a joke to my Chemistry teacher. He replied "Oh man, I slapped my neon that one";Chemistry
I get knocked down, but I get up again, and you're never, oh you knocked me down again, you are being very rude;Rudeness
A joke about mods [deleted];Mods
I just microwaved my TV dinner & it came out fully cooked on the first try, so I'm basically a chef at Applebee's now if anyone's hungry.;Cooking
Why was the obtuse triangle upset? Because he is never right.;Triangle
So I donated blood today... Good to know my blood is gonna be running through some other guy's boner;blood
I once dated a guy with premature ejaculation. I don't know why. I knew it wasn't going to last. In fact, I could see it coming.;premature ejaculation
I watched the African version of "Man v. Food", but it was just a half-hour of a guy chasing a gazelle.;Man v. Food
An efficiency expert concluded his lecture with a note of caution. "You don't want to try these techniques at home....;efficiency
A man walks in to a green grocer's "Excuse me ma'am, are these carrots genetically modified?" "No" interrupted the carrot.;carrots
How many flies does it take to screw in a light bulb? Two! But don't ask me how they got inside there.;flies
I think I'm gonna become a solipsist, who's with me? Wait... no one's with me.;solipsism
What do you call a smoothie that came out too thick? A chunky. Credit to my dad this morning..;smoothie
Ever see the movie human centipede? That movie sucks ass.;human centipede
Vending machines are so homophobic Like, I'm sorry my dollar bill wasn't straight enough for you.;vending machines
Q: How many publishers does it take to change a lightbulb? A: Three. One to screw it in and two more to hold down the editor.;publishers
Did ye hear about the movie that the pirate went to see? 'Twas rated Argggghhhhh!!!!;pirate movie
What's the worst thing about alcoholics? They wine too much.;alcoholics
Here's a question. If you and your girlfriend/boyfriend/husband/wife switched phones and Facebook profiles for 24 hrs would you still have a relationship!!!!;relationships
A cobbler was once elected the mayor of a small town. People thought he was a real shoe-in.;cobbler
Every 5 seconds a woman gives birth to a baby. Stop this woman;birth
My wife gets her news from NPR. I get mine from Twitter. Guess which one of us knew about planking first? Suck it, legitimate media.;news
what if it doesnt want to be called hot sauce???? what if it wants to be called beautiful sauce;sauce
What do you call a melon with overbearing parents? cantaloupe );melon
Go ahead, judge me. Wait, let me get my bat first. Alright, I'm ready now.;judgment
What do you call a Phillipino contortions? A manilla folder;Filipino
Don't ever go camping. That shit's intense.;camping
Answering your cell when you don't recognize the number is like picking up a hitchhiker.;phone
What's Ja Rule's favorite type of bread? Challah!;bread
Why couldn't the man open a fish and herb shop? Because he didn't have the thyme or the plaice.;fish
Ever tried eating a clock? It's time consuming.;clock
What do you call a fuzzy philosopher? BEARistotle I'm so sorry;philosopher
What's a snake's favourite food ? Hiss Cakes !;snake
Why did Julius Caesar want to quit politics? All that backstabbing was too much for him.;Politics
what do you call a french kebab? a body bag.;Food
How do small people call each other? On microphones.;Height
Aggressiveness is in the eye of the beholder. Until he punches you in the face. Then aggressiveness is inbetween the eyes of the beholder.;Aggression
Do you want to hear an Ebola joke? Just refresh the page,it's probably posted again.;Disease
I Thought having a vasectomy would stop my wife from getting pregnant... But apparently it just changes the colour of the baby;Pregnancy
How did Jesus get his beach bod for the summer? Cross fit;Religion
So UBER is not a dating app? *sigh* I kinda thought all those 'Goodbye' kisses seemed more awkward than usual.;Dating
Genie: 1st wish ME: I wish for a pen G: #2 M: another pen G: wtf M: I already lost the 1st pen G: and ur 3rd M: ur not going to believe this;Wishes
Why did the blonde scale the glass wall? To see what was on the other side.;Hair Color
Do you think a contortionist would go on a date with me? Even if I couldn't fit in her box?;Dating
Do you know why they call them Sperm Whales? Because they're delicious!;Animals
What is a Pokemon's favorite kind of nut? A Pi-cashew;Pokemon
You know there are some trained minds that can tell a lot about a person just by looking at them. I like to call said minds 'Presumptious, judgemental Assholes.';People
What is your best wordplay joke? My personal favourite: Two peanuts walked into a bar, one was assaulted.;Wordplay
Gentrification tends to happen during autumn Because the brown leaves.;Gentrification
Santa is such a whore... He's always looking for some ho ho ho's.;Santa
I'm still waiting for my knight in shining sarcasm.;Love
"I found my charger!!" - a love story;Love
What's the worst part about being a black Jew? you have to sit at the back of the gas chamber.;Judaism
Turns out that German pilot was heavily depressed... He brought the whole plane down.;Pilots
Pants should have to wear pants so they understand why it sucks to wear pants.;Pants
What did the VW spokeswoman say after the EPA tester discovered the emissions discrepancy? Nothing, she was embarrassed.;Volkswagen
I'm bored Think I will go to the mall, find a great parking spot and sit in my car with my reverse lights on.;Boredom
How much do my arms have to weigh before I can be considered heavily armed?;Guns
On Possession So me and my sister when in a fight and she said, "Your so possessive", I responded, "What about my possession, is it ok?;Possessiveness
Please do not power off or unplug your machine. Installing update 45 of 9484727192873828277362517293847265127826262827262726273633833727...;Computers
A turkey was about to cross the road... when a chicken appeared and said "dont do that that, you will never hear the end of it";Turkeys
Want to hear a clean joke? Henry took a bath with bubbles. Want to hear a dirty joke? Bubbles was a man.;Bubbles
Oh, you solved a murder? I guess that's cool. One time I didn't run over my ex when I saw him crossing the street. I prevented a murder.;Murder
What does DNA stand for? National Dyslexics Association.;DNA
Dave: I don't want to sound stupid.... Me: Then stop right there and say nothing.;Stupidity
[job interview] "So do you have any questions you'd like to ask me?" Can I wait a week until I take the drug test?;Job Interviews
What's the difference between a nicely dressed man on a unicycle and a poorly dressed man on a bicycle?? Attire;Clothing
I'd like to give it up to sidewalks for keeping me off the streets.;Sidewalks
Did you hear about the spilt milk? It was an udder disaster....;Milk
My facebook homepage has become a sea of 'who the fuck is that?';Facebook
My brother was in a car accident yesterday... and lost both his left arm and left leg. Actually, he's my half brother. He's all right now.;brother
Did you guys hear they're making a sequel to the hit TV show "Medium?" It's called "Large.";TV show
My friends and family treat if as if I'm a god! They don't believe in me;god
"I'm going to France next summer." "Oh, really?" "No, De Gaulle.";France
Why is Kristen Stewart safe from the Fine Brothers? Because she has no facial expressions so can't react.;Kristen Stewart
You know what really makes me smile? Fascial muscles.;smile
The inventor of the Red Solo Cup had died. His body was found under the sofa in the living room three days after his death.;Red Solo Cup
Him: I wanna be the man you fell in love with all those years ago. Me: You wanna be Ryan Reynolds?;Ryan Reynolds
For $60, this printer ink had better be hand squeezed out of endangered squids.;printer ink
I recently traced my family tree... It was easier, I'm rubbish at drawing.;family tree
So a fisherman is having an argument with a stain on his shirt.. And the stain says "I'm fish jizz, thank you." And the fisherman replies "No, you're whale-cum";fisherman
My friend's coming over, I've got to be careful... ...my house mates are crazy and he's allergic to nuts. *Yes indeed.*;friend
What did the cannibal do after dumping his girlfriend? He wiped his butt!;cannibal
"You're a joulepersecond!" "Wat?" "Exactly.";insult
TIL Lebanese people are from the fugawi tribe. When they walked out of the airport they said we're the fugawi.;Ethnicity
What did the lawyers say when they finished their basketball game? Court is adjourned;Lawyers
My girlfriend is from another Nation. ImagiNATION;Nationality
I was talking to coworkers about quitting this job and working as a pornographic actor... I decided against it, because I realized I was quitting "This fucking job for that fucking job.";Profession
"I enjoy working with a hammer, but I don't want a blue collar job." - Everyone who eventually becomes a judge.;Profession
A selfie stick is very useful..... .. as a prod to keep people out of your personal space.;Technology
What did the Mexican say when the house fell on him? Ayyyy watch it homes!;Nationality
[dinner party] GUEST: so what are your thoughts on euthanasia? ME: [mouth full of mashed potatoes] I am against youths everywhere.;Euthanasia
Relationships are a lot like algebra... Have you ever looked at your X and wondered Y?;Relationships
The phrase, "Don't take this the wrong way" has a zero percent success rate.;Communication
Me: are you married? Him: separated Me: your wife know about that?;Marriage
Where do men with erectile dysfunction go to find a job? Ubisoft;Profession
A rapist a gangster and a murderer are in the same car... Who is driving the car? A police officer!;Profession
Two atoms are walking down the street.... Two atoms walking down the street. One says, "Damn, Ive lost an electron". "Are you sure?" "Yep, I'm positive".;Science
My dog has been chasing people on bikes lately so I had to take away his bike;Pets
If you set someone free, love them. Wait I mean, if you love someone for free, set them. That doesn't make sense. Forget it.;freedom
What do you call a carrot that repeats everything you say? WOAH! BACK UP, BACK UP. You've seen a TALKING CARROT?;carrot
So I painted my laptop black, hoping it would run faster Now it doesn't work.;technology
Which is better a stool or a box to stand on? You stand on a stool, though I prefer the ladder;furniture
What do you do in a master bathroom? Masterbathe.;bathroom
Why did Hitler turn to genocide after a failed career as an artist? He never learned to mix the colors;Hitler
Why is Dublin the capital of Ireland? Cause it keeps on Dublin and Dublin.;Dublin
My 'home to pants off' speed ratio is unparalleled.;speed
What did the little girl's parents want for Christmas? A better son.;son
What's big, huge and hairy? A Goliath bird eating tarantula.;animal
How can you tell a rich Swiss from a poor Swiss? The poor swiss washes his Mercedes by himself;Swiss
The only thing keeping me from driving off this bridge is the insurance rate increase if I survive.;driving
The worst is when you're on a cruise ship that turns into an Autobot to fight a sea monster and you had a decent game of shuffleboard going;ship
I went to Russia, met a guy called Vladislav * **Baby, don't hurt me, don't hurt me, no more.**;Russia
Winston and a Cat What is the difference between J. Winston and a cat? One ruins girls clothes and steals crab legs, the other one is also losing the Rose Bowl.;Winston
What is Bear Grylls' favourite vegetable? Leek.;Bear Grylls
Are you ready for TheDivision's upcoming DLC? TheAddition? If not, you might like its already-existing-but-cut-for-later content TheSubstraction.;TheDivision
Thank you for explaining that Geico ad to me It means a great deal;Geico
My microwave broke. So, we're finding innovative alternatives. Did y'all know the surface on top of the oven heats up, too? Honest to God.;Microwave
The guy behind me at the grocery store only had energy drinks, root beer & gummie lifesavers, so I asked how far into assassins creed he was;Assassins Creed
OMG! I went shopping because I needed a skirt and these earings were on special so I bought four new pairs of shoes!;Shopping
I don't see the issue with microcephaly. Personally, I love a little head.;Microcephaly
Two months ago my best friend took off with my wife. And god damnit, I miss him.;Friend
I was just accosted by a small child riding shotgun in a shopping cart yelling "why you ain't got no babies?"I bet my father in law paid her;Child
Pull my finger Pffft;Finger
What did the dill pickle say to jennifer lopez? U WOt M8&gt?;Pickle
What do you call a 2x4 that lost its family to a fire? mourning wood;wood
Date: Do u have any allergies? Me: I'm allergic to raisins. They make me cry D: That's an unusual reaction M: They could've been wine!!;date
Hey, which Instagram filter takes out all the insecurities?;instagram
I hurt my neck sleeping on a pillow that was too fluffy. My body is not meant for this world.;sleep
A man once told me that he had never went to the bathroom in his entire life. I told him he was full of shit.;lie
Girl: Mom mom a monster's just bitten my foot off. Mom: Well keep out of the kitchen I've just washed the floor.;kitchen
I really, really need to stop eating clocks It is very time consuming;clocks
Did you hear about the ghost who was a great football player? No, what about him? He's a spooktacular quarterback.;football
My kids got in a fist fight while playing one of those claw machines at the pizza joint & shit like that is why I'm never sober.;kids
2015:hey how's it going so far? 2016:uh good 15: 16: 15:you've got an armed mili- 16:we've got an armed militia in a wildlife building, yeah;year
a 3 year old daughter * her - will i have a baby in my belly some day? * her dad - if u want to.. * her - no, that place is for candies;pregnancy
People who get offended when I breast feed publicly can fuck off What I'm doing is totally natural and strengthens the relationship between me and my dog;breastfeeding
Why did Gigi leave the party angrily? Because she's Hadid.;party
I just shaved my legs. I think I lost three pounds.;shaving
It's still Valentines day for another hour.. Roses are red Violets are blue No, they are violet FTFY;Valentines
Ain't no party like a dyslexic party Cause a dyslexic party don't pots.;Party
I don't get new car smell air fresheners Your '98 Ford Taurus isn't fooling anyone;Cars
Don't break anybody's heart, they have only one. Break their bones, they have 206.;Heart
Sorry I haven't returned your text in 3 days, I was taking a nap.;Text
Jared Fogle gets sentenced 15 1/2 years in prison At least he'll still be able to enjoy footlongs;Prison
An Irishman, a homosexual, and a Jew are sitting at a bar What a fine example of an integrated community.;Community
When I die, PLEASE don't bury me in a fancy suit. That happened to a guy I knew and it turned him into a skeleton.;Death
What did the turkey say to the turkey hunter? "Quack! Quack! Quack!";Hunting
"McDonald's sales soar thanks to all day breakfast" In unrelated news toilet paper stocks have risen and plumber businesses have been unable to keep up with demands for work.;Food
what do homosexuals and peanut butter have in common? They both dont come in boxes;Homosexuals
