"Joke";"Joke topic"
I'd estimate about 28% of the drugs you've taken were smuggled here in someone's asshole.;drugs
Q. What did the cannibal's wife give her  husband when he came home late for dinner? A. The cold shoulder.;marriage
Me: Ew, what sort of shop is this? It just sells dead birds? My cat: Pick out whatever you want, birthday boy. It's on me.;pets
The best things in life are free *plus shipping and handling*;shopping
I had I dream I wrote The Hobbit, and Lord of the Rings trilogy. I was Tolkien in my sleep.;literature
It was a sad day when I discovered my Universal Remote Control did not, in fact, control the Universe. Not even remotely.;technology
Did you hear about the Rabbi giving away hot drinks at the airport? It was Jew-tea-free;religion
I'm not very religious but... I'm praying that next year there will be a Jew who can pardon me of all my crimes!;religion
How do you like your eggs? Over here;food
If I was an author I would make my pen name... *Page Turner.*;literature
Parents, stop giving your kids these crazy names. I just found a love letter my son wrote to a girl named "Steven!";names
Fishing... It's like sex. The less you get the more you lie.;Fishing
A woman walks into a library and says to the bloke behind the counter, "Have you got any books on the female clitoris?" The bloke says, "Yes we have madame, but I don't know where they are.";Library
Why did the Scarecrow lose the debate? "All he had was a straw-man argument.";Scarecrow
Did you hear about the new transgender operation? It's called a strapadictomy;Transgender
Took my girlfriend to a baseball game this last season We made a deal in the beginning. I kiss her on every strike and she kisses me on the balls.;Baseball
My teacher asked me what a main feature of a greek tragedy was.... Apparently Bankruptcy was the wrong answer.;Greek Tragedy
What's Christopher Nolan's favorite song? BBBRRAAAAAAAHHHHHMMM...'s lullaby.;Christopher Nolan
I thought my witty comeback was completely original.... Turns out it was a riposte.;Witty Comeback
Grizzlies are emerging from hibernation, so hiking in groups of 3 or more is recommended. Also not being the slowest one of the group.;Hiking
*ruins your party with a can of Serious String*;Party
What do Eskimos get from sitting on the ice? polar-oids;Eskimos
Do you think that a funeral director signs his letters with ' yours eventually'?;Funeral Director
I bet black people whoooa this tweet is not starting off well;Racism
Kept nodding off at an estate auction and bought a garden gnome for 3 million dollars.; auction
Steve Irwin would have survived if he was wearing sun screen It protects against harmful rays; Steve Irwin
How does a one liner hurt its readers? With its punchline; one liner
Last week I got a vibrator stuck inside of me so I went to the doctors... ...this morning when the batteries went flat; vibrator
Here's my review of EA Sorry EA but if you want the review it'll be $5.99 for each letter and $7.99 for each punctuation and comma; EA
I want to get a dog just so I can name it Stain That way when I take it to the park, and if it runs off, I can yell "come Stain!"; dog
What's the difference between snowmen and snowomen? Snowballs; snowmen
A book never written: "Secret Societies" by E. Lumin Audi; book
I Would Flex But I Like This T-Shirt.; T-Shirt
Too soon for a knock knock joke? "Knock knock" "Who's there?" "The pilot, let me in!!!"; plane
What do you call an escape artist dog? Basset Houndini; dog
What's the hardest thing about rollerblading ?? Telling your parents you're gay.; rollerblading
What did one diabetic say to the other diabetic, on their blind date? I'm sorry, but you're just not my type.; diabetes
Women call me ugly until they find out how much money I make. Then they call me ugly and poor.;Money
If George W. Bush was the president of France today, he would declare war on Finland.;Politics
"Son: Dad, i had sex for the first time" 'Dad: That is great Son! Sit down and tell me all about it' 'son: Yeah about that...';Sex
Why was the Butcher depressed? Because his life was in shambles.;Profession
*daughter reading *son playing ipod *dog sleeping *house quiet *I go take a dump FISTFIGHT BREAKS OUT, DOG'S ON FIRE;Family
Did you hear about the New 3 Million Dollar Alabama State Lottery? 3 dollars a year for a million years.;Money
Japenese inmates on death row aren't given their date of death by the prison staff. I guess they just want to leave them hanging.;Death
I'm the guy that starts walking away as you're giving me directions.;Directions
What do two rednecks say to each other after a break up? Let's go back to being cousins.;Relationships
Don't ever let anybody outshine you in life. If that means arriving at someone's funeral in a casket, then so be it.;Ambition
an advice to every dad,if you wanna see your children just turn the router off,they will suddenly appear.btw ur neighbor might come as well.;Parenting
What did the Roman premature ejaculater say? Veni, Vidi, Veni.;Sex
One cigarette shortens your life by two hours, one bottle of vodka by three hours, and a workday  eight hours.;Health
Kind of morbid (sorry) (From my uncles) Him: Have you ever fucked a dog as long as you wanted? Me: NO! Him: Why'd you stop?;Work
El chiste! Did you hear about the Mexican serial killer? He had Loco motives.;Sex
So someone dropped a Chinese baby in a toilet? My advice is to pop it in a bag of rice overnight...;Chinese
Guys, you CAN catch AIDS from a toilet seat! If you sit down before the other guy gets up.;AIDS
What do you call playful insults between terrorists? Talibanter;Terrorists
What's a somali's favorite sport? Cross-country;Somali
do they have the fourth of July in the UK? Of course it comes after the third and before the fifth of July;Fourth of July
I had a 12 inch Italian last night Then I went to Subway;Italian
my kid threw a tantrum at IKEA and broke over 50 wine glasses. Cost me damn near $4 to pay for them all;IKEA
My penis and I have had the same secret handshake for 13 years. Friends forever.;Penis
Father: Well Son how are your exam results ? Son: They're under water Father: What do you mean ? Son: Below "C" level !;Exam Results
Who Let The Dogs Out? Ramsay Bolton.;Dogs
Almond Butter: For people that like peanut butter but don't want to be happy.;Almond Butter
Everyone has been in the Navy at least once. We all started out as a seaman;Navy
For gods sake! You'd think it would be safe not locking a car in a church carpark on a Sunday, apparently NOT. Anyway I got 8 iPhones.;Car
What's worse than biting into an apple and finding a worm? The Holocaust;Apple
Which group of people are the best at jazz? The Saxons!;Jazz
Q: What kind of television do horses like? A: Saddle-lite TV;TV
You know what really grinds my gears? When I shift into third without using the clutch.;Cars
The question is not "Why is Instagram not working?", but "Why does the world need another picture of you?" #instagramnotworking;Instagram
The worst thing you could hear after orally pleasing Willie Nelson. I'm not Willie Nelson.;Willie Nelson
Why did the condom go flying through the air? He was pissed off. (It took me an embarrassing amount of time to get this one.);Condoms
What kind of milk do the wealthiest people in the world give to their children? 1%;Milk
Me: My stomach hurts. WebMD: You're a kid, trying to get out of something.;Health
There's this great joke I read on 9gag...;Jokes
When Chuck Norris goes swimming he doesn't get wet. The water gets Chuck Norris.;Chuck Norris
Why did Adele cross the road? So she could say hello from the other side (If this has already been posted I might cry I thought I made this all up on my own haha);Adele
Wanna hear a pizza joke... never mind it's too cheesy;Pizza
What did one snowman say to the other? I think I smell carrots!;Snowmen
I don't have shit to say and;Nothing
Why was 6 afraid of 7? 7 did 9/11;math
Women freeze their eggs until they are ready to be a mom? Can I freeze my two year old until I'm ready?;parenting
OK, so they have GPS that can navigate you all the way across the country...why can't someone invent a device that can remind you why you went into a room?;technology
What group would an obese racist join? The cake-cake-cake.;racism
Guy goes to his psychotherapist wearing nothing but some transparent underpants the doctor says, "I can clearly see your nuts";psychiatry
(Warning, this is worse than those laffy-taffy jokes) Why don't engineers have sex with much frequency? Because it hertz!;physics
"open up, this is the police!" "well, I've felt alone since my girlfriend left me, I'm sad all the time-" "no the door open up the door";police
What do you call a fake Sony phone? Phony;electronics
What do skeletons like to put on their meat? Grave-y.;food
TIL there is a nerve that runs from the tear duct to the anus. If you don't believe me, let me pull a hair from your ass and see if it doesn't bring a tear to your eye.;anatomy
"A mother is a person who seeing there are only four pieces of pie for five people, promptly announces she never did care for pie.";family
Mom asked if I wanted to race toy cars with my neighbor Chucky. I responded, "Nah, that's child's play.";toys
What should you say to a pig on roller skates?  Don't say anything. Just get out of the way.;animals
Why are chemists such whores? They keep talking about their nitrates;chemistry
The Parachuteless Dave Michael: Dave is so brave! He jumped out of a plane without a parachute! John: Ohh is it true? Where did you get the news? Michael: From his funeral.;bravery
The way to end up $1 Million using the stock market LEGIT invest 10 million into it;stock market
Why the Xelerator is better than the Airblade... Dyson only makes products that suck.;Dyson products
So the doctor tells me I have Cancer.... I said, "That's nonsense, I'm a Gemini.";cancer
What did the one eyed thief, with a hook for a hand, call the elven princess? Arrrrrrr-wen;pirates
A man comes into the doctor's office the doctor says: "Clean that up yourself.";doctor's office
A girl at the restaurant was about to eat her food before I stood up & yelled "STOP. THIS IS NOT THE THIRD WORLD LADY. INSTAGRAM IT FIRST";social media
Anyone that says there are no stupid questions has never had to explain to a 5 year old why there are no pink bananas 267 times today.;parenting
Are you a Popsicle stand? ...Because I kind of want to blow you;flirting
Did you hear about the policeman who arrested the two boys, one who had a battery in possession and the other a firework? He charged one and let the other off.;police
How much does a Polar Bear weigh? Enough to lower your standards, I'm moonsout_goonsout;Polar Bear
What do you call a bodybuilder that can't sing? Muscle tone deaf.;bodybuilding
Telescopes probably use mirrors which means there is absolutely no way to know how many vampires there are in space.;vampires
Did you hear the one about Sandusky at the beach? A father walked up to him and said, "get out of my sun!";Sandusky
So Aliens Arrive "Earth has a species with advanced warfare, they seem intelligent." "No, they have it aimed at themselves.";aliens
I pick up hitchhikers cause then when I'm pulled over the weed is his.;hitchhiking
Black Friday sales keep getting earlier and earlier Ferguson got a huge jump on things this year.;Black Friday
Why is Jeb! Bush still running for president? Because the Bush family thinks that no child should be left behind.;Politics
Woman: "Can you please call me a taxi?" Man: "You're a taxi";Taxi
I'd rather see someone on the street coming towards me with a knife than a clipboard.;Encounters
Saw a new machine at the gym, but could only use it for 20mins before it made me sick It was great... it had M&ampM's, Skittles, you name it!;Gym
What do vacuums and woman have in common? The more you pay, the better they suck.;Vending Machine
Knock Knock Who's there ! Brook ! Brook who ? Brook-lyn bridge !;Magic
I quit watching awards shows, because I never win anything.;Brooklyn
Why is [friend's name] always on the bottom? Because they won't stop fucking up;Awards
DEAD BABY JOKES! I will get it started! Why is a pile of dead babies easier to move than a pile of bowling balls. - You cant use a pitchfork to move a pile of bowling balls.;Friend
How to lose a gf: Gf: which of my friends would be the most fun to have a 3some with? Me: *names two of them*;Dead Babies
"I find it hard, it's hard to find" - Kurt Cobain looking for the TV remote;Relationship
"Ok welcome to ask stupid questions club. Any questions?" Is this ask stupid questions club? "You're now the leader of this club" What club?;TV
What kind of dog wears a uniform and medals ? A guard dog !;Club
People who pariticpate in karaoke and are actually good singers are just fucking obnoxious.;karaoke
The more Twitter tells me it's over Capacity, the more I think Twitter still loves Capacity and regularly sits outside her house, weeping.;Twitter
I tell you what makes my blood boil, faulty spacesuits.;spacesuits
Who was the least guilty President of the them all? Lincoln. He was in-a-cent.;Lincoln
Yo mama's so mean... She has no standard deviation.;statistics
What did the potato name his son? Chip. Sorry.;potato
What's dumber than a box of rocks The hippie that carries them around the country.;intelligence
Two forks... Two forks were flying and one of them crashed. You know why? Because forks can't fly. Two cows were flying and one of them crashed. You know why? He got a fork in his eye.;forks
When ppl I know try to explain a problem they're having w/ someone I don't know, I think, "when I get home I'm going to eat food & watch TV";problem-solving
Why will no one watch the Olympic games this year only old men will be competing;Olympic games
Me: I can't get this star on top of the Christmas tree without a ladder, without dumping it over & ruining it. Whiskey: Yes you can.;Christmas tree
How many dead-heads does it take to change a lightbulb? None. They just let it burn out and follow it around for twenty years.;Grateful Dead
Of course my days are numbered.. That's how calendars work.;calendars
How do you turn a duck into a soul singer? Put him in the microwave 'till his Bill Withers.;music
Pronounce it "Valentimes Day" so Cupid will know to shoot you right in your stupid face.;Valentine's Day
What do you call a fart in a gay bar? A mating call LoL;Homosexuality
Watched a documentary about retina surgery the other day.. It was eye-opening.;Surgery
Why was Plutarch considered a great comedian? He was the first to practice dead-pan-delivery.;Comedy
What's the square root of 69? Eight something.;Math
If I ever see a shark I won't be attacked. Because although sharks are attracted to blood in the water, they are repelled by feces.;Sharks
A police officer came up to me yesterday and said, "Where were you between four and six?" I said, "Kindergarten.";Police
Two cows walk in to a bar... Then one of the cows says: "*Mooooo*", then the other replies, "*Fuck, I was supposed to say that*";Cows
[at the gym] ME: Hey, can you spot me? GUY: Sure, which machine? ME: *gestures to vending machine* Right over there;Gym
[very obviously being hit on] hahaha ok well, see you around [4 days later, cutting open a cantaloupe] wait a second;Dating
I just watched my dog chase his tail for ten minutes, and I thought to myself, Wow, dogs are easily entertained. Then I realized : I just watched my dog chase his tail for ten minutes.;Dogs
What snakes are good at sums ? Adders !;Math
What do you call it when a pickle makes a mistake? A dill d'oh;Pickles
Why can't you hear a pterodactyl in the bathroom? because the 'p' is silent.;Dinosaurs
Why is Peter Pan always flying? Because he never never lands!;flying
Not to get technical But according to chemistry alcohol is technically a solution;chemistry
Siri, fight Alexa.;technology
What do you call it when Einstein faps? A stroke of genius.;Einstein
Did you hear about the kid who slept through every class in school? He got all z's.;school
Leia: You owe child support. Han: What? I'm in hyperspace. Leia: You're standing right here Han: *makes hyperdrive noises with his mouth*;Star Wars
Black Friday through the years: 2005: 5am 2010: 3am 2012: 12am 2013: Thursday 8pm 2014: Thursday 2020: 4th of July;Black Friday
A blind judge conducted a trial.. And even after no one managed to provide a substantial incriminating evidence he still condemned the defendant. he couldn't see the truth.;law
Engineering joke At work today I told an engineer I liked the cool shapes in his design. "Oh, it's not intentional," he responded. "It's mostly in compression.";engineering
Heard a Beethoven piece & a Ke$ha song yesterday. Which one is deaf again?;music
Dead memes are like dead babies They never get old.;memes
Why did Mary fell from the swing ? Because she hasn't got arms !;Mary
How do weathermen get up a mountain? They climate;weather
"Keep that upside-down frown right where it is!" - Botox Patient Saying;Botox
Why didn't the hipster have HIV? He fucked Charlie Sheen before he was cool.;hipster
What do you call a turtle that sends pictures to everyone? a Snapping Turtle;turtle
Literal People Anonymous Welcome to Literal People Anonymous, would everyone please take a seat. NO, WAIT! BRING THOSE CHAIRS BACK!;people
Mcdonalds will be serving a new burger which you cant touch. Its called the Mchammer.;burger
Mom: Time to wake updog. Son: *groggily* What's updog? Mom: Just waking you up for school, dog, what's up wit u? Dad (from hallway): OWNED;dog
Why do trash pandas always get into a fight? They trash talk.;pandas
What's the difference between a Jew and Harry Potter? One of them left the chamber alive.;Jew
Just accidentally deleted all my contacts. Best day ever.;contacts
What do you a pterodactyl that can't fly? Inosaur.;pterodactyl
Confucius say... Man who walks everyday barefoot will have a tough sole;foot
What did one train track say to the opposite track? Wanna race?;train
Give me one reason why I shouldn't pass this math class "You held up 2 fingers just now" Ok then give me that many reasons;math
went to kiss a girl last night and her eyes rolled back and her head floated off her shoulders body burst into flames i am a bad kisser;kiss
I'm Homy... I bet 99% of you pervs misread that.; Names
Q: Why did the fly fly? A: Because the spider spied her.; Fly
What do a flat-earther, a Nazi, and YOU have in common? They all get one vote.; Politics
What's Mr T's favourite dessert? Petit Filous (Credit goes to my ex wife for this one).; Mr T
i have 1 queston for u what are thoooose; Shoes
A girl just broke up with her friend The guy deserved it. He loved her more than anything, but still he treated her really badly. He really was a dick' to her. (addicted to her); Relationships
*at a restaurant* Don't be awkward, don't be awkward Waitress: how's the food? Me: yes; Food
I think the implication that you might want to share your Kit Kat with 3 friends seems unreasonable.; Kit Kat
What do you do when you see an epileptic throwing a fit in a bath tub? You throw in some laundry and detergent.; Epilepsy
Roman mythology in 3 words The fuck's plagiarism?; Roman mythology
What do you call someone with no arms? Disarmed.; Disability
Eating some turkey? Put gravy on it. Mashed potatoes dry? Try gravy. Headache? Shot of gravy. Depressed? More gravy. Lost a limb? Gra; Gravy
Did you hear about the Chinese military general who deserted his position during a time of war? It was General Tso, and he will always be known as a chicken; General Tso
What's black and sits at the top of stairs? Stephen Hawking after a house fire.; Stephen Hawking
The person with duct tape holding most of their car together always has the right-of-way.;Masturbation
Don't run with scissors because you might accidentally trip, fall and cut the grand opening ribbon of a new museum 2 weeks ahead of schedule;Cars
Idiots beating you down Do not argue with an idiot. He will drag you down to his level and beat you with experience.;Scissors
Two more nuns Two nuns in a bath. First one says "where's the soap?" Second nun says "yeah, it does doesn't it.";Idiots
I can totally relate to the plight of the homeless. I once gave up Twitter for five whole days.;Nuns
Why people use Twitter: because updating 100 times a day on Facebook is not socially acceptable.;Homelessness
Conservatives keep telling me to find Jesus How am I supposed to find him if they want him sent back to mexico and want a wall to keep him out?;Twitter
Homeless people are so lucky. They don't have to pay rent and can eat as many pigeons as they want.;Jesus
No matter how kind you are, German children will always be kinder.;Homelessness
/!\ AP Breaking News /!\ Sheltered Rich White Southerner Uses Racial Slurs But Says It's Not Hateful;German children
You - The food smells wonderful Me - That's me I burped;Racial slurs
How does a mathematician solve constipation? Pro biotics and a healthy amount of fiber.;Food
Fun trick: Handcuff her and tell her you're taking her to 50 Shades of Grey. That way she can't escape when you go to The SpongeBob Movie.;Constipation
What's the right age to tell a film that it's adapted?;film
A stormtrooper just got sent to the firing squad. He will be missed.;stormtrooper
Okay, guys, yes, we know Bostonians have been calling iPods "IPads" for years. STOP MAKING FUN.;iPods
coworker: did you hear someone used all the charity money to buy snacks from the vending machine me: *laughing nervously* that's awful;charity
Guy in orchestra was charged with manslaughter Police state that he had a history of reckless violins.;orchestra
The only drinking problem I have is not having enough money to keep buying it.;drinking
You Gotta Hand It To Leave Brits They were so concerned about immigrants ruining their economy that they preempted it and ruined their economy themselves.;immigrants
[BDSM] I accidentally flogged another dominatrix's client Oops, wrong sub;BDSM
Raise your right hand if you were home schooled. No, your other right hand.;home schooling
Whats the difference between a piano, a tuna, and a bottle of glue? Anyone can tuna piano, but nobody can piano a tuna!;piano
[Brings date home] O geez did I leave all my rare, holographic Pokemon cards out on my bed again? Guess we'll just have to lay here & battle;Pokemon
Sometimes I run alongside trains, tearfully waving, just so people will think I have a girlfriend.;trains
A deeply religious man is trying to book a room at a hotel. He asks the receptionist if the pornography is disabled. To which she replies, "No. We just have regular pornography, you sick fuck.";hotel
My roommate dressed as a syringe for our Halloween house party. He's upstairs with the sexy girl wearing the Courtney Love costume. In the addict.;Halloween
Why can you never get caught with a 0 in math? because cot(0) doesn't exist ... This joke... it burns my eyes...;Math
Want to make a nerd's head explode? Go to any site that posted the new Star Wars trailer & write "Where's Captain Kirk?" in the comments.;Star Wars
When they were saying "we will find a good home for him" I thought they were talking about the dog,I didn't know they were talking about me!;Family
Do you love me? Of course Then whisper something soft and sweet in my ear Lemon meringue pie !;Love
There's 2 statues in a dark room, what did one statue say to the other statue? Is statue?;Statues
My gilfriend Is like Pokemon go servers. Unreliable Edit: bad spelling in title;Relationship
What did one lawyer say to the other lawyer?;Relationship
Tax time is when I'm grateful that I'm detal oriented.;Law
What does a geography graduate do with a lightbulb? Not get a job.;Accounting
I just bought some "ribbed cotton tank t-shirts" at WalMart. You'd think that'd be the one place on earth they'd call them wifebeaters.;Graduation
What did Paul Revere say when he got on his horse? Giddy up horsey !;Shopping
How do you raise a baby elephant ? With a fork lift truck !;History
Why did the pirate become a tenor? Because he has a lot of experience on the high C.;Baby elephant
"I'm cold" - a talking ice cube or a woman;Pirate
"Grandpa, get out of the bathtub. You'll get cold and die." Grandpa got out of the bathtub, got cold, and died...;death
She told me my analogies didn't make any sense. It seriously made me feel like a biscuit in an elevator.;analogy
Why is it easy to break in to an old man's  house? Because his gait is broken and his locks are few.;burglary
Just got back from my secret society meeting. I'm really pleased with next year's Golden Globe winners.;awards
I hate tacos. -Said no Juan ever;Mexican food
There is nothing worse than watching the new guy at Subway make your sandwich.;customer service
What does Batman put in his drinks? Just ice.;Batman
I was wondering how the truck was getting so big... Then it hit me.;truck
What do you call a weirdo slowly driving a jeep past an elementary school? Jeeper creeper!;pedophile
Little known fact: If you ride any animal in the zoo for more than 30 seconds... it's yours to keep.;zoo
Some days having kids makes it all worthwhile. I haven't experienced any yet, but statistically they're bound to happen at some point.;parenthood
[at SunMaid farms with a guy] Guy: so is this a date? Girl:... No? These are raisins;date
What do you call a person who looks at a glass half-empty? An Alcoholic.;alcoholism
He died doing what he loved: typing his symptoms into WebMD instead of going to the doctor;death
Anti-humor Two men walk into a bar, the third one ducks.;none
I'm not in a relation"ship," I'm in a relation"barge" that's towing emotional garbage all day long.;relationships
Teacher: What is the formula for water? Student: H, I, J, K, L, M, N, O. Teacher: That's not what I taught you. Student: But you said the formula for water was...H to O.;chemistry
My 4 year old and I are having an argument. I'm telling him that he is making me late for work and he's telling me that he is Batman.;parenting
