"Joke";"Joke topic"
I was talking to my buddy about 50 Shades Of Grey He said "yeah, my wife and I have been doing S&ampM for years." "Really!", I said, "I had no idea!" "Sure," he said, "she sleeps and I masturbate!";sex
Today is the rest of the world's 9/11 No, seriously, look up the calendar.;terrorism
Can someone please lecture me on their political views in an aggressive and condescending tone so I may realize the error of my ways?;politics
A man asked his wife what she wanted for Valentine's Day: Wife: "A divorce." Husband: "I really wasn't planning on spending that much.";divorce
Instructions for having an adventure: 1. Stand outside restaurant. 2. Wait for someone to ask if you're the valet. 3. Say yes.;adventure
On a cold, late December day... ... the wall calendar looked across the room at the advent calendar and said: "It looks like our days are numbered, pal".;Calendars
Ever look out the window of a plane and see a huge target on the roof of a Target? Haven't these people ever watched the History Channel?;Airplanes
Sci Fi Films I don't understand why in Sci Fi films, whenever there's danger they never send in a Cargo ship. So much for the Element of Supplies.;Sci-Fi
My friend took me to a twilight fencing class. I couldn't really see the point.;Fencing
Definition of clickbait;Internet
summer is the worst time of the year to turn goth what the shit was i thinking;Goth
Save a horse. Ride a cowboy. Use your best judgment with a centaur.;Horses
Q: How many Agents does it take to screw in a light bulb? A: Actually agents will screw in just about anything.;Light Bulbs
Bread: For when you want to wrap your food with other food, then eat it.;Food
Why was the Egyptian queen so grumpy? Because, she was on her pyramid!;Egyptian queen
What do you call a fish that eats shit? A bottom feeder.;fish
I used to be really scared about marriage... In fact, I hear 50% of all marriages end up lasting Forever!;marriage
WATSON: do you even have a proper education? SHERLOCK: Elementary, my dear Watson WATSON: but, like, beyond that SHERLOCK: nah;education
If you honestly think I want to hear about the details of your dream you're still fucking dreaming.;dreams
An ideal homework excuse Teacher: Where is your homework? Pupil: Some aliens from outer space borrowed it so they could study how the human brain worked;homework
What did Khloe Kardashian do for a vegetable? Broke up with James Harden;Khloe Kardashian
What did the cannibal do after dumping his girlfriend? Wipe.;cannibal
I'm not saying I can perform miracles or anything, but when the Taco Bell employee isn't looking, I can turn water into Sprite.;miracles
What do you get when you cross an elephant and a fish? Two very unhappy animals.;elephant
I am known all over the world for my tendency to exaggerate.;exaggeration
My friend asked me if he was gay... I didn't know how to give him a straight answer.;sexuality
"The police are looking for a man with one eye named Murphy." "What's the other eye called?";police
How many Southern Baptists does it take to screw in a light bulb? Change?!;Southern Baptists
Nice try Asian guy in porns.;Asian
How do they separate the men from the boys in Athens? With a crowbar.;Men
Q: What did the mermaid do last Saturday night? A: She went out with the tide.;Mermaid
Why did God make farts smell? So that deaf people could enjoy them too.;Farts
Entered into a hot potato competition today. It really got outta hand.;Potato
Dear Dude, who's slowly walking towards me at the park bench, dragging his one leg and can't keep his balance. Please be drunk and not a zombie.;Zombie
How do you impress a baker when you're taking his daughter on a date? Bring her flours;Baker
Bob Ross and Mr. Rogers fight for nicest person ever. Who wins? They both share the trophy;Personality
*Breaking news* The inventor of the anagram has died may he 'erect a penis'.;Anagram
I, for one, like Roman numerals.;Numerals
Van Gogh hands a wrapped up box to his girlfriend. "Vincent, please tell me this isn't another ear." "What?";Van Gogh
Knock Knock Who's there ! Chip ! Chip who ? Chip of Fools !;Knock-knock
If a rooster lays an egg on a triangular roof, which side does it roll down? Neither! Roosters don't lay eggs!;Rooster
I'm tired of talking to the monkey!! I wanna talk to the Organ Grinder!!;Monkey
What's the similarity of a dough and a human? If they are thick, they have a hard time to rise;Dough
Daddy! Daddy! I can't stop running in circles! Shut up son or I'll nail your other foot to the floor.;Parenting
Trevor: That's a cool pair of stockings you have on Jill. One red and one green. Jill: Yes and I have another pair just like it at home.;Clothing
What kind of water do ducks drink? Bottled Waddle.;Ducks
I believe that old ladies in wheelchairs with blankets covering their legs are actually retired mermaids.;Mermaids
[Wife walks in wearing nothing but whipped cream] Oh my god, Linda, it's like you've never even heard of ants.;Marriage
Bad credit? No credit? First time buyer? First time baby? No legs? 8 legs? You a spider? Are you a Spider trying to buy a house?;Spiders
Just another lawyer joke Lawyer: "Now, Mrs. Johnson, how was your first marriage terminated?" Witness: "By death." Lawyer: "And by whose death was it terminated?";Marriage
What is the German word for Constipation? Farfrompoopen.;Constipation
I knew a girl so ugly, she fell asleep at a frat party... and she woke up with more clothes on. (Stolen from Big Bang theory, I just love this joke);Ugliness
A new Michael Jackson album was released this week and it contains a track titled "Do You Know Where Your Children Are?" Even worse, the next song is called, "Can You Give Me Directions?";Michael Jackson
Which Asians have the softest skin? Laotians;Asians
Ok, Surgeon General, alcohol is bad for pregnant women. The warning label might be more effective stating alcohol causes pregnant women.;Pregnancy
The problem with being in the center of attention is that half of it is always behind your back.;Attention
What do you call a snobbish criminal going down the stairs? A condescending con descending (duh dun dun chh);stairs
A sad story A boy was jelous of his baby brother, so he put poison on his mother's nipples. The next day, the gardener died.;brothers
perfume should come with instructions like on medicine: Dab LIGHTLY on pulse points Do NOT marinade in event of overdose take shower;perfume
Joke my dad told me: What's black and white and red, and has trouble going through a revolving door? A nun with a javelin through her head;nun
If I had a 1$ for every gender there was... I'd have 2 dollars.;gender
GOD: I call them Water Buffalo ANGEL: But they live on land GOD: Yep ANGEL: GOD: ANGEL: u really dont care anymore do u GOD: Not a bit;animals
In my next life, I'd like to come back as someone who has a life.;reincarnation
My girlfriend was on her. So I put it in her:;Not enough information
Why can it be so annoying to drive a Skoda? The Czech engine light is always on.;Skoda
What's fourteen inches and white? Nothing.;Not enough information
Q: What do space aliens put on their windows? A: Venutian blinds.;aliens
What do you call a teacher that doesn't fart in public? A private tutor (tooter) Heard it from a guy on the street selling newspapers in front of the art institute in chicago.;teacher
New Series For The The History Channel The History Channel is planning a new series, "Airline Tragedies." They are putting the pilot together as I write this.;airlines
Crossing guards get mad when you call them what they really are... Human Traffic-ers.;Crossing guards
What did the blanket say when it fell off the bed? Oh sheet.;Blanket
Why is the Camel so hard to see in the desert? Because it's Camel-flaged...;Camel
I like to jump onto people's backs as an unexpected piggy back. but sometimes I get carried away;Piggyback
Why should you be careful playing against a team of big cats? They might be cheetahs!;Cats
If I had a dollar every time someone called me a racist, a lot of black people would try to rob me;Racism
What is the hardest thing about breaking up with a Japanese girl? You have to drop the bomb on her twice before she gets it. I'm going to hell..;Japanese
Snow is like sex... You never know how many inches you'll get or how long it will last. ..;Snow
What were Jesus' final words? "So long and thanks for all the fish." Edit: Everyone hates me.;Jesus
How can you tell an introverted Techie from an extroverted Techie? An extroverted Techie looks at *your* shoes when he's talking to you.;Techie
Why didn't the skeleton go to the dance? He had no-BODY to go with.;Skeleton
Why does God love atheists? Because they don't bother Him with incessant prayer.;Atheists
I went on a date with a drinking straw. It really sucked.;Drinking straw
If The Beatles were from Hawaii... What would they have called their song, "Hello Goodbye?";Music
During the bank robbery, I was the one who heroically soiled himself & cried in order to incapacitate the robbers with laughter;Crime
Why is singing like autoerotic asphyxiation? Because sometimes you just gotta belt it out;Music
Freddie Mercury: "Hey Brian, what rhymes with scaramouche?" Brian May: um... Fandango? Freddie: "Perfect!" *snorts another line of coke*;Music
What do a dog and a near-sighted gynecologist have in common? They both have wet noses.;Profession
Why is it good for a mason to live in constant fear? That way he just shits bricks.;Profession
[interview] My biggest weakness is that I'm too literal "That's fine. Your resume looks good, welcome aboard!" *turns to whiteboard* welcome;Job
A black man, muslim, and an illegal alien walk into a bar... And the bartender asks "What are you having Mr. President?";Politics
I accidentally swallowed some Liquid Paper last night ...Today, I woke up with a massive correction.;Health
If the world's fate ever hangs on my mom opening a picture mail on her phone in under ten minutes, we are all doomed.;Technology
My dad smeared glue all over his Uzi, and he say's his Glock is next. He can't be talked out of it. He's sticking to his guns.;Guns
I learned all my flirting from lizards so I just do a bunch of really fast pushups when I see a cute lizard.;Animals
Dear Satan, God never healed my dyslexia so I'm looking for new religion. Please send some pamphlets. And tell Rudolph hey. Love, Me;Religion
You and I are like ass cheeks... we're still together after all the shit that's gone between us.;Relationship
How many suh dudes does it take to screw in a lightbulb? Zero because it's already lit fam.;Stereotypes
What's worse than locking your keys in you car outside an abortion clinic? Having to go inside and ask for a coathanger;abortion
What's the Priest favorite breakfast? Kids.;children
Never date a girl with lots of baggage They'll travel too much, you will never get to see them.;dating
Why did peanut butter flop at the talent show? He didn't have the right jam.;talent show
What's Santa's favourite Chinese dish Beef Ho Fun;Santa
Best thing about living in NY is you can order anything, anytime, and 30 minutes later it shows up. You see here? This here is an orangutan.;NY
Batman walks into a bar... ...Followed by 24 Sodium atoms.;chemistry
Thanks 'the news', but I get my political info from the Facebook posts of crazy relatives and people I haven't seen since high school.;politics
Pregnant coworker with 3 children who always complains about money: When are YOU going to start having kids? Me: When are you going to stop?;pregnancy
I'm 100 percent against animal cruelty. Nothing makes me sadder than when my dog makes fun of me.;animal cruelty
I farted today and 4 people turned around.. I felt like I was on The Voice.;farting
If a cop tazed me and then yelled "Raiden Wins!"... I would instantly lose all animosity towards him.;police
The Bible would be more believable if Adam was tempted by a slice of pizza instead.;Bible
What did the Jewish pirate say when he heard his wife died? Argh, shiva me timbers;Jewish pirate
What's the difference between getting the girlfriend pregnant and locking your keys in the car? How pissed your wife gets when you explain the coat hanger.;pregnancy
Where does Skrillex like to eat lunch? He goes to WUBway!;Skrillex
I love dry erase boards... They're remarkable.;dry erase boards
Why wasn't the geologist hungry? He lost his apatite. I know that joke has its faults, so I'll just accept my pumicement and go back to looking at cleavage.;geology
If I was a candle... ...and somebody dumped a bucket of water on me, I'd be quite put out.;candle
Did you know - what is the best thing to put on a delicious cake ? Your MOUTH !!;cake
Found a baby snake in my backyard while mowing. Long story short, I don't have to mow anymore since my yard is on fire.;snake
Which dog eats with its tail? All dogs keep their tails on when eating.;dog
The baker wouldn't finish telling me how he makes bread. He said that information was on a knead-to-know basis.;baking
A joke about procrastination. Eh, I'll write it later.;procrastination
Every toddler is basically a 1/8th scale model of a person on bath salts.;toddlers
So Nicole Scherzinger has gone from Lewis Hamilton to Ed Sheeran... Guess orange really is the new black.;Nicole Scherzinger
What's the difference between a 100 year old and a 4 year old? What base you're counting in.;age
Wife: "You need to watch A Series of Unfortunate Events" Me: "okay, I'll get out the wedding video";marriage
A white girl walks into a bar She passes it with flying colors and becomes a top lawyer;lawyer
A Lizard lost its tail... but it got one back from a retail shop!;Lizard
A kid has cancer Then he gets AIDS from his mom;Cancer
How many chans does it take to change a lightbulb? Lulz!!! etc etc etc :-D;Lightbulb
What's Mario's favourite clothing? Denim denim denim;Mario
Who is this Rorschach guy? And why does he keep making paintings of my parents fighting?;Rorschach
I don't know what's longer: a microwave minute or a treadmill minute...;Time
What do you call a fat skeleton? big boned;Skeleton
What does a robot do at the end of a one night stand? He nuts and bolts.;Robot
Why does Daenerys Targaryen listen to Hoagy Carmichael? Because she's got Jorah on Her Mind.;Daenerys
A man walks into a bar with a roll of tarmac under his arm... and says "Pint please, and one for the road.";Bar
I don't see what people get from... Dark humor!;Dark humor
I'm taking part in the Hillsborough triathlon today! Football, squash, and fencing.;Triathlon
Man it's nuts today, I've killed over a dozen zombies and I have one question: Why were they all holding bags of candy?;Zombies
You can really scare someone when you yell "Peek-a-boo!". Especially when they're trying on clothes in the fitting room.;Fitting room
Knock knock. Who's there? The Jews. The Jews who? Don't question us, that's anti semitic.;Jews
What does a beer say when it's cold? Buuuurrrrrr!!!;Beer
Scandanavian Booty Call What did the Norse goddess say to Thor when he drunk dialed her? "I aint no Valhalla back girl.";Norse goddess
With a calendar, your days are numbered.;Calendar
Doe A deer, a female deer. Ray A hunter, with a gun.;Hunter
Have you heard about that cop that shot the black guy? Which one?;Police
When you think your man is being romantic but really he just doesn't have electricity.;Romance
What are Mario's overalls made out of? *Denim, Denim, Denim*;Mario
What's a Cholo's favorite Chinese food dish? Chicken chow meng.;Chinese food
Sometimes, late at night, I stare out the window at the stars and think about all the airlines that have wronged me...;Airlines
What comes after a great pee? A "Q" I made this joke up today. I don't know if it's been thought of before, but I couldn't go to sleep without posting it for the world :);Pee
What did the sign on the door of the whorehouse say? We're closed  beat it.;Whorehouse
TIL King George III had a strong distaste for The Colonies In fact he found them revolting.;King George III
What is something all Hispanic people write in college? An ese.;Hispanic
Why doesn't Santa have any children? Because he only comes once a year and it's down a chimney! Merry Christmas sickos! :);Christmas
Fred wrote in her homework book: Margarine is  butter made from imitation cows.;School
Like that scene in 'The Revenant' where Leo is mauled by the bear but it's just me at your wedding reception dancing with your grabby aunt.;Wedding
Jesus dies for our sins? No, no, no... He died for YOUR sins. I haven't touched a goat inappropriately since third grade.;Religion
8yo: mommy how old are you? Me: 46 8yo: *blink blink* so you seen a real dinosaur?;Age
Did you hear about Ken M.? He was a master baiter, but they told him to beat it.;Fishing
Mom, I am very worried... Mom, I am very worried, I have lost 3 kg. - But that are great news, You should be very happy. Yeah, Say it to my Colombian *friends*;Weight
Kinky and Perverted What is the difference between perverted?? Kinky is when you tickle your lovers ass with a feather ... perverted is when you use the whole chicken!;Sex
Trying to improve my street cred by lowering our minivan a couple inches.;Cars
I woke up with a ringing in my left ear So I put my phone on vibrate.;Phone
I thought of something funnier than 24 25;Numbers
Joseph was changing Jesus' diaper Joseph slowly takes out Jesus' dirty diaper, when Mary suddenly asks, "What's inside?". Joseph exclaimed "Holy shit!".;Religion
I just bought bunk beds. The other night I brought a date home. She said, "I'll get on top." I said, "Great, I'll get the ladder." She said, "You sure think a lot of yourself, don't you?";dating
Why did the zombie turtle have so much trouble dancing? Rigor tortoise.;turtle
Just used the holiday card with your kid's face on it to scoop up a dog turd in the living room.;holiday
"The ancients would grind the nougat plant with stones, adding cacao nibs as they worked." Satisfied, Paleo Dad accepts the 3 Musketeers.;candy
Kudos to NPH for keeping it brief. #Oscars;Oscars
There is no "we" in pizza;pizza
Why are 9/11 victims the best readers? They can go through 94 stories in seconds! Edit: Please don't hurt me.;9/11
I've been "watching my weight" and, rest assured, it's still there.;weight
A tree was knocked down by a recent storm... and destroyed an African family's home. The thing is, we didn't even know they lived up there!;tree
I was so poor as a kid, we only had Onepac Shakur.;poverty
I'm going to open a building that functions as a sperm bank as well as a urine analysis center. It'll be called "coming or going".;sperm bank
What's the difference between a happy programmer and a sad programmer? "Hello, world" and "Goodbye, cruel world";programming
There's no way that whatever mothballs prevent is worse than the smell of mothballs;mothballs
Apparently it's not acceptable to moan when someone is demonstrating a choke hold on you in crisis prevention training.;Training
What does a grumpy sheep say at Christmas? ...Baaaaaahumbug;Christmas
I really like ethnic foods, but the one type of asian cuisine I haven't had is North Korean food. Then again, neither have citizens of North Korea.;Food
we lost our power "why?" a transformer blew up by our house *eyes widen* "that's awes-" it's not as cool as it sounds;Power
What kind of parents are see-through? Transparence!;Parents
I got 99 problems but I'm avoiding them all.;Problems
[hospital] "We found the problem. There's an entire sheep in your stomach." "Is that bahahaad?" "Yes. It's causing some internal bleating.";Sheep
How do Jewish kids learn to count? 10% off, 20% off, 30% off;Judaism
Bath Humor Want to hear a dirty joke? Ray rolled in the mud Want to hear a clean joke? Ray took a bath with bubbles Want to hear a dirty joke? Bubbles is the girl next door;Bath
"Crouching Tiger, Hidden Butthole". Sometimes I just say things. I don't know.;Movie
Orange Jews 100% Concentrated.;Juice
Looking for a girlfriend is a lot like fishing There's a lot of fish in the sea but until you find one its just you and your rod;Dating
On the periodic table, the elements are represented by two groups. The symbols and the atomic number. Law and Order: Atomic Mass Unit;Chemistry
What do you call 3 agnostics sitting at a bar? I don't know.;Agnosticism
Did anyone ever find out who let the dogs out?;Music
OMG I love you You're the best You left me Did you bring me stuff OMG Anything I don't care Where have you been I smell someone else -Dogs;Relationship
Not to Brag: Not to brag, but I own the world's largest collection of air guitars.;Air Guitars
You know the jack in a box that scared the life out of you when you were a child? That's me as an adult cooking with my smoke detector;Cooking
Sweat pants & Uggs in public says "and I didn't brush my teeth, either.";Fashion
You could sell the cure for Ebola to Gamestop and they'd still only give you $4.99 for it;Gamestop
I'm hungry but broke so I'm waiting for my bf to say he's hungry too than he'll order something delicious while I pretend to be indifferent.;Relationship
A clown sighting was reported at the office this morning but it turns out Karen put her make up on in the car again.;Workplace
Keep microwaving fish in the office and stop wondering why you never get a desk by the windows.;Office Etiquette
I like to leave odd yelp reviews for fast food restaurants that say things like, "Not overly racist.";Racism
How does Craig Venter drink beer? Shotgun method;Science
I told my girlfriend that brown rice was just white rice with a criminal record... ...she called me a riceist;Racism
Bernie Sanders may be old, but he loves modern technologies such as. . . Socialist Media.;Politics
I prefer masturbating with coconut oil as opposed to lotion It just cums naturally.;Masturbation
What's an avocado's favorite music? Guac N' Roll;Avocado
What does a man with a 9 inch penis eat for breakfast? Well, Right now I'm frying up some eggs, got some toast in the toaster and the coffees brewing.;Penis
Just gargled mouthwash all over my shirt. I'd be a horrible homosexual.;Homosexuality
If Jesus were alive today...what type of car would he drive? A chrysler (Christler);Jesus
Why couldnt the bike stand on its own? Because it was two tired!;Bike
I've heard that students in Death Valley get terrible grades. They never get above C level.;Death Valley
Damn, I burnt one. What did God say when he made the first black man? "Damn, I burnt one.";Racism
Old musicians don't die. They just decompose.;Music
Glad I read the label on that Clorox. I was about to rub it in my eyes and keep it in the reach of so many children.;Clorox
ELI5: Why do i suck at posting in the right sub?;Posting
Obi-wan: You look different. Vader: You left me burning alive in lava with no arms and legs. Obi-wan: I thought maybe you got a haircut.;Star Wars
my cousin's baby is due tomorrow & my grandma keeps checkin her phone for news. waitin for the baby 2 text her like "im here lol. from baby";Baby
If you dont believe in Oral Sex, keep your mouth shut;Oral Sex
My girlfriend left me a roll of quarters for laundry today She told me to try to not blow it all on one load...;Relationship
While Ajax sales have been going down... It's still stronger than Greece;Economy
Two terrorists are sittign around a campfire..... when all of a sudden a donkey comes along.. The first terrorist jumps up and shouts " Look at that ass!";Terrorism
What did the father say to the pedophile at the beach? "Hey you're in my son";Pedophilia
I used to work in a haunted pub... There was spirits everywhere.;Workplace
My Internet was out for a while so I went downstairs to talk to my mom. She seems nice.;Family
They might as well put "Uhhh..." in front of every item on drive-thru menus.;Food
I was dropping my kids off at school when I saw a sign that said "Watch for Children." I'm going to miss them, but man this is a nice Rolex.;Parenting
A gun is like my penis.... On cold lonely nights sometimes I stick the end of it in my mouth;Sex
How Do You Get Stoned in Ancient Rome? Start shouting Jehovah.;History
What do more than half the U.S. population consider a gay marriage? Still not recognizable;Marriage
Church is one of the few places you get on your knees BEFORE a guy gives you wine.;Religion
I think I ate too much salmon over Christmas I just tried to run up an escalator that was going down.;Health
Why is Santa's sack so big? Testicular cancer;Cancer
What does The Sixth Sense and Titanic have in common? Icy dead people;Movies
Perhaps one day he'll meet his Girl Fieri.;Guy Fieri
Alcohol makes people do things they know they shouldn't but kinda want to. E.g I started sleeping 20 hours a day.;Alcohol
What has 4 wheels and flies? A garbage truck;Garbage truck
Give a man a jacket, and he will be warm for the day. Teach a man to jacket, and he will never leave his house.;Jacket
What do you call a Hebrew that lives in the Alpines? A Mountain Jew.;Jew
What is better than Roses on a Piano? Tulips on an Organ.;Flowers
What did the elephant say when it saw the  Chihuahuas coming down the road? Look out for the mice!;Elephant
North Korea claiming they test fired a big rock at Russia.;North Korea
I stole a Tom Cruise movie from the store the other day... It was Risky Business.;Tom Cruise
Bummed that there's no obvious place to insert a $ into my name.;Money
What do you call a person who loved tractors but doesn't any more? An extractor fan;Tractors
What do you call a frozen hamburger? A ham-brrr-ger. my 7yo claims she made it up herself.;Hamburger
If you say "Unique New York" (5 times fast) is it easy or hard?;New York
What's the difference between a 4WD and a rental car? A rental car can drive anywhere.;Cars
What we all have in common is how extra stupid we look when we stop everything and focus on removing a stray hair from our tongue.;Humanity
So Stephen Hawking walked into a bar Just kidding;Stephen Hawking
A batch of muffins are baking in the oven ... a muffin says to the other muffin 'getting hot in here eh' The other muffin says HOLY CRAP A TALKING MUFFIN;Muffins
