"Joke";"Joke topic"
I'm having problems with favstar. Can all of you trophy me to see if it's working right now? Thanks.;Favstar
What's the difference between being horny and being hungry? Where you put the cucumber;Hunger
I have the attention span of a gold fish It's been staring at me for several minutes now.;Attention
Why was the Doctor screaming angrily at his secretary? He ran out of patients.;Doctor
You guys ever seen a cockatoo? Yeah? I bet you have.;Cockatoo
Gandalf was an alien. It's right there in his name: Gandalf the GREY. Wake up, sheeple!;Gandalf
A man goes into a bakery and asks for 99 loaves of bread... "Why not make it a 100 loaves?" asks the baker, to which the man responds "who the fuck eats that much bread?!".;Bread
I think my girlfriend might be a vegetarian... ...because I've never met a girl like herbivore.;Girlfriend
Why couldn't we get precise kinetic data on the phosphine-catalyzed reaction? The reaction rate was too phos-phor-us;Reaction
What do you call your friend from Prague who beat you at chess? Your Czech mate;Chess
Why do clairvoyants have crystal balls? So they can see what's coming.;Clairvoyants
It's find it a tough decision to buy the right mattress... I guess I'll have to sleep on it.;Mattress
I had to bury my girlfriends cat today... He put up a hell of a fight, but I got him covered up!;Cat
When I was a child I played "The Floor is Lava!" But as an adult, I've put away childish fancies, and purchased magical lava-proof shoes.;Childhood
What happens to you at Christmas ? Yule be happy !;Christmas
Good job I am very surprised that no one has made a 9/11 joke. I would of thought that 9 times out of 11 that I would see one.;9/11
John Goodman descends from the sky on his hang glider, scooping stray cats into his mouth like a pelican.;John Goodman
What is brown and sticky? A stick.;Stick
mom: Why are your eyes red? Are you high!? [flashback to me cry-singing Taylor Swift's "Love Story" in the car on the way over] me: Yes;Taylor Swift
A horse walks into a bar and orders an N.;Horse
Colonel Mustard invited me to the library to check out his candlestick collection, but I dunno... I got a bad feeling.;Colonel Mustard
Your place or mine? Tell you what? I'll flip a coin. Head at my place, tail at yours.;Dating
Exits public bathroom stall Makes eye contact with the person next in line Mouths: "I'm so sorry";Bathroom
The lords army. Chad: My brother, why don't you join the lords army? Bob: I'm already their. Chad: I don't see you on Sundays... Bob: I'm in the secret service.;Church
Why isn't suntanning an Olympic sport? Because the best you can get is bronze.;Suntanning
Heading to Chinatown tomorrow just to hear the people there say the word "election" all day.;Chinatown
They agreed upon 'almond milk' when the original name  flavoured nut water  was rejected by test audiences, for whatever reason...;Almond milk
Jesus and Mary will occasionally appear on toast, or pancake, or waffles. Always breakfast foods. Why? Because it's the most important meal.;Jesus
God: Women will bleed for a week. Universe: What will men do for pleasure at that time? God: *sigh* Fine. Mouths. But they'll talk. A lot.;God
My life coach just asked me leave because apparently she has "other pedicures to do" and doesn't "speak English".;Life Coach
I have no problem with Capital Punishment in theory.... I just have problems with its execution.;Capital Punishment
How many ISIS mercenaries does it take to change a light bulb? None stupid crusader, that's a job for the hostages!;ISIS
If a parsley farmer is sued... can they garnish his wages?;Parsley
I bet everyone in Gotham prisons really hates the guy that killed Bruce Wayne's parents.;Gotham
What was the fisherman's favorite art style reelism;Art
I demand a binary world. Everything should be black and white. Or not.;Binary World
My Dad was the town drunk, ... and we lived in Chicago.;Dad
Max has 40 cookies, and decides to eat 34 of them. What does Max have now? Diabetes.;Cookies
Bruce Willis is working on the 5th Die Hard movie! They should call this one "Just kill me already!!!";Die Hard
2 Beers = 1 Tweet 5 Beers = 3 Tweets 9 Beers = 7 Tweets 12 Beers = 12 Tweets 24 Teers = 30 Beets;Beers
How do you call the social media that your grandmother uses? Instagran;Social Media
A great high-intensity workout is maintaining a neutral expression when someone tells you about a cool place to hear electronic music.;Workout
Next time you're in the changing room and sales person asks if you need anything, just say "Yes, can I get some toilet paper?";Sales
Werner Heisenberg is driving down the road. A cop pulls him over and asks "Do you know how fast you were going?" Heisenberg replies "No, but I know where I am.";Physics
What do you call a dedicated but untalented gymnast? A working stiff;Gymnastics
Linguistics Student: "What's a glottal fricative?" "*Heavy sigh*";Linguistics
What did the accountant with constipation do? He worked is out with a pencil.;Accounting
GOOD COP: cover me! DAD COP: *tucks him in* snug as a bug;Police
What do you get when you drop a Piano on an army base? A flat major.;Music
I'll be coming into some money When Katy Perry gets on the dollar bill;Money
In a car it's illegal to not wear a seatbelt. But I guess if you're on a bus they figure death will be a sweet relief.;Transportation
What's the worst part of locking your keys in the car at an abortion clinic? Having to go inside and ask for a coat hanger.;Abortion
What do you get if you cross a vampire and a circus entertainer ? Something that goes straight for the juggler !;Vampire
Bought a new vacuum cleaner.. ..it sucks more than my old one;Vacuum
I organised a 3 some last night. There were a couple of no shows but I still had a good time.;Threesome
Dark humor is like a terrorist attack... the timing needs to be just right.;Dark humor
My wife is going to the hair salon today so for the next few hours I will be practising my reaction.;Marriage
I refused to believe my dad was stealing from his job as a road worker But when I got home, all the signs were there.;Theft
A man walks into a bar and says... OUCH!;Bar
BEN CARSON: On the news I saw a portal to another dimension open & robots came out, we need to stop that MODERATOR:That was The Avengers sir;Politics
A company testing on animals just got sued for testing a chapstick on horses that made their lips burn off. They called it neigh-balm.;Animal testing
If you ask me about my love life, I can honestly say... I'm holding my own.;Love life
There are two types of people on Twitter. Those who can take a joke, and those who will copy it and claim it as their own;Twitter
Why shouldn't you throw a rock at a Mexican riding a bike? Because that might be your bike;Theft
I Decided To Learn How To Write Clickbait Titles. What I Learned Will Amaze You.;Clickbait
"Chewing" and "eating" are very similar things. But "getting chewed out" and "getting eaten out" are very different.;Sex
Don't judge Charlie Sheen until you've snorted a mile in his coke.;Charlie Sheen
I watched a documentary on how ships are held together It was riveting.;ships
Today I watched a donkey look both ways before crossing the street... ... he was a smart ass.;donkey
Any jokes about failed startups?;startups
I've got this great joke where I kidnap people's sticker families and leave little post-it ransom notes. Adorable or horrifying? You decide;kidnapping
Did you hear about the midget fortune teller that escaped from prison? The police reported a small medium at large.;midget
After years of hard work and dedication, I can finally say that I have that sexy body I've always wanted. It's in my freezer.;body
Wrong hole! It's too tight! -me putting on my watch, you pervs;watch
"Donald is intensely loyal. To family, friends, employees, country." -His 3rd wife;Donald
I have the body of a 25 year old supermodel, but it takes up too much space in my freezer.;body
My dick was in the Guinness book of records... Until the librarian throw me out.;Guinness book
What's the difference between stew haters and steers.;stew
Just realized some twitter handles are probably prison ID numbers.;twitter
I've just ordered a procrastinating blowup doll with real orgasm effect It's coming tomorrow;procrastination
We get it car dealers, EVERY Day is a sale day. You don't have to make shit up like The Saturday After It Rained On A Friday Sale.;car_dealers
Don't worry, you are safe Zombies eat brains;zombies
How do you know Adam and Eve weren't Chinese? They would have eaten the snake;adam_and_eve
What do you call a dead baby floating in the middle of the ocean? Bait.;dead_baby
Why do scuba-divers jump backwards into the water? Because if they jumped forwards they'd still be in the boat.;scuba_divers
Which country has the loosest regulations on incest? Oh shit, this isn't Google.;incest
BALD FLEAS Q What do you call two fleas on top of a bald head? A: Homeless.;fleas
How do you address a monster? Very politely.;monster
Like this if you can't think of a clever status either...;status
I bet my butcher $50 that he couldn't reach the meat on the top shelf. He said "No, the steaks are too high".;butcher
I asked Sean Connery what game he was going to play with Roger Federer tomorrow and what time he was going to go He replied: "Tennish";Tennis
What do you call 4 dicks tied together? An erectangle.;Anatomy
Whenever I tell someone I'm Russian they tell me to slow down.;Nationality
Apologies to my forehead for assuming that automatic doors will just "open.";Technology
*me, at high school prom Me: So, you wanna dance? Her: Definitely! M: Can you tell me why?;Dance
Are you bad wifi? Because I see there is no connection here.;Technology
Why did the cannibal live on his own? He was fed up with other people.;Cannibalism
Why did no one like the cannibal that started eating his own body? He was too full of himself.;Cannibalism
Why did Dr.Pepper blush? He received a Sunkist from his Crush;Drinks
My mom laughed at me when I said I was going to build a car out of spaghetti. You should have seen her face as I drove pasta;Engineering
One time I walked into a bathroom and there were no urinals I thought, "huh... that's strange." The girls that came in after me were apparently pretty freaked out by it too.;Bathroom
TEXT "TEXT" TO TEXT TO DONATE A TEXT TO TEXT;Donation
{discussing wedding dresses} CW1: I had mine preserved. CW2: I donated mine to a charity. You? Me: I used mine as kindling for a bonfire.;Wedding
Why was the chicken kicked out of class? For using *fowl* language.;language
Why do people always talk in absolutes? I would never do that. It's the worst.;absolutes
Find out this one weird trick fishermen use. Click bait.;fishermen
You're like a semicolon. I'm not sure exactly what to do with you.;punctuation
I want my money back, these suppositories taste like shit.;medicine
Best Way to deal with High School Bullies: Grow up to be smarter, richer and better looking than them and then add them on Facebook.;bullying
Why did the scarecrow get a promotion? Because he was outstanding in his field!;scarecrow
I wish they made bar-stools with seat belts and dual side airbags.;bars
is this Sara? hi, this is Tom from HS. my god its been years! Anyway, im calling because u changed your HBO Go password & I need the new one;password
Why did the scarecrow get a promotion? Because he was outstanding in his field.;scarecrow
If life gives you lemons... Make lemonade. If life gives you melons... You might be dyslexic;life
What's the difference between someone who doesn't use their turn signal and Hitler? You know Hitler will turn Reich.;Hitler
Why did the Romans build straight roads ? So their soldiers didn't go around the bend !;Romans
If the human race has a "signature move," its gotta be lying to the dentist about flossing.;dentist
Two nuns are sitting on a park bench... Two nuns are sitting on a park bench. A man in a trench coat runs up and flashes them. The first nun has a stroke. The second nun tried but she couldn't reach.;Nuns
"It's not you, it's me" - DiGiorno, to delivery;Relationships
What car does a japanese girl love to ride Nee-san;Cars
What do you call the area where a horse lives? The NEIGHHHHHHborhood;Horses
2 deer walk into a bar An hour later they walk out and one says to the other, "Man, I can't believe I blew twenty bucks in there.";Bars
I was told I was addicted to cocaine, but I can assure you I am definitely not. I just love the way it smells.;Drugs
Damn it's so cold out i saw woman in two pairs of pajamas at walmart;Weather
The Kool-Aid Man is a classy actor... even while crashing parties on TV, he never broke the 4th wall.;Kool-Aid
What did the Shit Summoner say at the bar ? Mind if I pull up a stool ?;Summoning
Food is like dark humour... Not everyone gets it.;Food
I took a class on Narcissism. I'm pretty sure I blew everyone away.;Narcissism
Rubbing my ass on these documents because the boss's email says to "cheek his paperwork".;Work
What did one boob say to the other? You're my breast friend. Budum tits.;Breasts
A priest, a rabbi, and a nun walk into a bar. The bartender looks at them and says, "What is this, a joke?";Bars
What's the difference between a refreshing beverage and an angry dragon? One hits the spot...;beverage
I was asked on a biology test "what is most commonly found in cells" Black people was the wrong answer...;biology
Gay test: are you gay ? If you answered yes, then you're gay.;sexuality
You know you've just had lunch with a narcissist when your neck is stiff from nodding.;personality
What do you do with 365 used condoms? Roll them into a tire and call it a Goodyear.;condoms
Life is like a dry handjob. Sometimes its painful sometimes its enjoyable most of the time its hard but mostly your just happy it keeps goin;life
I was wondering why my doctor prescribed LSD for my constipation... Then I saw a dragon and I fucking shit myself.;medicine
What does a Jew do at a coffee shop? Hebrew's coffee;religion
What does wearing Crocs and getting your dick sucked by a dude I have in common? They both feel really good but when you look down you know you're gay.;sexuality
I never thought I'd buy into Feng Shui. But oh how the tables have turned.;interior design
A Muslim, A Mormon and a Rastafarian walk into a bar... No one does anything;religion
I guess he's going back to "the artist formerly known as prince" too soon?;music
Today I was walking down the street today and a guy threw a slice of cheese at me. That's mature.;cheese
How can you tell an Italian witch from an English one ? By her suntan !;nationality
I was going to tell a time travel joke... but you didn't like it.;time travel
whats the difference between my sex life and racism racism actually exists;sex life and racism
INTERVIEWER: this says u work well with otters. Did u mean others? ME (shoving a romp of otters back into my briefcase): haha yeah of course;job interview
Two peanuts were walking down the street, one was a salted.;peanuts
How many sound guys does it take to screw in a light bulb? Two, two... One, two.;sound guys
My girlfriend and I spent $40 on a pesto pasta It was worth every penne;pesto pasta
Why do women love Satan? He's down to Earth.;Satan
Piglet: *sees recipe book* Honey-glazed...Pooh, what's ham? WinniethePooh: A food that goes well with honey. Now, how about a nice hot bath?;Winnie the Pooh
My boss hates it when I shorten his name to "Dick". Especially since his name is Steve.;job
Did you hear about the kidnapping in Dallas? They woke him up.;kidnapping
What can't I find on the internet? My keys;internet
(Tell this to your professional friends or relatives) Your must be a fish... because you've got lots of SCALES!! YEEEEEEYAAAAAA Edit: (skills/scales?) get it?;fish
Steve Harvey;Steve Harvey
Did you hear the one about the guy who couldn't think of a punch line?;Punch line
Did you hear about that Mexican train thief? They say he had loco motives.;Mexican train thief
What do you call an angry German? A sour kraut;German
What's an octopuses favourite latin saying? Squid pro quo!;Octopus
If you pee on a cop Urine trouble. (Credit to my bff);Peeing on a cop
What would Michael Jackson be doing if he were alive right now? Probably clawing at the inside of his coffin.;Michael Jackson
Yoda: "Mmhhh, why 5 afraid of 6 is?" Because 6 7 8;Math
Sea turtles happened when god got stoned one night and wondered what would happen if a frisbee was a lizard.;Sea turtles
I'm from the 80's. We ate cookies instead of deleting them.;Cookies
What do you call cows with 2 legs? Lean beef. bonus: What do you call cows with no legs? Ground beef.;Cows
What did the Jew say to the homeless man? Could you spare some change?;Homeless man
Me and the wife had a argument about what desserts to have, it turned into a custardy battle.;Desserts
How many apples grow on a tree? ALL OF THEM!!;Apples
*being pulled away by security from flamingo pen at the zoo with a handful of pink feathers and a black eye* HE STARTED IT;Animals
"Well gentlemen... the steaks are high." *two steaks giggle* "Hehehe omfg he totally knows, man...";Food
I gave my cat a middle name today, so she knows when she is really in trouble.;Pets
What is a modern name for a store that specializes in the sale of pornography? A junk shop.;Stores
Get off your high horse. Send your high horse to rehab. Keep an eye out to make sure your horse isn't getting high again.;Addiction
Another joke thread...What's your best: I'm as/so angry ________ (or variant) Here's mine: I'm more pissed off than a dragon trying to blow out birthday candles.;Anger
Why did everyone hate the shoe company? It had no soul.;Shoes
My biggest complaint about Batman v Superman is how the movie always just assumes you know which one is which.;Movies
[son at dinner] "a boy at school sells fireworks for $2" [to son and wife next day at breakfast] so, we'll charge $1.75 and split it 3 ways;Business
How does a jew make coffee? Hebrews it;Coffee
My son asked me to explain women to him so I told him we'd go to lunch and talk about it, then spent the next 3 hours getting dressed.;Women
What do you call a Jewish rapper? A rappi.;Music
What do you call a former member of ISIS? WASWAS;Terrorism
My girlfriend is like the square root of a negative 100... She's a perfect 10! But she's also imaginary.;math
Who was the most well rounded knight at King Arthur's round table? Circumference;geometry
God said He loves me? That's awkward. Tell Him I want to see other people.;religion
What is a British person's favorite cereal? Cheerios. say it in a British accent;nationality
People who put the punchline in the title What's worse than finding a worm in your apple?;humor
How does a mathematician deal with constipation? He works it out with a pencil;math
Why does Waldo wear stripes? Because he doesn't want to be spotted;clothing
There are two reasons I would never drink from a toilet Number 1, and number 2;hygiene
Short story about HYGIENE Hi, Eugene. Please be kind. First post here. );hygiene
The only people I know I'm superior to are the ones who announce the break they're taking from Facebook.;social media
Why did the skeleton not attend prom? He had no body to go with.;prom
Whenever I try to steal from people I get stabbed by an old plastic fork or a stick. The homeless are resourceful, man.;homelessness
Where does food go when Palpatine eats it? In Sidious!;star wars
Why isn't Sonic the Hedgehog Muslim? Because once Ramadan is over, he can't stop fasting!;Sonic
If you accidentally get stuck holding the door for a bunch of people. 1. Relax 2. Accept your fate 3. You are part of the building now;Door
My life would be so much better if I could use a smokebomb to conceal my escape after being turned down by a girl.;Dating
I think I'm just going to date procrastination... It just makes sense, it's been fucking me every day since high school.;Procrastination
I'm not an elitist. I'm far better than that.;Elitism
A man who took an Airline company to court after his luggage went missing has lost his case.;Airline
What do you call a musician's erection? A tromboner.;Music
Why did the Moon break up with Earth? The Moon said they were slowly drifting apart.;Moon
I just watched Discovery's "How It's Made" and, honestly, I'm never eating another urinal cake again.;Urinal
Go piss on a friend. They may have been stung by a jellyfish & are too embarrassed to ask for help. You'll be a hero.;Jellyfish
What did the left butt cheek say to the right? If we stick together we can stop this shit.;Butt
4 out of 5 dentists agree: Dentist #5 is a real asshole.;Dentist
How do you get a Jewish girls number? Check her wrists.;Jewish girls
Splinters are woods way of sexual assault They can go deep inside you, and the bigger they are, the more it hurts.;Splinters
I bought my kid some McDonald's today. He really doesn't like stocks though.;McDonald's
Beer is mankind's best invention ever, but the wheel is the most revolutionary.;Beer
If I could time travel I'd go to my funeral and take names of people who seemed to be handling it a little too well.;Time travel
this is what happens when you don't read the comments before commenting [deleted];Commenting
Who is bigger - Mrs Bigger or Mrs Bigger's baby? Mrs Bigger's baby because he's a little Bigger.;Mrs Bigger
Who'll handle the Guantanamo closing? Same guys who did Circuit City?;Guantanamo
I just introduced my date as P. Sherman, 42 Wallaby Way, Sydney because I forgot his name. How's your night?;Dating
Why did the boy stand behind the horse? He thought he might get a kick out of it!;Horse
What does a scientologist and an almond have in common? They are both nuts.;Scientology
Cop: Do you know why I pulled you over? Me:I'm cute? Cop: Nope Me: you like my car? Cop: Nope Me: I could do this all day.;Traffic stop
How do you stop a rooser crowing on Sunday ?  Eat him on Saturday !;Rooster
Magician walking down the street A magician is walking down a street, he then turns into a grocery store.;Magician
i swear to god I'm funny I was going to tell a gay joke... Butt fuck it.. Bada bom tisssh;gay
Hey, did you all hear about the Muslim space program? Yeah, me neither.;muslim
Freaking out people walking round the cemetery dressed as a Ghostbuster.;ghostbuster
What's a bounty hunter's favorite cheese? Fetta;bounty hunter
Why are dogs such terrible dancers? They have two left feet.;dogs
So, are you a sub? *he looks into my eyes* What do you mean, like a sandwich?;sub
I used to be a werewolf... but I'm alright noooooooowwwwww!;werewolf
'I' before 'E' , except after 'C' Weird.;spelling
Some dude was bragging about his brother being a navy seal and it's like...I don't care what colour he is, why is your brother a seal;navy seal
My boyfriend is watching Glee voluntarily and tapping his foot and smiling. That makes me a lesbian now, right?;boyfriend
if religion is the opium of the masses then i smoke weed everyday!;religion
4 gay guys walk into a bar, but there's only 1 available stool. What do they do? Flip it over.;gay
One time a friend said that he "ain't never had no nothing". It remains the only time where I have heard someone use a quadruple negative.;language
The Internet is like alcohol, it gives people courage.;Internet
Why do French tanks have a rear-view mirror? To see the front;Tanks
When I see a woman driving a bus I smile and think about how far we as a society have come in equality. ` And then I wait for the next bus.;Equality
How do you keep an idiot in suspense? I'll post the answer in the comments.;Suspense
Why I think North Korea is a bad place [deleted];North Korea
What's the best thing about living in Switzerland? I don't know, but the flag is a big plus.;Switzerland
H.o.m.e.w.o.r.k Half of my energy wasted on random knowledge . :);Homework
Government officials have released a report including satellite images of secret ISIS training facilities Iocated in Italy That's right.....Italian ISIS;ISIS
Raging Gamers A recent survey conducted asked about a thousand 13-year old gamers what they had done last week. 92% said "your mum";Gamers
Dogs that belong to homeless people must think "just say you're sorry dude and we can sleep inside tonight";Homeless
So I went to ask about some yoga classes in my neighbourhood as it's my first time. The instructor asked me if I was flexible... ... I said "I can't do Tuesdays.";Yoga
How do you ask an Uber driver if he drives for Lyft, too? Do you even Lyft bro? (I'll see myself out);Uber
[wedding reception] DAVE IS HAVIN A SEIZURE Paramedic: How long has he been having convulsions? IDK HE'S WHITE, I THOUGHT HE WAS DANCING;Wedding
I took my cat to Build-A-Bear so he could see what's going to happen to him if he pees on the carpet again.;Cats
Q: What do you call kinky sex with chocolate? A: S&M&M.;Chocolate
What did Tennessee? ...the same thing Arkansas;Geography
ELI5: If both my parents have huge dicks, does that mean I will be genetically guaranteed to have a huge dick when I grow up?;Genetics
Nobody told Ahmed about the clock change so he blew himself up in the garage.;Terrorism
I had a cocaine joke, but now I can't find it It makes me really mad because I had it all lined up;Cocaine
thank you all for donating to my gofundme to pay for my surgery I have decided to buy 600 playstations with the money;Gofundme
What happened to Jesus when he tried to play defense on a professional Basketball player? He got crossed.;Basketball
What do you call a an Egyptian crocodile who swears they live in Florida? In da-Nile;Geography
So is the Pope like... single now?;Pope
NRA member: I've got guns. I'm in charge. Me: That's nice. I've got bubonic plague - "cough, cough" - now you do, too. I win.;NRA
Why are Boy Scouts such great murderers? Because they leave no trace.;Boy Scouts
One Gay Greek says to another, "Do you think you'll ever go back to Greece?" "No," he answered, "I'll stick with K-Y Jelly!";Greece
